country,region,text,date,year,page,extracted_date,full_text
ALGERIA,,"23/VI/l 984 Decree No. 84-157 to amend Decree No. 71 -77 of 5 April 1971 on the organisation of a system of family benefits in agriculture. (Journal officiel, 10 July). [Amends s. 6.]",,,1,,"23/VI/l 984 Decree No. 84-157 to amend Decree No. 71 -77 of 5 April 1971 on the organisation of a system of family benefits in agriculture. (Journal officiel, 10 July). [Amends s. 6.] "
ALGERIA,,"lj/IX/1984 Decree No. 84-271 to create a national centre for vocational education by correspondence, (ibid., 19 Sep.) [Inter alia, provides for the types of vocational training specified in s. 2 of Decree No. 83-572 of 15 October 1983 to be made available by correspondence.]",,,1,,"lj/IX/1984 Decree No. 84-271 to create a national centre for vocational education by correspondence, (ibid., 19 Sep.) [Inter alia, provides for the types of vocational training specified in s. 2 of Decree No. 83-572 of 15 October 1983 to be made available by correspondence.] "
AUSTRALIA,,"An Act to amend the Conciliation and Arbitration Act 1904 [LS 1956—Aust. 1 (consolidation). . . 1972—Aust. 1], to repeal the Public Service Arbitration Act 1920, and for related purposes. No. 115 of 1983. Conciliation and Arbitration Amendment Act (No. 2) 1983. [Miscellaneous amendments.]",16.12.,1983,1,16/XII/1983,"16/XII/1983 An Act to amend the Conciliation and Arbitration Act 1904 [LS 1956—Aust. 1 (consolidation). . . 1972—Aust. 1], to repeal the Public Service Arbitration Act 1920, and for related purposes. No. 115 of 1983. Conciliation and Arbitration Amendment Act (No. 2) 1983. [Miscellaneous amendments.] "
AUSTRALIA,Victoria,"I /V/l 984 An Act to amend the Public Service Act 1974 and for other purposes. No. 10046. Public Service (Amendment) Act 1984. [Inter alia: inserts a new s. 15A (principles applying in administration: recruitment, promotion and advancement, fair and equitable treatment, equal pay, education and training) and a new part VA (consultations prior to redundancies); amends s. 43 (annual increments of salary or wages).]",,,1,,"I /V/l 984 An Act to amend the Public Service Act 1974 and for other purposes. No. 10046. Public Service (Amendment) Act 1984. [Inter alia: inserts a new s. 15A (principles applying in administration: recruitment, promotion and advancement, fair and equitable treatment, equal pay, education and training) and a new part VA (consultations prior to redundancies); amends s. 43 (annual increments of salary or wages).] "
AUSTRALIA,Western Australia,"Construction Safety Amendment Regulations (No. 3) 1984. (Government Gazette, 20 July) [Miscellaneous amendments.]",20.7.,1984,1,20/VII/1984,"20/VII/1984 Construction Safety Amendment Regulations (No. 3) 1984. (Government Gazette, 20 July) [Miscellaneous amendments.] "
BARBADOS,,"An Act to repeal the Shops Act and make new provisions relating to shops. No. 3. Shops Act 1983. (Official Gazette, Supplement, 8 Mar.) [Inter alia, ss. 3 to 5: opening and closing of shops; ss. 6 to 13: conditions of employment of shops assistants; ss. 14 and 15: inspection, supervision and investigation.]",29.2.,1984,1,29/11/1984,"29/11/1984 An Act to repeal the Shops Act and make new provisions relating to shops. No. 3. Shops Act 1983. (Official Gazette, Supplement, 8 Mar.) [Inter alia, ss. 3 to 5: opening and closing of shops; ss. 6 to 13: conditions of employment of shops assistants; ss. 14 and 15: inspection, supervision and investigation.] "
BARBADOS,,"An Act to provide for the establishment of the National Health Service Board. No. 22. National Health Service Board Act 1984. (ibid., Supplement, 24 Sep.) [To provide general practice services free of charge to residents except as provided for in the regulations.]",14.9.,1984,1,14/IX/1984,"14/IX/1984 An Act to provide for the establishment of the National Health Service Board. No. 22. National Health Service Board Act 1984. (ibid., Supplement, 24 Sep.) [To provide general practice services free of charge to residents except as provided for in the regulations.] "
BELGIUM,,"Royal Order to amend the Royal Order of 20 July 1973 to make maritime inspection regulations. (Moniteur belge - Belgisch Staatsblad, 13 Sep.)",28.3.,1984,1,28/III/1984,"28/III/1984 Royal Order to amend the Royal Order of 20 July 1973 to make maritime inspection regulations. (Moniteur belge - Belgisch Staatsblad, 13 Sep.) "
BELGIUM,,"Royal Order to amend the Royal Order of 27 April 1976 to supplement the Royal Order of 8 April 1976 to institute a family benefit scheme for self-employed persons, (ibid., 28 June) [Miscellaneous amendments.]",25.5.,1984,1,25/V/1984,"25/V/1984 Royal Order to amend the Royal Order of 27 April 1976 to supplement the Royal Order of 8 April 1976 to institute a family benefit scheme for self-employed persons, (ibid., 28 June) [Miscellaneous amendments.] "
BELGIUM,,"Royal Order to issue model regulations for joint committees on apprenticeship, (ibid., 6 July) [Model regulations in annex.]",13.6.,1984,1,13/VI/1984,"13/VI/1984 Royal Order to issue model regulations for joint committees on apprenticeship, (ibid., 6 July) [Model regulations in annex.] "
BELGIUM,,Copyright © International Labour Organisation 1985 3/1985,,,1,,Copyright © International Labour Organisation 1985 3/1985 
BELGIUM,,1985—List No. 3 2 (208),,,2,,1985—List No. 3 2 (208) 
BELGIUM,,"Royal Order to amend section 20 of Royal Order No. 72 of 10 November 1967 respecting retirement and survivors' pensions for self-employed persons, (ibid., 12 July)",20.6.,1984,2,20/VI/1984,"20/VI/1984 Royal Order to amend section 20 of Royal Order No. 72 of 10 November 1967 respecting retirement and survivors' pensions for self-employed persons, (ibid., 12 July) "
BELGIUM,,"Royal Order to amend the Order of the Regent of 10 April 1948 respecting the conditions of employment of temporary wage earners, (ibid., 11 July) [Replaces s. 15 (2): In the event of absence owing to illness or infirmity, a wage earner is entitled to the normal remuneration and to additional compensation to the extent and subject to the conditions fixed by s. 52 of the Act of 3 July 1978 [LS 1978—Bel. 1 ] respecting contracts of employment and by the collective agreement concluded on 28 June 1973 in the National Labour Council.]",21.6.,1984,2,21/VI/1984,"21/VI/1984 Royal Order to amend the Order of the Regent of 10 April 1948 respecting the conditions of employment of temporary wage earners, (ibid., 11 July) [Replaces s. 15 (2): In the event of absence owing to illness or infirmity, a wage earner is entitled to the normal remuneration and to additional compensation to the extent and subject to the conditions fixed by s. 52 of the Act of 3 July 1978 [LS 1978—Bel. 1 ] respecting contracts of employment and by the collective agreement concluded on 28 June 1973 in the National Labour Council.] "
BELGIUM,,"Royal Order to amend the Royal Order of 17 November 1969 to issue general regulations respecting the grant of allowances to handicapped persons, (ibid., 27 July) [Amends s. 39, subs. 2, clause 1.]",27.6.,1984,2,27/VI/1984,"27/VI/1984 Royal Order to amend the Royal Order of 17 November 1969 to issue general regulations respecting the grant of allowances to handicapped persons, (ibid., 27 July) [Amends s. 39, subs. 2, clause 1.] "
BELGIUM,,"Royal Order to lay down the conditions under which minors aged 15 years or over may conclude students' contracts of employment, (ibid., 12 July) [S. 1: Minors aged 15 years or over pursuing full-time education may conclude students' contracts of employment in accordance with the provisions of Title VI of the Act of 3 July 1978 [LS 1978—Bel. 1] respecting contracts of employment.]",28.6.,1984,2,28/VI/1984,"28/VI/1984 Royal Order to lay down the conditions under which minors aged 15 years or over may conclude students' contracts of employment, (ibid., 12 July) [S. 1: Minors aged 15 years or over pursuing full-time education may conclude students' contracts of employment in accordance with the provisions of Title VI of the Act of 3 July 1978 [LS 1978—Bel. 1] respecting contracts of employment.] "
BELGIUM,,"Royal Order to amend the Royal Order of 20 December 1963 [LS 1963—Bel. 2 . . . 1967—Bel. 2A] respecting employment and unemployment, (ibid., 28 July) [Miscellaneous amendments.]",29.6.,1984,2,29/VI/1984,"29/VI/1984 Royal Order to amend the Royal Order of 20 December 1963 [LS 1963—Bel. 2 . . . 1967—Bel. 2A] respecting employment and unemployment, (ibid., 28 July) [Miscellaneous amendments.] "
BELGIUM,,"Royal Order to supplement the Royal Order of 1 February 1984 respecting entitlement of dismissed aged workers to unemployment benefit, (ibid., 26 July) [Provisions concerning the application of s. 126 of the Royal Order of 20 December 1963 [LS 1963—Bel. 2 . . . 1967—Bel. 2A] respecting employment and unemployment.]",12.7.,1984,2,12/VII/1984,"12/VII/1984 Royal Order to supplement the Royal Order of 1 February 1984 respecting entitlement of dismissed aged workers to unemployment benefit, (ibid., 26 July) [Provisions concerning the application of s. 126 of the Royal Order of 20 December 1963 [LS 1963—Bel. 2 . . . 1967—Bel. 2A] respecting employment and unemployment.] "
BELGIUM,,"Royal Order to amend sections 118, 123, 124 and 160 of the Royal Order of 20 December 1963 [LS 1963—Bel. 2 . . . 1967—Bel. 2A] respecting employment and unem- ployment. (ibid.) [Miscellaneous amendments.]",13.7.,1984,2,13/VII/1984,"13/VII/1984 Royal Order to amend sections 118, 123, 124 and 160 of the Royal Order of 20 December 1963 [LS 1963—Bel. 2 . . . 1967—Bel. 2A] respecting employment and unem- ployment. (ibid.) [Miscellaneous amendments.] "
BELGIUM,,"Royal Order to amend sections 133,139 and 191 ofthe Royal Order of 20 December 1963 [LS 1963—Bel. 2 . . . 1967—Bel. 3] respecting employment and unemployment, (ibid., 14 Aug.)",20.7.,1984,2,20/VII/1984,"20/VII/1984 Royal Order to amend sections 133,139 and 191 ofthe Royal Order of 20 December 1963 [LS 1963—Bel. 2 . . . 1967—Bel. 3] respecting employment and unemployment, (ibid., 14 Aug.) "
BELGIUM,,"Royal Order to waive and supplement section 124 of the Royal Order of 20 Dec- ember 1963 [LS 1963—Bel. 2 . . . 1967—Bel. 3] respecting employment and unemploy- ment, to supplement section 133 ofthe same Order and to amend section 160, subsection 5, paragraph II, clause 4, of the same Order, (ibid.) [Concerns young workers.]",26.7.,1984,2,26/VII/1984,"26/VII/1984 Royal Order to waive and supplement section 124 of the Royal Order of 20 Dec- ember 1963 [LS 1963—Bel. 2 . . . 1967—Bel. 3] respecting employment and unemploy- ment, to supplement section 133 ofthe same Order and to amend section 160, subsection 5, paragraph II, clause 4, of the same Order, (ibid.) [Concerns young workers.] "
BELGIUM,,"Royal Order to amend the Royal Order of 24 December 1968 on the employment of women, (ibid., 17 Oct.) [Repeals s. 1, clauses 1, 2 and 3, of the above Order as amended by the Order of 24 March 1977.]",26.7.,1984,2,26/VII/1984,"26/VII/1984 Royal Order to amend the Royal Order of 24 December 1968 on the employment of women, (ibid., 17 Oct.) [Repeals s. 1, clauses 1, 2 and 3, of the above Order as amended by the Order of 24 March 1977.] "
BELGIUM,,"20/VIH/1984 Royal Order to insert a section 172bis in the Royal Order of 20 December 1963 [LS 1963—Bel. 2 . . . 1967—Bel. 2A] respecting employment and unemployment, (ibid., 15Sep.)",,,2,,"20/VIH/1984 Royal Order to insert a section 172bis in the Royal Order of 20 December 1963 [LS 1963—Bel. 2 . . . 1967—Bel. 2A] respecting employment and unemployment, (ibid., 15Sep.) "
BELGIUM,,"22/VIII/l 984 Repeal Order to amend the Royal Order of 30 March 1967 providing general rules for implementing the Acts on annual holidays with pay. (ibid., 26 Sep.) [Amends s. 33(1) and (2) ofthe 1967 Order, as amended by the Order of 29 September 1978.]",,,2,,"22/VIII/l 984 Repeal Order to amend the Royal Order of 30 March 1967 providing general rules for implementing the Acts on annual holidays with pay. (ibid., 26 Sep.) [Amends s. 33(1) and (2) ofthe 1967 Order, as amended by the Order of 29 September 1978.] "
BELGIUM,,"Royal Order to amend the Royal Order of 22 December 1967 to make general regulations for the self-employed persons' retirement and survivors' pension scheme, (ibid., 6 Oct.) [Numerous amendments.]",20.9.,1984,2,20/IX/1984,"20/IX/1984 Royal Order to amend the Royal Order of 22 December 1967 to make general regulations for the self-employed persons' retirement and survivors' pension scheme, (ibid., 6 Oct.) [Numerous amendments.] "
BELGIUM,,"Royal Order to amend the Royal Order of 21 December 1967 to make general regulations for the employed persons' retirement and survivors' pension scheme, (ibid.)",20.9.,1984,2,20/IX/1984,"20/IX/1984 Royal Order to amend the Royal Order of 21 December 1967 to make general regulations for the employed persons' retirement and survivors' pension scheme, (ibid.) "
BELGIUM,,209) 3 1985—List No. 3,,,3,,(209) 3 1985—List No. 3 
BELGIUM,,"Royal Order to amend the Royal Order of 27 July 1971 prescribing the special rules for the entitlement of professional journalists to the pension, and the special rules for implementing Royal Order No. 50 of 24 October 1967 [LS 1967—Bel. 4] respecting retirement and survivors' pensions for employed persons, (ibid.) [Replaces s. 12, para. 2, of the above-mentioned Order.]",20.9.,1984,3,20/IX/1984,"20/IX/1984 Royal Order to amend the Royal Order of 27 July 1971 prescribing the special rules for the entitlement of professional journalists to the pension, and the special rules for implementing Royal Order No. 50 of 24 October 1967 [LS 1967—Bel. 4] respecting retirement and survivors' pensions for employed persons, (ibid.) [Replaces s. 12, para. 2, of the above-mentioned Order.] "
BELGIUM,,"20/IX/l 984 Royal Order to amend the Royal Order of 28 July 1975 under s. 2, para. 2, of Royal Order No. 50 of 24 October 1967 [LS 1967—Bel. 4] respecting retirement and survivors' pensions for employed persons, (ibid.)",,,3,,"20/IX/l 984 Royal Order to amend the Royal Order of 28 July 1975 under s. 2, para. 2, of Royal Order No. 50 of 24 October 1967 [LS 1967—Bel. 4] respecting retirement and survivors' pensions for employed persons, (ibid.) "
BELGIUM,,"Royal Order under the Act of 19 December 1974 to organise relations between the public authorities and the trade unions of the staff of these authorities, (ibid., 20 Oct.) [Title II: Union activity (Chap. I: Union approved procedure; Chap. II: Prerogatives of the unions); Title III: Bargaining committees; Title IV: Concertation [joint consultation] committees; Title V: Control of representativeness; Title VI: Persons participating in union activities. Ss. 39 and 40 (safety, health and workplace improvement functions of the first-level concertation committees). The Act of 19 December 1974 and the above implementing Order provide for a uniform structure of collective labour relations throughout the public sector.]",28.9.,1984,3,28/IX/1984,"28/IX/1984 Royal Order under the Act of 19 December 1974 to organise relations between the public authorities and the trade unions of the staff of these authorities, (ibid., 20 Oct.) [Title II: Union activity (Chap. I: Union approved procedure; Chap. II: Prerogatives of the unions); Title III: Bargaining committees; Title IV: Concertation [joint consultation] committees; Title V: Control of representativeness; Title VI: Persons participating in union activities. Ss. 39 and 40 (safety, health and workplace improvement functions of the first-level concertation committees). The Act of 19 December 1974 and the above implementing Order provide for a uniform structure of collective labour relations throughout the public sector.] "
BELIZE,,16/V/l 984 An Act to amend the Labour Ordinance to ensure that workers do not forfeit benefits already earned. No. 7. Labour (Amendment) Act 1984. [Repeals and replaces s. 189 (severance pay).],,,3,,16/V/l 984 An Act to amend the Labour Ordinance to ensure that workers do not forfeit benefits already earned. No. 7. Labour (Amendment) Act 1984. [Repeals and replaces s. 189 (severance pay).] 
BOTSWANA,,"I l/X/1982 An Act to provide for the settlement of trade disputes generally and for the settlement of trade disputes in essential services, for the control and regulation of industrial action and for matters incidental thereto. No. 19 of 1982. Trade Disputes Act 1982. (Government Gazette, Supplement A, 15 Oct.) [Inter alia, Part III: Arbitration by permanent arbitrator; Part V: Collective labour agreements; Part VI: Unlawful industrial action; Part VII: Protection of essential services.]",,,3,,"I l/X/1982 An Act to provide for the settlement of trade disputes generally and for the settlement of trade disputes in essential services, for the control and regulation of industrial action and for matters incidental thereto. No. 19 of 1982. Trade Disputes Act 1982. (Government Gazette, Supplement A, 15 Oct.) [Inter alia, Part III: Arbitration by permanent arbitrator; Part V: Collective labour agreements; Part VI: Unlawful industrial action; Part VII: Protection of essential services.] "
BOTSWANA,,"An Act to repeal and replace the Employment Act in order to amend the law relating to employment, to make comprehensive provision therefor and to provide for matters incidental thereto and connected therewith. No. 29 of 1982. Employment Act 1982. (ibid., Extraordinary, Supplement A, 29 Dec.) [Inter alia, Part III: Contracts of employment; Part V: Recruitment; Part VI: Forced labour; Part VII: Protection of wages; Part VIII: Rest periods, hours of work, holidays, etc.; Part XI: Employment of children and young persons; Part XII: Employment of females; Part XVI: Determination of minimum wages.]",30.11.,1982,3,30/XI/1982,"30/XI/1982 An Act to repeal and replace the Employment Act in order to amend the law relating to employment, to make comprehensive provision therefor and to provide for matters incidental thereto and connected therewith. No. 29 of 1982. Employment Act 1982. (ibid., Extraordinary, Supplement A, 29 Dec.) [Inter alia, Part III: Contracts of employment; Part V: Recruitment; Part VI: Forced labour; Part VII: Protection of wages; Part VIII: Rest periods, hours of work, holidays, etc.; Part XI: Employment of children and young persons; Part XII: Employment of females; Part XVI: Determination of minimum wages.] "
BOTSWANA,,"31 /VII 1/1983 An Act to re-enact with amendments the law relating to trade unions to make better provision therefor and for federations of trade unions and employers' organisations and for matters connected therewith and incidental thereto. No. 23 of 1983. Trade Unions and Employers' Organisations Act 1983. [Inter alia, Part III: Registration of trade unions, federations of trade unions and employers' organisations; Part V, s. 20: Membership of trade unions by children and young persons; Part X: Amalgamations and federations of registered trade unions; Part XI: Recognition of registered trade unions as negotiating bodies; Part XIII: Picketing, intimidation, disputes, etc.]",,,3,,"31 /VII 1/1983 An Act to re-enact with amendments the law relating to trade unions to make better provision therefor and for federations of trade unions and employers' organisations and for matters connected therewith and incidental thereto. No. 23 of 1983. Trade Unions and Employers' Organisations Act 1983. [Inter alia, Part III: Registration of trade unions, federations of trade unions and employers' organisations; Part V, s. 20: Membership of trade unions by children and young persons; Part X: Amalgamations and federations of registered trade unions; Part XI: Recognition of registered trade unions as negotiating bodies; Part XIII: Picketing, intimidation, disputes, etc.] "
BULGARIA,,"Instruction No. 5 of the Labour and Social Affairs Committee and the Central Council of Bulgarian Trade Unions, respecting the preparation and approval of general and departmental regulations on occupational safety. (D'rzhaven Vestnik, 3 Aug.)",2.4.,1984,3,2/IV/1984,"2/IV/1984 Instruction No. 5 of the Labour and Social Affairs Committee and the Central Council of Bulgarian Trade Unions, respecting the preparation and approval of general and departmental regulations on occupational safety. (D'rzhaven Vestnik, 3 Aug.) "
BULGARIA,,"Act respecting the administration of social insurance, (ibid., 5 June) [Repeals the Act of 3 February 1960 to entrust the administration of social insurance to the trade unions. Transfers its administration to the Labour and Social Affairs Committee of the Council of Ministers.]",30.5.,1984,3,30/V/1984,"30/V/1984 Act respecting the administration of social insurance, (ibid., 5 June) [Repeals the Act of 3 February 1960 to entrust the administration of social insurance to the trade unions. Transfers its administration to the Labour and Social Affairs Committee of the Council of Ministers.] "
BULGARIA,,1985—List No. 3 4 (210),,,4,,1985—List No. 3 4 (210) 
BULGARIA,,"An Act to amend and supplement the Labour Code [LS 1951—Bul.2 . . . 1968—Bui. 1], the Pensions Act [LS 1957—Bul. 1], the Social Insurance Act [LS 1949—Bul. 1] and the Income Tax Act. (ibid.) [Miscellaneous amendments.]",30.5.,1984,4,30/V/1984,"30/V/1984 An Act to amend and supplement the Labour Code [LS 1951—Bul.2 . . . 1968—Bui. 1], the Pensions Act [LS 1957—Bul. 1], the Social Insurance Act [LS 1949—Bul. 1] and the Income Tax Act. (ibid.) [Miscellaneous amendments.] "
BULGARIA,,"Resolution No. 28 of the Council of Ministers and the Central Council of Bulgarian Trade Unions, to amend and supplement certain legal texts, with a view to the better implementation of the December programme for improving the national standard of living. (ibid., 3 Aug.) [Numerous amendments, inter alia, to the Ordinance of 1 February 1977 respecting the additional remuneration payable for unpleasant and other specific conditions of work, the Regulations of 6 April 1958 made under Part III of the Labour Code (LS 1951—Bul. 2 . . . 1968—Bul. 1), the Regulations of 15 January 1958 made under the Pensions Act (LS 1957—Bul. 1 ) and the Regulations of 19 August 1967 (LS 1967—Bul. 2B) respecting the social insurance of co-operative farmers.]",14.6.,1984,4,14/VI/1984,"14/VI/1984 Resolution No. 28 of the Council of Ministers and the Central Council of Bulgarian Trade Unions, to amend and supplement certain legal texts, with a view to the better implementation of the December programme for improving the national standard of living. (ibid., 3 Aug.) [Numerous amendments, inter alia, to the Ordinance of 1 February 1977 respecting the additional remuneration payable for unpleasant and other specific conditions of work, the Regulations of 6 April 1958 made under Part III of the Labour Code (LS 1951—Bul. 2 . . . 1968—Bul. 1), the Regulations of 15 January 1958 made under the Pensions Act (LS 1957—Bul. 1 ) and the Regulations of 19 August 1967 (LS 1967—Bul. 2B) respecting the social insurance of co-operative farmers.] "
BULGARIA,,"29/VIII/l 984 Decree No. 2787, to amend and supplement the Pensions Act [of 6 November 1957: LS 1957—Bul. 1]. (ibid., 31 Aug.) [Amends s. 47a.]",,,4,,"29/VIII/l 984 Decree No. 2787, to amend and supplement the Pensions Act [of 6 November 1957: LS 1957—Bul. 1]. (ibid., 31 Aug.) [Amends s. 47a.] "
BULGARIA,,"Ordinance No. 9 of the Committee on Culture, the Ministry of Finance and the Labour and Social Affairs Committee, respecting musical and artistic activity, (ibid., 4 Sep.) [Provisions, inter alia, as to performers' conditions of employment and remuneration.]",,,4,,"— Ordinance No. 9 of the Committee on Culture, the Ministry of Finance and the Labour and Social Affairs Committee, respecting musical and artistic activity, (ibid., 4 Sep.) [Provisions, inter alia, as to performers' conditions of employment and remuneration.] "
CANADA,Newfoundland,"The Public Service (Pensions) (Reversal of Option) Regulations 1984. Newfoundland Regulation 239/84. (Newfoundland Gazette, Part I, 2 Nov.) [Regulations made under s. 34 of the Public Service (Pensions) Act, Ch. 319 of the Revised Statutes of Newfoundland 1970.]",25.10.,1984,4,25/X/1984,"25/X/1984 The Public Service (Pensions) (Reversal of Option) Regulations 1984. Newfoundland Regulation 239/84. (Newfoundland Gazette, Part I, 2 Nov.) [Regulations made under s. 34 of the Public Service (Pensions) Act, Ch. 319 of the Revised Statutes of Newfoundland 1970.] "
CANADA,Quebec,"Act to amend the Social Assistance Act. (Gazette officielle du Québec, Part 2, 4 July) [Allows the Minister of Labour and Income Security to set up work experience or training programmes for recipients of social assistance with a view to developing their ability to enter employment. Authorises payment of an adequate additional amount of social assistance to such recipients and provides for their coverage by the Industrial Accidents Act while working under the programmes.]",4.4.,1984,4,4/IV/1984,"4/IV/1984 Act to amend the Social Assistance Act. (Gazette officielle du Québec, Part 2, 4 July) [Allows the Minister of Labour and Income Security to set up work experience or training programmes for recipients of social assistance with a view to developing their ability to enter employment. Authorises payment of an adequate additional amount of social assistance to such recipients and provides for their coverage by the Industrial Accidents Act while working under the programmes.] "
