country,region,text,date,year,page,extracted_date,full_text
CANADA,Quebec,"Act concerning the Co-operative Society Development Act. (ibid., 6 June) [The purpose of the Society is to promote the formation and development of co-operative enterprises for the purpose of increasing (1) the participation of the population in economic activity; (2) the economic development of the regions and employment creation in those regions.]",23.5.,1984,4,23/V/1984,"23/V/1984 Act concerning the Co-operative Society Development Act. (ibid., 6 June) [The purpose of the Society is to promote the formation and development of co-operative enterprises for the purpose of increasing (1) the participation of the population in economic activity; (2) the economic development of the regions and employment creation in those regions.] "
CANADA,Quebec,"Act to amend the Act on hours of business in commercial establishments, (ibid., 7 July) [Inter alia, includes Sundays in the list of days when customers are not to be admitted; and is also designed to increase the types of establishment not covered by the Act.]",20.6.,1984,4,20/VI/1984,"20/VI/1984 Act to amend the Act on hours of business in commercial establishments, (ibid., 7 July) [Inter alia, includes Sundays in the list of days when customers are not to be admitted; and is also designed to increase the types of establishment not covered by the Act.] "
CANADA,Quebec,"Act to amend the Co-operatives Act. (ibid., 18 July) [The amendments make, inter alia, a distinction between ""workers' co-operatives"" whose main aim is to provide employment for their members, and ""commercial co-operatives"" whose main aim is the purchase of goods for sale to the public. Commencement: 20 June 1984.]",20.6.,1984,4,20/VI/1984,"20/VI/1984 Act to amend the Co-operatives Act. (ibid., 18 July) [The amendments make, inter alia, a distinction between ""workers' co-operatives"" whose main aim is to provide employment for their members, and ""commercial co-operatives"" whose main aim is the purchase of goods for sale to the public. Commencement: 20 June 1984.] "
CZECHOSLOVAKIA,,"Notification of the Federal Ministry of Labour and Social Affairs to amend and supplement the Notification [No. 128 of 1975] to provide for the application of the Social Security Act [No. 121 of 1975: LS 1975—Cz. 3], as subsequently amended. (Sbirka zäkonu, Text 73) [Numerous amendments.]",21.6.,1984,4,21/VI/1984,"21/VI/1984 Notification of the Federal Ministry of Labour and Social Affairs to amend and supplement the Notification [No. 128 of 1975] to provide for the application of the Social Security Act [No. 121 of 1975: LS 1975—Cz. 3], as subsequently amended. (Sbirka zäkonu, Text 73) [Numerous amendments.] "
CZECHOSLOVAKIA,,211) 5 1985—List No. 3,,,5,,(211) 5 1985—List No. 3 
CZECHOSLOVAKIA,,"Notification of the Federal Ministry of Labour and Social Affairs to amend and supplement the Notification [No. 104 of 1964] to provide for the application of the Act [No. 103 of 1964] respecting a sickness scheme for co-operative farmers and a benefit scheme for mothers and children, as subsequently amended, (ibid., Text 74) [Numerous amendments.]",21.6.,1984,5,21/VI/1984,"21/VI/1984 Notification of the Federal Ministry of Labour and Social Affairs to amend and supplement the Notification [No. 104 of 1964] to provide for the application of the Act [No. 103 of 1964] respecting a sickness scheme for co-operative farmers and a benefit scheme for mothers and children, as subsequently amended, (ibid., Text 74) [Numerous amendments.] "
CZECHOSLOVAKIA,,"Notification of the Central Council of Trade Unions to amend the Notification [No. 143 of 1965] respecting the grant of cash sickness insurance benefits, (ibid., Text 80) [Amends ss. 41 and 59.]",22.6.,1984,5,22/V1/1984,"22/V1/1984 Notification of the Central Council of Trade Unions to amend the Notification [No. 143 of 1965] respecting the grant of cash sickness insurance benefits, (ibid., Text 80) [Amends ss. 41 and 59.] "
CZECHOSLOVAKIA,,"Notification of the Central Council of Trade Unions to amend the Notification [No. 95 of 1968] of the Central Council of Trade Unions respecting the grant of children's allowances under the sickness insurance scheme, (ibid., Text 78) [Amends ss. 1, 2, 7, Il and 14.]",22.8.,1984,5,22/VIII/1984,"22/VIII/1984 Notification of the Central Council of Trade Unions to amend the Notification [No. 95 of 1968] of the Central Council of Trade Unions respecting the grant of children's allowances under the sickness insurance scheme, (ibid., Text 78) [Amends ss. 1, 2, 7, Il and 14.] "
CZECHOSLOVAKIA,Czech Socialist Republic,"Notification of the Ministry of Labour and Social Affairs of the Czech Socialist Republic to amend and supplement Notification No. 130 of 1975 of the Ministry of Labour and Social Affairs of the Czech Socialist Republic to provide for the application of the Social Security Act [of 12 November 1975: LS 1975—Cz. 3] and the Act [of 18 November 1975] of the Czech National Council respecting the competence of the authorities of the Czech Socialist Republic in matters of social security, as subsequently amended, (ibid., Text 94) [Miscellaneous amendments.]",7.9.,1984,5,7/IX/1984,"7/IX/1984 Notification of the Ministry of Labour and Social Affairs of the Czech Socialist Republic to amend and supplement Notification No. 130 of 1975 of the Ministry of Labour and Social Affairs of the Czech Socialist Republic to provide for the application of the Social Security Act [of 12 November 1975: LS 1975—Cz. 3] and the Act [of 18 November 1975] of the Czech National Council respecting the competence of the authorities of the Czech Socialist Republic in matters of social security, as subsequently amended, (ibid., Text 94) [Miscellaneous amendments.] "
CZECHOSLOVAKIA,Slovak Socialist Republic,"15/VIII/l 984 Notification of the Ministry of Labour and Social Affairs of the Slovak Socialist Republic to amend and supplement Notification No. 134 of 1975 of the Ministry of Labour and Social Affairs of the Slovak Socialist Republic to provide for the application of the Social Security Act [of 12 November 1975: LS 1975—Cz. 3] and the Act [of 19 November 1975] of the Slovak National Council respecting the competence of the authorities of the Slovak Socialist Republic in matters of social security, (ibid., Text 92) [Miscellaneous amendments.]",,,5,,"15/VIII/l 984 Notification of the Ministry of Labour and Social Affairs of the Slovak Socialist Republic to amend and supplement Notification No. 134 of 1975 of the Ministry of Labour and Social Affairs of the Slovak Socialist Republic to provide for the application of the Social Security Act [of 12 November 1975: LS 1975—Cz. 3] and the Act [of 19 November 1975] of the Slovak National Council respecting the competence of the authorities of the Slovak Socialist Republic in matters of social security, (ibid., Text 92) [Miscellaneous amendments.] "
DENMARK,,"Notification respecting social pensions. No. 455. (Lovtidende A, 1984, No. 61)",5.9.,1984,5,5/IX/1984,"5/IX/1984 Notification respecting social pensions. No. 455. (Lovtidende A, 1984, No. 61) "
DENMARK,,"5/IX/l 984 Notification respecting applications for social pensions, the payment of such pensions, etc. No. 456. (ibid.)",,,5,,"5/IX/l 984 Notification respecting applications for social pensions, the payment of such pensions, etc. No. 456. (ibid.) "
ECUADOR,,Act No. 180 on the financing of the trade union central organisations. (Registro Oficial 9 Aug.),7.8.,1984,5,7/VIII/1984,7/VIII/1984 Act No. 180 on the financing of the trade union central organisations. (Registro Oficial 9 Aug.) 
FINLAND,,"Ordinance to amend s. 9 of the Employment Ordinance (No. 948 of 1971 ). (Finlands Författningssamling -Suomen Säädöskokoelma, No. 261)",23.3.,1984,5,23/III/1984,"23/III/1984 Ordinance to amend s. 9 of the Employment Ordinance (No. 948 of 1971 ). (Finlands Författningssamling -Suomen Säädöskokoelma, No. 261) "
FINLAND,,"Ordinance to amend the Ordinance (No. 832 of 1982) respecting assistance in the placement of handicapped persons in employment, (ibid., No. 321) [Amends ss. 3, 7, 9 and 17.]",25.4.,1984,5,25/IV/1984,"25/IV/1984 Ordinance to amend the Ordinance (No. 832 of 1982) respecting assistance in the placement of handicapped persons in employment, (ibid., No. 321) [Amends ss. 3, 7, 9 and 17.] "
FINLAND,,"Decision of the Council of State respecting the linkage of national pensions to the cost of living, (ibid., No. 383) [Repeals Decision No. 780 of 1982 on the same subject.]",17.5.,1984,5,17/V/1984,"17/V/1984 Decision of the Council of State respecting the linkage of national pensions to the cost of living, (ibid., No. 383) [Repeals Decision No. 780 of 1982 on the same subject.] "
FINLAND,,"An Act to amend the Act (No. 649 of 1973) [LS 1973—Fin. 2] to provide for the guaranteed payment of wages, (ibid., No. 403) [Amends ss. 4, 7, 8, 12, 16 and 17 and inserts new ss. la and la.]",25.5.,1984,5,25/V/1984,"25/V/1984 An Act to amend the Act (No. 649 of 1973) [LS 1973—Fin. 2] to provide for the guaranteed payment of wages, (ibid., No. 403) [Amends ss. 4, 7, 8, 12, 16 and 17 and inserts new ss. la and la.] "
FINLAND,,"Seamen's Leave Act. (ibid., No. 433) [Repeals Act No. 353 of 1975 on the same subject.]",1.6.,1984,5,l/VI/1984,"l/VI/1984 Seamen's Leave Act. (ibid., No. 433) [Repeals Act No. 353 of 1975 on the same subject.] "
FINLAND,,1985—List No. 3 6 (212),,,6,,1985—List No. 3 6 (212) 
FINLAND,,"An Act to amend the Seamen's Hours of Work Act (No. 296 of 1976) [LS 1976—Fin. 1]. (ibid., No. 435) [Amends ss. 15 and 28 and inserts new ss. 16a to 16c.]",1.6.,1984,6,l/VI/1984,"l/VI/1984 An Act to amend the Seamen's Hours of Work Act (No. 296 of 1976) [LS 1976—Fin. 1]. (ibid., No. 435) [Amends ss. 15 and 28 and inserts new ss. 16a to 16c.] "
FINLAND,,"An Act to amend section 3 of the Annual Leave Act (No. 272 of 1973). (ibid., No. 510)",29.6.,1984,6,29/VI/1984,"29/VI/1984 An Act to amend section 3 of the Annual Leave Act (No. 272 of 1973). (ibid., No. 510) "
FINLAND,,"Decision of the Ministry of Manpower to apply the Ordinance (No. 832 of 1982) respecting assistance in the placement of handicapped persons in employment, (ibid., No. 624) [Repeals Decision No. 64 of 1983 on the same subject.]",24.7.,1984,6,24/VII/1984,"24/VII/1984 Decision of the Ministry of Manpower to apply the Ordinance (No. 832 of 1982) respecting assistance in the placement of handicapped persons in employment, (ibid., No. 624) [Repeals Decision No. 64 of 1983 on the same subject.] "
FINLAND,,"An Act to protect the livelihood of unemployed persons, (ibid., No. 602) [Provides for the payment of daily unemployment benefit to unemployed jobseekers who are resident in Finland.]",24.8.,1984,6,24/VIII/1984,"24/VIII/1984 *An Act to protect the livelihood of unemployed persons, (ibid., No. 602) [Provides for the payment of daily unemployment benefit to unemployed jobseekers who are resident in Finland.] "
FINLAND,,"Act respecting unemployment funds, (ibid., No. 603) [Repeals Act No. 125 of 1934 (LS 1934—Fin. 3 . . . 1960—Fin. 4) respecting nation-wide unemployment funds.]",24.8.,1984,6,24/VIII/1984,"24/VIII/1984 *Act respecting unemployment funds, (ibid., No. 603) [Repeals Act No. 125 of 1934 (LS 1934—Fin. 3 . . . 1960—Fin. 4) respecting nation-wide unemployment funds.] "
FINLAND,,"An Act to amend the Employment Act (No. 946 of 1971) [LS 1971—Fin. 1 ]. (ibid., No. 605) [Amends ss. 8 and 16 and repeals ss. 17 to 20, 24 to 25a and 27 to 28.]",24.8.,1984,6,24/VIII/1984,"24/VIII/1984 An Act to amend the Employment Act (No. 946 of 1971) [LS 1971—Fin. 1 ]. (ibid., No. 605) [Amends ss. 8 and 16 and repeals ss. 17 to 20, 24 to 25a and 27 to 28.] "
FINLAND,,"An Act to amend section 16 of the Act (No. 31 of 1976) respecting training for employment, (ibid., No. 606)",24.8.,1984,6,24/VIII/1984,"24/VIII/1984 An Act to amend section 16 of the Act (No. 31 of 1976) respecting training for employment, (ibid., No. 606) "
FINLAND,,"An Act to amend sections 2 and 7 of the Workers' Pensions Act (No. 395 of 1961) [LS 1961—Fin. 4]. (ibid., No. 607)",24.8.,1984,6,24/VIII/1984,"24/VIII/1984 An Act to amend sections 2 and 7 of the Workers' Pensions Act (No. 395 of 1961) [LS 1961—Fin. 4]. (ibid., No. 607) "
FINLAND,,"An Act to amend the Act (No. 436 of 1946) [LS 1946—Fin. 2] respecting collective agreements, (ibid., No. 660) [Amends ss. 7 to 10 and inserts a new s. 13a.]",7.9.,1984,6,7/IX/1984,"7/IX/1984 An Act to amend the Act (No. 436 of 1946) [LS 1946—Fin. 2] respecting collective agreements, (ibid., No. 660) [Amends ss. 7 to 10 and inserts a new s. 13a.] "
FINLAND,,"Ordinance respecting manpower committees, (ibid., No. 689) [Attached to manpower offices to give rulings on certain questions of employment and unemployment.]",5.10.,1984,6,5/X/1984,"5/X/1984 Ordinance respecting manpower committees, (ibid., No. 689) [Attached to manpower offices to give rulings on certain questions of employment and unemployment.] "
FINLAND,,"Ordinance to amend the Ordinance (No. 883 of 1973) respecting the guaranteed payment of wages, (ibid., No. 701) [Amends ss. 4 and 8 and repeals s. 10]",12.10.,1984,6,12/X/1984,"12/X/1984 Ordinance to amend the Ordinance (No. 883 of 1973) respecting the guaranteed payment of wages, (ibid., No. 701) [Amends ss. 4 and 8 and repeals s. 10] "
FRANCE,,"Decree No. 84-492 to revise and supplement the tables of occupational diseases appended to Decree No. 46-2959 of 31 December 1946 [LS 1948—Fr. 4B] made under Book IV of the Social Security Code, respecting the prevention of, and compensation for, industrial accidents and occupational diseases. {Journal officiel, 25/26 June)",22.6.,1984,6,22/VI/1984,"22/VI/1984 Decree No. 84-492 to revise and supplement the tables of occupational diseases appended to Decree No. 46-2959 of 31 December 1946 [LS 1948—Fr. 4B] made under Book IV of the Social Security Code, respecting the prevention of, and compensation for, industrial accidents and occupational diseases. {Journal officiel, 25/26 June) "
FRANCE,,"Decree No. 84-497 to supplement the provisions of the Labour Code respecting agreements for the grant of temporary regressive allowances, (ibid., 27 June) [Inserts a new s. R. 322-6-1 in the Labour Code: In regions and sectors where state-assisted industrial restructuring is undertaken, individual agreements for the grant of temporary regressive allowances may be concluded between the State and undertakings which have carried out collective dismissals, for the workers concerned who accept to be resettled in jobs involving a lower remuneration than they received in their previous jobs.]",25.6.,1984,6,25/VI/1984,"25/VI/1984 Decree No. 84-497 to supplement the provisions of the Labour Code respecting agreements for the grant of temporary regressive allowances, (ibid., 27 June) [Inserts a new s. R. 322-6-1 in the Labour Code: In regions and sectors where state-assisted industrial restructuring is undertaken, individual agreements for the grant of temporary regressive allowances may be concluded between the State and undertakings which have carried out collective dismissals, for the workers concerned who accept to be resettled in jobs involving a lower remuneration than they received in their previous jobs.] "
FRANCE,,"Organic Act No. 84^*99 to amend Ordinance No. 58-1360 of 29 December 1958 [LS 1959—Fr. 2B] to promulgate an organic Act respecting the Economic and Social Council. (ibid., 28 June) [Miscellaneous amendments.]",27.6.,1984,6,27/VI/1984,"27/VI/1984 Organic Act No. 84^*99 to amend Ordinance No. 58-1360 of 29 December 1958 [LS 1959—Fr. 2B] to promulgate an organic Act respecting the Economic and Social Council. (ibid., 28 June) [Miscellaneous amendments.] "
FRANCE,,"Act No. 84-622 to amend Ordinance No. 45-2658 of 2 November 1945 [respecting the conditions under which aliens may enter and reside in France, and respecting the establishment of a National Immigration Office] and the Labour Code [LS 1981—Fr. 1 . . . 1983—Fr. 3] and respecting aliens residing in France and residence and work permits. (ibid., 19 July) [Replaces s. L. 341-4 and repeals s. L. 341-5 of the Labour Code.]",17.7.,1984,6,17/VII/1984,"17/VII/1984 Act No. 84-622 to amend Ordinance No. 45-2658 of 2 November 1945 [respecting the conditions under which aliens may enter and reside in France, and respecting the establishment of a National Immigration Office] and the Labour Code [LS 1981—Fr. 1 . . . 1983—Fr. 3] and respecting aliens residing in France and residence and work permits. (ibid., 19 July) [Replaces s. L. 341-4 and repeals s. L. 341-5 of the Labour Code.] "
FRANCE,,213) 7 1985—List No. 3,,,7,,(213) 7 1985—List No. 3 
FRANCE,,"Decree No. 84-630 respecting the Higher Council for Social Work, (ibid.) [A Higher Council for Social Work is set up under the Minister of Social Affairs and National Solidarity. It gives its opinion on matters relating to training and the exercise of an occupation, excluding issues relating to bargaining or the application of collective agreements in the social sector, and international relations in the field of social work. Repeals, inter alia, Decree No. 62- 895 of 31 July 1962 respecting the Higher Council for Social Service.]",17.7.,1984,7,17/VII/1984,"17/VII/1984 Decree No. 84-630 respecting the Higher Council for Social Work, (ibid.) [A Higher Council for Social Work is set up under the Minister of Social Affairs and National Solidarity. It gives its opinion on matters relating to training and the exercise of an occupation, excluding issues relating to bargaining or the application of collective agreements in the social sector, and international relations in the field of social work. Repeals, inter alia, Decree No. 62- 895 of 31 July 1962 respecting the Higher Council for Social Service.] "
FRANCE,New Caledonia and Dependencies,"3/DC/1984 Decree No. 84-816 making certain provisions of the Labour Code applicable to the Territory of New Caledonia and Dependencies (Second Part: Decrees in Council of State). (Journal officiel de la Nouvelle-Calédonie el Dépendances, 9 Oct.)",,,7,,"3/DC/1984 Decree No. 84-816 making certain provisions of the Labour Code applicable to the Territory of New Caledonia and Dependencies (Second Part: Decrees in Council of State). (Journal officiel de la Nouvelle-Calédonie el Dépendances, 9 Oct.) "
FRANCE,New Caledonia and Dependencies,"Act No. 84-821: Statute of the Territory of New Caledonia and Dependencies (promulgated by Order No. 2517 of 18 September 1984). (ibid., 20 Sep.) (Title V deals with access to the public service.]",6.9.,1984,7,6/1X/1984,"6/1X/1984 Act No. 84-821: Statute of the Territory of New Caledonia and Dependencies (promulgated by Order No. 2517 of 18 September 1984). (ibid., 20 Sep.) (Title V deals with access to the public service.] "
FRANCE,New Caledonia and Dependencies,"Decision No. 2757 recognising certain training programmes as continuous vocational training within the framework of permanent education, (ibid., 23 Oct.)",10.10.,1984,7,10/X/1984,"10/X/1984 Decision No. 2757 recognising certain training programmes as continuous vocational training within the framework of permanent education, (ibid., 23 Oct.) "
GERMAN DEMOCRATIC REPUBLIC,,"Ordinance (No. 2) respecting the grant and the calculation of pension under compulsory social insurance. Pension Ordinance (No. 2). (Gesetzblatt der Deutschen Demokratischen Republik, Part I, 15 Aug.)",26.7.,1984,7,26/VII/1984,"26/VII/1984 Ordinance (No. 2) respecting the grant and the calculation of pension under compulsory social insurance. Pension Ordinance (No. 2). (Gesetzblatt der Deutschen Demokratischen Republik, Part I, 15 Aug.) "
FEDERAL REPUBLIC OF GERMANY,,"Ordinance (No. 7) to amend the Ordinance respecting work permits. (Bundesgesetz- blatt, Part I, 14 July) [Amends s. 1 (2), clause 3 (provisions relating to persons requesting asylum).]",6.7.,1984,7,6/VII/1984,"6/VII/1984 Ordinance (No. 7) to amend the Ordinance respecting work permits. (Bundesgesetz- blatt, Part I, 14 July) [Amends s. 1 (2), clause 3 (provisions relating to persons requesting asylum).] "
FEDERAL REPUBLIC OF GERMANY,,"An Act (No. 5) to amend certain provisions respecting the public service, (ibid., 31 July) [Amends, inter alia, the consolidated text, as at 3 January 1977, of the Basic Act respecting the law applicable to public servants and the consolidated text, as at 3 January 1977, of the Federal Public Servants Act.]",25.7.,1984,7,25/VII/1984,"25/VII/1984 An Act (No. 5) to amend certain provisions respecting the public service, (ibid., 31 July) [Amends, inter alia, the consolidated text, as at 3 January 1977, of the Basic Act respecting the law applicable to public servants and the consolidated text, as at 3 January 1977, of the Federal Public Servants Act.] "
FEDERAL REPUBLIC OF GERMANY,,"Act to improve the right to vote in elections concerning social insurance, (ibid., 2 Aug.) [Amends certain provisions of Books I and IV of the Social Code [LS 1980—Ger.F.R. 2], supplements ss. 655 (4) and 656 of the Federal Insurance Code [LS 1980—Ger.F.R. 1] and amends s. 205 of the Employment Promotion Act of 25 June 1969 [LS 1969—Ger.F.R. 1, 1974—Ger.F.R. 1]",27.7.,1984,7,27/VII/1984,"27/VII/1984 Act to improve the right to vote in elections concerning social insurance, (ibid., 2 Aug.) [Amends certain provisions of Books I and IV of the Social Code [LS 1980—Ger.F.R. 2], supplements ss. 655 (4) and 656 of the Federal Insurance Code [LS 1980—Ger.F.R. 1] and amends s. 205 of the Employment Promotion Act of 25 June 1969 [LS 1969—Ger.F.R. 1, 1974—Ger.F.R. 1] "
FEDERAL REPUBLIC OF GERMANY,,"Notification of the consolidated text of the Ordinance respecting safety on board ships. Safety on Board Ships Ordinance-SchSV. (ibid., 22 Aug.)",15.8.,1984,7,15/VIII/1984,"15/VIII/1984 Notification of the consolidated text of the Ordinance respecting safety on board ships. Safety on Board Ships Ordinance-SchSV. (ibid., 22 Aug.) "
FEDERAL REPUBLIC OF GERMANY,,"First Act to amend the Youth Employment Protection Act. [12April 1976: LS 1976— Ger.F.R. 2]. (ibid., 20 Oct.) [Apart from a number of minor amendments to the Act of 1976, makes corresponding amendments in the Seaman's Act [26 July 1957: BGBl. II], the Federal Insurance Code [LS 1980—Ger.F.R. 1], the Farmers' Sickness Insurance Act 1972 [10 August 1972: BGBl. I] and the Employment Promotion Act [25 June 1969: LS 1969—Ger.F.R. 1 . . . 1974—Ger.F.R. 1]]",15.10.,1984,7,15/X/1984,"15/X/1984 First Act to amend the Youth Employment Protection Act. [12April 1976: LS 1976— Ger.F.R. 2]. (ibid., 20 Oct.) [Apart from a number of minor amendments to the Act of 1976, makes corresponding amendments in the Seaman's Act [26 July 1957: BGBl. II], the Federal Insurance Code [LS 1980—Ger.F.R. 1], the Farmers' Sickness Insurance Act 1972 [10 August 1972: BGBl. I] and the Employment Promotion Act [25 June 1969: LS 1969—Ger.F.R. 1 . . . 1974—Ger.F.R. 1]] "
GREECE,,"Presidential Decree No. 120: Health and safety of employees of the shipyards. (Efemeris tes Kubemeseos, Part L 15 May) [Supplements Royal Decree of 25 August 1920 codifying the legislative provisions on workers' health and safety.]",15.5.,1984,7,15/V/1984,"15/V/1984 Presidential Decree No. 120: Health and safety of employees of the shipyards. (Efemeris tes Kubemeseos, Part L 15 May) [Supplements Royal Decree of 25 August 1920 codifying the legislative provisions on workers' health and safety.] "
GUYANA,,Labour (Amendment) Act 1984. No. 9 of 1984,6.4.,1984,7,6/IV/1984,6/IV/1984 Labour (Amendment) Act 1984. No. 9 of 1984. 
GUYANA,,1985—List No. 3 8 (214),,,8,,1985—List No. 3 8 (214) 
IRELAND,,"Protection of Young Persons (Prohibition on Employment of Children) Order 1981. (Statutory Instrument, No. 429)",17.12.,1981,8,17/XII/1981,"17/XII/1981 Protection of Young Persons (Prohibition on Employment of Children) Order 1981. (Statutory Instrument, No. 429). "
IRELAND,,"Employment Regulation Order (Agricultural Workers Joint Labour Committee). No. 2. (ibid., No. 336). [This instrument fixes statutory minimum rates of remuneration and statutory conditions of employment of agricultural workers as defined by the Industrial Relations Act 1976.]",2.11.,1983,8,2/XI/1983,"2/XI/1983 Employment Regulation Order (Agricultural Workers Joint Labour Committee). No. 2. (ibid., No. 336). [This instrument fixes statutory minimum rates of remuneration and statutory conditions of employment of agricultural workers as defined by the Industrial Relations Act 1976.] "
ITALY,,"Decree No. 536 of the President of the Republic respecting regulations concerning the Department of the Civil Service. (Gazzetta Ufficiale, 3 Sep.)",20.6.,1984,8,20/VI/1984,"20/VI/1984 Decree No. 536 of the President of the Republic respecting regulations concerning the Department of the Civil Service. (Gazzetta Ufficiale, 3 Sep.) "
ITALY,,"Act No. 413 respecting the reorganisation of the pension scheme for seamen, (ibid., Supplement, 2 Aug.)",6.7.,1984,8,6/VII/1984,"6/VII/1984 Act No. 413 respecting the reorganisation of the pension scheme for seamen, (ibid., Supplement, 2 Aug.) "
ITALY,,"Decree supplementing the provisions of the Decree of 12 September 1958 approving a model register of accidents, (ibid., 10 Oct.) [Computerisation of data concerning industrial accidents.]",10.8.,1984,8,10/VIII/1984,"10/VIII/1984 Decree supplementing the provisions of the Decree of 12 September 1958 approving a model register of accidents, (ibid., 10 Oct.) [Computerisation of data concerning industrial accidents.] "
