country,region,text,date,year,page,extracted_date,full_text
ITALY,,"29/VIII/l 984 Legislative Decree No. 519 respecting urgent measures to maintain and increase the level of employment, (ibid., 30 Aug.) [Inter alia, s. 3: workers aged between 15 and 29 years may be engaged by undertakings and public bodies under a contract for training and employment of a duration not to exceed 24 months. S. 4: regional committees for employment. S. 5: employment of workers under contracts for part-time employment.]",,,8,,"29/VIII/l 984 Legislative Decree No. 519 respecting urgent measures to maintain and increase the level of employment, (ibid., 30 Aug.) [Inter alia, s. 3: workers aged between 15 and 29 years may be engaged by undertakings and public bodies under a contract for training and employment of a duration not to exceed 24 months. S. 4: regional committees for employment. S. 5: employment of workers under contracts for part-time employment.] "
IVORY COAST,,"Decree No. 84-109 amending section 12 of Decree No. 82-729 of 21 July 1982, as amended by Decree No. 83-807 of 3 August 1983, laying down operating rules for the Ivory Coast Manpower Office. (Journal officiel, 15 Mar.)",22.2.,1984,8,22/11/1984,"22/11/1984 Decree No. 84-109 amending section 12 of Decree No. 82-729 of 21 July 1982, as amended by Decree No. 83-807 of 3 August 1983, laying down operating rules for the Ivory Coast Manpower Office. (Journal officiel, 15 Mar.) "
IVORY COAST,,"Decree No. 84-545 to specify the powers and duties of the Minister of Social Affairs, and to reorganise his Ministry, (ibid., 24 May) [Responsible, inter alia, for the training of social workers.]",18.4.,1984,8,I8/IV/1984,"I8/IV/1984 Decree No. 84-545 to specify the powers and duties of the Minister of Social Affairs, and to reorganise his Ministry, (ibid., 24 May) [Responsible, inter alia, for the training of social workers.] "
IVORY COAST,,"Order No. 9 MTIC.CAB. on the powers and duties of the Inspector-General of the Labour and Employment Services, (ibid., 21 June) [The Inspector-General may also examine files relating to employment or any field within the jurisdiction of the Minister of Labour and Ivorisation of Public Employees.]",2.5.,1984,8,2/V/1984,"2/V/1984 Order No. 9 MTIC.CAB. on the powers and duties of the Inspector-General of the Labour and Employment Services, (ibid., 21 June) [The Inspector-General may also examine files relating to employment or any field within the jurisdiction of the Minister of Labour and Ivorisation of Public Employees.] "
JAMAICA,,"31 /VIII/1982 An Act to establish a scheme for financing and implementing the training of persons with a view to employment and to provide for matters connected therewith or incidental thereto. No. 13-1982. Human Employment and Resource Training Act ¡982. [Establishes a Human Employment and Resource Training Trust the functions of which shall be: (a) to develop, encourage, monitor and provide finance for, training schemes for employment of trainees; (b) to provide employment opportunities for trainees; (c) to direct or assist in the placement of persons seeking employment in Jamaica; (d) to promote employment projects.]",,,8,,"31 /VIII/1982 An Act to establish a scheme for financing and implementing the training of persons with a view to employment and to provide for matters connected therewith or incidental thereto. No. 13-1982. Human Employment and Resource Training Act ¡982. [Establishes a Human Employment and Resource Training Trust the functions of which shall be: (a) to develop, encourage, monitor and provide finance for, training schemes for employment of trainees; (b) to provide employment opportunities for trainees; (c) to direct or assist in the placement of persons seeking employment in Jamaica; (d) to promote employment projects.] "
JORDAN,,"Provisional Act No. 18 of 1984 to amend the Labour Code. (Al-Jarida al-Rasmiya, 2 Apr.) [Repeals subs. (7) of s. 13 of the principal Act (No. 21 of 1960) and provides, inter alia, that an employer may hire a foreign worker only if there are no Jordanian workers with the required qualifications or if there are not enough such workers, and that priority shall in all cases be",20.5.,1984,8,20/V/1984,"20/V/1984 Provisional Act No. 18 of 1984 to amend the Labour Code. (Al-Jarida al-Rasmiya, 2 Apr.) [Repeals subs. (7) of s. 13 of the principal Act (No. 21 of 1960) and provides, inter alia, that an employer may hire a foreign worker only if there are no Jordanian workers with the required qualifications or if there are not enough such workers, and that priority shall in all cases be "
JORDAN,,215) 9 1985—List No. 3,,,9,,(215) 9 1985—List No. 3 
KUWAIT,,"1984 Ministerial Order No. 77 concerning the issue of work permits to non-Kuwaiti workers in the private sector. (Al Koweit al Yom, 15 Apr.) [Repeals Ministerial Orders Nos. 37 and 39 of 1979 on the same subject.]",,,9,,"1984 Ministerial Order No. 77 concerning the issue of work permits to non-Kuwaiti workers in the private sector. (Al Koweit al Yom, 15 Apr.) [Repeals Ministerial Orders Nos. 37 and 39 of 1979 on the same subject.] "
LUXEMBOURG,,"13/VI/l 984 Grand-Ducal Regulations to amend the Grand-Ducal Regulations of 24 May 1979 to lay down rules for the sickness insurance of self-employed intellectual workers. (Mémorial, Series A, 22 June) [Amend ss. 1 and 4.]",,,9,,"13/VI/l 984 Grand-Ducal Regulations to amend the Grand-Ducal Regulations of 24 May 1979 to lay down rules for the sickness insurance of self-employed intellectual workers. (Mémorial, Series A, 22 June) [Amend ss. 1 and 4.] "
LUXEMBOURG,,"Consolidated text of the Act of 30 June 1976, as amended, to set up an unemployment fund and to regulate the grant of compensation for total unemployment, (ibid., 31 July) [Inter alia, Title II, Ch. II: Unemployment of young persons (ss. 30 to 32); Ch. Ill: Measures for job integration and reintegration (s. 33); Ch. IV: Unemployment of self-employed persons (s. 34). ]",31.7.,1984,9,3I/VII/1984,"3I/VII/1984 Consolidated text of the Act of 30 June 1976, as amended, to set up an unemployment fund and to regulate the grant of compensation for total unemployment, (ibid., 31 July) [Inter alia, Title II, Ch. II: Unemployment of young persons (ss. 30 to 32); Ch. Ill: Measures for job integration and reintegration (s. 33); Ch. IV: Unemployment of self-employed persons (s. 34). ] "
LUXEMBOURG,,"Consolidated text of the Act of 27 July 1978 to proyide for various measures to promote the employment of young persons, as amended and adapted, (ibid., 1 Aug.) [Inter alia, Ch. I: Practical training contract (ss. 1 to 13); Ch. II: Setting up of a temporary auxiliary workers' division (ss. 14 to 18); Ch. Ill: Orientation bonus (s. 19); Ch. IV: Assistance towards the recruitment of apprentices (s. \9bis); Ch. V: Declaration of vacancies (s. 20).]",1.8.,1984,9,l/VIII/1984,"l/VIII/1984 Consolidated text of the Act of 27 July 1978 to proyide for various measures to promote the employment of young persons, as amended and adapted, (ibid., 1 Aug.) [Inter alia, Ch. I: Practical training contract (ss. 1 to 13); Ch. II: Setting up of a temporary auxiliary workers' division (ss. 14 to 18); Ch. Ill: Orientation bonus (s. 19); Ch. IV: Assistance towards the recruitment of apprentices (s. \9bis); Ch. V: Declaration of vacancies (s. 20).] "
MALTA,,"Arbitration Rules of Procedure (Amendment) Rules 1984. L.N. 55 of 1984. (Government Gazette, Supplement, 20 Nov.) [Rules made under the Industrial Relations Act 1976 (Act No. XXX of 1976: LS 1976—Malta 1). Miscellaneous amendments, inter alia, Rule 7, concerning ""List of witnesses"".]",,,9,,"— Arbitration Rules of Procedure (Amendment) Rules 1984. L.N. 55 of 1984. (Government Gazette, Supplement, 20 Nov.) [Rules made under the Industrial Relations Act 1976 (Act No. XXX of 1976: LS 1976—Malta 1). Miscellaneous amendments, inter alia, Rule 7, concerning ""List of witnesses"".] "
MAURITIUS,,"30/IH/l 984 An Act to provide for the establishment of a Central Training Office. Central Training Office Act 1984. (Government Gazette, Legal Supplement, 31 Mar.) [The objects of the Office shall be (a) to advise the Minister responsible for Education on matters relating to vocational and technical training; (b) to monitor the needs for occupational training; (c) to administer, control and operate training schemes; (d) to provide for, promote, assist in and regulate the training or apprenticeship of persons employed in commercial, technical and vocational fields. The Central Training Office Act 1980 is repealed.]",,,9,,"30/IH/l 984 An Act to provide for the establishment of a Central Training Office. Central Training Office Act 1984. (Government Gazette, Legal Supplement, 31 Mar.) [The objects of the Office shall be (a) to advise the Minister responsible for Education on matters relating to vocational and technical training; (b) to monitor the needs for occupational training; (c) to administer, control and operate training schemes; (d) to provide for, promote, assist in and regulate the training or apprenticeship of persons employed in commercial, technical and vocational fields. The Central Training Office Act 1980 is repealed.] "
MAURITIUS,,"28/VI/l 984 An Act to provide for the payment of an additional remuneration. No. 33. Additional Remuneration Act 1984. (ibid., Legal Supplement, 30 June)",,,9,,"28/VI/l 984 An Act to provide for the payment of an additional remuneration. No. 33. Additional Remuneration Act 1984. (ibid., Legal Supplement, 30 June) "
NETHERLANDS,,"Decision of the Minister of Justice under section 2 (1) (c) of the Employment of Foreign Workers Act, respecting the publication in the Staatsblad of the text of Royal Decree No. 574 of 25 October 1979, as amended by Royal Decree No. 249 of 26 April 1984. (Staatsblad, No. 377) [Consolidated text of the Decree in annex.]",10.8.,1984,9,10/VIII/1984,"10/VIII/1984 Decision of the Minister of Justice under section 2 (1) (c) of the Employment of Foreign Workers Act, respecting the publication in the Staatsblad of the text of Royal Decree No. 574 of 25 October 1979, as amended by Royal Decree No. 249 of 26 April 1984. (Staatsblad, No. 377) [Consolidated text of the Decree in annex.] "
NETHERLANDS,,"An Act to amend the Sickness Funds Act (No. 392 of 1964: LS 1964—Neth. 2] and the General Special Sickness Expenses Act [No. 655 of 1967]. (ibid., No. 427) [Miscellaneous amendments.]",26.9.,1984,9,26/IX/1984,"26/IX/1984 An Act to amend the Sickness Funds Act (No. 392 of 1964: LS 1964—Neth. 2] and the General Special Sickness Expenses Act [No. 655 of 1967]. (ibid., No. 427) [Miscellaneous amendments.] "
NETHERLANDS,,"Decree to make regulations for the financing of sickness funds within the framework of the sickness funds insurance scheme. Sickness Funds (Financing) Decree, (ibid., No. 429)",26.9.,1984,9,26/IX/1984,"26/IX/1984 Decree to make regulations for the financing of sickness funds within the framework of the sickness funds insurance scheme. Sickness Funds (Financing) Decree, (ibid., No. 429) "
NETHERLANDS,,1985—List No. 3 10 (216),,,10,,1985—List No. 3 10 (216) 
NORWAY,,"Provisions to amend the Provisions [of 29 April 1977] respecting workers' protection officials and working environment committees. No. 240. (Norsk Lovtidend, Part I, 23 Feb.) [Amends ss. 1, 5, 6 and 9.]",3.2.,1984,10,3/II/1984,"3/II/1984 Provisions to amend the Provisions [of 29 April 1977] respecting workers' protection officials and working environment committees. No. 240. (Norsk Lovtidend, Part I, 23 Feb.) [Amends ss. 1, 5, 6 and 9.] "
NORWAY,,"An Act to amend the Act (No. 13 of 23 May 1980) [LS 1980—Nor. 1] respecting vocational training at work. No. 6. (ibid., 21 Mar.) [Amends s. 7.]",2.3.,1984,10,2/III/1984,"2/III/1984 An Act to amend the Act (No. 13 of 23 May 1980) [LS 1980—Nor. 1] respecting vocational training at work. No. 6. (ibid., 21 Mar.) [Amends s. 7.] "
NORWAY,,"An Act to amend the Act (No. 4 of 4 February 1977) [LS 1977—Nor. 1] respecting workers' protection and the working environment, etc. No. 12. (ibid., 25 Apr.) [Amends ss. 41, 46, 47, 49 and 50 and inserts a new s. 45A.]",30.3.,1984,10,30/III/1984,"30/III/1984 An Act to amend the Act (No. 4 of 4 February 1977) [LS 1977—Nor. 1] respecting workers' protection and the working environment, etc. No. 12. (ibid., 25 Apr.) [Amends ss. 41, 46, 47, 49 and 50 and inserts a new s. 45A.] "
NORWAY,,"An Act to amend the National Insurance Act (No. 12of 17June 1966)[LS 1970—Nor. 1 (consolidation), 1971—Nor. 2]. No. 35. (ibid., 26 June) [Amends ss. 6 and 16.]",1.6.,1984,10,l/VI/1984,"l/VI/1984 An Act to amend the National Insurance Act (No. 12of 17June 1966)[LS 1970—Nor. 1 (consolidation), 1971—Nor. 2]. No. 35. (ibid., 26 June) [Amends ss. 6 and 16.] "
NORWAY,,"An Act to amend the rules as to benefit during unemployment contained in the National Insurance Act (No. 12 of 17 June 1966) [LS 1970—Nor. 1 (consolidation), 1971— Nor. 2], No. 68. (ibid., 10 July) [Amends s. 4.]",8.6.,1984,10,8/VI/1984,"8/VI/1984 An Act to amend the rules as to benefit during unemployment contained in the National Insurance Act (No. 12 of 17 June 1966) [LS 1970—Nor. 1 (consolidation), 1971— Nor. 2], No. 68. (ibid., 10 July) [Amends s. 4.] "
NORWAY,,"8/VI/l 984 An Act to amend the Act (No. 2 of 3 December 1951 ) respecting pension insurance for forestry workers. No. 72. (ibid.) [Amends ss. 3, 12, 13 and 36 and repeals s. 24.]",,,10,,"8/VI/l 984 An Act to amend the Act (No. 2 of 3 December 1951 ) respecting pension insurance for forestry workers. No. 72. (ibid.) [Amends ss. 3, 12, 13 and 36 and repeals s. 24.] "
NORWAY,,"Provisions respecting unemployment insurance in fishing. No. 1300. (ibid., 19 July) [Repeal the Provisions of 20 November 1981 on the same subject.]",22.6.,1984,10,22/VI/1984,"22/VI/1984 Provisions respecting unemployment insurance in fishing. No. 1300. (ibid., 19 July) [Repeal the Provisions of 20 November 1981 on the same subject.] "
NORWAY,,"Provisions respecting the leave scheme for fishermen. No. 1317. (ibid., 24 July) [Repeal the Provisions of 17 December 1982 on the same subject.]",27.6.,1984,10,27/VI/1984,"27/VI/1984 Provisions respecting the leave scheme for fishermen. No. 1317. (ibid., 24 July) [Repeal the Provisions of 17 December 1982 on the same subject.] "
NORWAY,,"Provisions to amend the Provisions [of 28 February 1975] respecting benefit under Chapter 4 of the National Insurance Act (No. 12 of 17 June 1966) [LS L970—Nor. 1 (consolidation), 1971—Nor. 2] for seamen employed in the distant trade. No. 1675. (ibid., 18 Oct.) [Amend s. 7.]",21.9.,1984,10,21/IX/1984,"21/IX/1984 Provisions to amend the Provisions [of 28 February 1975] respecting benefit under Chapter 4 of the National Insurance Act (No. 12 of 17 June 1966) [LS L970—Nor. 1 (consolidation), 1971—Nor. 2] for seamen employed in the distant trade. No. 1675. (ibid., 18 Oct.) [Amend s. 7.] "
PANAMA,,"Act No. 23 to regulate rural organisations in the Republic of Panama. (Gaceta Oficial, n Oct.) [Title I, Ch. II: Rural settlements and their constitution; Ch. Ill: Economic system of rural settlements; Ch. IV: Agricultural production associations and their constitution; Title II, Ch. I: Administrative rules, rights, obligations and prohibitions of rural organisations; Title III: Ownership of land.]",21.10.,1983,10,21/X/1983,"21/X/1983 Act No. 23 to regulate rural organisations in the Republic of Panama. (Gaceta Oficial, n Oct.) [Title I, Ch. II: Rural settlements and their constitution; Ch. Ill: Economic system of rural settlements; Ch. IV: Agricultural production associations and their constitution; Title II, Ch. I: Administrative rules, rights, obligations and prohibitions of rural organisations; Title III: Ownership of land.] "
PERU,,"Presidential Decree No. 027-84-EM/VM approving regulations under sections of the Mining (General) Act. (El Peruano, 28 Aug.)",24.8.,1984,10,24/VIII/1984,"24/VIII/1984 Presidential Decree No. 027-84-EM/VM approving regulations under sections of the Mining (General) Act. (El Peruano, 28 Aug.) "
PHILIPPINES,,"Executive Order No. 940 optimising the use of existing training and educational resources through the establishment of a vocational technical (VOCTECH) network of training and educational institutions on a voluntary and co-operative basis. (Official Gazette, 7 May)",2.3.,1984,10,2/III/1984,"2/III/1984 Executive Order No. 940 optimising the use of existing training and educational resources through the establishment of a vocational technical (VOCTECH) network of training and educational institutions on a voluntary and co-operative basis. (Official Gazette, 7 May) "
POLAND,,"Order of the Minister of Labour, Wages and Social Affairs to amend the Order [of 21 October 1974] respecting workers' vacation leave. (Dziennik Ustaw, Text 188) [Amends ss. 10, 11 and 20.]",26.6.,1984,10,26/VI/1984,"26/VI/1984 Order of the Minister of Labour, Wages and Social Affairs to amend the Order [of 21 October 1974] respecting workers' vacation leave. (Dziennik Ustaw, Text 188) [Amends ss. 10, 11 and 20.] "
POLAND,,217) 11 1985—List No. 3,,,11,,(217) 11 1985—List No. 3 
POLAND,,"Direction No. 35 of the Minister of Labour, Wages and Social Affairs respecting placement. (Dziennik Urzedowy Ministerstwa Pracy, Plac i Spraw Socjalnych, Text 31) [Repeals Direction No. 11 of 23 June 1978 on the same subject.]",17.7.,1984,11,17/VII/1984,"17/VII/1984 Direction No. 35 of the Minister of Labour, Wages and Social Affairs respecting placement. (Dziennik Urzedowy Ministerstwa Pracy, Plac i Spraw Socjalnych, Text 31) [Repeals Direction No. 11 of 23 June 1978 on the same subject.] "
POLAND,,"Decision No. 114 of the Council of Ministers to repeal the Decision [of 17 August 1981 ] respecting supplementary benefits for workers in socialised establishments who change their jobs. (Monitor Polski, Text 142)",22.8.,1984,11,22/VIII/1984,"22/VIII/1984 Decision No. 114 of the Council of Ministers to repeal the Decision [of 17 August 1981 ] respecting supplementary benefits for workers in socialised establishments who change their jobs. (Monitor Polski, Text 142) "
POLAND,,"Order of the council of Ministers to amend the Order [of 19 January 1979: LS 1979— Pol. 1 ] respecting the types of work prohibited to women. (Dziennik Ustaw, Text 235) [Numerous amendments.]",5.9.,1984,11,5/IX/1984,"5/IX/1984 Order of the council of Ministers to amend the Order [of 19 January 1979: LS 1979— Pol. 1 ] respecting the types of work prohibited to women. (Dziennik Ustaw, Text 235) [Numerous amendments.] "
PORTUGAL,Macao,"Decree-Law No. 94/84/M approving the Labour Inspectorate Regulations. (Boletím Oficial, 25 Aug.) [S. 2: Education and guidance function vis-à-vis employers and workers; s. 3: Inspection; s. 5: Duties of employers and workers; s. 7: Enforcement; s. 10: Fines.]",25.8.,1984,11,25/V1II/1984,"25/V1II/1984 Decree-Law No. 94/84/M approving the Labour Inspectorate Regulations. (Boletím Oficial, 25 Aug.) [S. 2: Education and guidance function vis-à-vis employers and workers; s. 3: Inspection; s. 5: Duties of employers and workers; s. 7: Enforcement; s. 10: Fines.] "
ROMANIA,,"16/IH/1984 Decree No. 93 of the Council of State respecting the remuneration of workers employed in the construction sector by global agreement, whereby undertakings undertake to perform work. (Buletinul Oficial, 19 Mar.)",,,11,,"16/IH/1984 Decree No. 93 of the Council of State respecting the remuneration of workers employed in the construction sector by global agreement, whereby undertakings undertake to perform work. (Buletinul Oficial, 19 Mar.) "
ROMANIA,,"Decree No. 135 of the Council of State respecting the remuneration by global agreement of workers employed in maritime transport, river transport and harbour activities. (ibid., 18 Apr.)",17.4.,1984,11,17/IV/1984,"17/IV/1984 Decree No. 135 of the Council of State respecting the remuneration by global agreement of workers employed in maritime transport, river transport and harbour activities. (ibid., 18 Apr.) "
ROMANIA,,"Decree No. 138 of the Council of State respecting the remuneration by global agreement of persons performing construction work abroad, (ibid., 19 Apr.)",17.4.,1984,11,17/IV/1984,"17/IV/1984 Decree No. 138 of the Council of State respecting the remuneration by global agreement of persons performing construction work abroad, (ibid., 19 Apr.) "
ROMANIA,,"Decree No. 139 of the Council of State respecting the conclusion of contracts of global agreement whereby undertakings undertake to perform construction work, (ibid.) [Annex: model contract.]",17.4.,1984,11,17/IV/1984,"17/IV/1984 Decree No. 139 of the Council of State respecting the conclusion of contracts of global agreement whereby undertakings undertake to perform construction work, (ibid.) [Annex: model contract.] "
ROMANIA,,"Decree No. 144 of the Council of State respecting the remuneration by global agreement of workers employed in international motor transport, (ibid., 21 Apr.)",19.4.,1984,11,19/IV/1984,"19/IV/1984 Decree No. 144 of the Council of State respecting the remuneration by global agreement of workers employed in international motor transport, (ibid., 21 Apr.) "
SAN MARINO,,"Act No. 4 to amend the penalties provided for in Act No. 83 of 11 December 1979 respecting placement. (Bollettino Ufficiale, 31 Jan.) [Penalties for employment of workers without a work permit.]",25.1.,1984,11,25/1/1984,"25/1/1984 Act No. 4 to amend the penalties provided for in Act No. 83 of 11 December 1979 respecting placement. (Bollettino Ufficiale, 31 Jan.) [Penalties for employment of workers without a work permit.] "
SINGAPORE,,"The Merchant Shipping (Safety Convention) Regulations 1984. No. S219. (Government Gazette, Subsidiary Legislation, Supplement, 30 Aug.) [Regulations under the Merchant Shipping Act (Cap. 172). Commencement: 1 September 1984.]",,,11,,"— The Merchant Shipping (Safety Convention) Regulations 1984. No. S219. (Government Gazette, Subsidiary Legislation, Supplement, 30 Aug.) [Regulations under the Merchant Shipping Act (Cap. 172). Commencement: 1 September 1984.] "
SINGAPORE,,"An Act to amend the Employment Act. No. 21 of 1984. Employment (Amendment) Act 1984. (ibid., Acts Supplement, 17 Aug.) [Numerous amendments.]",10.8.,1984,11,10/VIII/1984,"10/VIII/1984 An Act to amend the Employment Act. No. 21 of 1984. Employment (Amendment) Act 1984. (ibid., Acts Supplement, 17 Aug.) [Numerous amendments.] "
SINGAPORE,,"The Employment Agency Rules 1984. (ibid., Subsidiary Legislation, Supplement, 24 Aug.) [Rules under s. 23 of the Employment Agencies Act (Ch. 244), concerning licensing formalities and returns. Revoke the Employment Agency Rules 1958 [LS 1958—Sin. 1 ]. Commencement: 24 August 1984.]",20.8.,1984,11,20/VIII/1984,"20/VIII/1984 The Employment Agency Rules 1984. (ibid., Subsidiary Legislation, Supplement, 24 Aug.) [Rules under s. 23 of the Employment Agencies Act (Ch. 244), concerning licensing formalities and returns. Revoke the Employment Agency Rules 1958 [LS 1958—Sin. 1 ]. Commencement: 24 August 1984.] "
SINGAPORE,,1985—List No. 3 12 (218),,,12,,1985—List No. 3 12 (218) 
REPUBLIC OF SOUTH AFRICA,,"Government Notice No. R. 1148: Regulations under the Basic Conditions of Employment Act 1983 (No. 3 of 1983) [LS 1983—SA 1]. (Government Gazette, 3 June)",3.6.,1983,12,3/VI/1983,"3/VI/1983 Government Notice No. R. 1148: Regulations under the Basic Conditions of Employment Act 1983 (No. 3 of 1983) [LS 1983—SA 1]. (Government Gazette, 3 June) "
REPUBLIC OF SOUTH AFRICA,,"Government Notice No. R. 1056: Amendment of Regulations under the Basic Conditions of Employment Act 1983 (No. 3 of 1983) [LS 1983—SA 1]. (ibid., 25 May) [Inter alia, inserts a new Annexure 5 (Prescribed manner in which employee's wage must be paid).]",25.5.,1984,12,25/V/1984,"25/V/1984 Government Notice No. R. 1056: Amendment of Regulations under the Basic Conditions of Employment Act 1983 (No. 3 of 1983) [LS 1983—SA 1]. (ibid., 25 May) [Inter alia, inserts a new Annexure 5 (Prescribed manner in which employee's wage must be paid).] "
REPUBLIC OF SOUTH AFRICA,,"Act to provide for the organisation and administration of the public service of the Republic, the regulation of the conditions of employment, terms of office, discipline, retirement and discharge of members of the public service, and matters connected therewith. No. 111. Public Service Act 1984. (ibid., 15 Aug.)",12.7.,1984,12,12/VII/1984,"12/VII/1984 Act to provide for the organisation and administration of the public service of the Republic, the regulation of the conditions of employment, terms of office, discipline, retirement and discharge of members of the public service, and matters connected therewith. No. 111. Public Service Act 1984. (ibid., 15 Aug.) "
SPAIN,,"Act No. 30: Measures for the reform of the public service. (Boletín Oficial del Estado, 3 Aug.; errata: ibid., 11 Oct.)",2.8.,1984,12,2/VIII/1984,"2/VIII/1984 Act No. 30: Measures for the reform of the public service. (Boletín Oficial del Estado, 3 Aug.; errata: ibid., 11 Oct.) "
