country,region,text,date,year,page,extracted_date,full_text
SPAIN,,"2/VIII/l 984 Act No. 31, respecting employment protection, amending Title II of Basic Act No. 51 of 8 October 1980 [LS 1980—Sp. 2] respecting employment, (ibid., 4 Aug.) [Repeals, inter alia, Title II of the Basic Act respecting employment and clause (a) of s. 3 of Royal Decree No. 1469 of 19 June 1981 (LS 1981—Sp. 1) respecting unemployment benefits for permanent employees covered by the special social security scheme for agriculture.]",,,12,,"2/VIII/l 984 Act No. 31, respecting employment protection, amending Title II of Basic Act No. 51 of 8 October 1980 [LS 1980—Sp. 2] respecting employment, (ibid., 4 Aug.) [Repeals, inter alia, Title II of the Basic Act respecting employment and clause (a) of s. 3 of Royal Decree No. 1469 of 19 June 1981 (LS 1981—Sp. 1) respecting unemployment benefits for permanent employees covered by the special social security scheme for agriculture.] "
SPAIN,,"2/VIII/l 984 *Act No. 32, to amend certain sections of Act No. 8 of 10 March 1980 [LS 1980—Sp. 1] to promulgate a Worker's Charter (ibid.) [Amends the following sections of the Charter: 11 (employment for purposes of practical experience and training); 15 (duration of contracts); 17 (prohibition of discrimination in employment relationships); 33 (Wage Guarantee Fund); 49 (termination of contracts); 62 (staff representatives); 63 (works committees); 67 (election and term of office of members of works committees); 71 (voting for works committees); 72 (representatives of casual or temporary workers); 75 (election of representatives and works committees); 87 (capacity to engage in collective bargaining); etc.]",,,12,,"2/VIII/l 984 *Act No. 32, to amend certain sections of Act No. 8 of 10 March 1980 [LS 1980—Sp. 1] to promulgate a Worker's Charter (ibid.) [Amends the following sections of the Charter: 11 (employment for purposes of practical experience and training); 15 (duration of contracts); 17 (prohibition of discrimination in employment relationships); 33 (Wage Guarantee Fund); 49 (termination of contracts); 62 (staff representatives); 63 (works committees); 67 (election and term of office of members of works committees); 71 (voting for works committees); 72 (representatives of casual or temporary workers); 75 (election of representatives and works committees); 87 (capacity to engage in collective bargaining); etc.] "
SPAIN,,"Order to provide that dismissed workers shall be treated as being in employment for the purposes of health assistance while proceedings for wrongful or invalid dismissal are pending in the labour tribunal, (ibid., 22 Sep.) (1984-09-22, N. 228, pp. 27602-27603)",14.9.,1984,12,14/IX/1984,"14/IX/1984 Order to provide that dismissed workers shall be treated as being in employment for the purposes of health assistance while proceedings for wrongful or invalid dismissal are pending in the labour tribunal, (ibid., 22 Sep.) (1984-09-22, N. 228, pp. 27602-27603) "
SWEDEN,,"An Act to amend the Act (No. 80 of 1982) [LS 1982—Swe. 1] respecting the protection of employment. (Svensk Forfattningssamling, No. 510) [Amends s. 2.]",14.6.,1984,12,14/VI/1984,"14/VI/1984 An Act to amend the Act (No. 80 of 1982) [LS 1982—Swe. 1] respecting the protection of employment. (Svensk Forfattningssamling, No. 510) [Amends s. 2.] "
SWEDEN,,"An act to amend the Act (No. 13 of 1974) [LS 1974—Swe. 2] respecting certain measures for the promotion of employment, (ibid., No. 511) [Amends ss. 9, 12, 17 and 19 and inserts a new s. la.]",14.6.,1984,12,14/VI/1984,"14/VI/1984 An act to amend the Act (No. 13 of 1974) [LS 1974—Swe. 2] respecting certain measures for the promotion of employment, (ibid., No. 511) [Amends ss. 9, 12, 17 and 19 and inserts a new s. la.] "
SWEDEN,,"An Act to amend the Unemployment Insurance Act (No. 370 of 1973) [LS 1973— Swe. 2]. (ibid., No. 513) [Amends ss. 12, 13, 21, 24, 30, 32, 97 and 99 and inserts new ss. 96a and 966.]",14.6.,1984,12,14/VI/1984,"14/VI/1984 An Act to amend the Unemployment Insurance Act (No. 370 of 1973) [LS 1973— Swe. 2]. (ibid., No. 513) [Amends ss. 12, 13, 21, 24, 30, 32, 97 and 99 and inserts new ss. 96a and 966.] "
SWEDEN,,"An Act to amend the Act (No. 371 of 1973) [LS 1973—Swe. 3] respecting cash employment market assistance, (ibid., No. 514) [Numerous amendments.]",14.6.,1984,12,14/VI/1984,"14/VI/1984 An Act to amend the Act (No. 371 of 1973) [LS 1973—Swe. 3] respecting cash employment market assistance, (ibid., No. 514) [Numerous amendments.] "
SWEDEN,,"Ordinance to amend the Order (No. 731 of 1973) made under the Unemployment Insurance Act (No. 370 of 1973) [LS 1973—Swe. 2]. (ibid., No. 515) [Amends ss. 3 and 5.]",14.6.,1984,12,14/VI/1984,"14/VI/1984 Ordinance to amend the Order (No. 731 of 1973) made under the Unemployment Insurance Act (No. 370 of 1973) [LS 1973—Swe. 2]. (ibid., No. 515) [Amends ss. 3 and 5.] "
SWEDEN,,"Ordinance respecting subsidies towards employment market training within the undertaking, (ibid., No. 518) [Repeals Ordinance No. 541 of 1981 on the same subject.]",14.6.,1984,12,14/VI/1984,"14/VI/1984 Ordinance respecting subsidies towards employment market training within the undertaking, (ibid., No. 518) [Repeals Ordinance No. 541 of 1981 on the same subject.] "
SWEDEN,,219) 13 1985—List No. 3,,,13,,(219) 13 1985—List No. 3 
SWEDEN,,"Ordinance respecting induction and wage subsidies [for handicapped persons], (ibid., No. 519) [Repeals the Ordinance (No. 338 of 1980) [LS 1980—Swe. 1 ] respecting employment for which wage subsidies are payable.]",14.6.,1984,13,14/V1/1984,"14/V1/1984 Ordinance respecting induction and wage subsidies [for handicapped persons], (ibid., No. 519) [Repeals the Ordinance (No. 338 of 1980) [LS 1980—Swe. 1 ] respecting employment for which wage subsidies are payable.] "
SWEDEN,,"Ordinance to amend the Employment Market Order (No. 368 of 1966) [LS 1977— Swe. 1 (consolidation)], (ibid., No. 525) [Numerous amendments.]",14.6.,1984,13,14/VI/1984,"14/VI/1984 Ordinance to amend the Employment Market Order (No. 368 of 1966) [LS 1977— Swe. 1 (consolidation)], (ibid., No. 525) [Numerous amendments.] "
SWEDEN,,"An Act to amend the Public Insurance Act (No. 381 of 1962) [LS 1973— Swe. 5 (consolidation), 1976—Swe. 3B]. (ibid., No. 551) [Amends ss. 4 and 14 of Ch. 4.]",14.6.,1984,13,14/VI/1984,"14/VI/1984 An Act to amend the Public Insurance Act (No. 381 of 1962) [LS 1973— Swe. 5 (consolidation), 1976—Swe. 3B]. (ibid., No. 551) [Amends ss. 4 and 14 of Ch. 4.] "
SWITZERLAND,,"Ordinance respecting the implementation of the federal Act respecting an occu- pational provident scheme for federal employees. (Recueil des lois fédérales-Sammlung der eidgenössischen Gesetze, 24 July) [Commencement: l January 1985.]",4.7.,1984,13,4/VII/1984,"4/VII/1984 Ordinance respecting the implementation of the federal Act respecting an occu- pational provident scheme for federal employees. (Recueil des lois fédérales-Sammlung der eidgenössischen Gesetze, 24 July) [Commencement: l January 1985.] "
SWITZERLAND,,"Ordinance concerning the Hours of Work Act. (ibid., 2 Oct.) [Amends s. 24 (second para.) ofthe Ordinance of 26 January 1972. Annual holiday with pay: five weeks up to age 20 years; five weeks as from age 50 years; six weeks as from age 60 years.]",24.9.,1984,13,24/IX/1984,"24/IX/1984 Ordinance concerning the Hours of Work Act. (ibid., 2 Oct.) [Amends s. 24 (second para.) ofthe Ordinance of 26 January 1972. Annual holiday with pay: five weeks up to age 20 years; five weeks as from age 50 years; six weeks as from age 60 years.] "
TUNISIA,,"1 /VIII/1984 Decree No. 84-864 to organise the Ministry ofthe Family and Promotion of Women. (Journal officiel, 10 Aug.)",,,13,,"1 /VIII/1984 Decree No. 84-864 to organise the Ministry ofthe Family and Promotion of Women. (Journal officiel, 10 Aug.) "
UNION OF SOVIET SOCIALIST REPUBLICS,,"Order No. 170/10-101 ofthe State Labour and Social Affairs Committee ofthe USSR and the Secretariat ofthe All-Union Central Council of Trade Unions to approve regulations on procedures and conditions for the use of flexible work timetables for women with children. (Byulleten Gosudarstvennogo Komiieta SSSRpo Trudu i Sotsialnym Voprosam, 1984, No. 9) [Special arrangements between mangament and women worker for a fixed or indefinite period when she is prevented by the need to care for the child from working normal hours. Statutory daily and weekly rest periods to be observed, with maximum often hours actual work and 12 hours of presence (including unpaid breaks) in a 24-hour period. Timetable normally consists of three parts: ""fixed time"", ""variable time"" and ""breaks for rest and meals"".]",6.6.,1984,13,6/VI/1984,"6/VI/1984 Order No. 170/10-101 ofthe State Labour and Social Affairs Committee ofthe USSR and the Secretariat ofthe All-Union Central Council of Trade Unions to approve regulations on procedures and conditions for the use of flexible work timetables for women with children. (Byulleten Gosudarstvennogo Komiieta SSSRpo Trudu i Sotsialnym Voprosam, 1984, No. 9) [Special arrangements between mangament and women worker for a fixed or indefinite period when she is prevented by the need to care for the child from working normal hours. Statutory daily and weekly rest periods to be observed, with maximum often hours actual work and 12 hours of presence (including unpaid breaks) in a 24-hour period. Timetable normally consists of three parts: ""fixed time"", ""variable time"" and ""breaks for rest and meals"".] "
UNION OF SOVIET SOCIALIST REPUBLICS,,"Decree No. 340-XI ofthe Presidium ofthe Supreme Soviet ofthe USSR to amend and supplement certain legislative texts of the USSR. (Vedomosti Verkhovnogo Soveta SSSR, 13 June, Text 422) [Makes amendments consequential upon the enactment ofthe Act on work collectives and on increasing their role in the management of undertakings, institutions and organisations (of 17 June 1983: LS 1983—USSR 1), inter alia, to the Fundamental Principles governing the labour legislation ofthe USSR and the Union Republics (approved by Act No. 2-VIII ofthe Supreme Soviet of the USSR of 15 July 1970) and to the Regulations respecting the rights of the factory, works or local trade union committee (approved by Decree ofthe Presidium ofthe Supreme Soviet of the USSR of 22 September 1971). Amendments concern, inter alia, participation of work collectives in concluding collective agreements, ensuring work discipline, drawing up plans to improve occupational safety and health, and in the management of undertakings, institutions and organisations.]",8.6.,1984,13,8/VI/1984,"8/VI/1984 Decree No. 340-XI ofthe Presidium ofthe Supreme Soviet ofthe USSR to amend and supplement certain legislative texts of the USSR. (Vedomosti Verkhovnogo Soveta SSSR, 13 June, Text 422) [Makes amendments consequential upon the enactment ofthe Act on work collectives and on increasing their role in the management of undertakings, institutions and organisations (of 17 June 1983: LS 1983—USSR 1), inter alia, to the Fundamental Principles governing the labour legislation ofthe USSR and the Union Republics (approved by Act No. 2-VIII ofthe Supreme Soviet of the USSR of 15 July 1970) and to the Regulations respecting the rights of the factory, works or local trade union committee (approved by Decree ofthe Presidium ofthe Supreme Soviet of the USSR of 22 September 1971). Amendments concern, inter alia, participation of work collectives in concluding collective agreements, ensuring work discipline, drawing up plans to improve occupational safety and health, and in the management of undertakings, institutions and organisations.] "
UNITED KINGDOM,Great Britain,"Social Security (New Zealand) Order 1983. (Statutory Instruments, No. 1894) [Provides for modification ofthe Social Security Act 1975 and the Child Benefit Act 1975 so as to give effect to the Convention on Social Security between the United Kingdom and New Zealand, signed on 1 November 1983 (text of Convention set out in schedule).]",21.12.,1983,13,21/XII/1983,"21/XII/1983 Social Security (New Zealand) Order 1983. (Statutory Instruments, No. 1894) [Provides for modification ofthe Social Security Act 1975 and the Child Benefit Act 1975 so as to give effect to the Convention on Social Security between the United Kingdom and New Zealand, signed on 1 November 1983 (text of Convention set out in schedule).] "
UNITED KINGDOM,Great Britain,1985—List No. 3 14 (220),,,14,,1985—List No. 3 14 (220) 
UNITED KINGDOM,Great Britain,"Merchant Shipping (Navigational Equipment) Regulations 1984. (ibid., No. 1203)",2.8.,1984,14,2/VIII/1984,"2/VIII/1984 Merchant Shipping (Navigational Equipment) Regulations 1984. (ibid., No. 1203) "
UNITED KINGDOM,Great Britain,"Merchant Shipping (Fire Protection) Regulations 1984. (ibid., No. 1218) [Give efTect in relation to new United Kingdom ships to Ch. 11-2 of the Amendments to the International Convention for the Safety of Life at Sea 1974.]",2.8.,1984,14,2/VIII/1984,"2/VIII/1984 Merchant Shipping (Fire Protection) Regulations 1984. (ibid., No. 1218) [Give efTect in relation to new United Kingdom ships to Ch. 11-2 of the Amendments to the International Convention for the Safety of Life at Sea 1974.] "
UNITED KINGDOM,Great Britain,"Merchant Shipping (Fire Appliances) (Amendment) Regulations 1984. (ibid., No. 1221) [Amend the Regulations of 1980 on the same subject, to give effect to the Amendments to the International Convention for the Safety of Life at Sea 1974.]",2.8.,1984,14,2/VIII/1984,"2/VIII/1984 Merchant Shipping (Fire Appliances) (Amendment) Regulations 1984. (ibid., No. 1221) [Amend the Regulations of 1980 on the same subject, to give effect to the Amendments to the International Convention for the Safety of Life at Sea 1974.] "
UNITED KINGDOM,Hong Kong,"An Ordinance to amend the Employment Ordinance [No. 38 of 26 September 1968: LS 1968—HK 1, 1970—HK 1]. No. 48. Employment (Amendment) (No. 3) Ordinance 1984. (Government Gazette, Legal Supplement No. 1,13 July) [Numerous amendments. Inter alia, inserts a new Part IIA (End-of-year payment). ]",12.7.,1984,14,12/VII/1984,"12/VII/1984 An Ordinance to amend the Employment Ordinance [No. 38 of 26 September 1968: LS 1968—HK 1, 1970—HK 1]. No. 48. Employment (Amendment) (No. 3) Ordinance 1984. (Government Gazette, Legal Supplement No. 1,13 July) [Numerous amendments. Inter alia, inserts a new Part IIA (End-of-year payment). ] "
UNITED STATES OF AMERICA,,"Amendments to 20 CFR Part 404—Federal old-age, survivors' and disability insurance (1950-). (Federal Register, 13 July) [Amend rules on determining disability insured status for young workers who became disabled before reaching the age of 31 years, to give effect to Public Law 98-21 (Social Security Amendments of 1983).]",26.4.,1984,14,26/IV/1984,"26/IV/1984 Amendments to 20 CFR Part 404—Federal old-age, survivors' and disability insurance (1950-). (Federal Register, 13 July) [Amend rules on determining disability insured status for young workers who became disabled before reaching the age of 31 years, to give effect to Public Law 98-21 (Social Security Amendments of 1983).] "
UNITED STATES OF AMERICA,,"Amendments to 20 CFR Part 404—Federal old-age survivors' and disability insurance, (ibid., 24 July) [Amend the methods of computing benefits under totalisation agreements, i.e. social security agreements with foreign countries permitting the establishment of entitlement to benefits by combining periods of coverage under the United States system and the system of the foreign country.]",15.6.,1984,14,15/VI/1984,"15/VI/1984 Amendments to 20 CFR Part 404—Federal old-age survivors' and disability insurance, (ibid., 24 July) [Amend the methods of computing benefits under totalisation agreements, i.e. social security agreements with foreign countries permitting the establishment of entitlement to benefits by combining periods of coverage under the United States system and the system of the foreign country.] "
UNITED STATES OF AMERICA,,"Amendments to 38 CFR Part 21—Vocational Rehabilitation and Education, (ibid., 18 July) [Establish an Emergency Veterans' Job Training Programme under the Emergency Veterans' Job Training Act of 1983. Eligible unemployed veterans are assisted in obtaining training for employment in permanent jobs. Employers who employ and train veterans in such jobs receive payments from the Veterans' Administration towards the cost of training.]",7.7.,1984,14,7/VII/1984,"7/VII/1984 Amendments to 38 CFR Part 21—Vocational Rehabilitation and Education, (ibid., 18 July) [Establish an Emergency Veterans' Job Training Programme under the Emergency Veterans' Job Training Act of 1983. Eligible unemployed veterans are assisted in obtaining training for employment in permanent jobs. Employers who employ and train veterans in such jobs receive payments from the Veterans' Administration towards the cost of training.] "
URUGUAY,,"Decree No. 269, to regulate situations of affiliation to more than one primary occupational organisation. (Diario Oficial, 25 July)",4.7.,1984,14,4/VII/1984,"4/VII/1984 Decree No. 269, to regulate situations of affiliation to more than one primary occupational organisation. (Diario Oficial, 25 July) "
VENEZUELA,,"Act to establish a National Costs, Prices and Wages Commission. (Gaceta Oficial, 2 July)",28.6.,1984,14,28/VI/1984,"28/VI/1984 Act to establish a National Costs, Prices and Wages Commission. (Gaceta Oficial, 2 July) "
VENEZUELA,,"Decree No. 178: Rules for the payment of the compensatory allowances for transport expenses, (ibid., 29 June)",29.6.,1984,14,29/VI/1984,"29/VI/1984 Decree No. 178: Rules for the payment of the compensatory allowances for transport expenses, (ibid., 29 June) "
ZIMBABWE,,"District Councils (Conditions of Service) (Amendment) Regulations 1984 (No. 2). S.I. 246. [Amends principal regulations of 1981 by inserting, inter alia, provision concerning maternity leave.]",,,14,,"— District Councils (Conditions of Service) (Amendment) Regulations 1984 (No. 2). S.I. 246. [Amends principal regulations of 1981 by inserting, inter alia, provision concerning maternity leave.] "
ZIMBABWE,,Hazardous Substances and Articles (Protective Clothing: General) Regulations 1984. S.I. 263. [Commencement: 1 January 1985. Duties of employer and employee.],,,14,,— Hazardous Substances and Articles (Protective Clothing: General) Regulations 1984. S.I. 263. [Commencement: 1 January 1985. Duties of employer and employee.] 
ZIMBABWE,,Leather and Shoe-Manufacturing Industry Employment Regulations 1984. S.I. 265,,,14,,— Leather and Shoe-Manufacturing Industry Employment Regulations 1984. S.I. 265. 
ZIMBABWE,,221) 15 1985—List No. 3,,,15,,(221) 15 1985—List No. 3 
ZIMBABWE,,Minimum Wages (Specification of Minimum Wages) (Amendment) Notice 1984 (No. 4). S.I. 238B. [Amends s. 2 and schedules to Minimum Wages (Specification of Minimum Wages) Notice 1983 (No. 3).J,1.7.,1984,15,l/VII/1984,l/VII/1984 Minimum Wages (Specification of Minimum Wages) (Amendment) Notice 1984 (No. 4). S.I. 238B. [Amends s. 2 and schedules to Minimum Wages (Specification of Minimum Wages) Notice 1983 (No. 3).J 
ZIMBABWE,,Employment (Domestic Workers) (Amendment) Regulations 1984 (No. 3). S.I. 238C. [Amends schedule to Employment (Domestic Workers) Regulations 1983 (No. 2).],1.7.,1984,15,l/VII/1984,l/VII/1984 Employment (Domestic Workers) (Amendment) Regulations 1984 (No. 3). S.I. 238C. [Amends schedule to Employment (Domestic Workers) Regulations 1983 (No. 2).] 
INTERNATIONAL TREATIES AND AGREEMENTS,Belgium  United States of America,"Convention on social security between the Kingdom of Belgium and the United States of America, with final Protocol. Done at Washington. (Belgium: Moniteur belge - Belgisch Staatsblad, 30 June 1984)",19.2.,1982,15,19/11/1982,"19/11/1982 Convention on social security between the Kingdom of Belgium and the United States of America, with final Protocol. Done at Washington. (Belgium: Moniteur belge - Belgisch Staatsblad, 30 June 1984) "
INTERNATIONAL TREATIES AND AGREEMENTS,Belgium  United States of America,Additional Protocol to the Convention on social security between the Kingdom of Belgium and the United States of America of 19 February 1982. (Belgium: ibid.),23.11.,1982,15,23/XI/1982,23/XI/1982 Additional Protocol to the Convention on social security between the Kingdom of Belgium and the United States of America of 19 February 1982. (Belgium: ibid.) 
INTERNATIONAL TREATIES AND AGREEMENTS,Canada United States of America,"Agreement between the Governments of Quebec and of the United States of America on matters of social security and administrative arrangements for the implementation of the Agreement. Signed in Quebec. (Canada: Gazette officielle du Québec, Part 2, 18 July 1984)",30.3.,1983,15,30/III/1983,"30/III/1983 Agreement between the Governments of Quebec and of the United States of America on matters of social security and administrative arrangements for the implementation of the Agreement. Signed in Quebec. (Canada: Gazette officielle du Québec, Part 2, 18 July 1984) "
INTERNATIONAL TREATIES AND AGREEMENTS,Denmark Finland Iceland Norway Sweden,"Agreement between Denmark, Finland, Iceland, Norway and Sweden on co-operation between the authorities and institutions responsible for vocational rehabilitation and employment market promotion. Signed at Copenhagen. (Denmark: Overenskomster med Fremmede Stater, 31 Dec. 1983)",6.3.,1982,15,6/III/1982,"6/III/1982 Agreement between Denmark, Finland, Iceland, Norway and Sweden on co-operation between the authorities and institutions responsible for vocational rehabilitation and employment market promotion. Signed at Copenhagen. (Denmark: Overenskomster med Fremmede Stater, 31 Dec. 1983) "
INTERNATIONAL TREATIES AND AGREEMENTS,Federal Republic of Germany Tunisia,"General Convention on social security between the Tunisian Republic and the Federal Republic of Germany, with additional Protocol. Signed in Tunis. (Tunisia: Journal officiel, 17 Aug.) [Ratified by Tunisia by Act No. 84-65 of 6 August 1984.]",16.4.,1984,15,16/IV/1984,"16/IV/1984 General Convention on social security between the Tunisian Republic and the Federal Republic of Germany, with additional Protocol. Signed in Tunis. (Tunisia: Journal officiel, 17 Aug.) [Ratified by Tunisia by Act No. 84-65 of 6 August 1984.] "
INTERNATIONAL TREATIES AND AGREEMENTS,Morocco Romania,"Convention on social security between the Government of the Socialist Republic of Romania and the Government of the Kingdom of Morocco. Signed at Rabat. (Romania: Buletinul Oficial, 29 June 1984)",27.7.,1983,15,27/VII/1983,"27/VII/1983 Convention on social security between the Government of the Socialist Republic of Romania and the Government of the Kingdom of Morocco. Signed at Rabat. (Romania: Buletinul Oficial, 29 June 1984) "
INTERNATIONAL TREATIES AND AGREEMENTS,Norway United States of America,"Agreement between the Kingdom of Norway and the United States of America on social security. Signed at Washington. (Norway: Overenskomster med Fremmede Stater, 20 June 1984)",13.1.,1983,15,13/1/1983,"13/1/1983 Agreement between the Kingdom of Norway and the United States of America on social security. Signed at Washington. (Norway: Overenskomster med Fremmede Stater, 20 June 1984) "
INTERNATIONAL TREATIES AND AGREEMENTS,Norway United States of America,Administrative Agreement for the implementation of the Agreement on social security [signed on 13 January 1983] between the Kingdom of Norway and the United States of America. Signed at Washington. (Norway: ibid.),13.1.,1983,15,13/1/1983,13/1/1983 Administrative Agreement for the implementation of the Agreement on social security [signed on 13 January 1983] between the Kingdom of Norway and the United States of America. Signed at Washington. (Norway: ibid.) 
INTERNATIONAL TREATIES AND AGREEMENTS,SpainSweden,"Convention on social security between Spain and Sweden. Done at Stockholm. (Sweden: Svensk Författningssamling, 1984, No. 555)",4.2.,1983,15,4/II/1983,"4/II/1983 Convention on social security between Spain and Sweden. Done at Stockholm. (Sweden: Svensk Författningssamling, 1984, No. 555) "
INTERNATIONAL TREATIES AND AGREEMENTS,SpainSweden,Administrative Agreement on the Convention on social security of 4 February 1983 between Spain and Sweden. Done at Stockholm. (Sweden: ibid.),4.2.,1983,15,4/II/1983,4/II/1983 Administrative Agreement on the Convention on social security of 4 February 1983 between Spain and Sweden. Done at Stockholm. (Sweden: ibid.) 
