,line_text,spans,x0,y0,x1,y1,page,label_kmeans_0,label_kmeans_1,label
346,grants against death or total permanent invalidity consequent,['grants against death or total permanent invalidity consequent'],87.0,524.26,330.58,534.26,5,0,0,start
347,"upon shipwreck. 5th August, 1Q20. T., Sp. 6—7.. . Royal Order creating under the direction and inspection of the","['upon shipwreck. 5th August, 1Q20.', 'T., Sp. 6—7..', '.', 'Royal', 'Order creating under the direction and inspection of the']",70.0,532.81,329.06,550.36,5,0,0,start
348,Ministry of Labour a general service of employment exchanges,['Ministry of Labour a general service of employment exchanges'],87.0,548.73,328.14,558.23,5,0,0,start
349,"and statistics of the labour demand and supply. 29th September,","['and statistics of the labour demand and supply. 29th September,']",87.0,556.84,330.02,566.34,5,0,0,start
350,"1920. T., Sp. 3 .. .. .. .. ..","['1920.', 'T., Sp. 3', '..', '..', '..', '..', '..']",87.0,564.86,277.28,575.69,5,0,2,other
351,Royal Order concerning the establishment of emigrants' insurance,"['Royal', ""Order concerning the establishment of emigrants' insurance""]",70.0,572.51,330.1,582.31,5,0,0,start
352,in accordance with the rules hereinafter contained. i ith December,['in accordance with the rules hereinafter contained. i ith December'],87.0,581.06,329.71,590.26,5,0,0,start
353,"1920. T., Sp. 6—7 (I) .. .. .. ..","['1920.', 'T., Sp. 6—7 (I)', '..', '..', '..', '..']",87.0,589.21,277.78,600.21,5,0,2,other
