country,region,text,page
MOROCCO MOROCCO ),,"NORWAY (cont. ) PANAMA  18 Dec. An Act to amend the Fishermens! Pension Insurance 31 Mar. Decree No. 68 of the Council of Ministers, respec-  Act (No, 12) of 28 June 1957. No. 86. (Ibid., ting the centralisation by the Social Insurance  31 Dec.) Fund of compulsory coverage of the risk of employ-  ment injury for all workers employed by the State  18 Dec. Provisions respecting exemption from the waiting and private undertakings operating in the Republic  period in the case of applications for unemployment Lextensive regulations concerning industrial  benefit [under s. 4 (2) 2 of the National Insurance accidents and labour matters connected therewith}.  Acti}.  (Ibia.) (""Gaceta Oficial"", 3 Apr.) Pan. 1  18 Dec, Provisions respecting the period during which 28 May Decree No. 124 of the Council of Ministers, to  ersons may be debarred from unemployment benefit amend and supplement the Basic Act [Legislative  funder s. 4 (2) 3 of the National Insurance Act!]. Decree No. 14 of 27 Aug. 19541] respecting the  Ibid.) Social Insurance Fund Land amending Act No. 134  of 27 Apr. 1943 on the same subject]. (Ibid.,  18 Dec. Provisions respecting the continuation of insurance 29 June Pan. 2  in the case of termination of service, leave  entitlement, etc. [under s. 1 (2) 3 (b) of the 16 July Decree No. 249 of the Council of Ministers, to  National Insurance Act].  (Ibid.) issue the Basic Act for the organisation of the  Ministry of Labour and Social Welfare [repeals  18 Dec. Provisions respecting the continuation of insurance ss. 586 to 620 of the Labour Code* where contrary  for not more than six months as from date of depar- to the present decree]. (Ibid., 27 July)  ture, in_ the case of temporary absence from the  Kingdom [under _s. 1 (2) 3 (a) of the National  Insurance Act]. (Ibid. )  PERU  18 Dec. Provisions respecting the insurance coverage of the  insured person's spouse and children maintained by 6 Feb. Legislative Decree No. 18138, to prescribe the  him and living together with him as a family in conditions for the conclusion of individual con-  Norway L[under s. 1 (2)_3, first para., of the tracts of fixed duration or for a specified piece  National Insurance Act-]. (Ibid.) of work [in work centres where operations of a  permanent or interrupted nature are carried on  18 Dec. Provisions to exclude from insurance coverage under individual contracts of specified duration or for  Chs. 9 and 11 of the National Insurance Act~ alien a specified piece of work may be entered into only  crew members on Norwegian cruise vessels or self- if the casual or temporary nature of the services  employed on such vessels [under s. 1 (2) 2, third or work necessitate this form of contract].  para., of the Act]. (Ibid. ) (""EL Peruano"", 7 Feb.) Per. 1  18 Dec. Provisions prescribing the extent to which insured 6 Feb. Legislative Decree No. 18139: Journalists Act  persons covered by s. (8) 1, first para., of the [stability of employment for journalists].  National Insurance Act~ continue their entitlement  to benefit under s. 2 (8) after termination of the 10 Mar. Presidential Decree No. 002-TR: rest periods for  employment relation. (Ibid. ) domestic workers [domestic workers entitled to  8 hours! night rest, an uninterrupted rest period  21 Dec. Provisions to grant a maternity (confinement) cash of 24 hours once a week, to be taken on a Sunday  benefit to persons covered by s. 2 (7) 1 of the or week-day, and to a day off on 1 May, 28 July  National Insurance Act>-. (Ibid.) and 25 Dec., overtime pay to be given in respect  of work on any of the above aayst. (Ibid.,  12 Mar.)  ",31
MOROCCO MOROCCO ),,"PAKISTAN 27 July Legislative Decree No. 18350, to promulgate the  Industries Act. Per. 2 A (extracts)  16 Oct. An Ordinance to amend the Industrial Relations  Ordinance 1969 | numerous, amendments to Industrial  Relations Ordinance 1969°]. No. XIX. 1431954 - Pan. 1. °* 4S 1947 - Pan. 1, 1950 - Pan. 1.  Industrial Relations (Amendment) Ordinance 1970.  (""Gazette of Pakistan"", 17 Oct., Extraordinary)  1 is 1966 - Nor. 3... 1970 - Nor. 1 (consolidated text). 2 4s 1969  ",31
MOROCCO MOROCCO ),,"- Pak. 2.  -~ 74 - - 75 -  PERU (cont.) POLAND (cont. )  1 Sep. Legislative Decree No. 18384, respecting the 21 Feb. Order of the Chairman of the Labour and Wages  ",31
MOROCCO MOROCCO ),,"""industrial community"" [under Part VIII of the Committee respecting works industrial rehabili-  ",32
MOROCCO MOROCCO ),,"Industries Act (No. 18350) s. 1: ""The 'industrial tation centres [under the Order of the Council of  ",32
MOROCCO MOROCCO ),,community! ... is composed of all the employees Ministers of 5 May 19671 respecting the planned  ,32
MOROCCO MOROCCO ),,"(other than casual workers and part-time workers) employment of disabled persons]. (""Dzgiennik  ",32
MOROCCO MOROCCO ),,"in a given undertaking”]. (Ibid., 3 Sep.) Ustaw"", 14 Mar.)  Per. 2 B  12 Mar. Direction of the Chairman of the Labour and  -- Consolidated text of Legislative Decree No. 17716 Wages Committee respecting the organisation of  ",32
MOROCCO MOROCCO ),,with annexes and schedules [respecting agrarian practical work for students attending higher  ,32
MOROCCO MOROCCO ),,reform] [constitutes the present legislation on educational establishments and liability to defray  ,32
MOROCCO MOROCCO ),,"agrarian reform; contains, inter alia, the the expenses connected with the organisation of  ",32
MOROCCO MOROCCO ),,"following titles: VII. ""Technical Assistance and such work. (""Monitor Polski"", 7 Apr.)  ",32
MOROCCO MOROCCO ),,"Credit"" (provides for security in the agricultural  ",32
MOROCCO MOROCCO ),,"and stockbreeding sector); XIV. ""Anti-social Work 21 Mar. Order of the Chairman of the Small-Scale Industry  ",32
MOROCCO MOROCCO ),,"and Farming Systems"" (all personal service to be Committee respecting occupational safety and  ",32
MOROCCO MOROCCO ),,"subject to labour law; declares and void any health in peat works. (""Dgiennik Ustaw"",  ",32
MOROCCO MOROCCO ),,obligations of personal service in return for ten- 20 Apr.)  ,32
MOROCCO MOROCCO ),,"ancy of land); repeals, inter alia, Act No, 15037  ",32
MOROCCO MOROCCO ),,"respecting agrarian reform]. (Ibid., 20 Aug.) 9 Apr. Direction of the Minister of Health and Social  Welfare to provide for the health care of  10 Nov. Legislative Decree No. 18471, to prescribe the students engaged on practical work itd alia,  ",32
MOROCCO MOROCCO ),,"grounds for dismissal of workers employed in the pre-employment medical examinations]. (""Monitor  ",32
MOROCCO MOROCCO ),,"private sector. (Ibid., 11 Nov.) Per. 3 Polski"", 22 Apr.)  PHILIPPINES RUMANTA  21 May Revised Rules and Regulations implementing 26 Mar, Act No. 1, respecting labour organisation and  ",32
MOROCCO MOROCCO ),,"Republic Act No. 679 [of 8 Apr. 1952, respecting discipline in specialised State socialist units  ",32
MOROCCO MOROCCO ),,"the employment of women and children! ] as [ss. 12, 13, 16 (contracts of employment) and  ",32
MOROCCO MOROCCO ),,"amended. (""Official Gazette"", 6 July) 117 of the Labour Code are to be interpreted in  relation to the provisions of this Act, which  repeals, inter alia, s. 20 (c) (contracts of  employment) and ss. 24 to 26 (works rules) of the  POLAND Code]. (""Buletinul Oficial"", 27 Mar.)  12 Jan. Order of the Council of Ministers respecting the 10 July Act No. 4, respecting the organisation of pro-  ",32
MOROCCO MOROCCO ),,"obligations of socialised establishments in con- duction and work in agriculture. (Ibid., 10 July)  ",32
MOROCCO MOROCCO ),,nection with the enforcement of the penalty of  ,32
MOROCCO MOROCCO ),,"restricted freedom [employment of persons sentenced 10 July Act No. 6, respecting the organisation and func-  ",32
MOROCCO MOROCCO ),,"by the local authorities to unpaid work in the tioning of consumers' co-operatives [ repeals,  ",32
MOROCCO MOROCCO ),,"public interest]. (""Dgiennik Ustaw"", 16 Jan.) inter alia, Decree No. 133 of 2 Apr. 1949 respect-  : ing the organisation of co-operation]. (Ibid. )  ",32
MOROCCO MOROCCO ),,29 Jan. Directions of the Chairman of the Central Mining  ,32
MOROCCO MOROCCO ),,"Office [to determine the criteria for assessing 24 Dec, Order No. 1877 of the Council of Ministers and the  ",32
MOROCCO MOROCCO ),,certain dangers in mines; detailed technical Council of the National Union of Producers! Co-  ,32
MOROCCO MOROCCO ),,"provisions]. (""Monitor Polski"", 19 Feb.) operatives concerning the guarantee of a minimum  monthly income to members of co-operatives, state  5 Feb. Direction of the Chairman of the Central Mining subsidies for managerial staff and the guarantee  ",32
MOROCCO MOROCCO ),,Office respecting the protection of the health of of full payment of increased pensions to members  ,32
MOROCCO MOROCCO ),,workers employed in underground mining establish- of agricultural producers! co-operatives.  ,32
MOROCCO MOROCCO ),,"ments against the effects of dust. Ibid.) (Ibid., 24 Dec.)  16 Feb. Decision No. 24 of the Council of Ministers, 7 5  ",32
MOROCCO MOROCCO ),,respecting the organisation of periods of practical _ _ _  ,32
MOROCCO MOROCCO ),,work for students attending higher educational 3s 1949 19 fore I. US 1950 - Rum. 1... 1960 - Rum. 1.  ,32
MOROCCO MOROCCO ),,"establishments. (Ibid., 6 Mar.)  1 ts 1952 - Phi. 1, 1954 - Phi. 2.  - 76 - , -77 -  ",32
RUMANIA ) SINGAPORE,,"31 Dec. Order No. 1956, respecting home work in certain 24 July An Act to make provision for securing the employ-  branches of handicrafts manufacture and other ment of persons who have completed national  work [repeals Decisions of the Council of service and for matters connected therewith  Ministers Nos. 1301 and 1991 of 1969 and 165 of [employers bound to provide employment, or re-  1970]. (Ipid., 4 Jan. 1971) engage, from ""registered persons"" who have com-  ; pleted national service; powers of Minister to  make orders directing employment of ""registered  persons""|. No. 28. National Servicemen  SENEGAL (Employment) Act 1970. (""Government Gazette"",  7 Aug., Acts Supplement)  ",33
RUMANIA ) SINGAPORE,,"27 Jan. Act No. 70-04, to supplement ss. 35 and 45 . ; .  [concerning respectively the making and resilia- 14 Dec, the Singapore Fort Regulations 1970 [ss. 8:  tion of fixed-term contracts of employment] of adequate crew on board; 16: safety of persons  the Labour Code.! (""Journal Officiel"", 14 Feb.) on board; Schedule: list of dangerous goods).  ’ (Ibid., 24 Dec.)  ",33
RUMANIA ) SINGAPORE,,"20 Feb. Decree No. 70-180, to prescribe the special con-  ditions of employment of daily workers and seasonal  workers. (Tbid., 9 Mar.) REPUBLIC OF SOUTH AFRICA  ",33
RUMANIA ) SINGAPORE,,"20 Feb. Decree No. 70-182, to prescribe the hours during ; _  which work is considered to be night work [10 p.m. 24 Feb. Act to provide for the payment of additional  to 5 a.m.3; repeals local Order No. 4214 IT of racaennn a nespect Oe eae con tosis ane  5 biectl. Tbid. uberculosis and certain additional gratuities;  26 June 1953 on the same subject] (Thid.) to amend the Pneumoconiosis Compensation Act 1962  ",33
RUMANIA ) SINGAPORE,,"20 Feb. Decree No. 70-183, to prescribe the general scheme [No. 64 of 1962], so as to regulate further the  of exceptions to the statutory hours of work payment of costs imcurred in connection with the  repeals, inter alia, Orders Nos. 3946 IT of medical examination of certain persons, and the  J 1953 and 4215 IT of 26 J i . Ibid. duties of Bantu affairs authorities; to provide  @ June 1955 and 4215 ° une 1955] (Tbid.) for the control of certain works and the medical  ",33
RUMANIA ) SINGAPORE,,"20 Feb. Decree No. 70-184, to prescribe the modes of examination of persons employed thereat and on  remunerating overtime work | repeals, inter alia, certain work at certain mines; and to provide for  General Order No. 4576 IT of 8 duly 1953]... matters incidental thereto. No. 8.  (Ibid. ) Pneumoconiosis Compensation Act 1970.  ° (""Government Gazette"", 4 Mar.)  ",33
RUMANIA ) SINGAPORE,,"20 Feb. Decree No. 70-185, to prescribe the conditions for .  and amount of prior notice in the cases of occupa- 24 Feb. Act to amend the provisions of the Workmen's  tions and branches of activity not yet covered by Compensation Act 1941” relating to definitions,  collective agreements [repeals Order No. 8126 of application of Act extra-territorially and to sea-  29 Dec. 1953 on the same subject]. (Ibid. ) men and airmen, compensation, employers and medical  ° expenses. No. 9. Workmen's Compensation  ",33
RUMANIA ) SINGAPORE,,"22 Apr. Decree No. 70-453, to establish a Senegalese Amendment Act 1970. = (Ibid.)  j Cc i f ar  Bene Man Committee {the members of the 3 Mar. Act to amend the provisions of the Bantu Trust  Ministry of Labour and three representatives of and Land Act, 1956, relating to the powers of the  the most representative trade unions and workers! South African Bantu Trust and the occupation by  congresses and women's and youth movements |. Bantu of certain land; to amend the provisions  (Ipid., 6 June) of the Bantu (Urban Areas) Consolidation Act,  “9 1945, relating to the removal, curtailment or  ‘ bolition of locations, Bantu villages and Bantu  ",33
RUMANIA ) SINGAPORE,,"20 Jul Decree No. 70-917, respecting hours of work and a an :  y weekly rest in the public services and public hostels; so as to provide for the detention of,  establishments [repeals Orders Nos. 2629 IT of and the performance of work by, Bantu removed  29 Apr. 1954 (as amended), 7441 IT of 15 Nov. under section 14 of the last=-mentioned Act3.  1956 and, as regards public educational estab- relating vo the vacation of condemned dwellings,  lishments, 7442 IT of 15 Nov. 1956, on the same the disestablishment of urban local authorities;  subject] , (Ibid., 8 Aug.) , to amend the provisions of the Bantu Labour Act,  . “? 1964, relating to the powers and duties of the  1 ts 1962 - Sen. 2B. 1 2  LS 1941 - S.A. 2 ... 1956 - S.A. 3A. LS 1964 - S.A. 1.  - 78 - - 79 -  ",33
RUMANIA ) SINGAPORE,,"REPUBLIC OF SOUTH AFRICA (cont.) REPUBLIC OF SOUTH AFRICA (cont.)  Director of Bantu Labour; so as to confer on the Act 196 i . .  Minister of Bantu Administration and Development certain persone? to amend’ the atte Service of  certain powers in relation to the performance of Government Non-White Employees Pensions Act 1966  work by or the employment or continued employment relating to the power to make regulations con- ’  of Bantu s relating to the powers and functions of cerning transfers; to amend the provisions of  certain officers; so as to provide that certain the Aged Persons Act 1967, the War Veterans!  records shall be prima facie evidence of the facts Pensions Act 1968, the Blind Persons Act 1968  recorded therein; employers of Bantu females in and the Disability Grants Act 1968, relating to  prescribed areas; relating to the power of the the promulgation of regulations with retrospective  State President to make regulations; and to pro- effect; to amend the provisions of the Provincial  vide for incidental matters [inter alia, amend § and the Territory Service Pension Act 1969, rela-  SS. 2, 20, 22, 24 and 28 of Act No. _67 oF 1964+; ting to ages for retirement and power to make  recruitment or employment of Bantus]. o. 19. regulations concerning transfers; +o amend the  Bantu Laws Amendment Act 1970. (Ibid., 6 Mar.) provisions of the Pension Laws Amendment Act  . 196 relati i i i  i7 July Government Notice No. R. 1147: Amendments to the a3 2) tere peneiona and te overpormentat te ween.  Regulations of 15 Dec. 1965, as amended, under the vide for the payment with retrospective effect of  Government Service Pensions Act 1965 [amends certain benefits under the regulations promulgated  regs. 17, 18, 5 31 and 323 adds reg. 33 and by Government Notice No. 977 of 1950 and Government  replaces reg. 59]. Public Service Pension Fund. Notice No. 1134 of 1950; and to provide for  (Ibid., 17 July) incidental matters. No. 86. Second Pension  A :  17 duly Government Notice No. R. 1148: amendments to the aws Amendment Act 1970. (Ibid., 21 Oct.)  Regulations of 17 Dec. 1965 as amended, under the  Government Service Pensions Act. 1965 [amends  regs. 1, 2 and 3; adds reg. 5A]. Government SPAIN  Service Widow's Pension Fund. (Ibid.  il Mar. Order respecting the supervision of the lab  el Aug. Act to amend the Bantu Education Act 1953 Less : : P : ° & tabour  [amendments respecting administrative aspects of Oficial"", 24 ter to aliens. (""Boletin  Bantu Schools, and conse participation in control ; °  and management thereof]. No. 44. Bantu 12 Mar Decree No. 63 to i . . .  . —— . . nst  Education Amendment Act 1970. (Ibid., 2 Sep.) security scheme for performers Pendens. 10 of  . Act No. 193 of 28 Dec. 1963+ to define the  el Aug. Government Notice No. R. 1333: Amendment to basi ar : : .  Regulations under the Wage Act 1957¢ [amends 13 liar) of social security]. (Ibid.,  reg. 2, sub-regs. 2 and 6 of the Schedule}.  (Ibid., 21 Aug.) 19 Mar. Order to institute a welfare service under the  social securit i  1 Oct. Act to amend the provisions of the Associated persons. (tela 33 wae) ene Fo aged  Institutions Pension Fund Act 1963, relating to °  the power to make regulations concerning transfers 9 Apr Decree No. 1075, res i isi  : . . pecting the provision of  and to the delegation of powers; _to amend the health care for Spanish emigrant workers and the  provisions of the Government Service Pensions Act members of their families resident in Spain  1965, relating to the power to make regulations (Ibid., 15 Apr.) P °  concerning transfers and the adjustment of pensions , .  in respect of persons who may become entitled to 22 Ma Decree No. 1376 .  compensation under the Workmen's Compensation Act. y collective labour dispates [repesis Doosee of  19419, and to effect certain improvements in No. 2354 of 20 Sep. 1962, respecting procedure  sections 14 and 19; to amend the provisions of the conciliation and_arbitration in collective ,  Parliamentary Service and Administrators Pensions labour relations] (Ibid 25 May) 5 1  . > Pp.  143 1964 - S.A. 1. ° LS 1957 -S.A. 1. 7? LS 1941 - S.A. 2... 1  ",34
RUMANIA ) SINGAPORE,,1956 S.A. 3 A. LS 1966 - Sp. 3 A.  - 80 - - 81 -  SPAIN (cont. ) SPAIN (cont. )  8 June Order to amend s. 9 of the Order of 28 Dec. 3 Dec. Decree No. 3649 to lay down regulations con-  ,34
RUMANIA ) SINGAPORE,,19661 to prescribe rules for the application cerning the social security system's national and  ,35
RUMANIA ) SINGAPORE,,and administration of family assistance provincial birth and family encouragement awards.  ,35
RUMANIA ) SINGAPORE,,"benefits under the general social security scheme (Ibid., 26 Dec.)  ",35
RUMANIA ) SINGAPORE,,{covers workers who are temporarily disabled as a  ,35
RUMANIA ) SINGAPORE,,"result of an industrial accident or occupational 17 Dec. Decree No. 3677, to lay down rules for the pre-  ",35
RUMANIA ) SINGAPORE,,"disease, who were not covered by s. 9]. (Ibid., vention and punishment of fraudulent activities  ",35
RUMANIA ) SINGAPORE,,"17 June} in connection with the recruitment and employment  of workers {fines in the case of physical or  9 July Decree No. 1867, to approve General Regulations juridical persons who give contracts of employment  ",35
RUMANIA ) SINGAPORE,,"under Act No. 116 of 30 Dec. 1969° to provide for to or recruit workers and hire out, loan or trans-  ",35
RUMANIA ) SINGAPORE,,a special social security scheme for seafarers. fer such workers temporarily to other undertakings].  ,35
RUMANIA ) SINGAPORE,,"(Ibid., 11 July) (Ibid., 4 Jan. 1971) Sp. 3  23 July Decree No. 2309, to amplify the provisions con- 22 Dec. Act No. 41, to improve the protection afforded by  ",35
RUMANIA ) SINGAPORE,,tained in clause 4 of s. 37 of Act No. 116 of and modify the financing of the special agricul turat  ,35
RUMANIA ) SINGAPORE,,"30 Dec. 1969° to provide for a special social social security scheme. (Ibid., 31 Dec.  ",35
RUMANIA ) SINGAPORE,,"security scheme for seafarers. (Ibid., 24 Aug.)  ",35
RUMANIA ) SINGAPORE,,31 July Order to approve the Staff Rules of the Workers'  ,35
RUMANIA ) SINGAPORE,,Mutual Benefit Organisation [repeals the Staff SWAZILAND  ,35
RUMANIA ) SINGAPORE,,"Rules of 1959]. (Ibid., 11 Sep.)  9 Jan. An Act to amend the Shop Hours Proclamation  20 Aug. Decree No. 2310, to issue regulations concerning (Cap. 191). No. 8. Shop Hours (Amendment Act)  ",35
RUMANIA ) SINGAPORE,,"the labour rights of working women under Act 1970. (""Government Gazette"", 16 Jan., Supplement)  ",35
RUMANIA ) SINGAPORE,,"[No. 56] of 22 July 1961 [ repeals, inter alia,  ",35
RUMANIA ) SINGAPORE,,Decree No. 258 of 1 Feb. 1962* to provide for the  ,35
RUMANIA ) SINGAPORE,,application in matters of employment of Act  ,35
RUMANIA ) SINGAPORE,,No. 56° which places men and women workers on an SWEDEN  ,35
RUMANIA ) SINGAPORE,,equal footing as regards their rights in labour  ,35
RUMANIA ) SINGAPORE,,"matters]. (Ibia., 24 Aug.; errata: ibid., 10 Apr. General Hourg of Work Act [repeals Hours of Work  ",35
RUMANIA ) SINGAPORE,,"24 Sep. Sp. 2 Act (No. 138+ of 1930), the Hours of Work  (Agriculture) Act of 1948¢, the Act (No. 6527) of  20 Aug. Decree No. 2530 to issue regulations for the 1942 respecting hours of work in the retail trade  ",35
RUMANIA ) SINGAPORE,,special social security scheme for self-employed and the Act (No. 216) respecting hours of work in  ,35
RUMANIA ) SINGAPORE,,"workers [repeals, inter alia, Decree No. 1167 of hotels, restaurants and cafés]. (""Svensk  ",35
RUMANIA ) SINGAPORE,,"23 June 1960 to extend the advantages of the Forfattningssamling"", No. 103 Swe. 1  ",35
RUMANIA ) SINGAPORE,,workers! mutual benefit scheme to self-employed  ,35
RUMANIA ) SINGAPORE,,"persons]. (Ibid., 15 Sep.) 10 Apr. Seafarers' Hours of Work Act [repeals the  Seafarerst Hours of Work Act, 19594 (No. 404)].  25 Aug. Order to establish systems for the collection of (Ibid., No. 105)  ",35
RUMANIA ) SINGAPORE,,seafarers' contributions by the special social  ,35
RUMANIA ) SINGAPORE,,security scheme [made under s. 25 of Act No. 116 27 May An Act to amend the Public Insurance Act? (No. 381)  ,35
RUMANIA ) SINGAPORE,,"of 30 Dec. 19692, to provide for a special social of 25 May 1962. (Ibid., No. 141)  ",35
RUMANIA ) SINGAPORE,,"security scheme for seafarers]. (Ibid., 11 Sep.)  27 May Order to amend the Employment Market Order  28 Aug. Order to approve the Labour Ordinance for building . (No. 368) of 3 June 1966. (Ibid., No. 182)  ",35
RUMANIA ) SINGAPORE,,"and construction, glass and ceramics [numerous  ",35
RUMANIA ) SINGAPORE,,repeals of legislation concerning the above and 27 May An Act to amend the Public Insurance Act? (No. 381)  ,35
RUMANIA ) SINGAPORE,,"allied sectors]. (Ibid., 5, 7, 8 and 9 Sep.) of 25 May 1962. (Ibid., No. 186)  27 May An Act respecting the employer's right to make  1 2 deductions from wages to offset payments due.  LS 1966 - Sp. 3 C. LS 1969 - Sp. 3. 7% LS 1962 - Sp. 1B.  445 1962 - Sp. 1A. > LS 1969 - Sp. 3. (Ibid., No. 215)  1 45 1930 - Swe. 1... 1942 - Swe. 2. ° LS 1948 - Swe. 1.  3 4S 1942 - Swe. 2A. 4 LS 1959 - Swe. 1. 9 LS 1962 - Swe. 1 A.  6 LS 1966 - Swe. 1, 1968 - Swe. 1.  - 82 - ~ 83 -  ",35
SWEDEN ) SWEDEN ),,"27 May An Act to amend [s. 20 of] the Seamen's Act, 30 Oct. Ordinance to amend the Ordinance (No. 419) of  19521 (No. 530), (Ibid., No. 216) 1968 respecting employers! general contributions.  (Ibid., No. 566)  ",36
SWEDEN ) SWEDEN ),,"27 May Order to amend [ss. 5, 11, 12, 16 and 17 of]  the State Officials! Pensions Regulations, 1959 30 Oct. An Act to amend yon 19, s. 4 (financing of  (No. 287). (Ibid., No. 381) insurance scheme) of] the Public Insurance Act  (No. 381) of 25 May 1962. (Ibid., No. 567)  ",36
SWEDEN ) SWEDEN ),,"5 June An Act respecting the Central Social Council,  and for other purposes [the Council centralises, 13 Nov. Order to amend the Instruction (No. 776) of  at the level of the commune, all questions con- %3 Dec. 1965 respecting the Labour Protection  cerning social affairs, assistance to children Office. (Ibid., No. 622)  and temperance]. (Ibid., No. 296)  13 Nov. Order respecting medical care [repeals the Regu-  ",36
SWEDEN ) SWEDEN ),,"17 June An Act to amend [ss. 1, 10, 13, 27, 29 and 38 of] lations (No. 70) of 29 Mar. 1963 on the same  the State Officials Act, 1965 (No. 274). (Ibid., subject]. (Ibid., No. 703)  O. 353  20 Nov. Order to amend the Civil Service Pensions General  ",36
SWEDEN ) SWEDEN ),,"17 dune Order to amend [ss. 21, 22, 25, 26, 27, 37 and 38 Regulations, 1959 (No. 287). (Ibid., No. 674)  of] the State Officials Ordinance, 1965 (No. 601).  (Ibid., No. 354) 20 Nov. Order respecting pilots and lighthouses | repeals  inter alia, the Ordinance (No. 330) of 1937  ",36
SWEDEN ) SWEDEN ),,"29 June An Act to amend es: 7, 12, 22, 23 and 43 of] the respecting pilots]. (Ibid., No. 698  Mines Act, 1938 (No. 314). (Ibid., No. 451  20 Nov. Order to amend the Instruction (No. 606) of 1967  ",36
SWEDEN ) SWEDEN ),,"29 June An Act to amend (ss. 23, 24 and 95 of | the Protec-— respecting the Social Assistance Directorate.  tion of Onildren Act, 1960 (No. 97). (Ibid., (Ibid., No. 736)  No. 460  11 Dec. Order to amend [ss. 3, 4, 8, 12, 17, 41, 44 and 47  ",36
SWEDEN ) SWEDEN ),,"29 June An Act respecting patents applied for [repeals the of] the Instruction | (No. 667) of 3 Dec. 1965  Act (No. 59) of 1899 on the same subject]. respecting the general directorate of labour and  (Ibid., No. 485) the provincial labour boards. (Ibid., No. 727)  ",36
SWEDEN ) SWEDEN ),,"29 June Order respecting patents applied for. (Ibid., 11 Dec. An Act respecting the guarantee of payment of  No. 486) wages by the State in the case of bankruptcy.  (Ibid., No. 741)  ",36
