country,region,text,page
SWEDEN ) SWEDEN ),,"29 June An Act to amend the Act (No. 729) of 1960 respec-  ting authors! rights over literary and artistic ll Dec. An Act respecting the contribution to be paid for  works. (Ibid., No. 488) the guarantee of wages [reserve fund against the  risk of employer's bankruptcy]. (Ibid., No. 742)  ",36
SWEDEN ) SWEDEN ),,"29 June Order to amend the Instruction (No. 658) of 1965  respecting patents and registration. (Ibid., il Dec. Order respecting the guarantee of payment of wages  No. 497) by the State in the case of bankruptcy. (Ibid.,  No. 745  ",36
SWEDEN ) SWEDEN ),,"4 Sep. An Order to amend the Workers! Protection Order  (No. 208) of 6 May 1949° [which issued regulations 17 Dec. An Act to amend [ss. 8 to 11 (fines for offences)  under the Workers? Protection Act of 3 Jan. 1949°]. of} the Act (No. 113) of 18 Apr. 19352 to issue  (Ibid., No. 520) Swe. 2 provisions respecting placement. (Ibid.,  No. 877  ",36
SWEDEN ) SWEDEN ),,"18 Sep. Seafarers' Hours of Work Order [under the  Seafarers! Hours of Work Act, 1970 (No. 105). 17 Dec. An Act representing the hours of work and other  Repeals the Administrative Order of 1960 (No. 13) conditions of work of domestic employees | repeals  under the Seafarers! Hours of Work Act (No. 404) the Domestic Employees Act (No. 461) of 30 June  of 30 June 19597]. (Ibid., No. 550) 19445].  (Ibid., No. 943) Swe. 3  1 bs 1952 - Swe. 3. ° LS 1949 - Swe. 4. 7% LS 1949 - Swe. 1 2  se 7 a a 1 1g 1962 - Swe. l. LS 1935 - Swe. 1 ... 1942 ~ Swe. 3.  ",36
SWEDEN ) SWEDEN ),4 msl  Swe l,"SWITZERLAND SYRIAN ARAB REPUBLIC  9 Jan. Ordinance made under the federal Act [of 12 Dec, 7 Jan. Legislative Decree No. 12, to issue regulations  19401] respecting home work [repeals the Regula- for the professions of physician and pharmacist.  tions of 16 Dec. 1941, the Ordinance of 29 Aug. (""Al-Jarida al-Rasmiya"", 28 Jan.  1947 respecting the types of work prohibited for  homeworkers and the Order of the Federal Council ee Jan. Legislative Decree No. 51, to amend [s. 1 of]  of 2 Mar. 1951 to amend the Regulations of 16 Dec. Legislative Decree No. 74 of 6 Nov. 1961  1941]. (""Recueil des Lois Fédérales - Sammlung respecting weekly rest. (Ibid., 11 Feb.)  der eidgendssischen Gesetze"", 30 Jan.)  27 Jan. Legislative Decree No. 54, to establish voca-  9 Feb. Ordinance respecting the precautions to be taken tional rehabilitation centres for the disabled  to prevent accidents in agriculture [s. 1: duties [organisation; powers and duties]. (Ibid. )  of the advisory service on agricultural accident : . f .  prevention]. (Ibid., 6 Mar.) 9 June Legislative Decree No. 127, to amend Legislative  Decree No. 49 of 3 July 1962° respecting the  16 Mar. Order of the Federal Council, to limit the number dismissal of individual workers [amends ss. 1,  of aliens carrying on a gainful occupation 2, 4, 9, 155 supplements s. 14; repeals and  [Schedule: table fixing the maximum annual number replaces s. 18]. (Ibid. 1 July) Syr. 1  of residents! permits for each canton]. (Ibid.,  20 Mar.) 20 July Legislative Decree No. 143, to organise  co-operative associations. (Ibid., 12 Aug.)  16 Mar. Ordinance of the Federal Department of Public  Economy, respecting the application of the Order  of the Federal Council limiting the number of  aliens carrying on a gainful occupation. (Ibid.) TANZANIA  16 Mar. Order of the Federal Council to amend [s. 7 10 Feb. Presidential Circular No. 1 of 1970: the  (minimum insurayce benefits) of] the Ordinance establishment of workers! councils, executive  [of 9 Mar. 1954°] respecting insurance against boards and boards of directors [the new institu-  occupational accidents and agricultural accident tions are distinct from the workers' committees  prevention. (Ibid. ) established by Act No. 62 of 10 Dec. 1964°].  SHC/C: 180/1/102. Tan. 1  Ll dune Order of the Federal Council to establish a model  contract of employment for training staff in 13 Nov. Civil Service Regulations 1970. Government  homes, institutions and boarding establishments, Notice No. 288, (""Gazette of the United Republic  (Ibid., 19 June) of Tanzania"", 13 Nov., Acts Supplement)  9 Sep. Order of the Federal Council to amend Ordinance  No. 1 made under Federal Act respecting work in  industries, handicrafts and commerce (Labour Act). THAILAND  (Ibid., 11 Sep.) _. ; «ops . .  24 July Ministerial Notification No. 2, issued under  30 Sep. A federal Act to amend the Sickness and Accident the Factories Act [21 Feb. 1969: B.E. 2512]  Insurance Act [amends ss. 65, third para., 65bis, respecting the duties of a licensee to operate a  third para., 74, second para. 78, fifth para., factory [under s. 39 of the Factories Act].  112, second para. and 132 of the Act of 13 June BE, 2513. (""Royal Thai Government Gazette"",  1911, as amended by the federal Act of 13 Mar. 30 Nov.)  19643]. (Ibid., 15 Jan. 1971)  9 Oct. A federal Act to amend [numerous amendments |  the Act respecting supplementary old-age, sur- TOGO  vivors' and disability pensions [dated 19 Mar. .  1965]. (Ibid. ) 2 Oct. Decree No. 70-164, to prescribe for the purposes  of section 134 of the Labour Code the general  9 Oct. A federal Act to amend [s. 19, first para. of] safety and health measures applying to workers in  the Invalidity Insurance Act fof 19 June 19594], establishments of all kinds | Schedule: table  (Ibid. ) indicating execution of warnings, admonitions  and orders to comply (minimum time limit for  execution and possibility of appeal on each pro-  : : "" - . ""  1 LS 1940 — Swi. 2-3. 2 LS 1954 - Swi. 1. 3 LS 1964 — Swi. 1. Nos) the Decree) }. (""Journal Officiel"",  ",37
SWEDEN ) SWEDEN ),4 msl  Swe l,"4 4S 1959 - Swi. 1, 1967 - Swi. 1.  lis 1962 - Syr. 1. © LS 1964 ~ Tan. 2  - 86 - ; - 87 -  TUNISTA TURKEY  25 Feb. Decree No. 70-64, respecting the organisation of 28 Feb. Decree No. 7/359, to give effect to the regula-  ",37
SWEDEN ) SWEDEN ),4 msl  Swe l,"the National Statistical Institute. (""Journal tions governing shift work issued by the Ministry  ",38
SWEDEN ) SWEDEN ),4 msl  Swe l,"Officiel"", 27 Feb.) of Labour under s. 72 of the Labour Act, No. 931  of 28 July 1967.1 (""Resmi Gazete"", 2 Apr.)  ",38
SWEDEN ) SWEDEN ),4 msl  Swe l,"25 Feb. Decree No. 70-66, to prescribe the powers and  ",38
SWEDEN ) SWEDEN ),4 msl  Swe l,duties of the Secretariat of State for Social 3 Mar. Regulations respecting industrial safety and  ,38
SWEDEN ) SWEDEN ),4 msl  Swe l,"Affairs and Housing. (Ibid. ) health [s. 76 of the Labour Actl}. (Ibid.,  3 Mar.  ",38
SWEDEN ) SWEDEN ),4 msl  Swe l,"10 Mar. Act No. 70-7, respecting the Economic and Social  ",38
SWEDEN ) SWEDEN ),4 msl  Swe l,"Council [repeals Legislative Decree No. 61-1 of 3 Apr. Act No. 1248, to amend and supplement s. 5 of the  ",38
SWEDEN ) SWEDEN ),4 msl  Swe l,1 Jan. 1961 to establish an Economic and Social Labour Act (No. 931 of 28 July 1967)+ fs. 5  ,38
SWEDEN ) SWEDEN ),4 msl  Swe l,"Council, as approved by Act No. 61-235 of 28 dune clause 6 (activities not covered by the Act) to  ",38
SWEDEN ) SWEDEN ),4 msl  Swe l,1961 and amended by Act No. 65-9 of 19 Apr. 1965]. include apprentices under 18; adds to second  ,38
SWEDEN ) SWEDEN ),4 msl  Swe l,"(Ibid. 6-10 Mar.) para. of s. 5 (activities covered by the Act) the  following clause (e) ""doorkeepers, caretakers  10 Mar. Decree No. 70-77, respecting the organisation, (concierges) in blocks of flats with central  ",38
SWEDEN ) SWEDEN ),4 msl  Swe l,operation and financial and administrative arrange- heating and those who perform such duties full time  ,38
SWEDEN ) SWEDEN ),4 msl  Swe l,"ments of the Economic and Social Council. (Ibid. ) for the same employers in the same blocks of flats  1 or residential apartment buildings""]. (Ibid.,  30 Apr. Act No. 70-20, to amend the Labour Code” [amends 11 Apr.)  ",38
SWEDEN ) SWEDEN ),4 msl  Swe l,"ss. 429 (third para.), 431, 437, 440 and 444  ",38
SWEDEN ) SWEDEN ),4 msl  Swe l,"respecting the Labour Medal]. (Ibid., 28 Apr. - 16 July Decree No. 7/1960: Regulations of the Ministry  ",38
SWEDEN ) SWEDEN ),4 msl  Swe l,"1 May) of Labour under section 86 of the Labour Act  and respecting employers! applications for suitable  9 July Act No. 70-34, to amend Act No. 60-30 of 14 Dec. manpower to the Placement Administration. (Ibid.,  ",38
SWEDEN ) SWEDEN ),4 msl  Swe l,1960¢ respecting the organisation of social 2 Aug.  ,38
SWEDEN ) SWEDEN ),4 msl  Swe l,"security schemes [numerous amendments; inserts,  ",38
SWEDEN ) SWEDEN ),4 msl  Swe l,"after s. 95, a new Title IIbis ""Social Insurance 25 July Deeree No. 7/1125, to issue joint regulations of  ",38
SWEDEN ) SWEDEN ),4 msl  Swe l,"in Agriculture""]. (Ibid., 10-14 July) Tun. 1 the Ministry of Labour and the Ministry of Health  and Social Welfare respecting activities at which  4 Sep. Decree No. 70-308, to issue model rules for it is prohibited by health regulations to work  ",38
SWEDEN ) SWEDEN ),4 msl  Swe l,"central co-operatives in the agricultural sector for more than eight hours a day. (Ibid.,  ",38
SWEDEN ) SWEDEN ),4 msl  Swe l,[Schedule: model rules for these central co- 27 Aug.)  ,38
SWEDEN ) SWEDEN ),4 msl  Swe l,"operatives; model share certificates, provisional  ",38
SWEDEN ) SWEDEN ),4 msl  Swe l,"share certificates, membership register). (Ibid., 29 July Act No. 1317, to amend and supplement certain  ",38
SWEDEN ) SWEDEN ),4 msl  Swe l,"11-15-18 Sep.) sections [1, 2, 5, 6, 8, 11 to 15, 18, 20, 21, 23,  25, 27 to 29 and 32] of Act No. 274 of 15 duly  14 Sep. Legislative Decree No. 70-1, to amend [numerous 19634 respecting trade unions. (Ibid., 12 Aug.)  ",38
SWEDEN ) SWEDEN ),4 msl  Swe l,amendments] Act No. 59-18 of 5 Feb. 1959 to pre- Tur. 1  ,38
SWEDEN ) SWEDEN ),4 msl  Swe l,scribe a scheme of civil and military retirement  ,38
SWEDEN ) SWEDEN ),4 msl  Swe l,"pensions. (Ibid.; errata: ibid., 23-27 Apr. 10 Nov. Decree No. 7/1556, to issue joint regulations of  ",38
SWEDEN ) SWEDEN ),4 msl  Swe l,"1971) the Ministry of Labour and the Ministry of Health  and Social Welfare respecting the health and  el Sep. Decree No. 70-516, to approve the model rules for safety of workers employed on construction sites.  ",38
SWEDEN ) SWEDEN ),4 msl  Swe l,"service co-operatives (diversified crops) (Ibid., 4 Dec.  ",38
SWEDEN ) SWEDEN ),4 msl  Swe l,"[| Schedule: model rules; model share certificates,  ",38
SWEDEN ) SWEDEN ),4 msl  Swe l,provisional share certificates; membership regi-  ,38
SWEDEN ) SWEDEN ),4 msl  Swe l,"ster]. (Ibid., 29 Sep.)  UGANDA  7 Sep. An Act to amend and consolidate the law relating  to the constitution and regulation of co-operative  societies and for other matters connected there-  with [repeals the Co-operative Societies Act  (Cap. 93) ]. No. 30. The Co-operative  Societies Act 1970.  13451966 - Tun. 1. *° LS 1960 - Tun. 1 A.  153 1967 - Tur. 1. * LS 1963 - Tur. 1.  - 88 - - 89 -  UGANDA (cont.) UNION OF SOVIET SOCIALIST REPUBLICS (cont.)  14 Dec. An Act to establish and regulate an integrated 12 June Ordinance No. 5254-VII of the Presidium of the  ",38
SWEDEN ) SWEDEN ),4 msl  Swe l,"employeest trade union, to dissolve the former Supreme Soviet of the USSR, to issue regulations  ",39
SWEDEN ) SWEDEN ),4 msl  Swe l,Uganda Labour Congress and all other trade under the Decree [No. 5253-VII] of the  ,39
SWEDEN ) SWEDEN ),4 msl  Swe l,unions registered under the Trade Unions Act Presidium of the Supreme Soviet of the USSR of  ,39
SWEDEN ) SWEDEN ),4 msl  Swe l,"1965, to provide for the formation of branch 12 June [see above]. (Ibid., Text 205)  ",39
SWEDEN ) SWEDEN ),4 msl  Swe l,unions and for other purposes connected therewith  ,39
SWEDEN ) SWEDEN ),4 msl  Swe l,"[repeals the Trade Unions Act 1965 (No. 11, 26 June 15 June Ordinance No. 182/P-13 of the State Labour and  ",39
SWEDEN ) SWEDEN ),4 msl  Swe l,"1965)+]. No. 40. Trade Unions Act. (""Uganda Wages Committee of the Council of Ministers of  ",39
SWEDEN ) SWEDEN ),4 msl  Swe l,"Gazette"", 31 Dec.) the USSR and the Presidium of the All-Union  Central Council of Trade Unions of the USSR con-  cerning the remuneration of workers of sovkhozes  and other state agricultural undertakings  UNION OF SOVIET SOCIALIST REPUBLICS [Schedule 1: model regulations for the remunera-  tion of these workers; Schedule 2: model  6 Feb. Ordinance of the Presidium of the Central Council regulations concerning the remuneration of  ",39
SWEDEN ) SWEDEN ),4 msl  Swe l,"of Trade Unions of the USSR, to supplement and managerial staff and technicians or experts  ",39
SWEDEN ) SWEDEN ),4 msl  Swe l,"amend the regulations respecting the procedure for employed by these undertakings; repeals, inter  ",39
SWEDEN ) SWEDEN ),4 msl  Swe l,"the grant and payment of state social insurance alia, s. 1 of Order No. 285/14 of 30 Apr. 1961,  ",39
SWEDEN ) SWEDEN ),4 msl  Swe l,"benefits [amends ss. 25, 31, 61 and 102 and Order No. 271/P-12 of 30 Apr. 1965 and s. 1 of  ",39
SWEDEN ) SWEDEN ),4 msl  Swe l,"supplements ss. 26, 31, 128 and 132 of the regula- Order No. 297/P-13 of 13 May 1965]. (""Byulleten  ",39
SWEDEN ) SWEDEN ),4 msl  Swe l,tions of 5 Feb. 1955 on the same subject]. Gosudarstvennogo Komiteta Soveta Ministrov SSSR po  ,39
SWEDEN ) SWEDEN ),4 msl  Swe l,"(""Okhrana Truda i Sotsialnoe Strakhovanie"", No. 7) Voprosam Truda i Zarabotnoi Platy"", No. 10)  23 Feb. Ordinance of the Central Committee of the 15 July Act No. 2-VIII of the Supreme Soviet of the USSR,  ",39
SWEDEN ) SWEDEN ),4 msl  Swe l,Communist Party of the Soviet Union and the Council to approve fundamental principles governing the  ,39
SWEDEN ) SWEDEN ),4 msl  Swe l,of Ministers of the USSR to issue provisions to labour legislation of the USSR and the Union  ,39
SWEDEN ) SWEDEN ),4 msl  Swe l,"intensify the campaign against persons evading Republics. (""Vedomosti Verkhovnogo Soveta SSSR"",  ",39
SWEDEN ) SWEDEN ),4 msl  Swe l,socially useful work and leading an anti-social Text 265) USSR 1  ,39
SWEDEN ) SWEDEN ),4 msl  Swe l,"parasitic type of life. (""Sovetskaya Yustitsia"", TO  ",39
SWEDEN ) SWEDEN ),4 msl  Swe l,"May ) 30 Nov. Decree No. 523-8 of the Presidium of the Supreme  Soviet of the USSR, to issue administrative  27 Feb. Order No. 145 of the Council of Ministers of the regulations under the Act [No. 2-8 of 15 July  ",39
SWEDEN ) SWEDEN ),4 msl  Swe l,"USSR, respecting the privileges and priorities 1970 (see above)] to approve fundamental principles  ",39
SWEDEN ) SWEDEN ),4 msl  Swe l,enjoyed by workers released in connection with the governing the labour legislation of the USSR and  ,39
SWEDEN ) SWEDEN ),4 msl  Swe l,"improvement of the administrative system and the the Union Republics. Ibid., Text 514)  ",39
SWEDEN ) SWEDEN ),4 msl  Swe l,"reduction of its costs. (Ibid., Apr.)  25 Dec. Order No. 510/36 of the State Labour and Wages  20 Mar. Order No. 214 of the Council of Ministers of the Committee of the Council of Ministers of the  ",39
SWEDEN ) SWEDEN ),4 msl  Swe l,USSR and the Central Council of Trade Unions of USSR and the Secretariat of the All-Union Central  ,39
SWEDEN ) SWEDEN ),4 msl  Swe l,"the USSR concerning measures for the application Council of Trade Unions, respecting the conditions  ",39
SWEDEN ) SWEDEN ),4 msl  Swe l,of social security in the case of members of of remuneration of workers. employed in autonomous  ,39
SWEDEN ) SWEDEN ),4 msl  Swe l,"kolkhoses. (Ibid., June) scientific research laboratories, not included in  the categories of workers remunerated in accordance  30 Mar. Interpretation No. 4/11 of the State Labour and with the provisions of Order No. 660 of the  ",39
SWEDEN ) SWEDEN ),4 msl  Swe l,"Wages Committee of the Council of Ministers of the Council of Ministers of the USSR, dated 5 June  ",39
SWEDEN ) SWEDEN ),4 msl  Swe l,"USSR and the Secretariat of the Central Council of 1957. (""Byulleten Gosudarstvennogo Komiteta  ",39
SWEDEN ) SWEDEN ),4 msl  Swe l,Trade Unions of the USSR respecting the grant of Soveta Ministrov SSSR po Voprosam Truda i  ,39
SWEDEN ) SWEDEN ),4 msl  Swe l,"supplementary unpaid leave to women with small . Zarobotnoi Platy"", 1971, No. 5)  ",39
SWEDEN ) SWEDEN ),4 msl  Swe l,children (until the child's first birthday).  ,39
SWEDEN ) SWEDEN ),4 msl  Swe l,"(Ibid., May)  Russian Soviet Federative Socialist Republic  ",39
SWEDEN ) SWEDEN ),4 msl  Swe l,12 June Decree No. 5253-VII of the Presidium of the  ,39
SWEDEN ) SWEDEN ),4 msl  Swe l,"Supreme Soviet of the USSR, to provide for the 25 Feb. Decree of the Presidium of the Supreme Soviet of  ",39
SWEDEN ) SWEDEN ),4 msl  Swe l,"suspension of prison sentences, these being re- the RSFSR to supplement and amend the Penal Code  ",39
SWEDEN ) SWEDEN ),4 msl  Swe l,"placed by compulsory labour. (""Vedomosti and the Code of Criminal Procedure of the RSFSR  ",39
SWEDEN ) SWEDEN ),4 msl  Swe l,"Verkhovnogo Soveta SSSR"", Text 204) [new drafting of s. 209 (systematic begging and  vagrancy); new s. 209-1 (persons evading or  failing to comply with a decision concerning  1 placement in useful employment and ceasing to  LS 1965 - Ug. 1. lead a parasitic existence) ]. (""Sovetskaya  Yustitsia"", May)  - 9O - - 9] -  UNION OF SOVIET SOCIALIST REPUBLICS (cont.) UNITED ARAB REPUBLIC  31 May Law No. 40 of 1970 to amend certain provisions  Russian Soviet Federative Socialist Republic (cont.) of the Social Insurance Code [Law No. 63] of  21 March 19641 [replaces ss. 2 (persons covered  25 Feb. Decree of the Presidium of the Supreme Soviet of by Code) and 82 (entitlement to disability and  ",39
SWEDEN ) SWEDEN ),4 msl  Swe l,"the RSFSR to amend the Decree of 4 May 19611 of survivors' pensions) of the Code]. (""Al-Wagatu  ",40
SWEDEN ) SWEDEN ),4 msl  Swe l,"the Presidium of the Supreme Soviet of the RSFSR al-Misriya"", 4 June)  ",40
SWEDEN ) SWEDEN ),4 msl  Swe l,to intensify the campaign against persons evading  ,40
SWEDEN ) SWEDEN ),4 msl  Swe l,"socially useful work and leading an anti-social, 28 June Act No. 45 of 1970 to amend certain provisions  ",40
SWEDEN ) SWEDEN ),4 msl  Swe l,"parasitic type of life [replaces ss. 1 to 6]. [ss..13, 17, 33 and 69] of the Social Insurance  ",40
SWEDEN ) SWEDEN ),4 msl  Swe l,"(""Vedomosti Verkhovnogo Soveta RSFSR"", Text 255) Codel. (Ibid., 2 July)  USSR 2  ",40
SWEDEN ) SWEDEN ),4 msl  Swe l,4 June Ordinance No. 550 of the Council of Ministers to  ,40
SWEDEN ) SWEDEN ),4 msl  Swe l,prescribe the modes of and conditions for the UNITED KINGDOM  ,40
SWEDEN ) SWEDEN ),4 msl  Swe l,"rehabilitation through labour, in the RSFSR, of  ",40
SWEDEN ) SWEDEN ),4 msl  Swe l,persons attempting to evade useful work of service  ,40
SWEDEN ) SWEDEN ),4 msl  Swe l,to the community Funder s. 3 of the Decree of the Great Britain  ,40
SWEDEN ) SWEDEN ),4 msl  Swe l,Supreme Soviet (of the RSFSR) dated 25 Feb. on  ,40
SWEDEN ) SWEDEN ),4 msl  Swe l,"the same subject (see above) ]. (""Sovetskaya 26 Feb. An Act to provide for the exercise, in relation  ",40
SWEDEN ) SWEDEN ),4 msl  Swe l,"Yustitsia"", 19 Oct.) to intermediate areas, of certain of the func-  tions under the Local Employment Acts 1960 to  1 July Order of the Presidium of the Supreme Soviet of 1966 of the Minister of Technology and other  ",40
SWEDEN ) SWEDEN ),4 msl  Swe l,"the RSFSR respecting the tasks of local industry persons and, in relation to derelict land  ",40
SWEDEN ) SWEDEN ),4 msl  Swe l,"of the RSFSR | industrial development and occupa- clearance areas, of the powers conferred by  ",40
SWEDEN ) SWEDEN ),4 msl  Swe l,tional training (including handicrafts) ]. s. 20 of the Industrial Development Act 1966;  ,40
SWEDEN ) SWEDEN ),4 msl  Swe l,"(""Vedomosti Verkhovnogo Soveta RSFSR"", Text 580) to provide for the making of grants out of  moneys provided by Parliament towards costs in-  1 July Act to establish a Rural Code for the RSFSR [date curred by councils in connection with the bringing  ",40
SWEDEN ) SWEDEN ),4 msl  Swe l,"of commencement 1 Dec. 1970]. (Ibid., Text 581) into use, or the improvement of the appearance of,  derelict, neglected or unsightly land; to with-  22 Oct. Decree of the Presidium of the Supreme Soviet draw the payments additional to refund of selec-—  ",40
SWEDEN ) SWEDEN ),4 msl  Swe l,of the RSFSR to issue administrative regulations tive employment tax which are made under s. 1 (1)  ,40
SWEDEN ) SWEDEN ),4 msl  Swe l,under the Rural Code of the RSFSR [dated 1 July (a) to (ad) of the Selective Employment Payments  ,40
SWEDEN ) SWEDEN ),4 msl  Swe l,"1970 (see above) ]}. (Ibid., Text 725) Act 1966, and to reduce correspondingly the  amount of payments to public bodies under s. 3 of  18 Dec. An Act to promulgate the Labour Rehabilitation that Act; to amend s. 60 of the Landlord and  ",40
SWEDEN ) SWEDEN ),4 msl  Swe l,"Code [inter alia, Ch. 7: general, vocational Tenant Act 1954; and for purposes connected with  ",40
SWEDEN ) SWEDEN ),4 msl  Swe l,and technical training of detainees; Ch. 16: the matters aforesaid. Ch. 7. Local Employment  ,40
SWEDEN ) SWEDEN ),4 msl  Swe l,procedures and conditions for cases where a Act 1970.  ,40
SWEDEN ) SWEDEN ),4 msl  Swe l,sentence is to be served in the form of labour  ,40
SWEDEN ) SWEDEN ),4 msl  Swe l,"rehabilitation without detention]. (Ibid., 29 May An Act to prevent discrimination, as regards terms  ",40
SWEDEN ) SWEDEN ),4 msl  Swe l,"Text 1220) and conditions of employment, between men and  women. Ch. 41. Equal Pay Act 1970. UK 1  Ukraine 29 May An Act to provide for the establishment of a  National Radiological Protection Board and an  23 Dec. An Act to promulgate the Labour Rehabilitation Advisory Committee, with functions concerning the  ",40
SWEDEN ) SWEDEN ),4 msl  Swe l,"Code [inter alia: Ch. 8: general, vocational and protection of people from radiation hazards; and  ",40
SWEDEN ) SWEDEN ),4 msl  Swe l,"technical training of detainees; Ch. 16: for connected purposes, Ch. 46. Radiological  ",40
SWEDEN ) SWEDEN ),4 msl  Swe l,procedures and conditions for cases where a sentence Protection Act 19770.  ,40
SWEDEN ) SWEDEN ),4 msl  Swe l,is to be served in the form of labour rehabilita-  ,40
SWEDEN ) SWEDEN ),4 msl  Swe l,"tion without detention]. (""Vedomosti Verkhovnogo 13 July The Air Navigation Order 1970 [inter alia,  ",40
SWEDEN ) SWEDEN ),4 msl  Swe l,"Soveta Ukrainskoy SSR"", 1971, Text 6) Part Vi: fatigue of crew; maximum flight duty  eriods and minimum rest periods, etc.].  (""Statutory Instruments"", No. 954)  1 4s 1961 - USSR 1.  1 Ls 1964 - UAR 3.  —~ 93 -  ~ 92 -  ",40
UNITED KINGDOM UNITED KINGDOM ),Great Britain Great Britain,widow's benefit under the National Insurance Act  in re sons ov nsionable ; . : ;  ,41
UNITED KINGDOM UNITED KINGDOM ),Great Britain Great Britain,hee ons Say 10485 to reluce from 50 to 40 the and drivers; s. 18: particular obligations and  ,41
UNITED KINGDOM UNITED KINGDOM ),Great Britain Great Britain,"qualifying age for widow's pension under s. 28 of oe ips) affecting drivers]. (Ibid.,  ",41
UNITED KINGDOM UNITED KINGDOM ),Great Britain Great Britain,that Act and to relax further the conditions for o-»  ,41
UNITED KINGDOM UNITED KINGDOM ),Great Britain Great Britain,such a pension and for a wife's retirement  ,41
UNITED KINGDOM UNITED KINGDOM ),Great Britain Great Britain,pension by virtue of her husband's insurance; to  ,41
UNITED KINGDOM UNITED KINGDOM ),Great Britain Great Britain,make provision for attendance allowance and the  ,41
UNITED KINGDOM UNITED KINGDOM ),Great Britain Great Britain,establishment and function of an Attendance  ,41
UNITED KINGDOM UNITED KINGDOM ),Great Britain Great Britain,Allowance Board; and for purposes connected with 17D  ,41
UNITED KINGDOM UNITED KINGDOM ),Great Britain Great Britain,the matters aforesaid. Ch. 51. National eC.  ,41
UNITED KINGDOM UNITED KINGDOM ),Great Britain Great Britain,Insurance (Old Persons' and Widows! Pensions and  ,41
UNITED KINGDOM UNITED KINGDOM ),Great Britain Great Britain,"Attendance Allowance) Act 1970.  general obligations affecting consignors, carriers  4 Dee. The Radioactive Substances (Road Transport  Workers) (Great Britain) Regulations 1970,  (Ibid., No. 1827)  An Act to provide for the payment of a new  benefit for certain families with small incomes;  and for purposes connected therewith [prescribed  amount: &15 for one child; £2 for each addi-  23 July An Act to make provision, as respects England and tional ehilel. Whe 994 Zamily income Supphe=  ",41
UNITED KINGDOM UNITED KINGDOM ),Great Britain Great Britain,"Wales, for discontinuing the classification of  ",41
UNITED KINGDOM UNITED KINGDOM ),Great Britain Great Britain,handicapped children as unsuitable for education  ,41
UNITED KINGDOM UNITED KINGDOM ),Great Britain Great Britain,"at school, and for purposes connected therewith.  ",41
UNITED KINGDOM UNITED KINGDOM ),Great Britain Great Britain,"Ch. 52, Education (Handicapped Children) Act Antigua  ",41
UNITED KINGDOM UNITED KINGDOM ),Great Britain Great Britain,1970. 19 Mar. An Act to make provision for the protection of  25 July An Act to make fresh provision in place of certain hee 1970 WOREmeR« NOs 3s Zrotection of Bakes  ,41
UNITED KINGDOM UNITED KINGDOM ),Great Britain Great Britain,enactments relating to merchant ships and seamen  ,41
UNITED KINGDOM UNITED KINGDOM ),Great Britain Great Britain,and to repeal. some of those enactments without  ,41
UNITED KINGDOM UNITED KINGDOM ),Great Britain Great Britain,replacement; to make further provision relating  ,41
UNITED KINGDOM UNITED KINGDOM ),Great Britain Great Britain,to merchant ships and seamen; and for purposes  ,41
UNITED KINGDOM UNITED KINGDOM ),Great Britain Great Britain,"connected therewith [repeals, inter alia: 17 Jul  ",41
UNITED KINGDOM UNITED KINGDOM ),Great Britain Great Britain,1. (the whole Act): The Merchant Shipping y  ,41
