country,region,text,page
FINLAND FRANCE ),2e May An Act partially to amend the Local Public LIBYA,"Act [of 12 June 1969]. (""Liechtensteinisches Ss. 24 of the Act of 7 June 1937+ as amended by the  ",27
FINLAND FRANCE ),2e May An Act partially to amend the Local Public LIBYA,"Landesgesetzblatt"", 20 Jan.) Act of 20 Apr. 1962]. (Ibid., 11 Dec.)  7 July Ordinance No. III under the Act respecting employ- 9 Dec. An Act to provide for the reduction of and to issue  ",27
FINLAND FRANCE ),2e May An Act partially to amend the Local Public LIBYA,"ment in industry, handicrafts and commerce regulations governing the hours of work of workers  ",27
FINLAND FRANCE ),2e May An Act partially to amend the Local Public LIBYA,(Employment Act [industrial safety and_ health employed in the public and private sectors of the  ,27
FINLAND FRANCE ),2e May An Act partially to amend the Local Public LIBYA,"prevention in industrial establishments]. economy. (Ibid., 1l Dec.) Dux. 1  ",27
FINLAND FRANCE ),2e May An Act partially to amend the Local Public LIBYA,"(Ibid., 23 July)  ",27
FINLAND FRANCE ),2e May An Act partially to amend the Local Public LIBYA,17 Dec. An Act respecting assistance to the blind.  ,27
FINLAND FRANCE ),2e May An Act partially to amend the Local Public LIBYA,"(Ibid., 21 Jan. 1971) MALAGASY REPUBLIC  235 June Act No. 70-002, respecting individual and col-  lective disputes in the merchant marine [amends  LUXEMBOURG Se 3-8-O1 of Act No. 66-007 of 5 July 1966, and  repeals all previous statutory instruments on the  24 June An Act to issue regulations respecting contracts same subject]. (""Journal Officiel"", 27 June)  ",27
FINLAND FRANCE ),2e May An Act partially to amend the Local Public LIBYA,for the hire of workers! services [supplements the  ,27
FINLAND FRANCE ),2e May An Act partially to amend the Local Public LIBYA,"fourth paragraph of s. 22 of the Order of 24 July Order No. 2828-DGTP/SMM, to prescribe the organisa~  ",27
FINLAND FRANCE ),2e May An Act partially to amend the Local Public LIBYA,30 Oct. 19581 respecting the establishment of tion of work on board and manning of commercial  ,27
FINLAND FRANCE ),2e May An Act partially to amend the Local Public LIBYA,"workers! committees in industrial, commercial and fishing vessels. (Ibid., 1 Aug.)  ",27
FINLAND FRANCE ),2e May An Act partially to amend the Local Public LIBYA,"handicraft undertakings, as amended by the Order  ",27
FINLAND FRANCE ),2e May An Act partially to amend the Local Public LIBYA,"of 20 Nov. 1962]. (""Paginomie Iuxembourgeoise"" 5 Aug. Order No. 3012-DGTP/SMM, to prescribe the modes of  ",27
FINLAND FRANCE ),2e May An Act partially to amend the Local Public LIBYA,"1970) application of Act No. 70002 of 23 June 1970  respecting individual and collective disputes in  30 Oct. Consolidated text of the laws and other statutory the merchant marine. (Ibid., 15 Aug.)  ",27
FINLAND FRANCE ),2e May An Act partially to amend the Local Public LIBYA,instruments making up the body of regulations  ,27
FINLAND FRANCE ),2e May An Act partially to amend the Local Public LIBYA,"governing the minimum living wage. (""Memorial"", 22 Sep. Decree No. 70-494, to prescribe the powers and  ",27
FINLAND FRANCE ),2e May An Act partially to amend the Local Public LIBYA,"Series A, 9 Dec.) duties of the Minister of Labour and to establish  the general organisation of his Ministry.  11 Nov. An Act respecting voluntary transfer of and seizure (Ibid., 8 Oct.  ",27
FINLAND FRANCE ),2e May An Act partially to amend the Local Public LIBYA,by garnishment of remuneration for work and of  ,27
FINLAND FRANCE ),2e May An Act partially to amend the Local Public LIBYA,"pensions of all kinds [repeals, inter alia, the 22 Sep. Decree No. 70-495, to prescribe the powers and  ",27
FINLAND FRANCE ),2e May An Act partially to amend the Local Public LIBYA,Act of 19 July 1895 respecting the transfer of duties of the Secretary of State for Co-operation  ,27
FINLAND FRANCE ),2e May An Act partially to amend the Local Public LIBYA,and seizure by garnishment of lower-bracket wages and Rural Development and to establish the general  ,27
FINLAND FRANCE ),2e May An Act partially to amend the Local Public LIBYA,"and salaries of manual and non-manual workers, and organisation of his Department [repeals Decree  ",27
FINLAND FRANCE ),2e May An Act partially to amend the Local Public LIBYA,the Act of 15 May 1934 to amend the Acts of No. 69-127 of 1 Apr. 1969 to establish under the  ,27
FINLAND FRANCE ),2e May An Act partially to amend the Local Public LIBYA,"19 July 1895 on the same subject]. (Ibid., Office of the President of the Republic a  ",27
FINLAND FRANCE ),2e May An Act partially to amend the Local Public LIBYA,20 Nov.) Secretariat of State for Development and Decree  No. 69-193 of 2 Apr. 1969 to prescribe the powers  27 Nov. Grand Ducal regulations respecting the procedure and duties of the Secretary of State for Develop-  ,27
FINLAND FRANCE ),2e May An Act partially to amend the Local Public LIBYA,for the seizure of remuneration from work and ment]. (Ibid.)  ,27
FINLAND FRANCE ),2e May An Act partially to amend the Local Public LIBYA,"pensions by garnishee order. (Ibid., 16 Dec.)  22 Sep. Decree No. 70-497, to fix the powers and duties  3 Dec. Grand Ducal regulations respecting the administra- [inter alia, government policy-making as_regards  ",27
FINLAND FRANCE ),2e May An Act partially to amend the Local Public LIBYA,tion of and rules to be observed in prisons improvement of women's status and rights] of the  ,27
FINLAND FRANCE ),2e May An Act partially to amend the Local Public LIBYA,"[Ch. IX: General education and vocational train- Secretary of State for Woman and Child Affairs, and  ",27
FINLAND FRANCE ),2e May An Act partially to amend the Local Public LIBYA,"ing of prisoners]. (Ibid., 17 Dec.) to establish the general organisation of his  Department. (Ibid.)  9 Dec. An Act to provide for equality of treatment to be  ",27
FINLAND FRANCE ),2e May An Act partially to amend the Local Public LIBYA,given to nationals of the member States of the  ,27
FINLAND FRANCE ),2e May An Act partially to amend the Local Public LIBYA,European Communities so as to place them on the  ,27
FINLAND FRANCE ),2e May An Act partially to amend the Local Public LIBYA,same footing as Luxembourg workers as regards MALAWI  ,27
FINLAND FRANCE ),2e May An Act partially to amend the Local Public LIBYA,eligibility to the organs for workers! representa-  ,27
FINLAND FRANCE ),2e May An Act partially to amend the Local Public LIBYA,tion in the undertaking [amends the fourth para- 10 Dec. An Act to amend the Widows and Orphans Pensions  ,27
FINLAND FRANCE ),2e May An Act partially to amend the Local Public LIBYA,graph of s. 8 of the Grand-Ducal Order of Act. No. 59. Widows and Orphans Pensions  ,27
FINLAND FRANCE ),2e May An Act partially to amend the Local Public LIBYA,"30 Oct. 1958° as amended by the Grand-Ducal  1 2  ~ ° . L a 6 -_ Ti ° °  1 tg 1958 - Tux. 1. * LS 1958 ~- Iux. 1. US 1957 - lux, 1 6 1962 — nx. 1  - 66 - - 67 -  MALAWL (cont.) MEXICO  ",27
FINLAND FRANCE ),2e May An Act partially to amend the Local Public LIBYA,"(Amendment) Act 1970 [replaces s. 10 (Pensions 30 Dec. Decree to amend [ss. 1, 4, 8, 18, 19, 20, 23, 24,  ",28
FINLAND FRANCE ),2e May An Act partially to amend the Local Public LIBYA,"Fund); adds Ss. 46 (powers of Minister) ]. 25, 26, 31, 37, clauses III and VII, 52, 56,  ",28
FINLAND FRANCE ),2e May An Act partially to amend the Local Public LIBYA,"(""Government Gazette"", 15 Dec.) clause IT, 57, 61, 63, 65, clause It,,74, 90, 94  and 104 of] the Social Insurance Act.  ll Dec. Aviation (Air Navigation) Regulations 1970 [under (""Diario Oficial"", 31 Dec.) Mex. 1  ",28
FINLAND FRANCE ),2e May An Act partially to amend the Local Public LIBYA,the Aviation Act 1970 (No. 7); regulations 16  ,28
FINLAND FRANCE ),2e May An Act partially to amend the Local Public LIBYA,"(composition of crew of aircraft), 46 (duties of  ",28
FINLAND FRANCE ),2e May An Act partially to amend the Local Public LIBYA,operators to prevent excessive fatigue of flight  ,28
FINLAND FRANCE ),2e May An Act partially to amend the Local Public LIBYA,"crew), 47 (establishment of limits on flight MONACO  ",28
FINLAND FRANCE ),2e May An Act partially to amend the Local Public LIBYA,"times, flying duty periods and rest periods), 48 ; ;  ",28
FINLAND FRANCE ),2e May An Act partially to amend the Local Public LIBYA,"pnox imam flying duty period for flight crew), 49 el Feb. Sovereign Ordinance No. 4409, made under Act No. 871  ",28
FINLAND FRANCE ),2e May An Act partially to amend the Local Public LIBYA,"minimum rest periods for flight crew), 50-51 of 17 July 1969 to institute public assistance  ",28
FINLAND FRANCE ),2e May An Act partially to amend the Local Public LIBYA,"(records of flight times, duty periods and rest allowances for workers in the private sector who ©  ",28
FINLAND FRANCE ),2e May An Act partially to amend the Local Public LIBYA,"periods; maximum flight times for crew), etc.]. are temporarily unemployed for reasons beyond their  ",28
FINLAND FRANCE ),2e May An Act partially to amend the Local Public LIBYA,"Government Notice No. 16, (""Malawi Gazette"", control. (""Journal de Monaco"", 27 Feb.)  ",28
FINLAND FRANCE ),2e May An Act partially to amend the Local Public LIBYA,"27 Jan, 1971, Extraordinary, Supplement) 26 Feb. Act No. 878, to amend ss. 3, 6 and 7 of Act No. 595  of 15 July 1954 to institute a family benefit  scheme [replaces ss. 3 and 7 (conditions for grant)  MAURITANTA and repeals the second and third paras. of s. 6].  (Ibid., 6 Mar.)  23 Jan. Act No. 70/029, respecting personnel requisition ; . ;  ",28
FINLAND FRANCE ),2e May An Act partially to amend the Local Public LIBYA,"[applies to civil servants and local government 6 Apr. Sovereign Ordinance No. 4440, to amend Sovereign  ",28
FINLAND FRANCE ),2e May An Act partially to amend the Local Public LIBYA,"officials, employees of quasi-public bodies and Ordinance No. 1447 of 28 Dec. 1956 respecting the  ",28
FINLAND FRANCE ),2e May An Act partially to amend the Local Public LIBYA,"employees in the private sector} (""Journal application of Acts Nos. 595 and 618 of 15 July  ",28
FINLAND FRANCE ),2e May An Act partially to amend the Local Public LIBYA,"Officiel"", 28 Jan.) 1954 and 26 July tpee to prescribe the scheme for  family allowances Lrepeals and replaces s. 5  23 Jan. Act No. 70/030, to amend certain sections [ss. 1 (definition of dependent child and head of house-  ",28
FINLAND FRANCE ),2e May An Act partially to amend the Local Public LIBYA,"(constitution of trade unions), 3 (freedom of hold), 6, 7 and 8 (modes of granting and paying  ",28
FINLAND FRANCE ),2e May An Act partially to amend the Local Public LIBYA,"association),and 9 (deposit of rules)] of the benefits), inserts new ss. 8bis, 8ter and 8quater  ",28
FINLAND FRANCE ),2e May An Act partially to amend the Local Public LIBYA,"Labour Code. (Ibid. Mau. 1A and supplements s. ll respecting the production,  nm by persons entitled to benefit, of identity and  24 Mar. Decree No. 70/077, to prohibit the right to strike other documents in support of their claims].  ",28
FINLAND FRANCE ),2e May An Act partially to amend the Local Public LIBYA,"in the case of certain state civil servants and (Ibid., 10 Apr.  ",28
FINLAND FRANCE ),2e May An Act partially to amend the Local Public LIBYA,state employees [enumeration of the categories . ;  ,28
FINLAND FRANCE ),2e May An Act partially to amend the Local Public LIBYA,"concerned ]. (Ibid., 29 Apr.) Mau. 1 G 28 July Ministerial Order No, 70-265, to extend the scope  es of Codicil No. 12 to the national collective  4 Apr. Decree No. 70/092, to prescribe the powers and labour agreement of 5 Nov. 1945 [Codicil No. 12, of  ",28
FINLAND FRANCE ),2e May An Act partially to amend the Local Public LIBYA,"duties of the Ministry of Health and Labour and the 20 Mar. 1970, respecting security of employment, is  ",28
FINLAND FRANCE ),2e May An Act partially to amend the Local Public LIBYA,"reorganisation of the central administration of the set out in the Schedule to the Order, which makes  ",28
FINLAND FRANCE ),2e May An Act partially to amend the Local Public LIBYA,Ministry of Health and Labour [repeals Decree the Codicil binding on all employers and wage  ,28
FINLAND FRANCE ),2e May An Act partially to amend the Local Public LIBYA,"No. 68219 of 10 July 1968]. Ibid.) earners in industrial and commercial undertakings  in occupational sectors within its scope].  (Ibid., 7 Aug.)  MAURITIUS 15 Dec. Act No. 896, to change the title of Division IV and  sections 26 to 30 inclusive and 36bis of Act  30 Apr. An Act to regulate the employment of persons who No. 526 of 23 Dec. 1950 respecting civil service  ",28
FINLAND FRANCE ),2e May An Act partially to amend the Local Public LIBYA,"are not citizens of Mauritius and matters retirement pensions, and to repeal the last para-  ",28
FINLAND FRANCE ),2e May An Act partially to amend the Local Public LIBYA,incidental thereto or connected therewith. No. 15. graph but one of s. 17 [retirement ; assessment and  ,28
FINLAND FRANCE ),2e May An Act partially to amend the Local Public LIBYA,"(""Government Gazette"", 2 May, Legal Supplement) surviving spouse of deceased pensioner; funeral  grant]. (Ibid., 18 Dec.)  15 Dec. Act No. 898, to provide for unpaid leave [not to  exceed twelve working days a year] for workers!  1 LS 1963 - Mau. l. education or the training of workers in trade union  matters. (Ibid.)  1 5g 1942 - Mex. 1 see 1959 - Mex. 1.  ~ 68 - - 69 -  ",28
MOROCCO MOROCCO ),,"21 dan. Decree No, 2-69-128, to amend and supplement the Ql Aug. Joint Order of the Minister of Labour, Employment  Order of 23 Oct. 1948+ concerning model rules of and Vocational Training and the Minister of  employment for determining the relations between Commerce, Industry, Mines and the Merchant Marine.  employed persons in industry, trade or the profes-~ No. 268-70, to issue a list of operations exposing  sions and their employers [replaces ss. 5 (paid workers habitually to the danger of lead poisoning  leave of absence), 8 (seniority bonuses) and 11 {repeals the Order of the Director of Labour and  (cessation of employment for prolonged absence on Social Questions of 10 Sep. 1953, to prescribe the  account of sickness, accident or incapacity) and list of industrial operations in which health  supplements s. 12 (reinstatement after military measures must be observed to prevent lead poison-  service) ]. (""Bulletin Officiel"", 4 Feb.) ing]. (Ibid., 2 Sep.)  6 Apr. Decree No. 2-69-323, to prescribe the special 21 Aug. Order of the Minister of Labour, Employment and  measures of protection and health to be observed in Vocational Training No. 270-70, to prescribe the  works sites where compressed air is used [repeals details to be given in notifications or warnings  Vizierial Order of 27 Jan. 1950 on the same subject]. of lead poisoning hazards and the precautions to  (Ibid., 15 Apr.; errata: ibid., 20 May) be taken to prevent such poisoning [repeals the  Order of the Director of Labour and Social Ques-  6 Apr. Decree No, 2-69-1, to amend [ss. 5 (second para- tions of 10 Sep. 1953 on the same subject;  graph), 7, 9, 10 (first paragraph), 11 (first Schedule: model notification/warning|. (Ibid. )  paragraph), 17 and 28 of] Decree NO. 256-248 of  8 Feb. 19582 made under Dahir No. 1-56-093 of  8 July 19579 respecting the organisation of indus-  trial medical services. (Ibid., 29 Apr.) NETHERLANDS  Mor. 1  15 Jan. An Act to amend [ss. 3 and,4 of] the Sickness  ",29
MOROCCO MOROCCO ),,"24 Apr. Joint order of the Minister of Labour, Employment Funds Act [of 15 Oct. 19641]. (""Staatsblad"",  and Vocational Training and of the Minister of No. 39)  Public Health No. 715-68, to prescribe the tests to  be carried out in the medical examination of 12 Jan. An Act_to lay down rules for the determination of  workers exposed to the risk of occupational wages [repeals Part III of the Extraordinary  pneumoconioses. (Ibid.) (Employment Relations) Decree 19452]. Wage  Determination Act. (Ibid., No. 69) Neth. 1  ",29
MOROCCO MOROCCO ),,"23 May Order of the Minister of Labour, Employment and ——  Vocational Training No. 405-70, to prescribe the 26 Nov. Government Decree to make general regulations to  specifications for the materials and equipment used establish a Social and Economic Council | repeals  for work in compressed air, and the modes of test- Government Decree No. 1 of 1 Feb. 1966 to estab-  ing such materials and equipment. (Ibid., 12 Aug.) lish a Social and Economic Council].  (""Publicatieblad"", No. 136)  ",29
MOROCCO MOROCCO ),,"22 July Decree No. 2-70-185, to prescribe special medical  prevention measures and health rules to be applied  in establishments where the staff is habitually  exposed to lead poisoning [repeals the Vizierial NEW ZEALAND  Order of 9 Sep. 1963 on the same subject].  (Ibid., 2 Sep.) 17 July An Act to amend the Social Security Act 1964?  jamends Part I (monetary benefits), Part II  ",29
MOROCCO MOROCCO ),,"29 July Dahir No. 1-69-135, respecting the protection of medical and hospital benefits and other related  literary and artistic works [repeals, inter alia, benefits) and Schedules 1 to 10, 12, 14 and 15].  the Dahir of 23 June 1916 respecting the protec- No. 9. Social Security Amendment Act 1970.  tion of literary and artistic works] « (Ibid.,  7 Oct.) 3 Aug. Order in Council: The State Services Salary  Order (No. 3) 1970 [repeals the State Services  ",29
MOROCCO MOROCCO ),,"31 July Dahir No. 1-70-177, to promulgate the Constitution Salary Order 1970].  [guarantees freedom of association and freedom to  join any trade union association (s. 8), the right 3 Aug. Order in Council: The State Services Salary  to work (s. 13) and the right to strike (s. 14)]. Order (No. 4) 1970 [repeals the State Services  (Ibid., 1 Aug.) Mor. 2 (extracts) Salary Order (No. 2) 1970].  i LS 1948 - Mor. 3. 2 IS 1959 - Mor. 1 A, B. iis 1964 - Neth. 2. e 4s 1963 - Neth. l. > Ls 1964 - N.Z. 1.  ",29
MOROCCO MOROCCO ),,3 43 1959 — Mor. 1 C.  - 7O - ; -71-  NEW ZEALAND (cont. ) NORWAY (cont. )  17 Oct. An Act to amend the Industrial Conciliation 6 May Instruction concerning the transport of chemical  ,29
MOROCCO MOROCCO ),,"and Arbitration Act 19541 [amends s. 73 and products in tanker ships. (Ibid., 10 June)  ",30
MOROCCO MOROCCO ),,"replaces ss. 176 to 180: labour disputes,  ",30
MOROCCO MOROCCO ),,personal grievances and industrial mediation 29 May An Act respecting patents deposited [ownershi  ,30
MOROCCO MOROCCO ),,"service]. No. 33. Industrial Conciliation and and exploitation]. No. 33. (Ibid., 29 May  ",30
MOROCCO MOROCCO ),,Arbitration Amendment Act 1970. NwZ. 1  5 June An Act to amend [ss. 135 and 349a (fines of six  27 Nov. An Act to amend the Superannuation Act 1956. months! to two years! imprisonment for offenders)  ,30
MOROCCO MOROCCO ),,"No. 116. superannuation Amendment Act 1970. of | the Penal Code of 22 May 1902 (racial dis-  crimination, etc. declared illegal). No. 34.  1 Dec. An Act to amend the Machinery Act 1950 [amendment (Ibid., 8 July)  ",30
MOROCCO MOROCCO ),,"concerning: 1. definition of terms: ""boiler"",  ",30
MOROCCO MOROCCO ),,"""crane"", ""lift""; 2. exemptions from the Act]. 19 June An Act to amend the National Insurance Act  ",30
MOROCCO MOROCCO ),,"No. 128. Machinery Amendment Act 1970. (No. 12) of 17 June 1966+ [repeals the Sickness  Insurance Act (No. 2) of 2 May 19562, the Act  2 Dec. An Act to amend the Shipping and Seamen Act 1952 (No. 5) of 15 Mar. 19572 to supplement the said  ",30
MOROCCO MOROCCO ),,"[inter alia, amendments respecting restriction on Sickness Insurance Act and the Unemployment  ",30
MOROCCO MOROCCO ),,employment of aliens; crew accommodation; labour Insurance Act (No. 4) of 28 May 19594]. No. 67.  ,30
MOROCCO MOROCCO ),,"discipline; safety]. No. 141. Shipping and (Ibid., 3 Aug.)  ",30
MOROCCO MOROCCO ),,"Seamen Amendment Act (No. 2) 1970.  19 June An Act to amend [ss. 1, 4, 12, 14 and 29 to 42]  3 Dec. An Act to amend [Part I, s. 36 and Schedules the Act (No. 9) of 27 June 1947° respecting  ",30
MOROCCO MOROCCO ),,{family benefits) and Part II (medical and measures to promote employment. No. 70.  ,30
MOROCCO MOROCCO ),,hospital benefits and other rglated benefits) of} (Ibid. ) Nor. 2  ,30
MOROCCO MOROCCO ),,the Social Security Act 1964. No. 149.  ,30
MOROCCO MOROCCO ),,"Social Security Amendment Act (No. 2) 1970. 23 June Provisions respecting the application of the Act  (No. 80) of 19 Dec. 1969 to grant additional  compensation to persons entitled to benefit under  the National Insurance Act [(No. 12) of 17 June  NIGER 19661}. (Ibid., 4 Aug.)  8 Sep. Order No. 41 MTP/T/MU, to prescribe the safety and 25 Sep. Provisions respecting allowances for heads of  ",30
MOROCCO MOROCCO ),,"health rules applicable in quarries and open mines families. (Ibid., 23 Oct.)  ",30
MOROCCO MOROCCO ),,"and work sites attached thereto. (""Journal  ",30
MOROCCO MOROCCO ),,"Officiel"", 15 Sep.) 20 Nov. Provisions respecting the benefits granted under  Ch. 4 of the_National Insurance Act (No. 12) of  17 June 19661 to seafarers voyaging to other  countries. (Ibid., 15 Dec.)  NORWAY  27 Nov. An Act to amend [ss. 3, 6, 7, 11 and 16 of]  20 Mar... Decision to amend the rules respecting the unem- the National Insurance Act (No. 12) of 17 June  ",30
MOROCCO MOROCCO ),,"ployment insurance of seafarers sailing to foreign 1966. No. 79. (Ibid., 28 Dec.) Nor. 1  ",30
MOROCCO MOROCCO ),,"ports. (""Norsk Lovtidend"", 22 Apr.)  4 Dec. Provisions fixing the conditions required of  9 Apr. Provisions respecting the grant of an extra family persons over 65 years for entitlement to unemploy-  ",30
MOROCCO MOROCCO ),,allowance for one child more than the number of ment allowances [under s. 4 (2) 1 (a) and (c) of  ,30
MOROCCO MOROCCO ),,"children in the family [in special cases: legal the National Insurance Act+]. (Ibid., 29 Dec.)  ",30
MOROCCO MOROCCO ),,"separation, disappearance, imprisonment, sickness,  ",30
MOROCCO MOROCCO ),,ete. Under the Family Allowances Act of 24 Oct. 11 Dec. Provision to the effect that certain occupational  ,30
MOROCCO MOROCCO ),,"1946]. (Ibid., 29 Apr.) diseases due to climate and epidemic diseases are  to be considered as employment injuries [under  17 Apr. An Act respecting the right to employees! s. 11 (4) of, the National Insurance Act of  ",30
MOROCCO MOROCCO ),,"inventions, No. 21. (Ibid., 20 May) Nor. 3 17 pune 1966 (list of these diseases) ]. (Ibid.,  —__ 30 Dec.  1 ts $954 - N.Z. 1 (extracts) ... 1968 - N.Z. 3. 2 -s 1964 - 1  N.Z. l. LS 1946 - Nor. 7. LS 1966 - Nor. 3, «++ 1970 - Nor, 1 (consolidated text).  2 59 1956 - Nor. 1, 1958 - Nor. 1 A. 7% LS 1958 - Nor. 1 B.  4 48 1959 ~ Nor. 1. 5 LS 1947 - Nor. 2, 1968 - Nor. 2 (consolidated text).  - 72 - - 73-  ",30
