country,region,text,date,year,page,extracted_date,full_text
FINLAND,,"21 Oct. An Ordinance to amend the Ordinance [of 23 Mar. 1934 (No. 126)] respecting the administration of the Act respecting unemployment funds entitled to a state grant? [changes title to “ Ordinance respecting national unemployment funds ”, amends s. 5 (report and balance) and inserts new ss. 17C (assistance subsidy for unemployment funds) and 28A (assessment of unemployment insurance contribution where insurance company fails to furnish necessary particulars or where particulars furnished are inadequate or incorrect)}. (Ibid., No. 412)",,,19,,"21 Oct. An Ordinance to amend the Ordinance [of 23 Mar. 1934 (No. 126)] respecting the administration of the Act respecting unemployment funds entitled to a state grant? [changes title to “ Ordinance respecting national unemployment funds ”, amends s. 5 (report and balance) and inserts new ss. 17C (assistance subsidy for unemployment funds) and 28A (assessment of unemployment insurance contribution where insurance company fails to furnish necessary particulars or where particulars furnished are inadequate or incorrect)}. (Ibid., No. 412) "
FINLAND,,"4 Nov. An Act to amend the National Pensions Act. (lbid., No- 466) in",,,19,,"4 Nov. An Act to amend the National Pensions Act. (lbid., No- 466) in. "
FINLAND,,"26 Nov. Ordinance respecting unemployment allowances [under s. 14 of the Act of 20 June respecting unemployment allowances]. (Ibid., No. 449)",,,19,,"26 Nov. Ordinance respecting unemployment allowances [under s. 14 of the Act of 20 June respecting unemployment allowances]. (Ibid., No. 449) "
FINLAND,,"26 Nov. An Ordinance to amend the Employment Ordinance [of 20 June] inserts a new s. 20A (payment of compensation amounts by commune to county council).] (Ibid., No. 450)",,,19,,"26 Nov. An Ordinance to amend the Employment Ordinance [of 20 June] inserts a new s. 20A (payment of compensation amounts by commune to county council).] (Ibid., No. 450) "
FINLAND,,"30 Dec. Act respecting special children’s allowances [allowances for orphans, illegitimate children and disabled children under 16 years of age]. (Ibid., No.’ 538)",,,19,,"30 Dec. Act respecting special children’s allowances [allowances for orphans, illegitimate children and disabled children under 16 years of age]. (Ibid., No.’ 538) "
FINLAND,,"30 Dec. An Ordinance to amend the National Pensions Ordinance of 7 Dec. 1956 (No. 594)] [amends ss. 22, 23, 40 (as amended), 52 ang) inserts a new s. 241A (equalisation fund)]. (Ibid",,,19,,"30 Dec. An Ordinance to amend the National Pensions Ordinance of 7 Dec. 1956 (No. 594)] [amends ss. 22, 23, 40 (as amended), 52 ang) inserts a new s. 241A (equalisation fund)].  (Ibid., "
FRANCE,,"17 Feb. Order respecting the operation of the additional retirement scheme instituted within the social insurance scheme by Decree No. 59-1569 of 31 Dec. 1959. (Journal Officiel de la République Frangaise, 29 Feb.-1 Mar.; errata: ibid., 3 Aug.)",,,19,,"17 Feb. Order respecting the operation of the additional retirement scheme instituted within the social insurance scheme by Decree No. 59-1569 of 31 Dec. 1959. (Journal Officiel de la République Frangaise, 29 Feb.-1 Mar.; errata: ibid., 3 Aug.) "
FRANCE,,"23 Feb. Decree No. 60-178, to amend the Act of 28 Oct. 1943 respecting steam and gas pressure vessels. (Ibid., 28 Feb.)",,,19,,"23 Feb. Decree No. 60-178, to amend the Act of 28 Oct. 1943 respecting steam and gas pressure vessels. (Ibid., 28 Feb.) "
FRANCE,,"29 Feb. Decree No. 60-188, to provide for the application to agricultural occupations of certain provisions of Act No. 59-960 of 31 July 1959 to issue various provisions for the promotion of industrial profi- ciency. (Ibid., 1 Mar.) Fr. 1",,,19,,"29 Feb. Decree No. 60-188, to provide for the application to agricultural occupations of certain provisions of Act No. 59-960 of 31 July 1959 to issue various provisions for the promotion of industrial profi- ciency. (Ibid., 1 Mar.) Fr. 1 "
FRANCE,,"4 Mar. Decree No. 60-219, to amend Decree No. 46-2769 of 27 Nov. 1946 3 respecting the organisation of social security in the mining industry [amends s. 101 (daily allowance)]. (Ibid., 9 Mar.)",,,19,,"4 Mar. Decree No. 60-219, to amend Decree No. 46-2769 of 27 Nov. 1946 3 respecting the organisation of social security in the mining industry [amends s. 101 (daily allowance)]. (Ibid., 9 Mar.) "
FRANCE,,"11 Mar. Decree No. 60-233, to provide for the application of Act No. 59-960 of 31 July 19594 to issue various provisions for the promotion of industrial proficiency (Division V: Miscellaneous Provisions). (Ibid., 16 Mar.)",,,19,,"11 Mar. Decree No. 60-233, to provide for the application of Act No. 59-960 of 31 July 19594 to issue various provisions for the promotion of industrial proficiency (Division V: Miscellaneous Provisions). (Ibid., 16 Mar.) "
FRANCE,,"28 Mar. Decree No. 60-277, to amend the first para. of s. 61 (attachment and assignment of remuneration) of Book I of the Labour Code.’ (Ibid., 30 Mar.) iL.S, 1959 (Fin.1). — 2 LS, 1934 (Fin. 3) ... 1960 (Fin. 4). — 8L.S. 1946 (Fr. 14) ... 1950 (Fr. 8). — 4 L.S. 1959 (Fr. 4). — 5 L.S. 1930 (Fr. 15), 1949 (Fr. 2 E). 2% —",,,19,,"28 Mar. Decree No. 60-277, to amend the first para. of s. 61 (attachment and assignment of remuneration) of Book I of the Labour Code.’ (Ibid., 30 Mar.) iL.S, 1959 (Fin.1). — 2 LS, 1934 (Fin. 3) ... 1960 (Fin. 4). — 8L.S. 1946 (Fr. 14) ... 1950 (Fr. 8). — 4 L.S. 1959 (Fr. 4). — 5 L.S. 1930 (Fr. 15), 1949 (Fr. 2 E). 2% — "
FRANCE,,"28 Mar. Order to extend a codicil to the national collective agreement for persons employed in the printing trades [annex contains general rules for the vocational training and apprenticeship of persons in the printing trades]. (Ibid., 14 Apr.)",,,20,,"28 Mar. Order to extend a codicil to the national collective agreement for persons employed in the printing trades [annex contains general rules for the vocational training and apprenticeship of persons in the printing trades]. (Ibid., 14 Apr.) "
FRANCE,,"8 Apr. Decree No. 60-332, to establish a committee of inquiry into the problems of old age. (Ibid., 9 Apr.)",,,20,,"8 Apr. Decree No. 60-332, to establish a committee of inquiry into the problems of old age. (Ibid., 9 Apr.) , "
FRANCE,,"8 Apr. Decree No. 60-338, to amend certain provisions of Decrees Nos. 54-1212 of 6 Dec. 1954 and 55-874 of 30 June 1955 respecting the vocational rehabilitation and resettlement of workers. (Ibid.)",,,20,,"8 Apr. Decree No. 60-338, to amend certain provisions of Decrees Nos. 54-1212 of 6 Dec. 1954 and 55-874 of 30 June 1955 respecting the vocational rehabilitation and resettlement of workers. (Ibid.) "
FRANCE,,"2 May Decree No. 60-439, respecting the supervision of agricultural co-operative societies and the unions and federations of such societies [under Decree No. 59-286 of 4 Feb, 1959]. (Ibid., 8 May)",,,20,,"2 May Decree No. 60-439, respecting the supervision of agricultural co-operative societies and the unions and federations of such societies [under Decree No. 59-286 of 4 Feb, 1959]. (Ibid., 8 May) "
FRANCE,,"114 May Order respecting the adjustment of invalidity pensions, old-age pensions payable under the social insurance scheme and the com- pensation due under the laws governing industrial accidents and occupational diseases [amends, inter alia, the first para. of s. 2 (pensions) of the Act of 16 Mar. 1943 ! to amend the legisla- tion relating to accidents in agricultural employment]. (Ibid., 19 May)",,,20,,"114 May Order respecting the adjustment of invalidity pensions, old-age pensions payable under the social insurance scheme and the com- pensation due under the laws governing industrial accidents and occupational diseases [amends, inter alia, the first para. of s. 2 (pensions) of the Act of 16 Mar. 1943 ! to amend the legisla- tion relating to accidents in agricultural employment]. (Ibid., 19 May) "
FRANCE,,"12 May Decree No. 60-452, respecting the organisation and functioning of the social security scheme [repeals numerous provisions of the Social Security Code]. (Ibid., 13 May; errata: ibid., 9 Mar. 1961}",,,20,,"12 May Decree No. 60-452, respecting the organisation and functioning of the social security scheme [repeals numerous provisions of the Social Security Code]. (Ibid., 13 May; errata: ibid., 9 Mar. 1961} "
FRANCE,,"142 May Decree No. 60-453, respecting the medical supervision of the general social security scheme. (Ibid., 13 May; errata: ibid., 14 May)",,,20,,"142 May Decree No. 60-453, respecting the medical supervision of the general social security scheme. (Ibid., 13 May; errata: ibid., 14 May) "
FRANCE,,"24 June Decree No. 60-606, to amend s. 3 of Ordinance No. 45-280 of 22 Feb. 1945, to institute works committees, in the matter of the choice of an accountant to assist the works committee. (Ibid., 29 June)",,,20,,"24 June Decree No. 60-606, to amend s. 3 of Ordinance No. 45-280 of 22 Feb. 1945, to institute works committees, in the matter of the choice of an accountant to assist the works committee. (Ibid., 29 June) "
FRANCE,,"27 June Order to fix the amount of the contributions payable under the family allowance scheme by employers and self-employed persons under Decree No. 46-1378 of 8 June 1946 to organise the social security scheme; repeals the Order of 28 Dec. 1956 on the same subject]. (Ibid., 30 June)",,,20,,"27 June Order to fix the amount of the contributions payable under the family allowance scheme by employers and self-employed persons under Decree No. 46-1378 of 8 June 1946 to organise the social security scheme; repeals the Order of 28 Dec. 1956 on the same subject]. (Ibid., 30 June) "
FRANCE,,"4 July Order to apply the provisions relating to training for promotion in agriculture contained in Decree No. 60-188 of 29 Feb. (Ibid., 13 July)",,,20,,"4 July Order to apply the provisions relating to training for promotion in agriculture contained in Decree No. 60-188 of 29 Feb. (Ibid., 13 July) "
FRANCE,,"4 July Decree No. 60-643, respecting the duties, membership and opera- tion of the joint committees instituted by s. 8 of Decree No. 60-451 of 12 May respecting the medical care provided for members of the social insurance scheme [contains model standing orders for departmental joint committees]. (Ibid., 4-5 July)",,,20,,"4 July Decree No. 60-643, respecting the duties, membership and opera- tion of the joint committees instituted by s. 8 of Decree No. 60-451 of 12 May respecting the medical care provided for members of the social insurance scheme [contains model standing orders for departmental joint committees]. (Ibid., 4-5 July) "
FRANCE,,"30 July Act No. 60-774, respecting the old-age insurance and workmen’s compensation schemes in agriculture [amends or supplements ss. 1124, 1125 and 1214 of the Rural Code]. (Ibid., 1-2 Aug.)",,,20,,"30 July Act No. 60-774, respecting the old-age insurance and workmen’s compensation schemes in agriculture [amends or supplements ss. 1124, 1125 and 1214 of the Rural Code]. (Ibid., 1-2 Aug.) "
FRANCE,,"2 Aug. Act No. 60-791, respecting technical and vocational training in agriculture. (Ibid., 4 Aug.) Fr. 2",,,20,,"2 Aug. Act No. 60-791, respecting technical and vocational training in agriculture. (Ibid., 4 Aug.) Fr. 2 "
FRANCE,,"3 Aug. Order to prescribe the period of practical experience in agriculture required for entitlement to benefit under the measures for the promotion of occupational proficiency in agriculture[under Decree No. 60-188 to provide for the application to agricultural occupa- 1 LS, 1943 (Fr. 6), 1948 (Fr. 4 B). — 2 L.S. 1945 (Fr. 8 A) ... 1958 (Fr. 2). 27 —",,,20,,"3 Aug. Order to prescribe the period of practical experience in agriculture required for entitlement to benefit under the measures for the promotion of occupational proficiency in agriculture[under Decree No. 60-188 to provide for the application to agricultural occupa- 1 LS, 1943 (Fr. 6), 1948 (Fr. 4 B). — 2 L.S. 1945 (Fr. 8 A) ... 1958 (Fr. 2). 27 — "
FRANCE,,"5 Aug. Act No. 60-808, respecting agricultural policy. (Ibid., 7 Aug.; errata: ibid., 26 Aug.) Fr. 3",,,21,,"5 Aug. Act No. 60-808, respecting agricultural policy. (Ibid., 7 Aug.; errata: ibid., 26 Aug.) Fr. 3 "
FRANCE,,"6 Aug. Decree No. 60-865, to replace certain sections of the Seamen’s Code by regulations. (Ibid., 17 Aug.) Fr. 4A",,,21,,"6 Aug. Decree No. 60-865, to replace certain sections of the Seamen’s Code by regulations. (Ibid., 17 Aug.) Fr. 4A "
FRANCE,,"12 Aug. Decree No. 60-899, to amend ss. 100 to 102 [medical advisers; medical fees; insured persons’ travelling expenses] of Decree No. 50-1225 of 24 Sep. 19502 to issue public administrative regulations respecting social insurance in agriculture. (Ibid., 25 Aug.)",,,21,,"12 Aug. Decree No. 60-899, to amend ss. 100 to 102 [medical advisers; medical fees; insured persons’ travelling expenses] of Decree No. 50-1225 of 24 Sep. 19502 to issue public administrative regulations respecting social insurance in agriculture. (Ibid., 25 Aug.) "
FRANCE,,"16 Aug. Order respecting thermal treatment for persons sustaining indus- trial accidents or contracting occupational diseases [repeals the Orders of 6 July 1959 and 15 Oct. 1959 on the same subject]. (Ibid., 1 Sep.)",,,21,,"16 Aug. Order respecting thermal treatment for persons sustaining indus- trial accidents or contracting occupational diseases [repeals the Orders of 6 July 1959 and 15 Oct. 1959 on the same subject]. (Ibid., 1 Sep.) "
FRANCE,,"9 Sep. Decree No. 60-1008, respecting the payment by the Seamen’s Provident Fund of the medical expenses incurred in connection with treatment at thermal spas [amends s. 30 of the Decree of 17 June 1938, as amended, respecting the reorganisation and unification of the seamen’s insurance system]. (Ibid., 19-20 Sep.)",,,21,,"9 Sep. Decree No. 60-1008, respecting the payment by the Seamen’s Provident Fund of the medical expenses incurred in connection with treatment at thermal spas [amends s. 30 of the Decree of 17 June 1938, as amended, respecting the reorganisation and unification of the seamen’s insurance system]. (Ibid., 19-20 Sep.) "
FRANCE,,"12 Sep. Decree No. 60-993, to amend ss. 288, 304 and 361 of the Social Security Code. (Ibid., 16 Sep.)",,,21,,"12 Sep. Decree No. 60-993, to amend ss. 288, 304 and 361 of the Social Security Code. (Ibid., 16 Sep.) "
FRANCE,,"24 Sep. Decree No. 60-1046, to amend Decree No. 50-1225 of 21 Sep. 1950 ? to issue public administrative regulations respecting social insu- rance in agriculture [amends ss. 15 to 19]. (Ibid., 1 Oct.; errata: ibid., 14 Oct.)",,,21,,"24 Sep. Decree No. 60-1046, to amend Decree No. 50-1225 of 21 Sep. 1950 ? to issue public administrative regulations respecting social insu- rance in agriculture [amends ss. 15 to 19]. (Ibid., 1 Oct.; errata: ibid., 14 Oct.) "
FRANCE,,"1 Oct. Decree No. 60-1081, to amend and supplement the occupational disease schedules to Decree No. 46-2959 of 31 Dec. 1946 * to make regulations under Book IV (prevention of, and compensation for, industrial accidents and occupational diseases) of the Social Security Code [amends Schedules 2 (hydrargyrism), 4 (benzolism), 6 (conditions caused by X-rays or radioactive substances) and 14 (poisoning by dinitrophenol) ; substitutes for Schedule 19 (spiro- chetosis ictero-haemorrhagica) a new Schedule (leptospirosis) ; adds a new Schedule 41 (conditions caused by penicillin)]. (Ibid., 10-41 Oct.)",,,21,,"1 Oct. Decree No. 60-1081, to amend and supplement the occupational disease schedules to Decree No. 46-2959 of 31 Dec. 1946 * to make regulations under Book IV (prevention of, and compensation for, industrial accidents and occupational diseases) of the Social Security Code [amends Schedules 2 (hydrargyrism), 4 (benzolism), 6 (conditions caused by X-rays or radioactive substances) and 14 (poisoning by dinitrophenol) ; substitutes for Schedule 19 (spiro- chetosis ictero-haemorrhagica) a new Schedule (leptospirosis) ; adds a new Schedule 41 (conditions caused by penicillin)]. (Ibid., 10-41 Oct.) "
FRANCE,,"6 Oct. Decree No. 60-1092, to amend Decree No. 57-340 of 15 Mar. 1957 to make rules for the installation and operation of steam and hot-water generators working under pressure. (Ibid., 13 Oct.)",,,21,,"6 Oct. Decree No. 60-1092, to amend Decree No. 57-340 of 15 Mar. 1957 to make rules for the installation and operation of steam and hot-water generators working under pressure. (Ibid., 13 Oct.) "
FRANCE,,"29 Oct. Decree No. 60-1153, to amend as regards jet aircraft Decree No. 51-359 of 23 Mar. 1951 to lay down rules for applying the Act of 21 June 1936 § respecting the hours of work of the flying person- nel of air transport and contracting undertakings [replaces, as regards jet aircraft, ss. 2 to 5 and 7 of Decree No. 51-359]. (Ibid., 30 Oct.)",,,21,,"29 Oct. Decree No. 60-1153, to amend as regards jet aircraft Decree No. 51-359 of 23 Mar. 1951 to lay down rules for applying the Act of 21 June 1936 § respecting the hours of work of the flying person- nel of air transport and contracting undertakings [replaces, as regards jet aircraft, ss. 2 to 5 and 7 of Decree No. 51-359]. (Ibid., 30 Oct.) "
FRANCE,,"2 Nov. Act No. 60-1156, to amend the Act of 13 Dec. 1926 to issue a Seamen’s Code and the Act of 17 Dec, 1926 to issue a disciplinary and penal code for the merchant marine. (Ibid., 3 Nov.; errata: ibid., 4 Nov.) Fr. 4B",,,21,,"2 Nov. Act No. 60-1156, to amend the Act of 13 Dec. 1926 to issue a Seamen’s Code and the Act of 17 Dec, 1926 to issue a disciplinary and penal code for the merchant marine. (Ibid., 3 Nov.; errata: ibid., 4 Nov.) Fr. 4B "
FRANCE,,"7 Nov. Decree No. 60-1193, respecting discipline on board ships in the mercantile marine [under the Act of 17 Dec. 1926%, of which 11.8. 1959 (Fr.4). — 2? LS. 1950 (Fr.5C). — 3 LS. 1938 (Fr.8 A) ... 1952 (Fr.1).— 4 1.8. 1948 (Fr. 4) ... 1955 (Fr. 5). — 5 LS. 1936 (Fr. 8). — 6 LS, 1926",,,21,,"7 Nov. Decree No. 60-1193, respecting discipline on board ships in the mercantile marine [under the Act of 17 Dec. 1926%, of which 11.8. 1959 (Fr.4). — 2? LS. 1950 (Fr.5C). — 3 LS. 1938 (Fr.8 A) ... 1952 (Fr.1).— 4 1.8. 1948 (Fr. 4) ... 1955 (Fr. 5). — 5 LS. 1936 (Fr. 8). — 6 LS, 1926 "
FRANCE,,"Fr. 16), 1939 (Fr. 6 B and C). 28 —",,,21,,"(Fr. 16), 1939 (Fr. 6 B and C). 28 — "
FRANCE,,"27 Dec. Act. No. 60-1434, to co-ordinate the application of Act No. 57-1223 of 23 Nov. 19571 respecting the resettlement of handicapped workers and the Act of 26 Apr. 1924 ?, as amended, to provide for the compulsory employment of disabled ex-servicemen repeals the last para. of s. 10 (civil action) and s. 12 (contracts of employment) of the Act of 26 Apr. 1924 and ss. 10, fourth para. (jobs reserved for particularly handicapped workers), 16 (wages) and 17 (notice of dismissal) of the Act of 23 Nov. 1957]. (Ibid., 28 Dec.)",,,22,,"27 Dec. Act. No. 60-1434, to co-ordinate the application of Act No. 57-1223 of 23 Nov. 19571 respecting the resettlement of handicapped workers and the Act of 26 Apr. 1924 ?, as amended, to provide for the compulsory employment of disabled ex-servicemen repeals the last para. of s. 10 (civil action) and s. 12 (contracts of employment) of the Act of 26 Apr. 1924 and ss. 10, fourth para. (jobs reserved for particularly handicapped workers), 16 (wages) and 17 (notice of dismissal) of the Act of 23 Nov. 1957]. (Ibid., 28 Dec.) "
FRANCE,Algeria,"2 Jan. Order respecting the special health and safety measures to be observed on sites involving work in compressed air. (Recueil des Actes Administratifs, 15 Jan.)",,,22,,"2 Jan. Order respecting the special health and safety measures to be observed on sites involving work in compressed air. (Recueil des Actes Administratifs, 15 Jan.) "
FRANCE,Algeria,"23 Feb. Order to prescribe conditions for the grant of benefit to home- workers, commercial travellers, canvassers, brokers, inspectors and other agents, and to domestic employees [under various ss. of Decision No. 49-045 of the Algerian Assembly, respecting the organisation of a social security system in Algeria; repeals the Order of 30 Nov. 1950 on the same subject]. (Ibid., 15 Mar.)",,,22,,"23 Feb. Order to prescribe conditions for the grant of benefit to home- workers, commercial travellers, canvassers, brokers, inspectors and other agents, and to domestic employees [under various ss. of Decision No. 49-045 of the Algerian Assembly, respecting the organisation of a social security system in Algeria; repeals the Order of 30 Nov. 1950 on the same subject]. (Ibid., 15 Mar.) "
FRANCE,Algeria,"23 Feb. Order to prescribe rules for the application to quarries of the Act of 21 June 1936 4 respecting the 40-hour week. (Ibid., 18 Mar.)",,,22,,"23 Feb. Order to prescribe rules for the application to quarries of the Act of 21 June 1936 4 respecting the 40-hour week. (Ibid., 18 Mar.) "
FRANCE,Algeria,"24 Feb. Order respecting the special safety measures to be observed in establishments where radioactive substances are prepared, handled or employed or where X-rays are used. (Ibid., 15 Mar.)",,,22,,"24 Feb. Order respecting the special safety measures to be observed in establishments where radioactive substances are prepared, handled or employed or where X-rays are used. (Ibid., 15 Mar.) "
FRANCE,Algeria,24 Feb. Order to prescribe the form of the notice concerning the dangers presented by X-rays and the precautions to be taken to avoid them. (Ibid.),,,22,,24 Feb. Order to prescribe the form of the notice concerning the dangers presented by X-rays and the precautions to be taken to avoid them. (Ibid.) 
FRANCE,Algeria,24 Feb. Order to prescribe the form of the notice concerning the dangers presented by radioactive substances and the precautions to be taken to avoid them. (Ibid.),,,22,,24 Feb. Order to prescribe the form of the notice concerning the dangers presented by radioactive substances and the precautions to be taken to avoid them. (Ibid.) 
FRANCE,Algeria,"7 Mar. Decree No. 60-222, respecting the sources of income of the joint funds for industrial accidents sustained in Algeria [repeals s. 3 of the Act of 30 Dec. 1922 to amend the amount of the sums levied towards the guarantee fund instituted by the Act of 9 Apr. 1898 respecting the compensation payable for industrial accidents and s. 3 of Decree No. 55-1388 of 18 Oct. 1955 respecting the prevention of, and compensation for, employment injuries (which amended Act No. 46-2426 of 30 Oct. 1946 5]. (Journal Officiel de la République Frangatse, 11 Mar.; Recueil des Actes Administratifs, 29 Mar.)",,,22,,"7 Mar. Decree No. 60-222, respecting the sources of income of the joint funds for industrial accidents sustained in Algeria [repeals s. 3 of the Act of 30 Dec. 1922 to amend the amount of the sums levied towards the guarantee fund instituted by the Act of 9 Apr. 1898 respecting the compensation payable for industrial accidents and s. 3 of Decree No. 55-1388 of 18 Oct. 1955 respecting the prevention of, and compensation for, employment injuries (which amended Act No. 46-2426 of 30 Oct. 1946 5]. (Journal Officiel de la République Frangatse, 11 Mar.; Recueil des Actes Administratifs, 29 Mar.) "
FRANCE,Algeria,"9 July | Order to amend the Order of 26 Sep. 1957 respecting the applica- tion of the sickness insurance scheme to agriculture {repeals and replaces s. 4 (c) (grant of benefit where the insured person does not fulfil the condition of six months’ registration)]. (Ibid., 15 July)",,,22,,"9 July | Order to amend the Order of 26 Sep. 1957 respecting the applica- tion of the sickness insurance scheme to agriculture {repeals and replaces s. 4 (c) (grant of benefit where the insured person does not fulfil the condition of six months’ registration)]. (Ibid., 15 July) "
FRANCE,Algeria,"9 July Order to amend the Order of 26 Sep. 1957 respecting the applica- tion of the survivors’ insurance scheme to agriculture [amends, unter alia, ss. 7, 8,13 and 14, inserts a new s. 17b1s and repeals s. 20]. (Ibid.) 11.8. 1957 (Fr. 3). — 2 L.S. 1924 (Fr.1). — 3 LS. 1949 (Fr. 4)... 1959 (Alg. 4). LS. 1936 (Fr. 8). — 5 L.S. 1946 (Fr. 12). 29 —",,,22,,"9 July Order to amend the Order of 26 Sep. 1957 respecting the applica- tion of the survivors’ insurance scheme to agriculture [amends, unter alia, ss. 7, 8,13 and 14, inserts a new s. 17b1s and repeals s. 20]. (Ibid.) 11.8. 1957 (Fr. 3). — 2 L.S. 1924 (Fr.1). — 3 LS. 1949 (Fr. 4)... 1959 (Alg. 4). LS. 1936 (Fr. 8). — 5 L.S. 1946 (Fr. 12). 29 — "
FRANCE,Algeria,9 July Order to amend the Order of 26 Sep. 1957 respecting the applica- tion of the sickness insurance scheme to agriculture. (Ibid.),,,23,,9 July Order to amend the Order of 26 Sep. 1957 respecting the applica- tion of the sickness insurance scheme to agriculture. (Ibid.) 
FRANCE,Algeria,9 July Order to amend the Order of 26 Sep. 1957 respecting the applica- tion of the maternity insurance scheme to agriculture. (Ibid.),,,23,,9 July Order to amend the Order of 26 Sep. 1957 respecting the applica- tion of the maternity insurance scheme to agriculture. (Ibid.) 
FRANCE,Algeria,9 July | Order to amend the Order of 26 Sep. 1957 respecting the applica- tion of the invalidity insurance scheme to agriculture [amends ss. 4 to 6 and 17]. (Ibid.),,,23,,9 July | Order to amend the Order of 26 Sep. 1957 respecting the applica- tion of the invalidity insurance scheme to agriculture [amends ss. 4 to 6 and 17]. (Ibid.) 
FRANCE,Algeria,"9 July Order to amend the Order of 17 Mar. 1958 to provide for the application of the old-age insurance scheme to agriculture [amends ss. 4, 7 and 25]. (Ibid.)",,,23,,"9 July Order to amend the Order of 17 Mar. 1958 to provide for the application of the old-age insurance scheme to agriculture [amends ss. 4, 7 and 25]. (Ibid.) "
