country,region,text,date,year,page,extracted_date,full_text
INDIA,Mysore,"2 Feb. An Act to consolidate and amend the law relating to the pre- vention of employment of women in factories, plantations and other establishments for some time before and some time after confinement and to provide for payment of maternity benefit and medical benefit to them. Mysore Act No. 4. Mysore Maternity Benefit Act 1959. (Ibid., 18 Feb., Part ITV, Sec. 2-B) Ind. 1",,,31,,"2 Feb. An Act to consolidate and amend the law relating to the pre- vention of employment of women in factories, plantations and other establishments for some time before and some time after confinement and to provide for payment of maternity benefit and medical benefit to them. Mysore Act No. 4. Mysore Maternity Benefit Act 1959. (Ibid., 18 Feb., Part ITV, Sec. 2-B) Ind. 1 "
INDIA,Rajasthan,"25 Aug. Notification to amend the Rajasthan Industrial Disputes Rules 1988 (retrenehment/lay-of compensation]. (Rajasthan Gazette, 8 Sep. 1 LS. 1946 (Ind. 4, consolidation), 1947 (Ind. 4). — 2 L.S. 1936 (Ind.1). — 3 L.S. 1947",,,31,,"25 Aug. Notification to amend the Rajasthan Industrial Disputes Rules 1988 (retrenehment/lay-of compensation]. (Rajasthan Gazette, 8 Sep. 1 LS. 1946 (Ind. 4, consolidation), 1947 (Ind. 4). — 2 L.S. 1936 (Ind.1). — 3 L.S. 1947 "
INDIA,Rajasthan,Ind. 1)... 1954 (Ind. 1). 3g —,,,31,,(Ind. 1)... 1954 (Ind. 1). 3g — 
INDIA,West Bengal,"11 June The West Bengal Payment of Wages (Procedure) Rules 1960 supersede the Bengal Payment of Wages (Procedure) Rules 1940]. (Calcutta Gazette, 30 June, Part I)",,,32,,"11 June The West Bengal Payment of Wages (Procedure) Rules 1960 supersede the Bengal Payment of Wages (Procedure) Rules 1940]. (Calcutta Gazette, 30 June, Part I) "
INDIA,West Bengal,"15 Feb. Regulations respecting labour unions, federations and confedera- tions. (Rouznameh Rasmi Kechvar Chahanchi Iran, 3 Apr.)",,,32,,"15 Feb. Regulations respecting labour unions, federations and confedera- tions. (Rouznameh Rasmi Kechvar Chahanchi Iran, 3 Apr.) "
INDIA,West Bengal,9 May Regulations respecting the conditions of work of aliens in Iran,,,32,,9 May Regulations respecting the conditions of work of aliens in Iran. 
INDIA,West Bengal,11 May Act respecting social insurance for workers. Iran 1 Regulations respecting the procedure to be followed in matters of inspection and to prescribe the powers and duties of labour inspectors [under s. 52 of the Labour Act 2),,,32,,11 May Act respecting social insurance for workers. Iran 1 Regulations respecting the procedure to be followed in matters of inspection and to prescribe the powers and duties of labour inspectors [under s. 52 of the Labour Act 2). 
INDIA,West Bengal,10 Nov. Regulations respecting private employment agencies [under s. 65 of the Labour Act ?],,,32,,10 Nov. Regulations respecting private employment agencies [under s. 65 of the Labour Act ?]. 
INDIA,West Bengal,"16 Aug. Regulations No. 39, respecting the disability pension fund. (Al- Wagayi’u al-Iragiya, 24 Aug.)",,,32,,"16 Aug. Regulations No. 39, respecting the disability pension fund. (Al- Wagayi’u al-Iragiya, 24 Aug.) "
INDIA,West Bengal,"21 Aug. Regulations No. 40, respecting social security employment [under s. 2 {insurable employment) of the Social Security Law, No. 27 of 19562]. (Ibid., 28 Aug.)",,,32,,"21 Aug. Regulations No. 40, respecting social security employment [under s. 2 {insurable employment) of the Social Security Law, No. 27 of 19562]. (Ibid., 28 Aug.) "
INDIA,West Bengal,"20 Sep. Regulations No. 43, to amend Regulations No. 48 of 19598 respecting the organisation of the Ministry of Social Affairs [inter alia, insert new ss. 3 (6) and 12 (Directorate of Social Affairs in the Liwas)]. (Ibid., 26 Sep.)",,,32,,"20 Sep. Regulations No. 43, to amend Regulations No. 48 of 19598 respecting the organisation of the Ministry of Social Affairs [inter alia, insert new ss. 3 (6) and 12 (Directorate of Social Affairs in the Liwas)]. (Ibid., 26 Sep.) "
INDIA,West Bengal,"19 Oct. Regulations No. 46, to amend the Social Security Employment Regulations No. 40 [amend s. 1 (4) and add a new s. 4; repeal the Social Security Employment Regulations, No. 62 of 1956]. (Ibid., 29 Oct.)",,,32,,"19 Oct. Regulations No. 46, to amend the Social Security Employment Regulations No. 40 [amend s. 1 (4) and add a new s. 4; repeal the Social Security Employment Regulations, No. 62 of 1956]. (Ibid., 29 Oct.) . "
IRELAND,,"2 Mar. Social Welfare (Treatment Benefit) (Amendment) Regulations 1960 [amend the Social Welfare (Treatment Benefit) Regulations 1954 (reduction of number of employment contributions required up to date of claim in case of young insured persons under 21 years)]. (Statutory Instruments, No. 43)",,,32,,"2 Mar. Social Welfare (Treatment Benefit) (Amendment) Regulations 1960 [amend the Social Welfare (Treatment Benefit) Regulations 1954 (reduction of number of employment contributions required up to date of claim in case of young insured persons under 21 years)]. (Statutory Instruments, No. 43) "
IRELAND,,"16 June Social Welfare (Treatment Benefit) (Amendment) (No. 2) Regula- tions 1960 [amend the Social Welfare (Treatment Benefit) Regula- tions 1954 (crediting of insurance and contributions outside the State)]. (Ibid., No. 126)",,,32,,"16 June Social Welfare (Treatment Benefit) (Amendment) (No. 2) Regula- tions 1960 [amend the Social Welfare (Treatment Benefit) Regula- tions 1954 (crediting of insurance and contributions outside the State)]. (Ibid., No. 126) "
IRELAND,,26 July An Act to amend and extend the Social Welfare Acts 1952 to 1958 and the Old-Age Pensions Acts 1908 to 1959. No. 25. Social Welfare (Amendment) Act 1960. Ire. 1 A,,,32,,26 July An Act to amend and extend the Social Welfare Acts 1952 to 1958 and the Old-Age Pensions Acts 1908 to 1959. No. 25. Social Welfare (Amendment) Act 1960. Ire. 1 A 
IRELAND,,"27 July An Act to amend and extend the Old-Age Pensions Acts 1908 to 1960*, the Unemployment Assistance Acts 1933 to 19595, the Widows’ and Orphans’ Pensions Acts 1935 to 1959 ® and the Social Welfare Acts 1952 to 1960 ’ [miscellaneous amendments (changes of rates, notifications, procedure, etc.)]. No. 28. Social Welfare (Miscellaneous Provisions) Act 1960. 1 L.S. 1959 (Iran 1). — 2? L.S. 1956 (Iraqi). — 3 L.S. 1959 (Iraq 1). — *# L.S. 1924 (I.F.S. 3)... 1960 (Ire.4), — 5 LS. 1952 (Ire. 1), — 6 L.S. 1935 (1.F.S.1) ... 1952",,,32,,"27 July An Act to amend and extend the Old-Age Pensions Acts 1908 to 1960*, the Unemployment Assistance Acts 1933 to 19595, the Widows’ and Orphans’ Pensions Acts 1935 to 1959 ® and the Social Welfare Acts 1952 to 1960 ’ [miscellaneous amendments (changes of rates, notifications, procedure, etc.)]. No. 28. Social Welfare (Miscellaneous Provisions) Act 1960. 1 L.S. 1959 (Iran 1). — 2? L.S. 1956 (Iraqi). — 3 L.S. 1959 (Iraq 1). — *# L.S. 1924 (I.F.S. 3)... 1960 (Ire.4), — 5 LS. 1952 (Ire. 1), — 6 L.S. 1935 (1.F.S.1) ... 1952 "
IRELAND,,"Ire. 1). — 7 L.S. 1952 (Ire. 1), 1960 (Ire. 1). 39 —",,,32,,"(Ire. 1). — 7 L.S. 1952 (Ire. 1), 1960 (Ire. 1). 39 — "
IRELAND,,"31 Dec. Docks (Safety, Health and Welfare) Regulations 1960 [repeal the Dock Regulations 19281]. (Ibid., No. 279)",,,33,,"31 Dec. Docks (Safety, Health and Welfare) Regulations 1960 [repeal the Dock Regulations 19281]. (Ibid., No. 279) "
ITALY,,"3 Jan. Act No. 5, to reduce the age limit for retirement in the case of workers employed in mines, quarries and peat-bogs [inter alia, reduces the age prescribed by Act No. 218 of 4 Apr. 1952 to 55]. (Gazzetta Ufficiale, 2 Feb.)",,,33,,"3 Jan. Act No. 5, to reduce the age limit for retirement in the case of workers employed in mines, quarries and peat-bogs [inter alia, reduces the age prescribed by Act No. 218 of 4 Apr. 1952 to 55]. (Gazzetta Ufficiale, 2 Feb.) "
ITALY,,"14 July Decree No. 1010 of the President of the Republic, to regulate the remuneration and conditions of work of managers and salaried employees working for agricultural and forestry undertakings gives force of law to the collective agreement, as supplemented, concluded for managerial staff on 6 Apr. 1957 and to s. 6 of the collective agreement concluded for salaried employees on 21 Oct. 1958; texts in annex]. (Ibid., 29 Sep., Supplement)",,,33,,"14 July Decree No. 1010 of the President of the Republic, to regulate the remuneration and conditions of work of managers and salaried employees working for agricultural and forestry undertakings gives force of law to the collective agreement, as supplemented, concluded for managerial staff on 6 Apr. 1957 and to s. 6 of the collective agreement concluded for salaried employees on 21 Oct. 1958; texts in annex]. (Ibid., 29 Sep., Supplement) "
ITALY,,"14 July Decree No. 1011 of the President of the Republic, to regulate the dismissal procedure for individual workers employed in industrial undertakings [gives force of law to the inter-union agreement of 18 Oct. 1950; text in annex]. (Ibid.)",,,33,,"14 July Decree No. 1011 of the President of the Republic, to regulate the dismissal procedure for individual workers employed in industrial undertakings [gives force of law to the inter-union agreement of 18 Oct. 1950; text in annex]. (Ibid.) "
ITALY,,"14 July Decree No. 1018 of the President of the Republic, to regulate the remuneration and conditions of work of agricultural labourers gives force of law to the collective agreement of 15 Feb. 1957; text in annex]. (Ibid., 30 Sep., Supplement)",,,33,,"14 July Decree No. 1018 of the President of the Republic, to regulate the remuneration and conditions of work of agricultural labourers gives force of law to the collective agreement of 15 Feb. 1957; text in annex]. (Ibid., 30 Sep., Supplement) "
ITALY,,"14 July Decree No. 1019 of the President of the Republic, to regulate the dismissal procedure to be followed in the reduction of staff in industrial undertakings [gives force of law to the inter-union agreement of 20 Dec. 1950; text in annex]. (Ibid.)",,,33,,"14 July Decree No. 1019 of the President of the Republic, to regulate the dismissal procedure to be followed in the reduction of staff in industrial undertakings [gives force of law to the inter-union agreement of 20 Dec. 1950; text in annex]. (Ibid.) "
ITALY,,"14 July Decree No. 1032 of the President of the Republic, to regulate the remuneration and conditions of work of wage and salary rners employed in the building and related industries [gives force of law to the collective agreement of 14 Nov. 1947, which established technical committees for the determination of salaried- employee status, to s. 8 of the collective agreement concluded for salaried employees on 31 Jan. 1952, to s. 53 of the collective agreement concluded for wage earners on 18 Dec. 1954 and to the collective agreements concluded for wage earners on 24 July 1959 and for salaried employees on 1 Aug. 1959; texts in annex]. (Ibid., 4 Oct., Supplement)",,,33,,"14 July Decree No. 1032 of the President of the Republic, to regulate the remuneration and conditions of work of wage and salary rners employed in the building and related industries [gives force of law to the collective agreement of 14 Nov. 1947, which established technical committees for the determination of salaried- employee status, to s. 8 of the collective agreement concluded for salaried employees on 31 Jan. 1952, to s. 53 of the collective agreement concluded for wage earners on 18 Dec. 1954 and to the collective agreements concluded for wage earners on 24 July 1959 and for salaried employees on 1 Aug. 1959; texts in annex]. (Ibid., 4 Oct., Supplement) "
ITALY,,"14 July Decree No. 1045 of the President of the Republic, to regulate the remuneration and conditions of work of persons employed in the timber and cork industries [gives force of law to the collec- tive agreement concluded for wage earners on 19 June 1959 and to the collective agreement concluded for salaried employees and persons in special categories on 21 July 1959; texts in annex]. (Ibid., 6 Oct., Supplement)",,,33,,"14 July Decree No. 1045 of the President of the Republic, to regulate the remuneration and conditions of work of persons employed in the timber and cork industries [gives force of law to the collec- tive agreement concluded for wage earners on 19 June 1959 and to the collective agreement concluded for salaried employees and persons in special categories on 21 July 1959; texts in annex]. (Ibid., 6 Oct., Supplement) "
ITALY,,"21 July Decree No. 1169 of the President of the Republic, to approve rules under Act No. 455 of 12 Apr. 19432 respecting compulsory insurance against silicosis and asbestosis, as amended by Decree No. 648 of 20 Mar. 1956.3 (Ibid., 26 Oct.)",,,33,,"21 July Decree No. 1169 of the President of the Republic, to approve rules under Act No. 455 of 12 Apr. 19432 respecting compulsory insurance against silicosis and asbestosis, as amended by Decree No. 648 of 20 Mar. 1956.3 (Ibid., 26 Oct.) "
ITALY,,"28 July Decree No. 1070 of the President of the Republic, to regulate the remuneration of workers employed in industrial undertakings gives force of law to the inter-union agreement of 27 Oct. 1946 1 LS. 1928 (1.F.S.1). — 2 LS. 1943 (It. 3). — 8 L.S. 1956 (It. 2)",,,33,,"28 July Decree No. 1070 of the President of the Republic, to regulate the remuneration of workers employed in industrial undertakings gives force of law to the inter-union agreement of 27 Oct. 1946 1 LS. 1928 (1.F.S.1). — 2 LS. 1943 (It. 3). — 8 L.S. 1956 (It. 2). "
ITALY,,"26 Aug. Decree No. 1035 of the President of the Republic, to amend Schedules I and III to the Ministerial Decree of 22 June 1935 to indicate the occupations in which a roster system of weekly rests is permitted [under s. 5 of Act No. 370 of 22 Feb. 19341 respecting the Sunday and weekly rest)]. (Ibid., 5 Oct.)",,,34,,"26 Aug. Decree No. 1035 of the President of the Republic, to amend Schedules I and III to the Ministerial Decree of 22 June 1935 to indicate the occupations in which a roster system of weekly rests is permitted [under s. 5 of Act No. 370 of 22 Feb. 19341 respecting the Sunday and weekly rest)]. (Ibid., 5 Oct.) "
ITALY,,"28 Aug. Decree No. 1333 of the President of the Republic, to regulate the remuneration and conditions of work of members of the crew of passenger vessels of over 50 gross register tons [gives force of law to the national collective agreement of 23 July 1959; text in annex]. (Ibid., 19 Nov., Supplement)",,,34,,"28 Aug. Decree No. 1333 of the President of the Republic, to regulate the remuneration and conditions of work of members of the crew of passenger vessels of over 50 gross register tons [gives force of law to the national collective agreement of 23 July 1959; text in annex]. (Ibid., 19 Nov., Supplement) "
ITALY,,"4 Oct. Act No. 1027, to amend Act No. 741 of 14 July 1959 % to issue transitional provisions to guarantee that workers enjoy certain minimum standards in matters of remuneration and conditions of work [extends the time limit for the application of ss. 1 (agree- ments) and 6 {issue of statutory provisions)]. (Ibid., 3 Oct.)",,,34,,"4 Oct. Act No. 1027, to amend Act No. 741 of 14 July 1959 % to issue transitional provisions to guarantee that workers enjoy certain minimum standards in matters of remuneration and conditions of work [extends the time limit for the application of ss. 1 (agree- ments) and 6 {issue of statutory provisions)]. (Ibid., 3 Oct.) "
ITALY,,"23 Oct. Act No. 1369, to prohibit subcontractors or intermediaries and the intervention of third parties in the performance of work, and to make new rules respecting the employment of manpower when work or services are allocated or given out. ([bid., 25 Nov.)",,,34,,"23 Oct. Act No. 1369, to prohibit subcontractors or intermediaries and the intervention of third parties in the performance of work, and to make new rules respecting the employment of manpower when work or services are allocated or given out. ([bid., 25 Nov.) "
ITALY,,"48 Dec. Act No. 1561, to make rules for the payment of compensation for length of service to salaried employees in the private sector the dismissal compensation provided for in s. 10 of the Legislative Decree of 13 Nov. 1924 3 respecting the contract of employment of salaried employees must be equal to at least as many months’ pay as the person concerned has completed years of service]. (Ibid., 29 Dec.)",,,34,,"48 Dec. Act No. 1561, to make rules for the payment of compensation for length of service to salaried employees in the private sector the dismissal compensation provided for in s. 10 of the Legislative Decree of 13 Nov. 1924 3 respecting the contract of employment of salaried employees must be equal to at least as many months’ pay as the person concerned has completed years of service]. (Ibid., 29 Dec.) "
ITALY,Sicily,"30 Dec. Act No. 48, to make provision for the social protection of workers and for the development of co-operation. (Ibid., 24 Mar. 1961, Supplement)",,,34,,"30 Dec. Act No. 48, to make provision for the social protection of workers and for the development of co-operation. (Ibid., 24 Mar. 1961, Supplement) "
ITALY,Sicily,"IVORY COAST (for legislation before 3 Nov., see p. 30)",,,34,,"IVORY COAST (for legislation before 3 Nov., see p. 30) "
ITALY,Sicily,"3 Nov. Act No. 60-356, to promulgate the Constitution of the Republic of the Ivory Coast. (Journal Offictel de la République de Céte d’Ivoire, & Nov., Extraordinary)",,,34,,"3 Nov. Act No. 60-356, to promulgate the Constitution of the Republic of the Ivory Coast. (Journal Offictel de la République de Céte d’Ivoire, & Nov., Extraordinary) "
ITALY,Sicily,"9 Dec. Decree No. 60-425, to establish a social training school and to issue rules for the said school [repeals all earlier provisions]. (Ibid., 24 Dec.)",,,34,,"9 Dec. Decree No. 60-425, to establish a social training school and to issue rules for the said school [repeals all earlier provisions]. (Ibid., 24 Dec.) "
JAPAN,,"31 Mar. Law No. 18, partially to amend the Unemployment Insurance Law ‘ and the Employment Security Law.5 (HKampoo, 31 Mar., Extraordinary No. 24)",,,34,,"31 Mar. Law No. 18, partially to amend the Unemployment Insurance Law ‘ and the Employment Security Law.5 (HKampoo, 31 Mar., Extraordinary No. 24) "
JAPAN,,"31 Mar. Law No. 29, to amend the Workmen’ s Accident Compensation Insurance Law ® [repeals the Silicosis and Traumatic Spinal Cord Impediment (Special Protection) Law 1955 and the Silicosis (Temporary Measures) Law 1958]. (Ibid., Extraordinary No. 25) 1L.S. 1934 (It. 3). — 2 L.S. 1959 (It. 3). — 3 L.S, 1924 (It. 3). — 4 L.S. 1947 (Jap. 1B)... 1950 (Jap. 41). — 5 L.S.1947 (Jap. 4), 1949 (Jap. 2). — 9 L.S. 1947 (Jap. 6). 41 —",,,34,,"31 Mar. Law No. 29, to amend the Workmen’ s Accident Compensation Insurance Law ® [repeals the Silicosis and Traumatic Spinal Cord Impediment (Special Protection) Law 1955 and the Silicosis (Temporary Measures) Law 1958]. (Ibid., Extraordinary No. 25) 1L.S. 1934 (It. 3). — 2 L.S. 1959 (It. 3). — 3 L.S, 1924 (It. 3). — 4 L.S. 1947 (Jap. 1B)... 1950 (Jap. 41). — 5 L.S.1947 (Jap. 4), 1949 (Jap. 2). — 9 L.S. 1947 (Jap. 6). 41 — "
JAPAN,,31 Mar. Law No. 30: Pneumoconiosis Law. (Ibid.) Jap. 1,,,35,,31 Mar. Law No. 30: Pneumoconiosis Law. (Ibid.) Jap. 1 
JAPAN,,"381 Mar. Ordinance No. 6 of the Ministry of Labour, made under the Pneumoconiosis Law [No. 30 of 31 Mar.] [list of different types of operations involving exposure to dust)",,,35,,"381 Mar. Ordinance No. 6 of the Ministry of Labour, made under the Pneumoconiosis Law [No. 30 of 31 Mar.] [list of different types of operations involving exposure to dust). "
JAPAN,,"25 July Law No 123: Physically Handicapped Persons (Promotion of Employment) Law. (Ibid., 25 July) Jap. 2",,,35,,"25 July Law No 123: Physically Handicapped Persons (Promotion of Employment) Law. (Ibid., 25 July) Jap. 2 "
JORDAN,,"14 May Law No 21 of 1960, to promulgate the Labour Code. (Al-Jarida al-Rasmiya, 21 May) Jor. 1",,,35,,"14 May Law No 21 of 1960, to promulgate the Labour Code. (Al-Jarida al-Rasmiya, 21 May) Jor. 1 "
LEBANON,,"23 Jan. Decree No. 3127, to organise a social development service. (Al- Jarida al-Rasmiya, 27 Jan.)",,,35,,"23 Jan. Decree No. 3127, to organise a social development service. (Al- Jarida al-Rasmiya, 27 Jan.) "
LEBANON,,"23 Dec. Decree No. 5768, to organise a Directorate of Vocational and Further Training. (Ibid., 28 Dec.)",,,35,,"23 Dec. Decree No. 5768, to organise a Directorate of Vocational and Further Training. (Ibid., 28 Dec.) "
LIBERIA,,"7 Apr. An Act to amend and make changes in the Liberian Maritime Law [of 1956]. (Acts Passed by the Legislature of the Republic of Liberia, 1959-60, p. 55)",,,35,,"7 Apr. An Act to amend and make changes in the Liberian Maritime Law [of 1956]. (Acts Passed by the Legislature of the Republic of Liberia, 1959-60, p. 55) "
LIBYA,,"46 Mar. Ordinance to provide for the registration of trade unions made under the Labour Code.1 No. 2. (Edj-djeridat er-resmiyat lil- memlekat al-libiyyat al-mattahidat, p. 7)",,,35,,"46 Mar. Ordinance to provide for the registration of trade unions made under the Labour Code.1 No. 2. (Edj-djeridat er-resmiyat lil- memlekat al-libiyyat al-mattahidat, p. 7) "
LIECHTENSTEIN,,"9Sep. Placement Act. (Landes-Gesetzblatt, 25 Oct.) Lie. 1",,,35,,"9Sep. Placement Act. (Landes-Gesetzblatt, 25 Oct.) Lie. 1 "
LIECHTENSTEIN,,"9 Sep. An Act to provide for the sickness and accident insurance of persons employed in agriculture and domestic service, and to amend certain provisions respecting insurance against accidents other than industrial accidents [repeals, inter alia, the Act of 29 Dec. 1939 respecting the interpretation of the Act respecting the prevention of accidents other than industrial accidents and of the Government Ordinance of 34 Mar. 1932]. (Ibid.)",,,35,,"9 Sep. An Act to provide for the sickness and accident insurance of persons employed in agriculture and domestic service, and to amend certain provisions respecting insurance against accidents other than industrial accidents [repeals, inter alia, the Act of 29 Dec. 1939 respecting the interpretation of the Act respecting the prevention of accidents other than industrial accidents and of the Government Ordinance of 34 Mar. 1932]. (Ibid.) "
LUXEMBOURG,,"4 July Ministerial Order to establish an Economic and Social Committee. (Mémorial, 14 July) Lux. 1",,,35,,"4 July Ministerial Order to establish an Economic and Social Committee. (Mémorial, 14 July) Lux. 1 "
LUXEMBOURG,,"30 July An Act to set up a National Solidarity Fund. (Ibid., 6 Aug.) Lux. 2",,,35,,"30 July An Act to set up a National Solidarity Fund. (Ibid., 6 Aug.) Lux. 2 "
LUXEMBOURG,,"20 Aug. Grand-Ducal Order to make regulations under the Act of 30 July to set up a National Solidarity Fund. (Ibid., 20 Aug.)",,,35,,"20 Aug. Grand-Ducal Order to make regulations under the Act of 30 July to set up a National Solidarity Fund. (Ibid., 20 Aug.) "
LUXEMBOURG,,"29 Dec. Grand-Ducal Order to amend and supplement the Grand-Ducal Order of 10 Oct. 1945 to amend the Act of 4 Apr. 1924 ? respecting the establishment of elective trade chambers. (Ibid., 29 Dec.) 1 LS. 4957 (Libya 2). — 2 L.S. 1924 (Lux, 1). 42 —",,,35,,"29 Dec. Grand-Ducal Order to amend and supplement the Grand-Ducal Order of 10 Oct. 1945 to amend the Act of 4 Apr. 1924 ? respecting the establishment of elective trade chambers. (Ibid., 29 Dec.) 1 LS. 4957 (Libya 2). — 2 L.S. 1924 (Lux, 1). 42 — "
LUXEMBOURG,,"MALAGASY REPUBLIC (for legislation before 26 June, see p. 30)",,,36,,"MALAGASY REPUBLIC (for legislation before 26 June, see p. 30) "
LUXEMBOURG,,"1 Oct. Ordinance No. 60-119, to establish a Labour Code. (Journal Officiel de la République Malgache, 8 Oct.) Mad. 1",,,36,,"1 Oct. Ordinance No. 60-119, to establish a Labour Code. (Journal Officiel de la République Malgache, 8 Oct.) Mad. 1 "
LUXEMBOURG,,"1 Oct. Ordinance No. 60-120, to lay down the procedure to be followed in the labour courts [repeals all contrary provisions]. (Ibid.)",,,36,,"1 Oct. Ordinance No. 60-120, to lay down the procedure to be followed in the labour courts [repeals all contrary provisions]. (Ibid.) "
LUXEMBOURG,,"3 Oct. Ordinance No. 60-136, to prescribe regulations for co-operative societies [repeals all contrary provisions]. (Ibid., 15 Oct.; errata: ibid., 11 Mar. 1961)",,,36,,"3 Oct. Ordinance No. 60-136, to prescribe regulations for co-operative societies [repeals all contrary provisions]. (Ibid., 15 Oct.; errata: ibid., 11 Mar. 1961) "
LUXEMBOURG,,"3 Oct. Ordinance No. 60-143, to make rules for occupational associations in agriculture in Madagascar [repeals all earlier provisions as to occupational associations, including those made under the Act of 21 June 1865, as subsequently amended, and under the Decree of 3 June 1913]. (Ibid., 22 Oct.)",,,36,,"3 Oct. Ordinance No. 60-143, to make rules for occupational associations in agriculture in Madagascar [repeals all earlier provisions as to occupational associations, including those made under the Act of 21 June 1865, as subsequently amended, and under the Decree of 3 June 1913]. (Ibid., 22 Oct.) "
LUXEMBOURG,,"3 Oct. Ordinance No. 60-149, respecting the manner in which government servants and persons employed by the public services may exercise the right of association and defend their occupational interests. (Ibid.)",,,36,,"3 Oct. Ordinance No. 60-149, respecting the manner in which government servants and persons employed by the public services may exercise the right of association and defend their occupational interests. (Ibid.) "
