country,region,text,date,year,page,extracted_date,full_text
ALBANIA,,"1949, Aug. 13 Legislative Decree No. 726, to provide for the calling up of specialists for employment, to make it illegal for wage-earning and salaried employees to abandon their employment, and to provide for the com- pulsory transfer of wage-earning and salaried employees from one institution or undertaking to another. (Gazeta Zyrtare, 31 Aug. 1949, No. 64, p. 3) Aib. 1B",,,1,,"1949, Aug. 13 Legislative Decree No. 726, to provide for the calling up of specialists for employment, to make it illegal for wage-earning and salaried employees to abandon their employment, and to provide for the com- pulsory transfer of wage-earning and salaried employees from one institution or undertaking to another. (Gazeta Zyrtare, 31 Aug. 1949, No. 64, p. 3) Aib. 1B "
ALBANIA,,"1950, Jan. 21. Act. No. 789, to amend and supplement the Labour Code. (Ibid., 8 Mar. 1950, No. 12, p. 2) Alb. 1 C",,,1,,"1950, Jan. 21. Act. No. 789, to amend and supplement the Labour Code. (Ibid., 8 Mar. 1950, No. 12, p. 2) Alb. 1 C "
ALBANIA,,"1950, June 16 Decree No. 1086, containing an authentic interpretation of sections 48 and 86 of the Labour Code. (Ibid., i7 July 1950, No. 44, p. 5) Alb.1D",,,1,,"1950, June 16 Decree No. 1086, containing an authentic interpretation of sections 48 and 86 of the Labour Code. (Ibid., i7 July 1950, No. 44, p. 5) Alb.1D "
ALBANIA,,"1950, July 5 Act. No. 1109, to supplement the Labour Code. (Ibid., 27 Juiy 1950, No. 49, p. 4) Alb. 1 E",,,1,,"1950, July 5 Act. No. 1109, to supplement the Labour Code. (Ibid., 27 Juiy 1950, No. 49, p. 4) Alb. 1 E "
ALBANIA,,"1951, Nov.1 Decree No. 1356, to amend the Labour Code. (Ibid., 10 Dec. 1951, No. 30, p. 958) Alb. 1 F",,,1,,"1951, Nov.1 Decree No. 1356, to amend the Labour Code. (Ibid., 10 Dec. 1951, No. 30, p. 958) Alb. 1 F "
BELGIUM,,"1940, Mar. 22 Act to amend and supplement the Act of 16 August 1887 regulating the payment of wages to workmen. (Moniteur Belge—Belgisch Siaats- blad, 7 Apr. 1940, No. 98, p. 1853) Bel. 2B",,,1,,"1940, Mar. 22 Act to amend and supplement the Act of 16 August 1887 regulating the payment of wages to workmen. (Moniteur Belge—Belgisch Siaats- blad, 7 Apr. 1940, No. 98, p. 1853) Bel. 2B "
PAPUA AND NEW GUINEA,,"1950, Dec. 19 Ordinance relating to the employment of Natives. No.48. Pap.-N.G.1B",,,1,,"1950, Dec. 19 Ordinance relating to the employment of Natives. No.48. Pap.-N.G.1B "
PERU,,"1942, Jan. 14 Presidential Decree to establish an Arbitration Tribunal for hearing and determining collective disputes, and to create a Collective Disputes Department for handling and disposing of such disputes. Per.2B II. CHRONOLOGICAL LIST OF LABOUR LEGISLATION IN 1953 This list gives the title and source of Acts, decrees, regulations, etc., enacted during 1953 on labour and related subjects (social security, housing",,,1,,"1942, Jan. 14 Presidential Decree to establish an Arbitration Tribunal for hearing and determining collective disputes, and to create a Collective Disputes Department for handling and disposing of such disputes. Per.2B II. CHRONOLOGICAL LIST OF LABOUR LEGISLATION IN 1953 This list gives the title and source of Acts, decrees, regulations, etc., enacted during 1953 on labour and related subjects (social security, housing, "
ALBANIA,,"Decree No. 1694, to interpret section 56 of the Labour Code. (Gazeta Zyrtare e Republikés Popullore té Shgipérisé, 12 Oct.) Alb. 1",9.7.,1953,2,July 9,"July 9 Decree No. 1694, to interpret section 56 of the Labour Code. (Gazeta Zyrtare e Republikés Popullore té Shgipérisé, 12 Oct.) Alb. 1 "
ARGENTINA,,"Decree No. 90, to amend the Reguiations under Act No. 12637 [of 10 Sep. 1946] respecting bank clerks {new provisions respecting maternity leave and leave for the purpose of study and the obtaining of technical qualifications). (B.O. 6 Feb.)",7.1.,1953,2,Jan 7,"Jan. 7 Decree No. 90, to amend the Reguiations under Act No. 12637 [of 10 Sep. 1946] respecting bank clerks {new provisions respecting maternity leave and leave for the purpose of study and the obtaining of technical qualifications). (B.O. 6 Feb.) "
ARGENTINA,,"Decree No. 9652, to lay down under Convention No. 27 concerning the marking of weight on heavy packages transported by vessels, adopted by the Interna- tional Labour Organisation and ratified by Argentina, that every package whose gross weight is 1,000 kilograms or over and which is transported by sea or iniand waterway shall have its weight plainly and durably marked on the tside. (B.O. 23 June)",2.6.,1953,2,June 2,"June 2. Decree No. 9652, to lay down under Convention No. 27 concerning the marking of weight on heavy packages transported by vessels, adopted by the Interna- tional Labour Organisation and ratified by Argentina, that every package whose gross weight is 1,000 kilograms or over and which is transported by sea or iniand waterway shall have its weight plainly and durably marked on the tside. (B.O. 23 June) "
ARGENTINA,,"Oct.13 Act No. 14250, respecting collective labour agreements. (B.O. 20 Oct.) Arg. 1",,,2,,"Oct.13 Act No. 14250, respecting collective labour agreements. (B.O. 20 Oct.) Arg. 1 "
ARGENTINA,,Act No. 14295: Rules governing occupational associations of employers. (B.O. 14 Jan. 1954) Arg. 2 PROVINCES,17.12.,1953,2,Dec 17,Dec. 17 Act No. 14295: Rules governing occupational associations of employers. (B.O. 14 Jan. 1954) Arg. 2 PROVINCES 
ARGENTINA,President Peron,"Act No. 30, respecting labour courts and procedure. (Derecho del Trabajo, Buenos Aires, Aug. 1954)",18.11.,1953,2,Nov 18,"Nov. 18 Act No. 30, respecting labour courts and procedure. (Derecho del Trabajo, Buenos Aires, Aug. 1954) "
AUSTRALIA,,National Health (Medical Benefits) Regulations 1953 [amended by S.R. No. 75 of 7 Aug. and No. 97 of 26 Noy.; repeal the National Health (Medical Expenses) Regulations 1949}. (S.R. No. 21),11.3.,1953,2,Mar 11,Mar. 11 National Health (Medical Benefits) Regulations 1953 [amended by S.R. No. 75 of 7 Aug. and No. 97 of 26 Noy.; repeal the National Health (Medical Expenses) Regulations 1949}. (S.R. No. 21) 
AUSTRALIA,,"Act to amend the Seamen’s Compensation Act 1911-491, and for other purposes [adds definitions of “ ambulance services ” and “ medical treat- ment ”; amends s. 5 AA (injury while travelling to work)). No. 10",28.3.,1953,2,Mar 28,"Mar. 28 Act to amend the Seamen’s Compensation Act 1911-491, and for other purposes [adds definitions of “ ambulance services ” and “ medical treat- ment ”; amends s. 5 AA (injury while travelling to work)). No. 10. "
AUSTRALIA,,Explosives Regulations [transport of explosives by road]. (S.R. No. 69),3.7.,1953,2,July 3,July 3 Explosives Regulations [transport of explosives by road]. (S.R. No. 69) 
AUSTRALIA,,"Act to amend the Social Services Consolidation Act 1947-522 [inter alia, qualifications for age pensions and conditions of grant of invalid pension). No. 51",26.10.,1953,2,Oct 26,"Oct. 26 Act to amend the Social Services Consolidation Act 1947-522 [inter alia, qualifications for age pensions and conditions of grant of invalid pension). No. 51. "
AUSTRALIA,New South Wales,"Act to provide for certain increases in amounts payable by way of compensa- tion under the Workers’ Compensation Act 1926 8, and the Workers’ Com- pensation (Silicosis) Act 1942, as amended by subsequent Acts; for this and other purposes to amend the said Acts; and for purposes connected therewith. No. 21",20.11.,1953,2,Nov 20,"Nov. 20 Act to provide for certain increases in amounts payable by way of compensa- tion under the Workers’ Compensation Act 1926 8, and the Workers’ Com- pensation (Silicosis) Act 1942, as amended by subsequent Acts; for this and other purposes to amend the said Acts; and for purposes connected therewith. No. 21. "
AUSTRALIA,New South Wales,B.0. = Boletin Oficial,,,2,,B.0. = Boletin Oficial. 
AUSTRALIA,New South Wales,"S.R. = Statutory Rules, 1953",,,2,,"S.R. = Statutory Rules, 1953. "
AUSTRALIA,New South Wales,"N.G.G. = New South Wales Government Gazette. 1 L.S. 1938 (Aust. 4) ... 1949 (Aust. 1), — 2.L.S. 1947 (Aust. 3) ... 1954 (Aust. 2).—",,,2,,"N.G.G. = New South Wales Government Gazette. 1 L.S. 1938 (Aust. 4) ... 1949 (Aust. 1), — 2.L.S. 1947 (Aust. 3) ... 1954 (Aust. 2).— "
AUSTRALIA,New South Wales,8 L.S. 1926 (Aust. 5) ... 1938 (Aust. 5),,,2,,8 L.S. 1926 (Aust. 5) ... 1938 (Aust. 5). 
AUSTRALIA,New South Wales,"Act to make further provisions for the management and regulation of mines of coal and mines of shale; to enable provision to be made for the management and regulation of open-cut workings; for these and other purposes to amend the Coal Mines Regulation Act 1912-47, and the Mining Act 1906-52; to validate certain matters; and for purposes connected therewith. No. 27",11.12.,1953,3,Dec 11,"Dec. 11 Act to make further provisions for the management and regulation of mines of coal and mines of shale; to enable provision to be made for the management and regulation of open-cut workings; for these and other purposes to amend the Coal Mines Regulation Act 1912-47, and the Mining Act 1906-52; to validate certain matters; and for purposes connected therewith. No. 27. "
AUSTRALIA,New South Wales,Act to extend In certain respects the provisions of the Workers’ Compensa- tion (Silicosis) Act 1942-46; for that purpose to amend that Act; and for purposes connected therewith. No. 28,11.12.,1953,3,Dec 11,Dec. 11 Act to extend In certain respects the provisions of the Workers’ Compensa- tion (Silicosis) Act 1942-46; for that purpose to amend that Act; and for purposes connected therewith. No. 28. 
AUSTRALIA,New South Wales,Act to increase the rates of compensation payable under the Workmen’s Compensation (Broken Hill) Act 1920-511; for this purpose to amend the Act; and for purposes connected therewith. No. 32,15.12.,1953,3,Dec 15,Dec. 15 Act to increase the rates of compensation payable under the Workmen’s Compensation (Broken Hill) Act 1920-511; for this purpose to amend the Act; and for purposes connected therewith. No. 32. 
AUSTRALIA,New South Wales,"Act to provide for the grant of certain allowances in addition to those already provided for under the Miners’ Accident Relief (Repeal) Act 1916, and the Miners’ Accident Relief (Supplemental) Act 1928; and for the payment thereof t of the Consolldated Revenue Fund; and for purposes connected there- with. No. 36",16.12.,1953,3,Dec 16,"Dec. 16 Act to provide for the grant of certain allowances in addition to those already provided for under the Miners’ Accident Relief (Repeal) Act 1916, and the Miners’ Accident Relief (Supplemental) Act 1928; and for the payment thereof t of the Consolldated Revenue Fund; and for purposes connected there- with. No. 36. "
AUSTRALIA,New South Wales,Act to make certain provisions relating to membership of industrial unions of employees and long-service leave of employees; for these and other pur- poses to amend the Industrial Arbitration Act 1940-52; and for purposes connected therewith. No. 42,17.12.,1953,3,Dec 17,Dec. 17 Act to make certain provisions relating to membership of industrial unions of employees and long-service leave of employees; for these and other pur- poses to amend the Industrial Arbitration Act 1940-52; and for purposes connected therewith. No. 42. 
AUSTRALIA,Queensland,"Apr., Amendments of the Apprenticeship Regulations 1930 (tools of trade, me-",,,3,,"Apr., Amendments of the Apprenticeship Regulations 1930 (tools of trade, me- "
AUSTRALIA,Queensland,"May and chanics, bakers and pastrycooks, building trades, spring-making trade",,,3,,"May and chanics, bakers and pastrycooks, building trades, spring-making trade, "
AUSTRALIA,Queensland,"etail] distributing trades, etc.]. (Q.I.G. 30 June)",1.6.,1953,3,June r,"June retail] distributing trades, etc.]. (Q.I.G. 30 June) "
AUSTRALIA,Queensland,"Act to amend the Industrial Conciliation and Arbitration Acts 1932-52 2, in certain particulars [amends, inter alia, ss. 10 A (annual holidays), 10 B (long- service ieave) and 50 (2) (holiday or leave pay)). No. 13",26.11.,1953,3,Nov 26,"Nov. 26 Act to amend the Industrial Conciliation and Arbitration Acts 1932-52 2, in certain particulars [amends, inter alia, ss. 10 A (annual holidays), 10 B (long- service ieave) and 50 (2) (holiday or leave pay)). No. 13. "
AUSTRALIA,Queensland,"Act to amend the State Housing Acts 1945-50, and the Workers’ Homes Acts 1919-49, each in certain particulars {amends s. 16 (period for payment and rate of interest) of the Workers’ Homes Acts}. No. 25",18.12.,1953,3,Dec 18,"Dec. 18 Act to amend the State Housing Acts 1945-50, and the Workers’ Homes Acts 1919-49, each in certain particulars {amends s. 16 (period for payment and rate of interest) of the Workers’ Homes Acts}. No. 25. "
AUSTRALIA,South Australia,"Act to amend the Workmen’s Compensation Act 1932-51 8 [amends ss. 4 (liability of employers), 7 (definition of “ workman”), 16 (compensation when workman dies leaving dependants), 17 (compensation on death without dependants), 18 (compensation for incapacity), 18 A (medical expenses) and 26 (fixed rates of compensation)]. No. 38",17.12.,1953,3,Dec 17,"Dec. 17 Act to amend the Workmen’s Compensation Act 1932-51 8 [amends ss. 4 (liability of employers), 7 (definition of “ workman”), 16 (compensation when workman dies leaving dependants), 17 (compensation on death without dependants), 18 (compensation for incapacity), 18 A (medical expenses) and 26 (fixed rates of compensation)]. No. 38. "
AUSTRALIA,Tasmania,Act to amend the Miners’ Pensions Act 1944 [increase of pension rates]. No. 13,20.4.,1953,3,Apr 20,Apr. 20 Act to amend the Miners’ Pensions Act 1944 [increase of pension rates]. No. 13. 
AUSTRALIA,Tasmania,Act to amend the Workers’ Compensation Act 1927 and to repeal the Workers’ Compensation Act 1948 [amends s. 8 (liability of employers for medical and hospital services) and the First Schedule (amount of compensation in case of death and incapacity and scale of compensation for specified injuries)}. No. 79,9.12.,1953,3,Dec 9,Dec. 9 Act to amend the Workers’ Compensation Act 1927 and to repeal the Workers’ Compensation Act 1948 [amends s. 8 (liability of employers for medical and hospital services) and the First Schedule (amount of compensation in case of death and incapacity and scale of compensation for specified injuries)}. No. 79. 
AUSTRALIA,Tasmania,Act to amend [s. 12 of} the Shops Act 1925 [small shops). No. 81,9.12.,1953,3,Dec 9,Dec. 9 Act to amend [s. 12 of} the Shops Act 1925 [small shops). No. 81. 
AUSTRALIA,Victoria,"Act to amend {ss. 6, 7, 8, 9 and 12 of} the Coal Mine Workers Pensions Act 1942 increases of pensions and additional payments to mineworkers]. No. 5674",14.4.,1953,3,Apr 14,"Apr. 14 Act to amend {ss. 6, 7, 8, 9 and 12 of} the Coal Mine Workers Pensions Act 1942 increases of pensions and additional payments to mineworkers]. No. 5674. "
AUSTRALIA,Victoria,"Act to amend the Workers’ Compensation Act 1951, and for other purposes (miscellaneous amendments). No. 5676",24.4.,1953,3,Apr 24,"Apr. 24. Act to amend the Workers’ Compensation Act 1951, and for other purposes (miscellaneous amendments). No. 5676. "
AUSTRALIA,Victoria,Q.I.G. = Queensland Industrial Gazette. 1 L.S. 1922 (Aust. 3) ... 1934 (Aust. 12). — 2 L.S. 1933 (Aust. 1) ... 1938 (Aust. 3),,,3,,Q.I.G. = Queensland Industrial Gazette. 1 L.S. 1922 (Aust. 3) ... 1934 (Aust. 12). — 2 L.S. 1933 (Aust. 1) ... 1938 (Aust. 3). 
AUSTRALIA,Victoria,"3 L.S. 1932 (Aust. 11), 1938 (Aust. 6)",,,3,,"3 L.S. 1932 (Aust. 11), 1938 (Aust. 6). "
AUSTRALIA,Victoria,Regulations relating to the periodical medical examinations of workers in certain land occupations and processes under the Health Acts 1928-44 repeal the Dangerous Trades (Medical Examination) Regulations 1947]. (V.G.G. 13 Nov.),4.11.,1953,4,Nov 4,Nov. 4 Regulations relating to the periodical medical examinations of workers in certain land occupations and processes under the Health Acts 1928-44 repeal the Dangerous Trades (Medical Examination) Regulations 1947]. (V.G.G. 13 Nov.) 
AUSTRALIA,Victoria,"Act to amend [s. 26 of] the Workers’ Compensation Acts {compensation in respect of medical expenses to cover replacement, etc., of artificial limbs). No. 5715",25.11.,1953,4,Nov 25,"Nov. 25 Act to amend [s. 26 of] the Workers’ Compensation Acts {compensation in respect of medical expenses to cover replacement, etc., of artificial limbs). No. 5715, "
AUSTRALIA,Victoria,"Act relating to the Ministry of Labour and Industry, to amend and consoli- date the law relating to industrial matters and the supervision and regulation of factories, shops and other premises, and for other purposes. No. 4771. Extracts: Aust. 1",23.12.,1953,4,Dec 23,"Dec. 23 Act relating to the Ministry of Labour and Industry, to amend and consoli- date the law relating to industrial matters and the supervision and regulation of factories, shops and other premises, and for other purposes. No. 4771. Extracts: Aust. 1 "
AUSTRALIA,Victoria,"Act to provide for the formation, registration and management of co-operative societies and for other purposes. No. 5769",23.12.,1953,4,Dec 23,"Dec. 23 Act to provide for the formation, registration and management of co-operative societies and for other purposes. No. 5769. "
AUSTRALIA,Western Australia,Act to amend the Workers’ Compensation Act 1912-51 1 {increases the maxi- mum weekly compensation payments in case of total incapacity in the case of a worker with dependants and increases the amount payable for medical and hospital expenses]. No. 64,7.1.,1953,4,Jan 7,Jan. 7 Act to amend the Workers’ Compensation Act 1912-51 1 {increases the maxi- mum weekly compensation payments in case of total incapacity in the case of a worker with dependants and increases the amount payable for medical and hospital expenses]. No. 64. 
AUSTRALIA,Western Australia,"Apprenticeship Regulations under the Industrial Arbitration Act 1912-52. (W.A.LG. Vol. XX XIII, No. 4)",2.11.,1953,4,Nov 2,"Nov. 2 Apprenticeship Regulations under the Industrial Arbitration Act 1912-52. (W.A.LG. Vol. XX XIII, No. 4) "
AUSTRALIA,Western Australia,Act to amend [s. 5 of] the Mine Workers’ Relief Act 1932-43 2 [interpretation of “ mine ” and “ mineworker ”]. No. 7,3.11.,1953,4,Nov 3,Nov. 3 Act to amend [s. 5 of] the Mine Workers’ Relief Act 1932-43 2 [interpretation of “ mine ” and “ mineworker ”]. No. 7. 
AUSTRALIA,Western Australia,Act to amend [ss. 2 and 53 of] the Inspection of Machinery Act 1921-54 (adds: “ any crane driven by hand or animal power used for raising or lower- ing a load exceeding one ton ”; replaces the Second Schedule]. No. 33,18.12.,1953,4,Dec 18,Dec. 18 Act to amend [ss. 2 and 53 of] the Inspection of Machinery Act 1921-54 (adds: “ any crane driven by hand or animal power used for raising or lower- ing a load exceeding one ton ”; replaces the Second Schedule]. No. 33. 
AUSTRALIA,Western Australia,"Jan. 214. Act to amend [ss. 5, 7, 8, 11, 29, 30 and the First Schedule of] the Workers’",,,4,,"Jan. 214. Act to amend [ss. 5, 7, 8, 11, 29, 30 and the First Schedule of] the Workers’ "
AUSTRALIA,Western Australia,1954) Compensation Act 1912-521. No. 88. OVERSEAS TERRITORIES,,,4,,(1954) Compensation Act 1912-521. No. 88. OVERSEAS TERRITORIES 
AUSTRALIA,Papua & New Guinea,Mines and Works Regulation (New Guinea) Ordinance Amendment Ordin- ance 1952. No. 57,7.2.,1953,4,Feb 7,Feb. 7 Mines and Works Regulation (New Guinea) Ordinance Amendment Ordin- ance 1952. No. 57. 
AUSTRALIA,Papua & New Guinea,"Ordinance to amend [ss. 2, 3, 5, 6, 7 and 9 of] the Natives’ Contracts Protec- tion Ordinance 1924-47 of the Territory of New Guinea. No. 16",19.2.,1953,4,Feb 19,"Feb. 19 Ordinance to amend [ss. 2, 3, 5, 6, 7 and 9 of] the Natives’ Contracts Protec- tion Ordinance 1924-47 of the Territory of New Guinea. No. 16. "
AUSTRALIA,Papua & New Guinea,Ordinance relating to aliens [repeals the Aliens Registration Ordinance 1925 of the Territory of New Guinea]. No. 23,23.4.,1953,4,Apr 23,Apr. 23. Ordinance relating to aliens [repeals the Aliens Registration Ordinance 1925 of the Territory of New Guinea]. No. 23. 
AUSTRALIA,Papua & New Guinea,"Ordinance to amend the Workers’ Compensation Ordinance 1951-52. No, 39",14.5.,1953,4,May 14,"May 14 Ordinance to amend the Workers’ Compensation Ordinance 1951-52. No, 39. "
AUSTRALIA,Papua & New Guinea,Ordinance to amend the Seamen (Unemployment Indemnity) Ordinance 1951 replaces the Schedule]. No. 44,19.5.,1953,4,May 19,May 19 Ordinance to amend the Seamen (Unemployment Indemnity) Ordinance 1951 replaces the Schedule]. No. 44. 
AUSTRALIA,Papua & New Guinea,Ordinance to amend the Native Apprenticeship Ordinance 1951-52. No. 62. Included in 1952—Pap.-N.G. 1,14.5.,1953,4,May 14,May 14 Ordinance to amend the Native Apprenticeship Ordinance 1951-52. No. 62. Included in 1952—Pap.-N.G. 1 
AUSTRALIA,Papua & New Guinea,Ordinance to amend the Native Labour Ordinance 1950-52. No. 59. Pap.-N.G. 1,2.7.,1953,4,July 2,July 2 Ordinance to amend the Native Labour Ordinance 1950-52. No. 59. Pap.-N.G. 1 
AUSTRIA,,"Ordinance of the Federal Ministry of Social Administration, respecting compulsory social insurance for agricultural workers. (B.R.O. 11 July, text 87)",22.5.,1953,4,May 22,"May 22 Ordinance of the Federal Ministry of Social Administration, respecting compulsory social insurance for agricultural workers. (B.R.O. 11 July, text 87) "
AUSTRIA,,"Federal Act to amend the Federal Act respecting the employment of children and young persons [amends the Federal Act of 1 July 1948 8; valid until 31 Dec.J. (B.R.O. 31 Aug., text 141)",9.7.,1953,4,July 9,"July 9 Federal Act to amend the Federal Act respecting the employment of children and young persons [amends the Federal Act of 1 July 1948 8; valid until 31 Dec.J. (B.R.O. 31 Aug., text 141) "
AUSTRIA,,V.G.G. = Victoria Government Gazette,,,4,,V.G.G. = Victoria Government Gazette. 
AUSTRIA,,W.A.I.G. = Western Australia Industrial Gazette,,,4,,W.A.I.G. = Western Australia Industrial Gazette. 
AUSTRIA,,B.R.O. = Bundesgesetzblatt fiir die Republik Osterreich. 1 L.S. 1925 (Aust. 2)... 1939 (Aust. 1). — 2 L.S. 1932 (Aust.6) ... 1935 (Aust. 2),,,4,,B.R.O. = Bundesgesetzblatt fiir die Republik Osterreich. 1 L.S. 1925 (Aust. 2)... 1939 (Aust. 1). — 2 L.S. 1932 (Aust.6) ... 1935 (Aust. 2). 
AUSTRIA,,8 L.S. 1948 (Aus. 3),,,4,,8 L.S. 1948 (Aus. 3). 
AUSTRIA,,"Federal Act to amend and supplement the Federal Act of 3 July 1947 respect- ing labour inspection (Federal Labour Inspection Act Fifth Amending Act). (B.R.O. 21 Jan. 1954, text 16) Aus. 1",16.12.,1953,5,Dec 16,"Dec. 16 Federal Act to amend and supplement the Federal Act of 3 July 1947 respect- ing labour inspection (Federal Labour Inspection Act Fifth Amending Act). (B.R.O. 21 Jan. 1954, text 16) Aus. 1 "
AUSTRIA,,"Federal Act to amend the Federal Act of 22 June 1949 1 respecting unemploy- ment insurance (Federal Unemployment Insurance Fifth Amending Act) inserts an additional section on frontier workers). (B.R.O. 24 Jan. 1954, text 17)",16.12.,1953,5,Dec 16,"Dec. 16 Federal Act to amend the Federal Act of 22 June 1949 1 respecting unemploy- ment insurance (Federal Unemployment Insurance Fifth Amending Act) inserts an additional section on frontier workers). (B.R.O. 24 Jan. 1954, text 17) "
BELGIUM,,"Royal Order to amend the Order of the Regent of 11 July 1949 2 respecting staff associations of government employees [adds art. 78 bis (provisions applicable in the following cases: withdrawal of recognition from a trade union organisation, transfer of administrative services between ministries, creation of a new ministry)]. (M.B. 17 Jan.)",14.1.,1953,5,Jan 14,"Jan. 14 Royal Order to amend the Order of the Regent of 11 July 1949 2 respecting staff associations of government employees [adds art. 78 bis (provisions applicable in the following cases: withdrawal of recognition from a trade union organisation, transfer of administrative services between ministries, creation of a new ministry)]. (M.B. 17 Jan.) "
BELGIUM,,Jan.17 Royal Order to amend the Order of the Regent of 10 May 1948 3 respecting additions to old-age and survivors’ pensions [repeals art. 42]. (M.B. 19/ 20 Jan.),,,5,,Jan.17 Royal Order to amend the Order of the Regent of 10 May 1948 3 respecting additions to old-age and survivors’ pensions [repeals art. 42]. (M.B. 19/ 20 Jan.) 
BELGIUM,,Royal Order to amend the Order of the Regent of 16 Jan. 1945 4 respecting the operations of the National Social Security Office [assessment of the board and lodging provided by the employer]. (M.B. 26 Mar.),21.3.,1953,5,Mar 21,Mar. 21. Royal Order to amend the Order of the Regent of 16 Jan. 1945 4 respecting the operations of the National Social Security Office [assessment of the board and lodging provided by the employer]. (M.B. 26 Mar.) 
BELGIUM,,Royal Order to amend (art. 57 of] the Order of the Regent of 11 July 1949 2 respecting staff associations of government employees [elections]. (M.B. 4 Apr.),30.3.,1953,5,Mar 30,Mar. 30 Royal Order to amend (art. 57 of] the Order of the Regent of 11 July 1949 2 respecting staff associations of government employees [elections]. (M.B. 4 Apr.) 
BELGIUM,,Royal Order to amend [arts. 5 and 6 of] the Order of the Regent of 5 Nov. 1946 § to extend the Legislative Order of 28 Dec. 1944 respecting social security for employees to employers and employees in agricultural undertak- ings (workers’ contributions}. (M.B. 9 Apr.),7.4.,1953,5,Apr 7,"Apr, 7 Royal Order to amend [arts. 5 and 6 of] the Order of the Regent of 5 Nov. 1946 § to extend the Legislative Order of 28 Dec. 1944 respecting social security for employees to employers and employees in agricultural undertak- ings (workers’ contributions}. (M.B. 9 Apr.) "
