country,region,text,date,year,page,extracted_date,full_text
GHAN A,,1 1 Oct . Co-operativ e Societie s (Amendment ) Decre e 196 8 [amend s s . 5 (2 ) o f th e Co-operativ e Societie s Decre e 1968] . N.L.C.D . No . 292,,,38,,1 1  Oct .   Co-operativ e  Societie s  (Amendment )  Decre e  196 8  [amend s  s .  5  (2 )  o f  th e  Co-operativ e  Societie s  Decre e  1968] .  N.L.C.D .  No .  292 .  
GHAN A,,1 L.S . 1961—Ger.D.R . 6 . 2 L.S . 1965—Ger.F.R . 2 (consolidation) . 3 L.S . 1949—Ger,,,38,,1  L.S .  1961—Ger.D.R .  6 .   2  L.S .  1965—Ger.F.R .  2  (consolidation) .   3  L.S .  1949—Ger .  
GHAN A,,"F.R . 1 (extracts) , 1956—Ger.F.R . 1 . — 4 8 —",,,38,,"F.R .  1  (extracts) ,  1956—Ger.F.R .  1 .  —  4 8  —  "
GREEC E,,"9 Jan . Emergenc y La w No . 252 , t o provid e fo r th e gran t o f a dowr y t o Gree k wome n workers , th e establishmen t o f da y nurseries , etc. , b y th e Workers ' Home . ('Eifmiepfc T)) ? Kupspv^oew? , Par t I , 1 7 Jan. )",,,39,,"9  Jan .   Emergenc y  La w  No .  252 ,  t o  provid e  fo r  th e  gran t  o f  a  dowr y  t o  Gree k  wome n  workers ,  th e  establishmen t  o f  da y  nurseries ,  etc. ,  b y  th e  Workers '  Home .  ('Eifmiepfc  T)) ?  Kupspv^oew? ,  Par t  I ,  1 7  Jan. )  "
GREEC E,,"1 3 Jan . Emergenc y La w No . 257 , respectin g seafarers ' federation s an d industria l associations . (Ibid. , 1 8 Jan. )",,,39,,"1 3  Jan .   Emergenc y  La w  No .  257 ,  respectin g  seafarers '  federation s  an d  industria l  associations .  (Ibid. ,  1 8  Jan. )  "
GREEC E,,"5 Mar . Ac t No . 313 , respectin g th e specia l protectio n o f worker s i n th e buildin g an d timbe r industrie s wh o ar e insure d wit h th e Supple - mentar y Fun d an d employe d i n particularl y arduou s an d unhealth y occupation s [benefit s enjoye d i n othe r occupation s t o b e extende d t o suc h workers] . (Ibid. , 9 Mar. )",,,39,,"5  Mar .   Ac t  No .  313 ,  respectin g  th e  specia l  protectio n  o f  worker s  i n  th e  buildin g  an d  timbe r  industrie s  wh o  ar e  insure d  wit h  th e  Supple - mentar y  Fun d  an d  employe d  i n  particularl y  arduou s  an d  unhealth y  occupation s  [benefit s  enjoye d  i n  othe r  occupation s  t o  b e  extende d  t o  suc h  workers] .  (Ibid. ,  9  Mar. )  "
GREEC E,,"8 Mar . Ac t No . 373 , respectin g th e registratio n an d trainin g o f merchan t seame n an d th e officia l interpretatio n o f certai n ss . o f th e Cod e o f Privat e Maritim e Law . (Ibid. , 1 5 Apr. )",,,39,,"8  Mar .   Ac t  No .  373 ,  respectin g  th e  registratio n  an d  trainin g  o f  merchan t  seame n  an d  th e  officia l  interpretatio n  o f  certai n  ss .  o f  th e  Cod e  o f  Privat e  Maritim e  Law .  (Ibid. ,  1 5  Apr. )  "
GREEC E,,"2 5 Apr . Ac t No . 380 , t o declar e 1 Ma y t o b e a compulsor y publi c holiday . (Ibid. , 2 6 Apr. )",,,39,,"2 5  Apr .   Ac t  No .  380 ,  t o  declar e  1  Ma y  t o  b e  a  compulsor y  publi c  holiday .  (Ibid. ,  2 6  Apr. )  "
GREEC E,,"4 Ma y Decisio n No . 2 3 o f th e Counci l o f Ministers , t o empowe r th e Governmen t t o tak e appropriat e actio n t o mee t urgen t socia l need s [come s int o operatio n o n th e dat e o f it s promulgatio n an d remain s i n forc e fo r a perio d o f fiv e years] . (Ibid. , 6 May )",,,39,,"4  Ma y   Decisio n  No .  2 3  o f  th e  Counci l  o f  Ministers ,  t o  empowe r  th e  Governmen t  t o  tak e  appropriat e  actio n  t o  mee t  urgen t  socia l  need s  [come s  int o  operatio n  o n  th e  dat e  o f  it s  promulgatio n  an d  remain s  i n  forc e  fo r  a  perio d  o f  fiv e  years] .  (Ibid. ,  6  May )  "
GREEC E,,"1 0 Ma y Emergenc y Ac t No . 400 , t o provid e fo r th e administratio n o f Decisio n No . 2 3 o f th e Counci l o f Minister s [o f 4 May] . (Ibid. , 1 4 May )",,,39,,"1 0  Ma y   Emergenc y  Ac t  No .  400 ,  t o  provid e  fo r  th e  administratio n  o f  Decisio n  No .  2 3  o f  th e  Counci l  o f  Minister s  [o f  4  May] .  (Ibid. ,  1 4  May )  "
GREEC E,,"1 8 Ma y Roya l Decre e No . 362 , t o mak e occupational healt h an d safet y regulation s fo r tannerie s throughou t th e countr y [supplement s th e Decre e o f 1 4 Mar . 193 4 l respectin g hygieni c condition s an d th e safet y o f wage-earnin g an d salarie d employee s i n factorie s an d workshops , etc. , o f al l kind s i n industr y an d handicrafts] . (Ibid. , 2 7 May )",,,39,,"1 8  Ma y   Roya l  Decre e  No .  362 ,  t o  mak e  occupational  healt h  an d  safet y  regulation s  fo r  tannerie s  throughou t  th e  countr y  [supplement s  th e  Decre e  o f  1 4  Mar .  193 4  l  respectin g  hygieni c  condition s  an d  th e  safet y  o f  wage-earnin g  an d  salarie d  employee s  i n  factorie s  an d  workshops ,  etc. ,  o f  al l  kind s  i n  industr y  an d  handicrafts] .  (Ibid. ,  2 7  May )  "
GREEC E,,"2 9 Ma y Emergenc y Ac t No . 434 , respectin g th e disposa l o f th e asset s o f workers ' union s tha t hav e bee n dissolved . (Ibid. , 3 0 May )",,,39,,"2 9  Ma y   Emergenc y  Ac t  No .  434 ,  respectin g  th e  disposa l  o f  th e  asset s  o f  workers '  union s  tha t  hav e  bee n  dissolved .  (Ibid. ,  3 0  May )  "
GREEC E,,"2 9 Ma y Roya l Decre e No . 369 , respectin g th e implementatio n o f ss . 1 0 an d 1 1 o f th e Constitutio n [whic h guarante e th e righ t o f assembl y an d association] . (Ibid. )",,,39,,"2 9  Ma y   Roya l  Decre e  No .  369 ,  respectin g  th e  implementatio n  o f  ss .  1 0  an d  1 1  o f  th e  Constitutio n  [whic h  guarante e  th e  righ t  o f  assembl y  an d  association] .  (Ibid. )  "
GREEC E,,"4 Jun e Emergenc y Ac t No . 435 , t o fix a minimu m wag e an d othe r condi - tion s fo r certai n classe s o f worker s [supplement s Ac t No . 323 9 o f 1 8 Ma y 195 5 2 respectin g collectiv e agreements] . (Ibid. , 4 June )",,,39,,"4  Jun e   Emergenc y  Ac t  No .  435 ,  t o  fix a  minimu m  wag e  an d  othe r  condi - tion s  fo r  certai n  classe s  o f  worker s  [supplement s  Ac t  No .  323 9  o f  1 8  Ma y  195 5  2  respectin g  collectiv e  agreements] .  (Ibid. ,  4  June )  "
GREEC E,,"4 Jun e Emergenc y Ac t No . 436 , respectin g overtim e i n publi c servic e undertaking s an d factorie s [supplement s th e Decre e o f 2 7 June / 4 Jul y 193 2 respectin g overtime] . (Ibid. )",,,39,,"4  Jun e   Emergenc y  Ac t  No .  436 ,  respectin g  overtim e  i n  publi c  servic e  undertaking s  an d  factorie s  [supplement s  th e  Decre e  o f  2 7  June /  4  Jul y  193 2  respectin g  overtime] .  (Ibid. )  "
GREEC E,,"1 2 Jun e Ac t No . 448 , respectin g th e gran t o f labou r permit s t o alien s i n urgen t cases . (Ibid. , 1 4 June )",,,39,,"1 2  Jun e   Ac t  No .  448 ,  respectin g  th e  gran t  o f  labou r  permit s  t o  alien s  i n  urgen t  cases .  (Ibid. ,  1 4  June )  "
GREEC E,,"2 8 Jun e Roya l Decre e No . 464 , t o mak e occupationa l healt h an d safet y regulation s fo r printin g work s an d factorie s engage d i n th e graphi c art s an d pape r processin g [supplement s th e Roya l Decre e o f 2 5 Aug./ 5 Sep . 192 0 t o consolidat e th e la w relatin g t o occupationa l healt h an d safety] . (Ibid. , 1 2 July )",,,39,,"2 8  Jun e   Roya l  Decre e  No .  464 ,  t o  mak e  occupationa l  healt h  an d  safet y  regulation s  fo r  printin g  work s  an d  factorie s  engage d  i n  th e  graphi c  art s  an d  pape r  processin g  [supplement s  th e  Roya l  Decre e  o f  2 5  Aug./ 5  Sep .  192 0  t o  consolidat e  th e  la w  relatin g  t o  occupationa l  healt h  an d  safety] .  (Ibid. ,  1 2  July )  "
GREEC E,,"1 3 Jul y Roya l Decre e No . 525 , t o approv e an d appl y regulation s governin g fire-fightin g equipmen t o n boar d [merchant ] vessels . (Ibid. , 7 Aug. )",,,39,,"1 3  Jul y   Roya l  Decre e  No .  525 ,  t o  approv e  an d  appl y  regulation s  governin g  fire-fightin g  equipmen t  o n  boar d  [merchant ]  vessels .  (Ibid. ,  7  Aug. )  "
GREEC E,,1 L.S . 1934—Gr . 11 . 2 L.S . 1955—Gr . 2 . — 4 9 —,,,39,,1  L.S .  1934—Gr .  11 .   2  L.S .  1955—Gr .  2 .  —  4 9  —  
GREEC E  ),,2 7 Jul y,,,40,,2 7  Jul y  
GREEC E  ),,"2 1 Sep . Roya l Decre e No . 542 , mad e unde r Ac t No . 447 3 o f 196 5 respectin g th e supervisio n o f shipping , th e inspectio n o f merchan t vessel s an d certai n othe r matters . (Ibid. , 2 0 Aug. ) Roya l Decre e No . 667 , t o consolidat e th e legislatio n fo r th e tim e bein g i n forc e a s t o occupationa l associations . (Ibid. , 7 Oct. )",,,40,,"2 1  Sep .  Roya l  Decre e  No .  542 ,  mad e  unde r  Ac t  No .  447 3  o f  196 5  respectin g  th e  supervisio n  o f  shipping ,  th e  inspectio n  o f  merchan t  vessel s  an d  certai n  othe r  matters .  (Ibid. ,  2 0  Aug. )  Roya l  Decre e  No .  667 ,  t o  consolidat e  th e  legislatio n  fo r  th e  tim e  bein g  i n  forc e  a s  t o  occupationa l  associations .  (Ibid. ,  7  Oct. )  "
GUATEMAL A,,2 9 Mar,,,40,,2 9  Mar .  
GUATEMAL A,,9 Apr,,,40,,9  Apr .  
GUATEMAL A,,1 0 Ma y,,,40,,1 0  Ma y  
GUATEMAL A,,6 Aug,,,40,,6  Aug .  
GUATEMAL A,,"2 2 Aug . Governmen t Orde r No . 1304 , t o approv e Orde r No . 46 8 o f 5 Dec . 196 7 o f th e Boar d o f th e Guatemala n Socia l Securit y Institut e t o mak e regulation s fo r cas h benefit s [i n respec t o f sickness , maternity, accident s an d buria l expenses] . (El Guatemalteco, 5 Apr. ) Governmen t Orde r No . 1319 , t o mak e regulation s fo r th e Nationa l Wage s Boar d an d th e join t minimu m wag e committee s [repeal s Governmen t Orde r No . 96 7 o f 2 Apr . 1966] . (Ibid. , 2 4 Apr. ) Decre e No . 1748 , t o promulgat e a Civi l Servic e Ac t [repeals ' inter alia, Presidentia l Decre e No . 58 4 o f 2 9 Feb . 195 6 an d Legis - lativ e Decre e No . 37 9 o f 1 6 Sep . 1965] . (Ibid. , 2 3 May ) Governmen t Orde r No . 1380 , t o approv e Orde r No . 47 5 [o f 2 5 July ] o f th e Boar d o f th e Guatemalan Socia l Securit y Institut e t o mak e a n initia l se t o f rule s fo r th e administratio n o f th e Regulation s [o f 1 0 Ma y 1967 ] respectin g sicknes s an d maternit y protectio n [repeal s Order s Nos . 211 , 230 , 231 , 273 , 280 , 287 , 344 , 346 , 390 , 403 , 415 , 425 , 45 9 an d 46 1 o f th e Board] . (Ibid. , 7 Aug. ) Governmen t Orde r No . 1390 , t o mak e regulation s fo r th e appoint - men t o f workers ' representative s t o atten d meeting s o f th e Counci l o f State . (Ibid. , 3 Sep. )",,,40,,"2 2  Aug .  Governmen t  Orde r  No .  1304 ,  t o  approv e  Orde r  No .  46 8  o f  5  Dec .  196 7  o f  th e  Boar d  o f  th e  Guatemala n  Socia l  Securit y  Institut e  t o  mak e  regulation s  fo r  cas h  benefit s  [i n  respec t  o f  sickness ,  maternity,  accident s  an d  buria l  expenses] .  (El  Guatemalteco,  5  Apr. )  Governmen t  Orde r  No .  1319 ,  t o  mak e  regulation s  fo r  th e  Nationa l  Wage s  Boar d  an d  th e  join t  minimu m  wag e  committee s  [repeal s  Governmen t  Orde r  No .  96 7  o f  2  Apr .  1966] .  (Ibid. ,  2 4  Apr. )  Decre e  No .  1748 ,  t o  promulgat e  a  Civi l  Servic e  Ac t  [repeals '  inter  alia,  Presidentia l  Decre e  No .  58 4  o f  2 9  Feb .  195 6  an d  Legis - lativ e  Decre e  No .  37 9  o f  1 6  Sep .  1965] .  (Ibid. ,  2 3  May )  Governmen t  Orde r  No .  1380 ,  t o  approv e  Orde r  No .  47 5  [o f  2 5  July ]  o f  th e  Boar d  o f  th e  Guatemalan  Socia l  Securit y  Institut e  t o  mak e  a n  initia l  se t  o f  rule s  fo r  th e  administratio n  o f  th e  Regulation s  [o f  1 0  Ma y  1967 ]  respectin g  sicknes s  an d  maternit y  protectio n  [repeal s  Order s  Nos .  211 ,  230 ,  231 ,  273 ,  280 ,  287 ,  344 ,  346 ,  390 ,  403 ,  415 ,  425 ,  45 9  an d  46 1  o f  th e  Board] .  (Ibid. ,  7  Aug. )  Governmen t  Orde r  No .  1390 ,  t o  mak e  regulation s  fo r  th e  appoint - men t  o f  workers '  representative s  t o  atten d  meeting s  o f  th e  Counci l  o f  State .  (Ibid. ,  3  Sep. )  "
HUNGAR Y,,"5 Jan . Governmen t Orde r No . 1001 , respectin g th e promotio n o f per - sonne l managemen t activities . (Magyar Kozlony, 5 Jan. )",,,40,,"5  Jan .   Governmen t  Orde r  No .  1001 ,  respectin g  th e  promotio n  o f  per - sonne l  managemen t  activities .  (Magyar  Kozlony,  5  Jan. )  "
HUNGAR Y,,"1 6 Jan . Ordinanc e No . 2 o f th e Ministe r o f Ligh t Industry , t o regulat e th e employmen t o f worker s i n small-scal e industry . (Ibid. , 1 6 Jan. )",,,40,,"1 6  Jan .   Ordinanc e  No .  2  o f  th e  Ministe r  o f  Ligh t  Industry ,  t o  regulat e  th e  employmen t  o f  worker s  i n  small-scal e  industry .  (Ibid. ,  1 6  Jan. )  "
HUNGAR Y,,"1 6 Jan . Ordinanc e No . 3 o f th e Ministe r o f Ligh t Industry , respectin g th e wag e rate s o f worker s i n small-scal e industry . (Ibid. )",,,40,,"1 6  Jan .   Ordinanc e  No .  3  o f  th e  Ministe r  o f  Ligh t  Industry ,  respectin g  th e  wag e  rate s  o f  worker s  i n  small-scal e  industry .  (Ibid. )  "
HUNGAR Y,,"1 6 Jan . Ordinanc e No . 4 o f th e Ministe r o f Ligh t Industry , respectin g th e employmen t o f worker s i n small-scal e productio n co-operatives . (Ibid. )",,,40,,"1 6  Jan .   Ordinanc e  No .  4  o f  th e  Ministe r  o f  Ligh t  Industry ,  respectin g  th e  employmen t  o f  worker s  i n  small-scal e  productio n  co-operatives .  (Ibid. )  "
HUNGAR Y,,"6 Apr . Governmen t Ordinanc e No . 15 , respectin g certai n question s connecte d wit h privat e handicrafts . (Ibid. , 6 Apr. )",,,40,,"6  Apr .   Governmen t  Ordinanc e  No .  15 ,  respectin g  certai n  question s  connecte d  wit h  privat e  handicrafts .  (Ibid. ,  6  Apr. )  "
HUNGAR Y,,"2 4 Apr . Ordinanc e No . 1 4 o f th e Ministe r o f Agricultur e an d Food , res - pectin g personne l managemen t i n agricultura l productio n co - operatives . (Ibid. , 2 4 Apr. )",,,40,,"2 4  Apr .   Ordinanc e  No .  1 4  o f  th e  Ministe r  o f  Agricultur e  an d  Food ,  res - pectin g  personne l  managemen t  i n  agricultura l  productio n  co - operatives .  (Ibid. ,  2 4  Apr. )  "
HUNGAR Y,,"2 1 Ma y Governmen t Ordinanc e No . 20 , t o amen d Governmen t Ordinanc e No . 1 6 o f 1 Jun e 196 6 respectin g famil y allowances . (Ibid. , 2 1 May )",,,40,,"2 1  Ma y   Governmen t  Ordinanc e  No .  20 ,  t o  amen d  Governmen t  Ordinanc e  No .  1 6  o f  1  Jun e  196 6  respectin g  famil y  allowances .  (Ibid. ,  2 1  May )  "
HUNGAR Y,,"2 1 Ma y Regulatio n No . 1 o f th e Nationa l Counci l o f Trad e Unions , t o amen d certai n provision s o f Regulatio n No . 2 o f 1 Jun e 196 6 respectin g famil y allowances . (Ibid. ) — 5 0 —",,,40,,"2 1  Ma y   Regulatio n  No .  1  o f  th e  Nationa l  Counci l  o f  Trad e  Unions ,  t o  amen d  certai n  provision s  o f  Regulatio n  No .  2  o f  1  Jun e  196 6  respectin g  famil y  allowances .  (Ibid. )  —  5 0  —  "
HUNGAR Y  ),,"3 0 Ma y Ordinanc e No . 5 o f th e Ministe r o f Ligh t Industry , respectin g th e provisio n o f protectiv e clothin g an d occupationa l safet y equipmen t fo r industria l worker s an d apprentices . (Ibid. , 3 0 May )",,,41,,"3 0  Ma y   Ordinanc e  No .  5  o f  th e  Ministe r  o f  Ligh t  Industry ,  respectin g  th e  provisio n  o f  protectiv e  clothin g  an d  occupationa l  safet y  equipmen t  fo r  industria l  worker s  an d  apprentices .  (Ibid. ,  3 0  May )  "
HUNGAR Y  ),,"3 0 Ma y Ordinanc e No . 6 o f th e Ministe r o f Ligh t Industry , respectin g th e reportin g an d investigatio n o f employmen t accident s sustaine d b y handicraftsme n an d apprentices . (Ibid. )",,,41,,"3 0  Ma y   Ordinanc e  No .  6  o f  th e  Ministe r  o f  Ligh t  Industry ,  respectin g  th e  reportin g  an d  investigatio n  o f  employmen t  accident s  sustaine d  b y  handicraftsme n  an d  apprentices .  (Ibid. )  "
HUNGAR Y  ),,"4 Jun e Ordinanc e No . 2 0 o f th e Ministe r o f Agricultur e an d Food , t o protec t th e healt h an d safet y o f worker s belongin g t o productio n co-operatives . (Ibid. , 4 June )",,,41,,"4  Jun e   Ordinanc e  No .  2 0  o f  th e  Ministe r  o f  Agricultur e  an d  Food ,  t o  protec t  th e  healt h  an d  safet y  o f  worker s  belongin g  t o  productio n  co-operatives .  (Ibid. ,  4  June )  "
HUNGAR Y  ),,"3 0 Jun e Legislativ e Ordinanc e No . 19 , t o amen d Legislativ e Ordinanc e No . 3 9 o f 195 5 x respectin g workers ' sicknes s insuranc e [amend s ss . 1 1 (sic k pay ) an d 2 8 (appeals)] . (Ibid. , 3 0 June )",,,41,,"3 0  Jun e   Legislativ e  Ordinanc e  No .  19 ,  t o  amen d  Legislativ e  Ordinanc e  No .  3 9  o f  195 5  x  respectin g  workers '  sicknes s  insuranc e  [amend s  ss .  1 1  (sic k  pay )  an d  2 8  (appeals)] .  (Ibid. ,  3 0  June )  "
HUNGAR Y  ),,"3 0 Jun e Legislativ e Ordinanc e No . 20 , t o amen d Legislativ e Ordinanc e No . 6 o f 1 4 Mar . 196 4 respectin g th e unificatio n o f th e socia l insuranc e scheme . (Ibid. )",,,41,,"3 0  Jun e   Legislativ e  Ordinanc e  No .  20 ,  t o  amen d  Legislativ e  Ordinanc e  No .  6  o f  1 4  Mar .  196 4  respectin g  th e  unificatio n  o f  th e  socia l  insuranc e  scheme .  (Ibid. )  "
HUNGAR Y  ),,"3 0 Jun e Governmen t Ordinanc e No . 23 , t o amen d Ordinanc e No . 7 1 o f 3 1 Dec . 195 5 o f th e Counci l o f Minister s mad e unde r Legislativ e Ordinanc e No . 3 9 o f 195 5 * respectin g workers ' sicknes s insurance . (Ibid. )",,,41,,"3 0  Jun e   Governmen t  Ordinanc e  No .  23 ,  t o  amen d  Ordinanc e  No .  7 1  o f  3 1  Dec .  195 5  o f  th e  Counci l  o f  Minister s  mad e  unde r  Legislativ e  Ordinanc e  No .  3 9  o f  195 5  *  respectin g  workers '  sicknes s  insurance .  (Ibid. )  "
HUNGAR Y  ),,"3 0 Jun e Governmen t Ordinanc e No . 24 , t o amen d Governmen t Ordinanc e No . 1 6 o f 1 9 Jul y 196 4 mad e unde r Legislativ e Ordinanc e No . 6 o f 1 4 Mar . 196 4 respectin g th e unificatio n o f th e socia l insuranc e scheme . (Ibid. )",,,41,,"3 0  Jun e   Governmen t  Ordinanc e  No .  24 ,  t o  amen d  Governmen t  Ordinanc e  No .  1 6  o f  1 9  Jul y  196 4  mad e  unde r  Legislativ e  Ordinanc e  No .  6  o f  1 4  Mar .  196 4  respectin g  th e  unificatio n  o f  th e  socia l  insuranc e  scheme .  (Ibid. )  "
HUNGAR Y  ),,"3 0 Jun e Governmen t Ordinanc e No . 25 , t o amen d Governmen t Ordinanc e No . 6 7 o f 2 4 Dec . 195 8 respectin g th e workers ' old-ag e insuranc e scheme . (Ibid. )",,,41,,"3 0  Jun e   Governmen t  Ordinanc e  No .  25 ,  t o  amen d  Governmen t  Ordinanc e  No .  6 7  o f  2 4  Dec .  195 8  respectin g  th e  workers '  old-ag e  insuranc e  scheme .  (Ibid. )  "
HUNGAR Y  ),,"3 0 Jun e Governmen t Ordinanc e No . 26 , t o amen d Governmen t Ordinanc e No . 3 0 o f 2 4 Dec . 196 6 mad e unde r Legislativ e Ordinanc e No . 3 0 o f 2 4 Dec . 196 6 respectin g compulsor y mutua l old-ag e insuranc e fo r member s o f agricultura l productio n co-operatives . (Ibid. )",,,41,,"3 0  Jun e   Governmen t  Ordinanc e  No .  26 ,  t o  amen d  Governmen t  Ordinanc e  No .  3 0  o f  2 4  Dec .  196 6  mad e  unde r  Legislativ e  Ordinanc e  No .  3 0  o f  2 4  Dec .  196 6  respectin g  compulsor y  mutua l  old-ag e  insuranc e  fo r  member s  o f  agricultura l  productio n  co-operatives .  (Ibid. )  "
HUNGAR Y  ),,"3 0 Jun e Regulatio n No . 3 o f th e Nationa l Counci l o f Trad e Unions , t o amen d Regulatio n No . 6 o f 3 1 Dec . 195 5 mad e unde r Ordinanc e No . 7 1 o f 3 1 Dec . 195 5 o f th e Counci l o f Minister s respectin g workers ' sicknes s insurance . (Ibid. )",,,41,,"3 0  Jun e   Regulatio n  No .  3  o f  th e  Nationa l  Counci l  o f  Trad e  Unions ,  t o  amen d  Regulatio n  No .  6  o f  3 1  Dec .  195 5  mad e  unde r  Ordinanc e  No .  7 1  o f  3 1  Dec .  195 5  o f  th e  Counci l  o f  Minister s  respectin g  workers '  sicknes s  insurance .  (Ibid. )  "
HUNGAR Y  ),,"3 0 Jun e Regulatio n No . 4 o f th e Nationa l Counci l o f Trad e Unions , t o amen d Regulatio n No . 2 o f 1 9 Jul y 196 4 respectin g th e unificatio n o f th e socia l insuranc e scheme . (Ibid. )",,,41,,"3 0  Jun e   Regulatio n  No .  4  o f  th e  Nationa l  Counci l  o f  Trad e  Unions ,  t o  amen d  Regulatio n  No .  2  o f  1 9  Jul y  196 4  respectin g  th e  unificatio n  o f  th e  socia l  insuranc e  scheme .  (Ibid. )  "
HUNGAR Y  ),,"3 0 Jun e Regulatio n No . 5 o f th e Nationa l Counci l o f Trad e Unions , t o amen d Ordinanc e No . 5 o f 8 Ma y 195 9 o f th e Ministe r o f Labou r respectin g th e workers ' old-ag e insuranc e scheme . (Ibid. )",,,41,,"3 0  Jun e   Regulatio n  No .  5  o f  th e  Nationa l  Counci l  o f  Trad e  Unions ,  t o  amen d  Ordinanc e  No .  5  o f  8  Ma y  195 9  o f  th e  Ministe r  o f  Labou r  respectin g  th e  workers '  old-ag e  insuranc e  scheme .  (Ibid. )  "
HUNGAR Y  ),,"3 0 Jun e Regulatio n No . 6 o f th e Nationa l Counci l o f Trad e Unions , t o amen d certai n provision s o f Regulatio n No . 6 o f 2 4 Dec . 196 6 respectin g compulsor y mutua l old-ag e insuranc e fo r member s o f agricultura l productio n co-operatives . (Ibid. )",,,41,,"3 0  Jun e   Regulatio n  No .  6  o f  th e  Nationa l  Counci l  o f  Trad e  Unions ,  t o  amen d  certai n  provision s  o f  Regulatio n  No .  6  o f  2 4  Dec .  196 6  respectin g  compulsor y  mutua l  old-ag e  insuranc e  fo r  member s  o f  agricultura l  productio n  co-operatives .  (Ibid. )  "
HUNGAR Y  ),,"1 1 Aug . Ordinanc e No . 6 o f th e Ministe r o f Education , respectin g appren - tice s followin g daytim e courses . (Ibid. , 1 1 Aug. )",,,41,,"1 1  Aug .   Ordinanc e  No .  6  o f  th e  Ministe r  o f  Education ,  respectin g  appren - tice s  followin g  daytim e  courses .  (Ibid. ,  1 1  Aug. )  "
HUNGAR Y  ),,1 L.S . 1955—Hun . 1 . — 5 1 —,,,41,,1  L.S .  1955—Hun .  1 .  —  5 1  —  
HUNGAR Y  ),,"2 7 Nov . Governmen t Ordinanc e No . 42 , t o amen d Governmen t Ordinanc e No . 1 6 o f 1 Jun e 196 6 respectin g famil y allowances . (Ibid. , 2 7 Nov. )",,,42,,"2 7  Nov .   Governmen t  Ordinanc e  No .  42 ,  t o  amen d  Governmen t  Ordinanc e  No .  1 6  o f  1  Jun e  196 6  respectin g  famil y  allowances .  (Ibid. ,  2 7  Nov. )  "
HUNGAR Y  ),,"4 Dec . Ordinanc e No . 6 o f th e Ministe r o f Educatio n an d th e Ministe r o f Commerce , respectin g th e workin g condition s an d wage s o f musi - cians , singer s an d performers . (Ibid. , 4 Dec. )",,,42,,"4  Dec .   Ordinanc e  No .  6  o f  th e  Ministe r  o f  Educatio n  an d  th e  Ministe r  o f  Commerce ,  respectin g  th e  workin g  condition s  an d  wage s  o f  musi - cians ,  singer s  an d  performers .  (Ibid. ,  4  Dec. )  "
HUNGAR Y  ),,"1 4 Dec . Ordinanc e No . 4 5 o f th e Ministe r o f Agricultur e an d Food , res - pectin g th e occupationa l safet y o f rura l worker s i n co-operatives . (Ibid. , 1 4 Dec. )",,,42,,"1 4  Dec .   Ordinanc e  No .  4 5  o f  th e  Ministe r  o f  Agricultur e  an d  Food ,  res - pectin g  th e  occupationa l  safet y  o f  rura l  worker s  i n  co-operatives .  (Ibid. ,  1 4  Dec. )  "
HUNGAR Y  ),,"1 8 Dec . Governmen t Ordinanc e No . 48 , t o amen d an d supplemen t Govern - men t Ordinanc e No . 6 7 o f 2 4 Dec . 195 8 respectin g old-ag e pension s an d retirement . (Ibid. , 1 8 Dec. )",,,42,,"1 8  Dec .   Governmen t  Ordinanc e  No .  48 ,  t o  amen d  an d  supplemen t  Govern - men t  Ordinanc e  No .  6 7  o f  2 4  Dec .  195 8  respectin g  old-ag e  pension s  an d  retirement .  (Ibid. ,  1 8  Dec. )  "
HUNGAR Y  ),,"2 1 Dec . Regulatio n No . 1 1 o f th e Nationa l Counci l o f Trad e Unions , t o amen d an d supplemen t Ordinanc e No . 5 o f 8 Ma y 195 9 o f th e Ministe r o f Labou r respectin g old-ag e pension s an d retirement . (Ibid. , 2 1 Dec. )",,,42,,"2 1  Dec .   Regulatio n  No .  1 1  o f  th e  Nationa l  Counci l  o f  Trad e  Unions ,  t o  amen d  an d  supplemen t  Ordinanc e  No .  5  o f  8  Ma y  195 9  o f  th e  Ministe r  o f  Labou r  respectin g  old-ag e  pension s  an d  retirement .  (Ibid. ,  2 1  Dec. )  "
HUNGAR Y  ),,"2 1 Dec . Regulatio n No . 1 2 o f th e Nationa l Counci l o f Trad e Unions , respectin g th e amoun t o f th e old-age , disabilit y an d survivors ' benefit s payabl e t o rura l worker s o n th e basi s o f th e lengt h o f thei r membershi p o f rura l co-operatives . (Ibid. )",,,42,,"2 1  Dec .   Regulatio n  No .  1 2  o f  th e  Nationa l  Counci l  o f  Trad e  Unions ,  respectin g  th e  amoun t  o f  th e  old-age ,  disabilit y  an d  survivors '  benefit s  payabl e  t o  rura l  worker s  o n  th e  basi s  o f  th e  lengt h  o f  thei r  membershi p  o f  rura l  co-operatives .  (Ibid. )  "
INDI A,,1 6 Mar,,,42,,1 6  Mar .  
INDI A,,1 9 Apr,,,42,,1 9  Apr .  
INDI A,,1 6 Ma y,,,42,,1 6  Ma y  
INDI A,,1 3 Sep,,,42,,1 3  Sep .  
INDI A,,2 8 Dec,,,42,,2 8  Dec .  
INDI A,,2 9 Dec,,,42,,2 9  Dec .  
