country,region,text,date,year,page,extracted_date,full_text
CANADA,,"Proclamation to appoint 20 February 1945 for bringing into force the Veterans Insurance Act (8 Geo. VI, ch. 49). (C.G., 3 March, p. 895)",13.2.,1945,21,Feb 13,"Feb. 13 Proclamation to appoint 20 February 1945 for bringing into force the Veterans Insurance Act (8 Geo. VI, ch. 49). (C.G., 3 March, p. 895) "
CANADA,,"Order in Council P.C. 127/1111 amending the regulations govern- ing the payment of compensation to seamen for loss of effects, etc. (C.W.O.R., Vol. I, p. 340)",21.2.,1945,21,Feb 21,"Feb. 21 Order in Council P.C. 127/1111 amending the regulations govern- ing the payment of compensation to seamen for loss of effects, etc. (C.W.O.R., Vol. I, p. 340) "
CANADA,,"Order in Council P.C. 26/1647 re amendment of reciprocal agree- ments with Belgium, Greece, the Netherlands, Norway, Poland and Yugoslavia providing for payment of compensation to merchant seaman. (C.W.O.R., Vol. I, p. 452)",9.3.,1945,21,Mar 9,"Mar. 9 Order in Council P.C. 26/1647 re amendment of reciprocal agree- ments with Belgium, Greece, the Netherlands, Norway, Poland and Yugoslavia providing for payment of compensation to merchant seaman. (C.W.O.R., Vol. I, p. 452) "
CANADA,,"Order in Council P.C. 2796: the National Selective Service Civilian Regulations. (C.W.O.R., Vol. II, p. 195) Can. 1",24.4.,1945,21,Apr 24,"Apr. 24 Order in Council P.C. 2796: the National Selective Service Civilian Regulations. (C.W.O.R., Vol. II, p. 195) Can. 1 "
CANADA,,"Order in Council P.C. 3589 amending [section 86 of] the Un- employment Insurance Act, 1940 28 [see Index II, p. 4]. (C.G., 2 June, p. 2412)",17.5.,1945,21,May 17,"May 17 Order in Council P.C. 3589 amending [section 86 of] the Un- employment Insurance Act, 1940 28 [see Index II, p. 4]. (C.G., 2 June, p. 2412) "
CANADA,,"Order in Council P.C. 3590 extending Part II of the Unemploy- ment Insurance Act to employment in lumbering and logging. (C.G., 2 June, p. 2413)",17.5.,1945,21,May 17,"May 17 Order in Council P.C. 3590 extending Part II of the Unemploy- ment Insurance Act to employment in lumbering and logging. (C.G., 2 June, p. 2413) "
CANADA,,"Order in Council P.C. 3757 amending the Post-Discharge Re- establishment Order [of 13 July 1944]2% (C.W.O.R., Vol. II, p. 481)",29.5.,1945,21,May 29,"May 29 Order in Council P.C. 3757 amending the Post-Discharge Re- establishment Order [of 13 July 1944]2% (C.W.O.R., Vol. II, p. 481) "
CANADA,,"Order in Council 4405 to make regulations pursuant to the Income War Tax Act with respect to Family Allowances. (C.G., 30 June, p. 2852)",20.6.,1945,21,June 20,"June 20 Order in Council 4405 to make regulations pursuant to the Income War Tax Act with respect to Family Allowances. (C.G., 30 June, p. 2852) "
CANADA,,"Order in Council P.C. 4274 to amend the National Selective Service Civilian Regulations [Regulations of 24 April 1945]. (C.W.O.R., Vol. I, p. 625)",22.6.,1945,21,June 22,"June 22 Order in Council P.C. 4274 to amend the National Selective Service Civilian Regulations [Regulations of 24 April 1945]. (C.W.O.R., Vol. I, p. 625) "
CANADA,,"Order in Council P.C. 4755: The Merchant Seamen Compensa- tion Regulations, 1945. (C.W.O.R., Vol. III, p. 119)",17.7.,1945,21,July 17,"July 17 Order in Council P.C. 4755: The Merchant Seamen Compensa- tion Regulations, 1945. (C.W.O.R., Vol. III, p. 119) "
CANADA,,"Order in Council P.C. 5324 extending provisions of ‘“ The Re- instatement in Civil Employment Act, 1942 ” to members of the Forces of any of the United Nations. (C.W.O.R., Vol. II], p. 196)",2.8.,1945,21,Aug 2,"Aug. 2. Order in Council P.C. 5324 extending provisions of ‘“ The Re- instatement in Civil Employment Act, 1942 ” to members of the Forces of any of the United Nations. (C.W.O.R., Vol. II], p. 196) "
CANADA,,"Order in Council No. 5093 establishing the Family Allowances Regulations [amended by Order in Council 6588 of 6 November 1945]. (C.G., 25 August, p. 3711, and 17 November, p. 5158)",3.8.,1945,21,Aug 3,"Aug. 3 Order in Council No. 5093 establishing the Family Allowances Regulations [amended by Order in Council 6588 of 6 November 1945]. (C.G., 25 August, p. 3711, and 17 November, p. 5158) "
CANADA,,"Order in Council 5562 amending the Unemployment Insurance Contribution Regulations [P.C. 6952 of 3 September 1943} [further amended by Order in Council 5664 of 4 September 1945]. (C.G., 8 September, p. 3914; 22 September, p. 4216)",21.8.,1945,21,Aug 21,"Aug. 21 Order in Council 5562 amending the Unemployment Insurance Contribution Regulations [P.C. 6952 of 3 September 1943} [further amended by Order in Council 5664 of 4 September 1945]. (C.G., 8 September, p. 3914; 22 September, p. 4216) "
CANADA,,"C.W.O.R. = Canadian War Orders and Regulations, 1945",,,21,,"C.W.O.R. = Canadian War Orders and Regulations, 1945. "
CANADA,,"C.G. = The Canada Gazette. 27 L.S. 1944 (Can. 2, C). — 8 L.S. 1940 (Can. 2); 1943 (Can. 3). — 2 L.S. 1944 (Can. 4). — %° LS. 1944 (Can. 3)",,,21,,"C.G. = The Canada Gazette. 27 L.S. 1944 (Can. 2, C). — 8 L.S. 1940 (Can. 2); 1943 (Can. 3). — 2 L.S. 1944 (Can. 4). — %° LS. 1944 (Can. 3). "
CANADA,,4945—Index II — 22 —,,,22,,4945—Index II — 22 — 
CANADA DOMINION,,"Order in Council P.C. 342/5720 amending the Merchant Seamen War Service Bonus Order, 1944 [P.C. 149/2705 of 18 April 1944]. (C.W.O.R., Vol. III, p. 306)",24.8.,1945,22,Aug 24,"Aug. 24 Order in Council P.C. 342/5720 amending the Merchant Seamen War Service Bonus Order, 1944 [P.C. 149/2705 of 18 April 1944]. (C.W.O.R., Vol. III, p. 306) "
CANADA DOMINION,,"Order in Council P.C. 5933 amending the Post-Discharge Re- establishment Order [P.C. 5210 of 13 July 1944]2°. [Further amended by P.C. 7224 of 4 December 1945]. (C.W.O.R., Vol. IT, p. 418; Vol. IV, p. 310)",7.9.,1945,22,Sep 7,"Sep. 7 Order in Council P.C. 5933 amending the Post-Discharge Re- establishment Order [P.C. 5210 of 13 July 1944]2°. [Further amended by P.C. 7224 of 4 December 1945]. (C.W.O.R., Vol. IT, p. 418; Vol. IV, p. 310) "
CANADA DOMINION,,"Order in Council P.C. 20/6173 re preference in appointment to the Civil Service of persons who have been on active service overseas. (C.W.O.R., Vol. III, p. 505)",21.9.,1945,22,Sep 21,"Sep. 21. Order in Council P.C. 20/6173 re preference in appointment to the Civil Service of persons who have been on active service overseas. (C.W.O.R., Vol. III, p. 505) "
CANADA DOMINION,,"Order in Council P.C. 6482 authorising the appointment of indus- trial disputes inquiry commissions to investigate situations likely to interfere with the transition to peacetime economy. (C.W.O.R., Vol. IV, p. 60)",11.10.,1945,22,Oct 11,"Oct. 11 Order in Council P.C. 6482 authorising the appointment of indus- trial disputes inquiry commissions to investigate situations likely to interfere with the transition to peacetime economy. (C.W.O.R., Vol. IV, p. 60) "
CANADA DOMINION,,"Order in Council P.C. 6599 authorizing agreements with the Provinces under the Vocational Training Co-ordination Act, 1942. (C.W.O.R., Vol. IV, p. 116)",25.10.,1945,22,Oct 25,"Oct. 25 Order in Council P.C. 6599 authorizing agreements with the Provinces under the Vocational Training Co-ordination Act, 1942. (C.W.O.R., Vol. IV, p. 116) "
CANADA DOMINION,,"Order in Council 7128 re Masters’ and Mates’ Certificates of competency and service. (C.G., 22 December, p. 5896)",4.12.,1945,22,Dec 4,"Dec. 4 Order in Council 7128 re Masters’ and Mates’ Certificates of competency and service. (C.G., 22 December, p. 5896) "
CANADA DOMINION,,"An Act to provide rehabilitation allowances for veterans. 9 & 10 Geo. VI, ch. 35. The Veterans Rehabilitation Act",18.12.,1945,22,Dec 18,"Dec. 18 An Act to provide rehabilitation allowances for veterans. 9 & 10 Geo. VI, ch. 35. The Veterans Rehabilitation Act. "
CANADA DOMINION,,Dec. 341. Order in Council P.C. 7430 amending the National Selective Service Civilian Regulations. PROVINCES,,,22,,Dec. 341. Order in Council P.C. 7430 amending the National Selective Service Civilian Regulations. PROVINCES 
CANADA DOMINION,Alberta,"Female Minimum Wage Order No. 16 (A.G., 28 February, p. 172)",28.2.,1945,22,Feb 28,"Feb. 28 Female Minimum Wage Order No. 16 (A.G., 28 February, p. 172) "
CANADA DOMINION,Alberta,"An Act to amend the Hours of Work Act [R.S.A. 1942, ch. 279]. 1945, ch. 62",28.3.,1945,22,Mar 28,"Mar. 28 An Act to amend the Hours of Work Act [R.S.A. 1942, ch. 279]. 1945, ch. 62. "
CANADA DOMINION,Alberta,"An Act to amend the Male Minimum Wage Act [R.S.A. 1942, ch. 282]. 1945, ch. 64",28.3.,1945,22,Mar 28,"Mar. 28 An Act to amend the Male Minimum Wage Act [R.S.A. 1942, ch. 282]. 1945, ch. 64. "
CANADA DOMINION,Alberta,"An Act to amend the Female Minimum Wage Act [R.S.A. 1942, ch. 283]. 1945, ch. 65",28.3.,1945,22,Mar 28,"Mar. 28 An Act to amend the Female Minimum Wage Act [R.S.A. 1942, ch. 283]. 1945, ch. 65. "
CANADA DOMINION,Alberta,"Order No. 1 under the Labour Welfare Act, 1943 [holidays with pay in mining]. (A.G., 30 April 1945, p. 441)",29.3.,1945,22,Mar 29,"Mar. 29 Order No. 1 under the Labour Welfare Act, 1943 [holidays with pay in mining]. (A.G., 30 April 1945, p. 441) "
CANADA DOMINION,Alberta,"An Act to amend the Industrial Conciliation and Arbitration Act [R.S.A. 1942, ch. 280]. 1945, ch. 63",6.4.,1945,22,Apr 6,"Apr. 6 An Act to amend the Industrial Conciliation and Arbitration Act [R.S.A. 1942, ch. 280]. 1945, ch. 63. "
CANADA DOMINION,Alberta,"An Act to amend the Mothers’ Allowance Act [R.S.A. 1942, ch. 302]. 1945, ch. 68",6.4.,1945,22,Apr 6,"Apr. 6 An Act to amend the Mothers’ Allowance Act [R.S.A. 1942, ch. 302]. 1945, ch. 68. "
CANADA DOMINION,Alberta,"An Act to regulate the working of coal mines [age and health of employees; hours of employment; wages; qualifications required for certificates]. 1945, ch. 8. The Coal Mines Regula- tion Act",6.4.,1945,22,Apr 6,"Apr. 6 An Act to regulate the working of coal mines [age and health of employees; hours of employment; wages; qualifications required for certificates]. 1945, ch. 8. The Coal Mines Regula- tion Act. "
CANADA DOMINION,Alberta,"Order in Council 1432-45 to make Regulations pursuant to the Coal Mines Regulation Act [Statutes 1945, ch. 8]. (A.G., 31 August, p. 937)",27.8.,1945,22,Aug 27,"Aug. 27 Order in Council 1432-45 to make Regulations pursuant to the Coal Mines Regulation Act [Statutes 1945, ch. 8]. (A.G., 31 August, p. 937) "
CANADA DOMINION,Alberta,"C.W.O.R. = Canadian War Orders and Regulations, 1945",,,22,,"C.W.O.R. = Canadian War Orders and Regulations, 1945. "
CANADA DOMINION,Alberta,C.G. = The Canada Gazette,,,22,,C.G. = The Canada Gazette. 
CANADA DOMINION,Alberta,A.G. = The Alberta Gazette,,,22,,A.G. = The Alberta Gazette. 
CANADA DOMINION,Alberta,R.S.A. = Revised Statutes of Alberta. 23 — 1945—Index II,,,22,,R.S.A. = Revised Statutes of Alberta. 23 — 1945—Index II 
CANADA DOMINION,British Columbia,"Regulation under the Workmen’s Compensation Act [R.S.B.C. 1936, ch. 312]: changes in Schedule of Industrial Diseases adds dermatitis]. (B.C.G., 11 January, p. 91)",9.1.,1945,23,Jan 9,"Jan. 9 Regulation under the Workmen’s Compensation Act [R.S.B.C. 1936, ch. 312]: changes in Schedule of Industrial Diseases adds dermatitis]. (B.C.G., 11 January, p. 91) "
CANADA DOMINION,British Columbia,"Regulations under the Workmen’s Compensation Act [R.S.B.C. 1936, ch. 312] to amend the Schedule of Industrial Diseases adds cutaneous circulatory or blood-cell lesions or physiological endocrine change]. (B.C.G., 29 March, p. 545)",26.3.,1945,23,Mar 26,"Mar. 26 Regulations under the Workmen’s Compensation Act [R.S.B.C. 1936, ch. 312] to amend the Schedule of Industrial Diseases adds cutaneous circulatory or blood-cell lesions or physiological endocrine change]. (B.C.G., 29 March, p. 545) "
CANADA DOMINION,British Columbia,"An Act to amend the “ Protection of Children Act” [Statutes 1943, ch. 5]. 1945, ch. 9. Protection of Children Act Amend- ment Act, 1945",28.3.,1945,23,Mar 28,"Mar. 28 An Act to amend the “ Protection of Children Act” [Statutes 1943, ch. 5]. 1945, ch. 9. Protection of Children Act Amend- ment Act, 1945. "
CANADA DOMINION,British Columbia,"An Act to amend the Old-Age Pension Act [R.S.B.C. 1936, ch. 208]. 1945, ch. 56. Old-Age Pension Act Amendment Act, 1945",28.3.,1945,23,Mar 28,"Mar. 28 An Act to amend the Old-Age Pension Act [R.S.B.C. 1936, ch. 208]. 1945, ch. 56. Old-Age Pension Act Amendment Act, 1945. "
CANADA DOMINION,British Columbia,"Regulations made pursuant to section 39 of the Factories Act R.8.B.C. 1936, ch. 92] governing the installation, operation and maintenance of man-lifts. (B.C.G., 17 May, p. 846)",11.5.,1945,23,May 11,"May 11 Regulations made pursuant to section 39 of the Factories Act R.8.B.C. 1936, ch. 92] governing the installation, operation and maintenance of man-lifts. (B.C.G., 17 May, p. 846) "
CANADA DOMINION,British Columbia,"Regulations under section 39 of the Factories Act [R.8.B.C. 1936, ch. 92] re female factory employees. (B.C.G., 17 May, p. 847) 1.8.S., Vol. XXII, No. 1, p. 19",11.5.,1945,23,May 11,"May 11 Regulations under section 39 of the Factories Act [R.8.B.C. 1936, ch. 92] re female factory employees. (B.C.G., 17 May, p. 847) 1.8.S., Vol. XXII, No. 1, p. 19 "
CANADA DOMINION,British Columbia,"General Accident-Prevention Regulations, under the Workmen’s Compensation Act [R.S.B.C., 1936, ch. 312]. (B.C.G., 20 Sep- tember, p. 1877) I.S.S. Vol. XXIi, No. 2, p. 56",25.6.,1945,23,June 25,"June 25 General Accident-Prevention Regulations, under the Workmen’s Compensation Act [R.S.B.C., 1936, ch. 312]. (B.C.G., 20 Sep- tember, p. 1877) I.S.S. Vol. XXIi, No. 2, p. 56 "
CANADA DOMINION,British Columbia,"Regulations under the Workmen’s Compensation Act [R.S.B.C., 1936, ch. 312] [varies Schedule of Industrial Diseases]. (B.C.G., 41 November, p. 2203)",24.10.,1945,23,Oct 24,"Oct. 24 Regulations under the Workmen’s Compensation Act [R.S.B.C., 1936, ch. 312] [varies Schedule of Industrial Diseases]. (B.C.G., 41 November, p. 2203) "
CANADA DOMINION,Manitoba,"An Act to amend the Child Welfare Act [R.S.M. 1940, ch. 32]. 1945, ch. 4",23.3.,1945,23,Mar 23,"Mar. 23 An Act to amend the Child Welfare Act [R.S.M. 1940, ch. 32]. 1945, ch. 4. "
CANADA DOMINION,Manitoba,"An Act to amend the Minimum Wage Act[R.S.M. 1940, ch. 138]. 1945, ch. 39",23.3.,1945,23,Mar 23,"Mar. 23. An Act to amend the Minimum Wage Act[R.S.M. 1940, ch. 138]. 1945, ch. 39. "
CANADA DOMINION,Manitoba,"An Act to amend the Old-Age and Blind Persons’ Pensions Act R.S.M. 1940, ch. 154]. 1945, ch. 40",7.4.,1945,23,Apr 7,"Apr. 7 An Act to amend the Old-Age and Blind Persons’ Pensions Act R.S.M. 1940, ch. 154]. 1945, ch. 40. "
CANADA DOMINION,Manitoba,"An Act to amend the Workmen’s Compensation Act({R.S.M. 1940, ch. 239]. 1945, ch. 70",7.4.,1945,23,Apr 7,"Apr. 7. An Act to amend the Workmen’s Compensation Act({R.S.M. 1940, ch. 239]. 1945, ch. 70. "
CANADA DOMINION,Manitoba,"Regulation 57 governing the operation of Mines in Manitoba safety and hygiene]. (M.G., 22 December, p. 294) ec. 27. Regulation 83 under the Workmen’s Compensation Act: indus- tries added; occupational diseases added; first-aid requirements. (M.G., 5 January, p. 35)",12.12.,1945,23,Dec 12,"Dec. 12 Regulation 57 governing the operation of Mines in Manitoba safety and hygiene]. (M.G., 22 December, p. 294) ec. 27. Regulation 83 under the Workmen’s Compensation Act: indus- tries added; occupational diseases added; first-aid requirements. (M.G., 5 January, p. 35) "
CANADA DOMINION,New Brunswick,"An Act to repeal the Labour Relations and Industrial Relations Act [2 Geo. VI, 1938, ch. 68]94. 1945, ch. 40",7.4.,1945,23,Apr 7,"Apr. 7. An Act to repeal the Labour Relations and Industrial Relations Act [2 Geo. VI, 1938, ch. 68]94. 1945, ch. 40. "
CANADA DOMINION,New Brunswick,"An Act respecting labour relations. 1945, ch. 41. Labour Rela- tions Act, 1945",7.4.,1945,23,Apr 7,"Apr. 7. An Act respecting labour relations. 1945, ch. 41. Labour Rela- tions Act, 1945. "
CANADA DOMINION,New Brunswick,"An Act respecting minimum wages. 1945, ch. 42. Minimum Wage Act, 1945",7.4.,1945,23,Apr 7,"Apr. 7 An Act respecting minimum wages. 1945, ch. 42. Minimum Wage Act, 1945. "
CANADA DOMINION,New Brunswick,R.S.B.C. = Revised Statutes of British Columbia,,,23,,R.S.B.C. = Revised Statutes of British Columbia. 
CANADA DOMINION,New Brunswick,B.C.G. = The British Columbia Gazette,,,23,,B.C.G. = The British Columbia Gazette. 
CANADA DOMINION,New Brunswick,R.S.M. = Revised Statutes of Manitoba. _,,,23,,R.S.M. = Revised Statutes of Manitoba. _ 
CANADA DOMINION,New Brunswick,M.G. = The Manitoba Gazette. 31 L.S. 1938 (Can. 5),,,23,,M.G. = The Manitoba Gazette. 31 L.S. 1938 (Can. 5). 
CANADA DOMINION,New Brunswick,1945—Index II — 24 —,,,24,,1945—Index II — 24 — 
CANADA DOMINION,Nova Scotia,"An Act respecting a minimum wage for men. 1945, ch. 21. Male Minimum Wage Act",29.3.,1945,24,Mar 29,"Mar. 29 An Act respecting a minimum wage for men. 1945, ch. 21. Male Minimum Wage Act. "
CANADA DOMINION,Nova Scotia,"An Act to amend chapter 4 of the Acts of 1930, The Mothers’ Allowances Act. 1945, ch. 50",29.3.,1945,24,Mar 29,"Mar. 29 An Act to amend chapter 4 of the Acts of 1930, The Mothers’ Allowances Act. 1945, ch. 50. "
CANADA DOMINION,Nova Scotia,"An Act to amend chapter 4 of the Acts of 1937, The Appren- ticeship Act. 1945, ch. 57",29.3.,1945,24,Mar 29,"Mar. 29 An Act to amend chapter 4 of the Acts of 1937, The Appren- ticeship Act. 1945, ch. 57. "
CANADA DOMINION,Nova Scotia,"An Act to amend chapter 3 of the Acts of 1938, The Work- men’s Compensation Act. 1945, ch. 59",29.3.,1945,24,Mar 29,"Mar. 29 An Act to amend chapter 3 of the Acts of 1938, The Work- men’s Compensation Act. 1945, ch. 59. "
CANADA DOMINION,Ontario,"An Act to amend the Workmen’s Compensation Act [R.S.O. 1937, ch. 204]. 9 Geo. VI (first session), ch. 28. The Work- men’s Compensation Act Amendment Act, 1945",22.3.,1945,24,Mar 22,"Mar. 22 An Act to amend the Workmen’s Compensation Act [R.S.O. 1937, ch. 204]. 9 Geo. VI (first session), ch. 28. The Work- men’s Compensation Act Amendment Act, 1945. "
CANADA DOMINION,Prince Edward Island,"An Act respecting the right of employees to organize. 9 Geo. VI, ch. 13. The Trade Union Act",19.4.,1945,24,Apr 19,"Apr. 19 An Act respecting the right of employees to organize. 9 Geo. VI, ch. 13. The Trade Union Act. "
CANADA DOMINION,Prince Edward Island,"An Act to carry out the International Labour Convention (1937) concerning the minimum age for the admission of children to industrial employment. 9 Geo. VI, ch. 21. The Prince Edward Island Minimum Age for Industrial Employment (International Labour Convention) Act, 1945",19.4.,1945,24,Apr 19,"Apr. 19 An Act to carry out the International Labour Convention (1937) concerning the minimum age for the admission of children to industrial employment. 9 Geo. VI, ch. 21. The Prince Edward Island Minimum Age for Industrial Employment (International Labour Convention) Act, 1945. "
CANADA DOMINION,Quebec,"Family Allowance Act. 1945, ch. 6",22.2.,1945,24,Feb 22,"Feb. 22 Family Allowance Act. 1945, ch. 6. "
CANADA DOMINION,Quebec,"An Act to amend the Workmen’s Compensation Act [R.S.Q. 1941, ch. 160]. 9 Geo. VI, ch. 42",9.3.,1945,24,Mar 9,"Mar. 9 An Act to amend the Workmen’s Compensation Act [R.S.Q. 1941, ch. 160]. 9 Geo. VI, ch. 42. "
CANADA DOMINION,Quebec,"An Act to assist apprenticeship and the enhancing of human capital. 9 Geo. VI, ch. 41. Apprenticeship Assistance Act",24.5.,1945,24,May 24,"May 24 An Act to assist apprenticeship and the enhancing of human capital. 9 Geo. VI, ch. 41. Apprenticeship Assistance Act. "
CANADA DOMINION,Quebec,"An Act to amend the Labour Relations Act [R.S.Q. 1941, ch. 162 A]. 9 Geo. VI, ch. 44",24.5.,1945,24,May 24,"May 24 An Act to amend the Labour Relations Act [R.S.Q. 1941, ch. 162 A]. 9 Geo. VI, ch. 44. "
CANADA DOMINION,Saskatchewan,"An Act to amend the One Day’s Rest in Seven Act [R.S.S. ch. 306]. 1945, ch. 106",9.3.,1945,24,Mar 9,"Mar. 9 An Act to amend the One Day’s Rest in Seven Act [R.S.S. ch. 306]. 1945, ch. 106. "
CANADA DOMINION,Saskatchewan,"An Act to amend the Trade Union Act, 1944. 1945, ch. 108",9.3.,1945,24,Mar 9,"Mar. 9 An Act to amend the Trade Union Act, 1944. 1945, ch. 108. "
CANADA DOMINION,Saskatchewan,"An Act to amend the Department of Social Welfare Act, 1944. 1945, ch. 12",30.3.,1945,24,Mar 30,"Mar. 30 An Act to amend the Department of Social Welfare Act, 1944. 1945, ch. 12. "
CANADA DOMINION,Saskatchewan,"An Act to provide for Old-Age Pensions and pensions for certain blind persons. 1945, ch. 99",30.3.,1945,24,Mar 30,"Mar. 30 An Act to provide for Old-Age Pensions and pensions for certain blind persons. 1945, ch. 99. "
CANADA DOMINION,Saskatchewan,"An Act to amend the Child Welfare Act [R.5.S., ch. 278]. 1945, ch. 100",30.3.,1945,24,Mar 30,"Mar. 30 An Act to amend the Child Welfare Act [R.5.S., ch. 278]. 1945, ch. 100. "
CANADA DOMINION,Saskatchewan,"An Act to amend the Workmen’s Compensation Act [R.SS., ch. 302]. 1945, ch. 103",30.3.,1945,24,Mar 30,"Mar. 30 An Act to amend the Workmen’s Compensation Act [R.SS., ch. 302]. 1945, ch. 103. "
CANADA DOMINION,Saskatchewan,"An Act to amend the Minimum Wage Act [R.S.S., ch. 310]. 1945, ch. 107",30.3.,1945,24,Mar 30,"Mar. 30 An Act to amend the Minimum Wage Act [R.S.S., ch. 310]. 1945, ch. 107. "
CANADA DOMINION,Saskatchewan,"Order in Council 496/45 to make regulations under the Old-Age and Blind Persons’ Pensions Act, 1945. (S.G., 16 April, p. 3)",6.4.,1945,24,Apr 6,"Apr. 6 Order in Council 496/45 to make regulations under the Old-Age and Blind Persons’ Pensions Act, 1945. (S.G., 16 April, p. 3) "
CANADA DOMINION,Saskatchewan,"Order in Council 577/45 to make regulations re allowances. (S.G., 30 April, p. 6)",19.4.,1945,24,Apr 19,"Apr. 19 Order in Council 577/45 to make regulations re allowances. (S.G., 30 April, p. 6) "
CANADA DOMINION,Saskatchewan,R.S.0. = Revised Statutes of Ontario,,,24,,R.S.0. = Revised Statutes of Ontario. 
CANADA DOMINION,Saskatchewan,R.8.Q. = Revised Statutes of Quebec,,,24,,R.8.Q. = Revised Statutes of Quebec. 
CANADA DOMINION,Saskatchewan,R.S.S. = Revised Statutes of Saskatchewan,,,24,,R.S.S. = Revised Statutes of Saskatchewan 
CANADA DOMINION,Saskatchewan,8.G. = Saskatchewan Gazette. 25 — 1945—Index II TERRITORIES,,,24,,8.G. = Saskatchewan Gazette. 25 — 1945—Index II TERRITORIES 
CANADA DOMINION,Yukon Territory,"An Ordinance to provide for the protection of children. 19435, ch. 1",30.4.,1945,25,Apr 30,"Apr. 30 An Ordinance to provide for the protection of children. 19435, ch. 1. "
CHILE,,"Act No. 8067, to supplement Legislative Decree No. 178 of 1931 to ratify and consolidate the laws relating to labour ®. (D.O., 10 February, p. 285) Chile 1 (A)",23.1.,1945,25,Jan 23,"Jan. 23 Act No. 8067, to supplement Legislative Decree No. 178 of 1931 to ratify and consolidate the laws relating to labour ®. (D.O., 10 February, p. 285) Chile 1 (A) "
CHILE,,"Act No. 8082, to authorise the President to consolidate the Labour Code ® in a single text and to amend Act No. 7726 *. (D.O., 27 February, p. 417) Chile 1 (B)",29.1.,1945,25,Jan 29,"Jan. 29 Act No. 8082, to authorise the President to consolidate the Labour Code ® in a single text and to amend Act No. 7726 *. (D.O., 27 February, p. 417) Chile 1 (B) "
CHILE,,"Decree No. 191 to amend Decree No. 49 [of 13 January] 1943 respecting the conditions of employment of seamen. (D.O., 2 April, p. 669)",21.2.,1945,25,Feb 21,"Feb. 21 Decree No. 191 to amend Decree No. 49 [of 13 January] 1943 respecting the conditions of employment of seamen. (D.O., 2 April, p. 669) "
CHILE,,"Act No. 8114, to order that the text annexed to Official Com- munication No. 25 of 10 April 1945 of the Faculty of Juridical and Social Sciences in the University of Chile be regarded as the definitive text of the Labour Code. (D.O., 19 July, p. 1385)",16.4.,1945,25,Apr 16,"Apr. 16 Act No. 8114, to order that the text annexed to Official Com- munication No. 25 of 10 April 1945 of the Faculty of Juridical and Social Sciences in the University of Chile be regarded as the definitive text of the Labour Code. (D.O., 19 July, p. 1385) "
CHILE,,"Decree No. 385, to establish an Immigration Co-ordinating Commission. (D.O., 19 November, p. 1)",7.5.,1945,25,May 7,"May 7? Decree No. 385, to establish an Immigration Co-ordinating Commission. (D.O., 19 November, p. 1) "
CHILE,,"Decree No. 454, to approve the Agrarian Plan, to establish a Council for the said Plan and to prescribe the powers and duties of the said Council. (D.O., 9 June, p. 1120)",9.5.,1945,25,May 9,"May 9 Decree No. 454, to approve the Agrarian Plan, to establish a Council for the said Plan and to prescribe the powers and duties of the said Council. (D.O., 9 June, p. 1120) "
CHILE,,"Decree No. 627, to amend Decree No. 860 of [6 December] 1944 to issue regulations for the Superior Labour Council. (D.O., 9 August, p. 1505)",25.7.,1945,25,July 25,"July 25 Decree No. 627, to amend Decree No. 860 of [6 December] 1944 to issue regulations for the Superior Labour Council. (D.O., 9 August, p. 1505) "
CHILE,,"Act No. 8157, to amend Act No. 6812 to make an addition to section 158 of the Labour Code *. (D.O., 10 September, p. 1677} Chile 1 (C)",17.8.,1945,25,Aug 17,"Aug. 17. Act No. 8157, to amend Act No. 6812 to make an addition to section 158 of the Labour Code *. (D.O., 10 September, p. 1677} Chile 1 (C) "
CHILE,,"Decree No. 732 of the General Labour Directorate to correct certain errata in the official edition of the definitive text of the Labour Code. (D.O., 14 September, p. 1704)",3.9.,1945,25,Sep 3,"Sep. 3 Decree No. 732 of the General Labour Directorate to correct certain errata in the official edition of the definitive text of the Labour Code. (D.O., 14 September, p. 1704) "
