country,region,text,date,year,page,extracted_date,full_text
FRANCE,Togo,"Order No. 681-53/ITLS, to prescribe the transitional provisions respecting the grant of leave and travelling expenses to employed persons in Togo. (J.0.T. 16 Oct.)",26.9.,1953,19,Sep 26,"Sep. 26 Order No. 681-53/ITLS, to prescribe the transitional provisions respecting the grant of leave and travelling expenses to employed persons in Togo. (J.0.T. 16 Oct.) "
FRANCE,Togo,"Order No. 897-53/ITLS, establishing a labour court. (J.O.T. 1 Jan. 1954)",17.12.,1953,19,Dec 17,"Dec. 17 Order No. 897-53/ITLS, establishing a labour court. (J.O.T. 1 Jan. 1954) "
FRANCE,Tonisia,"Order of the Director of Public Works, to make general regulations respecting the working of mines and quarries. (Journal Officiel Tunisien, 17 Nov.)",12.10.,1953,19,Oct 12,"Oct. 12 Order of the Director of Public Works, to make general regulations respecting the working of mines and quarries. (Journal Officiel Tunisien, 17 Nov.) "
GERMANY (DEMOCRATIC REPUBLIC),,Ordinance respecting the examination of workers’ proposals and complaints. (G.D.D.R. 13 Feb.),6.2.,1953,19,Feb 6,Feb. 6 Ordinance respecting the examination of workers’ proposals and complaints. (G.D.D.R. 13 Feb.) 
GERMANY (DEMOCRATIC REPUBLIC),,Ordinance respecting inventions and suggestions for improvements in nation- alised industry. (G.D.D.R. 17 Feb.),6.2.,1953,19,Feb 6,Feb. 6 Ordinance respecting inventions and suggestions for improvements in nation- alised industry. (G.D.D.R. 17 Feb.) 
GERMANY (DEMOCRATIC REPUBLIC),,Ordinance respecting the general and specialised training of workers in the nationalised and equivalent undertakings. (G.D.D.R. 12 Mar.),5.3.,1953,19,Mar 5,Mar. 5 Ordinance respecting the general and specialised training of workers in the nationalised and equivalent undertakings. (G.D.D.R. 12 Mar.) 
GERMANY (DEMOCRATIC REPUBLIC),,Notification respecting a model contract of vocational training for the agri- cultural producers’ co-operatives. (G.D.D.R. 23 Mar.),23.3.,1953,19,Mar 23,Mar. 23 Notification respecting a model contract of vocational training for the agri- cultural producers’ co-operatives. (G.D.D.R. 23 Mar.) 
GERMANY (DEMOCRATIC REPUBLIC),,Ordinance respecting work and discipline on board seagoing ships (Seamen’s Ordinance). (G.D.D.R. 24 Apr.) Ger.D.R. 1,16.4.,1953,19,Apr 16,Apr. 16 Ordinance respecting work and discipline on board seagoing ships (Seamen’s Ordinance). (G.D.D.R. 24 Apr.) Ger.D.R. 1 
GERMANY (DEMOCRATIC REPUBLIC),,"Regulations No. 1, under s. 51 of the Labour Act 1 [conditions for receipt of social insurance benefit by self employed persons]. (G.D.D.R. 7 May)",28.4.,1953,19,Apr 28,"Apr. 28 Regulations No. 1, under s. 51 of the Labour Act 1 [conditions for receipt of social insurance benefit by self employed persons]. (G.D.D.R. 7 May) "
GERMANY (DEMOCRATIC REPUBLIC),,Ordinance respecting the reorganisation and functions of the labour courts. (G.D.D.R. 13 May) Ger.D.R. 2,30.4.,1953,19,Apr 30,Apr. 30 Ordinance respecting the reorganisation and functions of the labour courts. (G.D.D.R. 13 May) Ger.D.R. 2 
GERMANY (DEMOCRATIC REPUBLIC),,Ordinance to provide for the establishment of committees to deal with disputes relating to employment in the nationalised and equivalent undertak- ings and in administrative services. (G.D.D.R. 13 May) Ger.D.R. 3,30.4.,1953,19,Apr 30,Apr. 30 Ordinance to provide for the establishment of committees to deal with disputes relating to employment in the nationalised and equivalent undertak- ings and in administrative services. (G.D.D.R. 13 May) Ger.D.R. 3 
GERMANY (DEMOCRATIC REPUBLIC),,"Regulations No. 3, under the Ordinance respecting the safeguarding of the rights of the working people and the payment of remuneration to wage and salary earners?. (G.D.D.R. 29 May)",27.5.,1953,19,May 27,"May 27 Regulations No. 3, under the Ordinance respecting the safeguarding of the rights of the working people and the payment of remuneration to wage and salary earners?. (G.D.D.R. 29 May) "
GERMANY (DEMOCRATIC REPUBLIC),,Regulations under the Act respecting the protection of women and children and women’s rights 3. (G.D.D.R. 22 June),3.6.,1953,19,June 3,June 3 Regulations under the Act respecting the protection of women and children and women’s rights 3. (G.D.D.R. 22 June) . 
GERMANY (DEMOCRATIC REPUBLIC),,J.0.N.C. = Journal Officiel de la Nouvelle-Calddonie et Dépendances,,,19,,J.0.N.C. = Journal Officiel de la Nouvelle-Calddonie et Dépendances. 
GERMANY (DEMOCRATIC REPUBLIC),,J.0.T. = Journal Offictel du Territoire du Togo,,,19,,J.0.T. = Journal Offictel du Territoire du Togo. 
GERMANY (DEMOCRATIC REPUBLIC),,G.D.D.R. = Gesetzblatt der Deutschen Demokratischen Republik. 1 1.8. 1950 (Ger.D.R. 1). — 2 L.S. 1952 (Ger.D.R. 1). — ® L.S. 1950 (Ger.D.R. 4). 3 —,,,19,,G.D.D.R. = Gesetzblatt der Deutschen Demokratischen Republik. 1 1.8. 1950 (Ger.D.R. 1). — 2 L.S. 1952 (Ger.D.R. 1). — ® L.S. 1950 (Ger.D.R. 4). 3 — 
GERMANY (DEMOCRATIC REPUBLIC),,"Ordinance to amend the Ordinance (of 10 Aug. 1950] to improve the situation of mineworkers, engineering and commercial staff and the conditions of production in mining (greater wage and salary differentials]. (G.D.D.R. 27 June)",25.6.,1953,20,June 25,"June 25 Ordinance to amend the Ordinance (of 10 Aug. 1950] to improve the situation of mineworkers, engineering and commercial staff and the conditions of production in mining (greater wage and salary differentials]. (G.D.D.R. 27 June) "
GERMANY (DEMOCRATIC REPUBLIC),,Ordinance to reorganise voluntary insurance schemes within the social insurance system. (G.D.D.R. 26 June),25.6.,1953,20,June 25,June 25 Ordinance to reorganise voluntary insurance schemes within the social insurance system. (G.D.D.R. 26 June) 
GERMANY (DEMOCRATIC REPUBLIC),,Ordinance to amend the Ordinance (of 20 May 1952) respecting the safeguard- ing of the rights of workers and the payment of remuneration to wage and salary earners1 [time-and-one-half rate for Sunday work]. (G.D.D.R. 44 Aug.),6.8.,1953,20,Aug 6,Aug. 6 Ordinance to amend the Ordinance (of 20 May 1952) respecting the safeguard- ing of the rights of workers and the payment of remuneration to wage and salary earners1 [time-and-one-half rate for Sunday work]. (G.D.D.R. 44 Aug.) 
GERMANY (DEMOCRATIC REPUBLIC),,Ordinance to reorganise the handicraft representative bodies. (G.D.D.R. 31 Aug.),20.8.,1953,20,Aug 20,Aug. 20 Ordinance to reorganise the handicraft representative bodies. (G.D.D.R. 31 Aug.) 
GERMANY (DEMOCRATIC REPUBLIC),,"Ordinance to establish a Shipping Office [repeals the Ordinance of 2 Nov. 1950 respecting the engagement and discharge of seamen 2), (G.D.D.R. 31 Aug.)",20.8.,1953,20,Aug 20,"Aug. 20 Ordinance to establish a Shipping Office [repeals the Ordinance of 2 Nov. 1950 respecting the engagement and discharge of seamen 2), (G.D.D.R. 31 Aug.) "
GERMANY (DEMOCRATIC REPUBLIC),,"Regulations No. 1, under the Ordinance establishing a Shipping Office: Signing on and off. (G.D.D.R. 31 Aug.)",20.8.,1953,20,Aug 20,"Aug. 20 Regulations No. 1, under the Ordinance establishing a Shipping Office: Signing on and off. (G.D.D.R. 31 Aug.) "
GERMANY (DEMOCRATIC REPUBLIC),,"Regulations No. 3, under the Ordinance [of 25 Oct. 1951] respecting the protection of labour 5 [duration of midday rest]. (G.D.D.R. 15 Sep.)",4.9.,1953,20,Sep 4,"Sep. 4 Regulations No. 3, under the Ordinance [of 25 Oct. 1951] respecting the protection of labour 5 [duration of midday rest]. (G.D.D.R. 15 Sep.) "
GERMANY (DEMOCRATIC REPUBLIC),,"Ordinance to improve further the working and llving conditions of the workers, and to extend the rights of the trade unions. (G.D.D.R. 11 Dec.)",10.12.,1953,20,Dec 10,"Dec. 10 Ordinance to improve further the working and llving conditions of the workers, and to extend the rights of the trade unions. (G.D.D.R. 11 Dec.) "
GERMANY (DEMOCRATIC REPUBLIC),,"Regulations No. 2, under the Labour Act 4 [payment of social insurance contributions; repeal regs. of 28 Apr. 1953). (G.D.D.R. 6 Jan. 1954)",20.12.,1953,20,Dec 20,"Dec. 20 Regulations No. 2, under the Labour Act 4 [payment of social insurance contributions; repeal regs. of 28 Apr. 1953). (G.D.D.R. 6 Jan. 1954) "
GERMANY (DEMOCRATIC REPUBLIC),,Dec. 214. Direction as to the manning of merchant ships and ocean fishing vessels. (G.D.D.R. 14 Jan. 1954),,,20,,Dec. 214. Direction as to the manning of merchant ships and ocean fishing vessels. (G.D.D.R. 14 Jan. 1954) 
GERMANY (FEDERAL REPUBLIC),,Act respecting the employment of disabled persons. (B.G.B. 18 June) Ger.F.R. 1,16.6.,1953,20,June 16,June 16 Act respecting the employment of disabled persons. (B.G.B. 18 June) Ger.F.R. 1 
GERMANY (FEDERAL REPUBLIC),,"Act to amend and complete the provisions respecting unemployment insur- ance and unemployment assistance [amends the Act respecting employment exchanges and unemployment insurance 5 and the Act respecting the calcula- tion and amount of unemployment assistance benefit ¢), (B.G.B. 28 Aug.)",24.8.,1953,20,Aug 24,"Aug. 24 Act to amend and complete the provisions respecting unemployment insur- ance and unemployment assistance [amends the Act respecting employment exchanges and unemployment insurance 5 and the Act respecting the calcula- tion and amount of unemployment assistance benefit ¢), (B.G.B. 28 Aug.) "
GERMANY (FEDERAL REPUBLIC),,Labour Courts Act. (B.G.B. 4 Sep.) Ger.F.R. 2,3.9.,1953,20,Sep 3,Sep. 3 Labour Courts Act. (B.G.B. 4 Sep.) Ger.F.R. 2 
GERMANY (FEDERAL REPUBLIC),,Sep.17 Act to regulate the handicraft trades (Handicrafts Regulation Act). (B.G.B. 23 Sep.) Extracts: Ger.F.R. 3,,,20,,Sep.17 Act to regulate the handicraft trades (Handicrafts Regulation Act). (B.G.B. 23 Sep.) Extracts: Ger.F.R. 3 
GERMANY (FEDERAL REPUBLIC),,"Act to amend Titles I to IV, VII and X of the Trade Code. (B.G.B. 2 Oct.)",29.9.,1953,20,Sep 29,"Sep. 29 Act to amend Titles I to IV, VII and X of the Trade Code. (B.G.B. 2 Oct.) "
GREECE,,"Legislative Decree No. 2511, respecting the control of mass dismissals. (E.K,. 10 Aug.) Gr. 1",6.8.,1953,20,Aug 6,"Aug. 6 Legislative Decree No. 2511, respecting the control of mass dismissals. (E.K,. 10 Aug.) Gr. 1 "
GREECE,,"Legislative Decree No. 2652, to amend and supplement Act No. 1752 of 1951, respecting employment at sea. (E.K. 30 Oct.) Gr. 2",17.10.,1953,20,Oct 17,"Oct. 17 Legislative Decree No. 2652, to amend and supplement Act No. 1752 of 1951, respecting employment at sea. (E.K. 30 Oct.) Gr. 2 "
GREECE,,"Legislative Decree No. 2655, to amend and supplement Act No. 24112 of 1920, respecting notice of termination of the contract of employment. (E.K. 31 Oct.) Gr. 3",17.10.,1953,20,Oct 17,"Oct. 17 Legislative Decree No. 2655, to amend and supplement Act No. 24112 of 1920, respecting notice of termination of the contract of employment. (E.K. 31 Oct.) Gr. 3 "
GREECE,,"Legislative Decree No. 2656, respecting the organisation and supervision of the employment market. (H.K. 31 Oct.) Gr. 4",17.10.,1953,20,Oct 17,"Oct. 17 Legislative Decree No. 2656, respecting the organisation and supervision of the employment market. (H.K. 31 Oct.) Gr. 4 "
GREECE,,Decree to amend certain provisions of the Royal Decree of 9 Dec. 1937 respecting the award and payment of compensation to divers meeting with industrial accidents. (E.K. 16 Nov.),17.10.,1953,20,Oct 17,Oct. 17 Decree to amend certain provisions of the Royal Decree of 9 Dec. 1937 respecting the award and payment of compensation to divers meeting with industrial accidents. (E.K. 16 Nov.) 
GREECE,,"Legislative Decree No. 2651, respecting the manning of Greek ships. (E.K. 30 Oct.)",30.10.,1953,20,Oct 30,"Oct. 30 Legislative Decree No. 2651, respecting the manning of Greek ships. (E.K. 30 Oct.) "
GREECE,,"Legislative Decree No. 2698, respecting the administration of the Social Insurance Institution, to modify the legislation relating to the said Institu- tion and to make other provisions {amends various provisions of Act No. 1846 of 19517). (E.K. 10 Nov.)",10.11.,1953,20,Nov 10,"Nov. 10 Legislative Decree No. 2698, respecting the administration of the Social Insurance Institution, to modify the legislation relating to the said Institu- tion and to make other provisions {amends various provisions of Act No. 1846 of 19517). (E.K. 10 Nov.) "
GREECE,,G.D.D.R. = Gesetzblatt der Deutschen Demokratischen Republik,,,20,,G.D.D.R. = Gesetzblatt der Deutschen Demokratischen Republik. 
GREECE,,"B.G.B. = Bundesgesetzblatt, Part I",,,20,,"B.G.B. = Bundesgesetzblatt, Part I. "
GREECE,,"E.K. = ’Epyyepis ris KuZepvijceus, 1 LS. 1952 Ger.D.R. 1). — 2 L.S, 1950 (Ger.D.R. 5).— 3 L.S. 1951 (Ger.D.R. 5). — EP Og feed. 1).— 5 L.S. 1929 (Ger. 5 B). —- © L.S. 1951 (Ger.F.R. 2B). —7 L.S. T. 4). 26 —",,,20,,"E.K. = ’Epyyepis ris KuZepvijceus, 1 LS. 1952 Ger.D.R. 1). — 2 L.S, 1950 (Ger.D.R. 5).— 3 L.S. 1951 (Ger.D.R. 5). — EP Og feed. 1).— 5 L.S. 1929 (Ger. 5 B). —- © L.S. 1951 (Ger.F.R. 2B). —7 L.S. T. 4). 26 — "
GUATEMALA,,"Order No 211 of the Ministry of Economy and Labour, respecting the regulations on the protection of mothers and children. (G. 24 Mar.)",21.3.,1953,21,Mar 21,"Mar. 21. Order No 211 of the Ministry of Economy and Labour, respecting the regulations on the protection of mothers and children. (G. 24 Mar.) "
GUATEMALA,,"Decree No. $91, to amend Decree No. $00 respecting agrarian reform. (G. 2 July)",28.6.,1953,21,June 28,"June 28 Decree No. $91, to amend Decree No. $00 respecting agrarian reform. (G. 2 July) "
GUATEMALA,,"Decree No. 994, to promulgate the law establishing a National Land Bank. (G. 14 July)",8.7.,1953,21,suly 8,"suly 8 Decree No. 994, to promulgate the law establishing a National Land Bank. (G. 14 July) "
HAITI,,"Act to amend arts. 12, 23 and 24 of the Act of 5 May 1948 respecting con- ditions of employment. (M. 28 Sep.) Hai.1A",24.9.,1953,21,Sep 24,"Sep. 24 Act to amend arts. 12, 23 and 24 of the Act of 5 May 1948 respecting con- ditions of employment. (M. 28 Sep.) Hai.1A "
HAITI,,Act to amend art. 29 of the Act of 23 Sep. 1952 respecting contracts of employment. (M. 28 Sep.) Hai. 1B,24.9.,1953,21,Sep 24,Sep. 24 Act to amend art. 29 of the Act of 23 Sep. 1952 respecting contracts of employment. (M. 28 Sep.) Hai. 1B 
HAITI,,Act respecting immigration and emigration. (M. 26 Sep.),25.9.,1953,21,Sep 25,Sep. 25 Act respecting immigration and emigration. (M. 26 Sep.) 
HAITI,,Act respecting co-operative societies. (M. 28 Sep.),26.9.,1953,21,Sep 26,Sep. 26 Act respecting co-operative societies. (M. 28 Sep.) 
HONDURAS,,"Order No. 3341 of the President of the Republic, issuing regulations respect- ing the Offices of the Director-General of Labour and Social Welfare and of the Inspectors-General of Labour. (G. 27 Jan.) Hon. 1",12.1.,1953,21,Jan 12,"Jan. 12 Order No. 3341 of the President of the Republic, issuing regulations respect- ing the Offices of the Director-General of Labour and Social Welfare and of the Inspectors-General of Labour. (G. 27 Jan.) Hon. 1 "
HONDURAS,,"Decree No. 15, to amend the law on the employment of young persons and women. (G. 17 Jan.) Hon. 2",13.1.,1953,21,Jan 13,"Jan. 13 Decree No. 15, to amend the law on the employment of young persons and women. (G. 17 Jan.) Hon. 2 "
HONDURAS,,"Decree No. 4, to amend art. 192 of the Constitution [hours of night work to be regulated by law; protection of women and young persons; prohibition of unhealthy operations}. (G. 24 Dec.)",15.12.,1953,21,Dec 15,"Dec. 15 Decree No. 4, to amend art. 192 of the Constitution [hours of night work to be regulated by law; protection of women and young persons; prohibition of unhealthy operations}. (G. 24 Dec.) "
HUNGARY,,"Resolution No. 2108 of the Council of Ministers and the National Council of the Trade Unions, respecting collective agreements. (M.K. 10 Jan.)",10.1.,1953,21,Jan 10,"Jan. 10 Resolution No. 2108 of the Council of Ministers and the National Council of the Trade Unions, respecting collective agreements. (M.K. 10 Jan.) "
HUNGARY,,"Ordinance No. 5 of the Council of Ministers, to repeal certain provisions relating to wages (repeals, inter alia, Ordinance No. 204/1951]. (M.K. 1 Feb.)",1.2.,1953,21,Feb 1,"Feb, 1 Ordinance No. 5 of the Council of Ministers, to repeal certain provisions relating to wages (repeals, inter alia, Ordinance No. 204/1951]. (M.K. 1 Feb.) "
HUNGARY,,"Ordinance No. 6 of the Council of Ministers, respecting family allowances repeals, inter alia, Ordinance No. 11780/1946]. (M.K. 8 Feb.)",8.2.,1953,21,Feb 8,"Feb. 8 Ordinance No. 6 of the Council of Ministers, respecting family allowances repeals, inter alia, Ordinance No. 11780/1946]. (M.K. 8 Feb.) "
HUNGARY,,"Ordinance No. 10 of the Council of Ministers, to abolish the National Wages Board [repeals Government Order No. 4194/1949 1 except for the penal provisions contained in s. 26). (M.K. 4 Mar.)",24.3.,1953,21,Mar 24,"Mar. 24 Ordinance No. 10 of the Council of Ministers, to abolish the National Wages Board [repeals Government Order No. 4194/1949 1 except for the penal provisions contained in s. 26). (M.K. 4 Mar.) "
HUNGARY,,"Ordinance No. 24 of the Council of Ministers, respecting the works payroll system. (M.K. 21 May)",21.5.,1953,21,May 21,"May 21 Ordinance No. 24 of the Council of Ministers, respecting the works payroll system. (M.K. 21 May) "
HUNGARY,,"Resolution No. 1028 of the Council of Ministers, to lay down regulations for the workshop training and further training of workers in manufacturing and the building trade [repeals Ordinances Nos. 4188/1949, 4027/1949 and 86/1951]. (M.K. 29 May)",29.5.,1953,21,May 29,"May 29 Resolution No. 1028 of the Council of Ministers, to lay down regulations for the workshop training and further training of workers in manufacturing and the building trade [repeals Ordinances Nos. 4188/1949, 4027/1949 and 86/1951]. (M.K. 29 May) "
HUNGARY,,"Ordinance No. 39 of the Council of Ministers, respecting the conditions for the employment of young persons. (M.K. 23 July)",23.7.,1953,21,July 23,"July 23 Ordinance No. 39 of the Council of Ministers, respecting the conditions for the employment of young persons. (M.K. 23 July) "
HUNGARY,,"Aug.9 Legislative Decree No. 14 of the Praesidium of the People’s Republic, re- specting the carrying on of handicraft trades [repeals all provisions of Act No. XVII of 1894, Act No. XII of 19222 and Act No. VII of 1936 which relate to handicrafts trades and all subsidiary legislation inconsistent with the Decree). (M.K. 9 Aug.)",,,21,,"Aug.9 Legislative Decree No. 14 of the Praesidium of the People’s Republic, re- specting the carrying on of handicraft trades [repeals all provisions of Act No. XVII of 1894, Act No. XII of 19222 and Act No. VII of 1936 which relate to handicrafts trades and all subsidiary legislation inconsistent with the Decree). (M.K. 9 Aug.) "
HUNGARY,,"Ordinance No. 4 of the Minister of Agriculture, to regulate matters relating to withdrawal from producers’ co-operatives and the dissolution of producers’ co-operatives. (M.K. 25 Sep.)",25.9.,1953,21,Sep 25,"Sep. 25 Ordinance No. 4 of the Minister of Agriculture, to regulate matters relating to withdrawal from producers’ co-operatives and the dissolution of producers’ co-operatives. (M.K. 25 Sep.) "
HUNGARY,,G. = El Guatematlteco,,,21,,G. = El Guatematlteco. 
HUNGARY,,M. = Le Moniteur,,,21,,M. = Le Moniteur. 
HUNGARY,,G. = La Gaceta,,,21,,G. = La Gaceta. 
HUNGARY,,M.K. = Magyar Koézlony. 1 L.S. 1949 (Hun. 3). — 2? L.S. 1922 (Hun. 1). 27 —-,,,21,,M.K. = Magyar Koézlony. 1 L.S. 1949 (Hun. 3). — 2? L.S. 1922 (Hun. 1). 27 —- 
HUNGARY,,"Ordinance No. 51 of the Council of Ministers, to amend certain provisions relating to sickness insurance [repeals all conflicting provisions of Act No. XXI of 1927 1 as amended and supplemented, and certain provisions of Ordinances Nos. 12370/1948, 120/1950, 2389/1950 and 94/1952). (M.K. 6 Nov.)",6.11.,1953,22,Nov 6,"Nov. 6 Ordinance No. 51 of the Council of Ministers, to amend certain provisions relating to sickness insurance [repeals all conflicting provisions of Act No. XXI of 1927 1 as amended and supplemented, and certain provisions of Ordinances Nos. 12370/1948, 120/1950, 2389/1950 and 94/1952). (M.K. 6 Nov.) "
HUNGARY,,"Nov. {2 Resolution No. 1070 of the Council of Ministers and the Central Directorate of the Hungarian Workers’ Party, to approve the basic rules for agricultural producers’ co-operatives. (M.K. 12 Nov.)",,,22,,"Nov. {2 Resolution No. 1070 of the Council of Ministers and the Central Directorate of the Hungarian Workers’ Party, to approve the basic rules for agricultural producers’ co-operatives. (M.K. 12 Nov.) "
HUNGARY,,"Legislative Decree No. 25 of the Praesidium of the People’s Republic, to amend and supplement Legislative Decree No. 7 of 1951 constituting the Labour Code. (M.K. 28 Nov.) Hun. 1",28.11.,1953,22,Nov 28,"Nov. 28 Legislative Decree No. 25 of the Praesidium of the People’s Republic, to amend and supplement Legislative Decree No. 7 of 1951 constituting the Labour Code. (M.K. 28 Nov.) Hun. 1 "
ICELAND,,"Feb. {8 Act No. 33, to amend Act No. 1 of 12 Jan. 1952 amending Act No. 50 of 7 May 1946 respecting social insurance. (St., Series B. 10, p. 109)",,,22,,"Feb. {8 Act No. 33, to amend Act No. 1 of 12 Jan. 1952 amending Act No. 50 of 7 May 1946 respecting social insurance. (St., Series B. 10, p. 109) "
ICELAND,,"Act No. 38, to amend Act Ne. 50 of 1946 respecting social insurance. (St., Series B. 10, p. 127)",27.2.,1953,22,Feb 27,"Feb. 27 Act No. 38, to amend Act Ne. 50 of 1946 respecting social insurance. (St., Series B. 10, p. 127) "
INDIA,,Notification S.R.O. 1641: Further amendments to the Indian Dock Labourers Regulations 1948. (B.G. 22 Oct.),22.8.,1953,22,Aug 22,Aug. 22. Notification S.R.O. 1641: Further amendments to the Indian Dock Labourers Regulations 1948. (B.G. 22 Oct.) 
INDIA,,"Ordinance further to amend the Industrial Disputes Act 1947 2.. No. V. (G.I., 24 Oct.)",24.10.,1953,22,Oct 24,"Oct. 24 Ordinance further to amend the Industrial Disputes Act 1947 2.. No. V. (G.I., 24 Oct.) "
INDIA,,"Notification No. P.F. 536 (2): Amendments to the Employees Provident Fund Scheme 19528, (B.G. 10 Dec.)",10.12.,1953,22,Dec 10,"Dec. 10 Notification No. P.F. 536 (2): Amendments to the Employees Provident Fund Scheme 19528, (B.G. 10 Dec.) "
INDIA,,"Act to amend the Employees’ Provident Funds Act 1952 [the amendments were incorporated in L.S. 1952 (Ind.2 A)]. No. XXXVII. (G.I. 12 Dec., Extra.)",12.12.,1953,22,Dec 12,"Dec. 12 Act to amend the Employees’ Provident Funds Act 1952 [the amendments were incorporated in L.S. 1952 (Ind.2 A)]. No. XXXVII. (G.I. 12 Dec., Extra.) "
INDIA,,"Act to repeal certain enactments and to amend certain other enactments revises Plantations Labour: Act 1951 4 (ss. 22 and 31) and the Mines Act 1952 5 (ss. 33 and 37)]. No. XLII. (G.I. 24 Dec., Extra.)",23.12.,1953,22,Dec 23,"Dec. 23 Act to repeal certain enactments and to amend certain other enactments revises Plantations Labour: Act 1951 4 (ss. 22 and 31) and the Mines Act 1952 5 (ss. 33 and 37)]. No. XLII. (G.I. 24 Dec., Extra.) "
INDIA,,"Act further to amend the Industrial Disputes Act 1947. No. XLIII. (G.I. 24 Dec., Extra.) Ind. 1 STATE GOVERNMENTS",23.12.,1953,22,Dec 23,"Dec. 23 Act further to amend the Industrial Disputes Act 1947. No. XLIII. (G.I. 24 Dec., Extra.) Ind. 1 STATE GOVERNMENTS "
INDIA,Assam,"The Assam Co-operative Societies Rules. (Assam Gazette, 11 Feb.)",4.2.,1953,22,Feb 4,"Feb. 4 The Assam Co-operative Societies Rules. (Assam Gazette, 11 Feb.) "
INDIA,Bihar,"The Bihar Maternity Benefit (Amendment) Act 1953. No. XVIII. (Bihar Gazette, 10 June)",4.6.,1953,22,June 4,"June 4 The Bihar Maternity Benefit (Amendment) Act 1953. No. XVIII. (Bihar Gazette, 10 June) "
INDIA,Bombay,"Act to amend the Industrial Disputes (Appelate Tribunal) Act 1950, in its application to the State of Bombay. No. XVI. (B.G., 30 Apr.)",30.4.,1953,22,Apr 30,"Apr. 30 Act to amend the Industrial Disputes (Appelate Tribunal) Act 1950, in its application to the State of Bombay. No. XVI. (B.G., 30 Apr.) "
INDIA,Bombay,"Act to provide for the constitution of a Fund for the financing of activities to promote welfare of labour in the State of Bombay and for conducting such activities. No. XL. (B.G., 17 June)",17.6.,1953,22,June 17,"June 17 Act to provide for the constitution of a Fund for the financing of activities to promote welfare of labour in the State of Bombay and for conducting such activities. No. XL. (B.G., 17 June) "
INDIA,Bombay,"Acts to amend the Bombay Industrial Relations Act 1946. Nos. LXII and LXIII. (B.G., 27 Nov.)",20.11.,1953,22,Nov 20,"Nov. 20 Acts to amend the Bombay Industrial Relations Act 1946. Nos. LXII and LXIII. (B.G., 27 Nov.) "
INDIA,Bombay,"Act to amend the Payment of Wages Act 1936 in its application to the State of Bombay. No. LXII. (B.G., 27 Nov.)",22.11.,1953,22,Nov 22,"Nov. 22 Act to amend the Payment of Wages Act 1936 in its application to the State of Bombay. No. LXII. (B.G., 27 Nov.) "
INDIA,Bombay,M.K. = Magyar Kézlény,,,22,,M.K. = Magyar Kézlény. 
INDIA,Bombay,St. = Stjérnarlidinai,,,22,,St. = Stjérnarlidinai. 
INDIA,Bombay,"B.G. = Bombay Government Gazette, Part IV",,,22,,"B.G. = Bombay Government Gazette, Part IV. "
INDIA,Bombay,"G.I. = Gazette of India, Part II, Sec. 1",,,22,,"G.I. = Gazette of India, Part II, Sec. 1. "
INDIA,Bombay,1 LS. 1927 (Hun. 1). — 2 L.S. 1947 (Ind. 1). — 3 L.S. 1952 (Ind. 2B). — 4 LS,,,22,,1 LS. 1927 (Hun. 1). — 2 L.S. 1947 (Ind. 1). — 3 L.S. 1952 (Ind. 2B). — 4 LS. 
INDIA,Bombay,1954 (Ind. 5). — 5 L.S. 1952 (Ind. 3). 28 —,,,22,,1954 (Ind. 5). — 5 L.S. 1952 (Ind. 3). 28 — 
INDIA,Hyderabad,"Nov.5 Hyderabad Workmen’s Compensation Rules 1953. (Hyderabad Government Gazette, 5 Nov., Part I-C)",,,23,,"Nov.5 Hyderabad Workmen’s Compensation Rules 1953. (Hyderabad Government Gazette, 5 Nov., Part I-C) "
