country,region,text,date,year,page,extracted_date,full_text
HUNGARY,,"Ordinance No. 1 of the Minister of Light Industry, to amend and supplement the law governing small-scale industries [list of trades requiring a vocational training diploma; list of industries not covered by the Ordinance; new classification of groups]. (lbid.)",28.8.,1964,24,28 Aug.,"28 Aug. Ordinance No. 1 of the Minister of Light Industry, to amend and supplement the law governing small-scale industries [list of trades requiring a vocational training diploma; list of industries not covered by the Ordinance; new classification of groups]. (lbid.) "
HUNGARY,,"Decree No. 8 of the Minister of Labour, respecting the placement of workers. (Ibid., 10 Dec.) Hun. 2",10.12.,1964,24,10 Dec.,"10 Dec. Decree No. 8 of the Minister of Labour, respecting the placement of workers. (Ibid., 10 Dec.) Hun. 2 "
HUNGARY,,"Legislative Decree No. 29 of the Presidium of the Hungarian People’s Republic, to make provision for certain questions of employment relations. (Ibid., 18 Dec.) Hun. 1",18.12.,1964,24,18 Dec.,"18 Dec. Legislative Decree No. 29 of the Presidium of the Hungarian People’s Republic, to make provision for certain questions of employment relations. (Ibid., 18 Dec.) Hun. 1 "
HUNGARY,,"Decree No. 33 of the Hungarian Revolutionary Workers’ and Peasants’ Government, to give effect to Legislative Decree No. 29 [of 18 Dec.] to make provision for certain questions of employ- ment relations [right to give notice, transfer to another under- taking or locality, annual leave, working clothes, disciplinary measures]. (Ibid.) 1 L.S. 1957—Hon. 4. 32 —",18.12.,1964,24,18 Dec.,"18 Dec. Decree No. 33 of the Hungarian Revolutionary Workers’ and Peasants’ Government, to give effect to Legislative Decree No. 29 [of 18 Dec.] to make provision for certain questions of employ- ment relations [right to give notice, transfer to another under- taking or locality, annual leave, working clothes, disciplinary measures]. (Ibid.) 1 L.S. 1957—Hon. 4. 32 — "
HUNGARY,,"Order No. 11 of the Minister of Labour, respecting certificates of employment [issued by the undertaking on cessation of employ- ment]. (Ibid., 24 Dec.)",24.12.,1964,25,24 Dec.,"24 Dec. Order No. 11 of the Minister of Labour, respecting certificates of employment [issued by the undertaking on cessation of employ- ment]. (Ibid., 24 Dec.) "
HUNGARY,,"Regulation No. 7 of the National Council of Trade Unions, to amend Order No. 2 of 10 Mar. 1962 of the Minister of Labour respecting the notification and registration of industrial accidents. (Ibid.)",24.12.,1964,25,24 Dec.,"24 Dec. Regulation No. 7 of the National Council of Trade Unions, to amend Order No. 2 of 10 Mar. 1962 of the Minister of Labour respecting the notification and registration of industrial accidents. (Ibid.) "
HUNGARY,,"Order No. 6 of the National Council of Trade Unions, to provide for the precautions to be taken to prevent industrial accidents tbl protect health and to define the scope of such precautions. Ibid.)",24.12.,1964,25,24 Dec.,"24 Dec. Order No. 6 of the National Council of Trade Unions, to provide for the precautions to be taken to prevent industrial accidents tbl protect health and to define the scope of such precautions. Ibid.) "
HUNGARY,,"Decree No. 35 of the Hungarian Revolutionary Workers’ and Peasants’ Government, respecting foremen (definition, obliga- tions, responsibilities, etc.]. (Ibid., 29 Dec.)",29.12.,1964,25,29 Dec.,"29 Dec. Decree No. 35 of the Hungarian Revolutionary Workers’ and Peasants’ Government, respecting foremen (definition, obliga- tions, responsibilities, etc.]. (Ibid., 29 Dec.) "
ICELAND,,"Regulations to amend the Rules[No. 21 of 18 Feb. 1953] respecting the activities of the national safety inspectors. (Stjérnartidindt, Series B, No. 41)",10.3.,1964,25,10 Mar.,"10 Mar. Regulations to amend the Rules[No. 21 of 18 Feb. 1953] respecting the activities of the national safety inspectors. (Stjérnartidindt, Series B, No. 41) "
ICELAND,,"Regulations to amend the Regulations [No. 93 of 22 Apr. 1960] respecting vocational training. (Ibid., No. 104)",3.6.,1964,25,3 June,"3 June Regulations to amend the Regulations [No. 93 of 22 Apr. 1960] respecting vocational training. (Ibid., No. 104) "
ICELAND,,"Regulations respecting the inspection of machines and devices generating ionising radiations. (Ibid., No. 190)",12.8.,1964,25,12 Aug.,"12 Aug. Regulations respecting the inspection of machines and devices generating ionising radiations. (Ibid., No. 190) "
ICELAND,,"Decree to amend the Decree [No. 63 of 20 Mar. 1963] respecting the conditions to be met for indeterminate sick leave. (Ibid., No. 246)",6.11.,1964,25,6 Nov.,"6 Nov. Decree to amend the Decree [No. 63 of 20 Mar. 1963] respecting the conditions to be met for indeterminate sick leave. (Ibid., No. 246) "
INDIA,,"An Act further to amend the Industrial Disputes Act 1947. No. 36. Industrial Disputes (Amendment) Act 1964. (Gazette of India, Extraordinary, Part II, Sec. 1, 10 Dec.) Incorporated in: 1965—Ind. 1",9.12.,1964,25,9 Dec.,"9 Dec. An Act further to amend the Industrial Disputes Act 1947. No. 36. Industrial Disputes (Amendment) Act 1964. (Gazette of India, Extraordinary, Part II, Sec. 1, 10 Dec.) Incorporated in: 1965—Ind. 1 "
INDIA,,"An Act further to amend the Indian Trade Unions Act 1926 ! amends ss. 1, 21 and 28 and adds anews. 21A (disqualifications of office-bearers of trade unions)]. No. 38. Indian Trade Unions (Amendment) Act 1964. (Ibid., 14 Dec.)",10.12.,1964,25,10 Dec.,"10 Dec. An Act further to amend the Indian Trade Unions Act 1926 ! amends ss. 1, 21 and 28 and adds anews. 21A (disqualifications of office-bearers of trade unions)]. No. 38. Indian Trade Unions (Amendment) Act 1964. (Ibid., 14 Dec.) "
INDIA,,"An Act further to amend the Payment of Wages Act 1936? inter alia, adds new ss. 12A,13A and 14A, repeals s. 19 and inserts new subsections (4) and (4A) in substitution for subsection (4) of s. 14]. No. 53. Payment of Wages (Amendment) Act 1964. (Ibid., 30 Dec.)",30.12.,1964,25,30 Dec.,"30 Dec. An Act further to amend the Payment of Wages Act 1936? inter alia, adds new ss. 12A,13A and 14A, repeals s. 19 and inserts new subsections (4) and (4A) in substitution for subsection (4) of s. 14]. No. 53. Payment of Wages (Amendment) Act 1964. (Ibid., 30 Dec.) "
INDIA,Madhya Pradesh,"An Ordinance to repeal the Madhya Pradesh Maternity Benefit Act 1958. No.2. Madhya Pradesh Maternity Benefit Repealing Ordinance 1964. (Madhya Pradesh Government Gazette, 31 Jan.) 1 L.S. 1946—Ind. 4 (consolidation). 2 4L.S. 1936—Ind. 4",25.1.,1964,25,25 Jan.,"25 Jan. An Ordinance to repeal the Madhya Pradesh Maternity Benefit Act 1958. No.2. Madhya Pradesh Maternity Benefit Repealing Ordinance 1964. (Madhya Pradesh Government Gazette, 31 Jan.) 1 L.S. 1946—Ind. 4 (consolidation). 2 4L.S. 1936—Ind. 4. "
INDIA,Madras,An Act further to amend the Madras Compulsory Labour Act 1858 [amends ss. 1 and 2}. No. 19. Madras Compulsory Labour (Amendment) Act 1964,1.9.,1964,26,1 Sep.,1 Sep. An Act further to amend the Madras Compulsory Labour Act 1858 [amends ss. 1 and 2}. No. 19. Madras Compulsory Labour (Amendment) Act 1964. 
INDIA,Madras,An Act to provide for the repeal of the Madras Maternity Benefit Act 1934.1 No.23. Madras Maternity Benefit (Repeal) Act 1964,28.10.,1964,26,28 Oct.,28 Oct. An Act to provide for the repeal of the Madras Maternity Benefit Act 1934.1 No.23. Madras Maternity Benefit (Repeal) Act 1964. 
INDIA,Maharashtra,"Maharashtra Workmen’s Compensation (Occupational Diseases) Rules 1962 [asbestosis, bagassosis, pneumoconiosis}. (Maharash- tra Government Gazette, 13 Feb.)",10.1.,1964,26,10 Jan.,"10 Jan. Maharashtra Workmen’s Compensation (Occupational Diseases) Rules 1962 [asbestosis, bagassosis, pneumoconiosis}. (Maharash- tra Government Gazette, 13 Feb.) "
INDIA,Punjab,"Punjab Maternity Benefit (Repealing) Act [repeals the Punjab Maternity Benefit Act 1943). No. 12. (Punjab Government Gazette, Extraordinary, 23 Apr.)",21.4.,1964,26,21 Apr.,"21 Apr. Punjab Maternity Benefit (Repealing) Act [repeals the Punjab Maternity Benefit Act 1943). No. 12. (Punjab Government Gazette, Extraordinary, 23 Apr.) "
INDIA,Uttar Pradesh,"Uttar Pradesh Cotton Ginning and Pressing Factories Rules 1964. (Government Gazette of Uttar Pradesh, 8 Feb.)",29.1.,1964,26,29 Jan.,"29 Jan. Uttar Pradesh Cotton Ginning and Pressing Factories Rules 1964. (Government Gazette of Uttar Pradesh, 8 Feb.) "
INDIA,West Bengal,"Amendments to the West Bengal Factories Rules 1958 [numerous amendments]. (Calcutta Gazette, 24 Sep.) —",20.8.,1964,26,20 Aug.,"20 Aug. Amendments to the West Bengal Factories Rules 1958 [numerous amendments]. (Calcutta Gazette, 24 Sep.) — "
IRAQ,,"A Law to amend Law No. 53 of 1963 ? to supplement the Labour Law, No. 1 of 19588 [replaces s. 9]. No. 74. (Al-Wagayi’u al’ fragiya, 20 May)",12.5.,1964,26,12 May,"12 May <A Law to amend Law No. 53 of 1963 ? to supplement the Labour Law, No. 1 of 19588 [replaces s. 9]. No. 74. (Al-Wagayi’u al’ fragiya, 20 May) "
IRAQ,,"A Law to amend the Agrarian Reform Law (No. 30 of 1958) replaces s. 31 (establishment of agricultural co-operative socie- ties)]. No. 84. (Ibid., 24 June)",4.6.,1964,26,4 June,"4 June A Law to amend the Agrarian Reform Law (No. 30 of 1958) replaces s. 31 (establishment of agricultural co-operative socie- ties)]. No. 84. (Ibid., 24 June) "
IRAQ,,"A Law to regulate the distribution of companies’ profits [75 per cent. distributed among shareholders or owners of the undertaking and 25 per cent. among labourers and staff}. No.101. (Ibid., 14 July)",14.7.,1964,26,14 July,"14 July A Law to regulate the distribution of companies’ profits [75 per cent. distributed among shareholders or owners of the undertaking and 25 per cent. among labourers and staff}. No.101. (Ibid., 14 July) "
IRAQ,,"Social Security Law. No. 140. (Ibid., 10 Oct.) Iraq 1",25.8.,1964,26,25 Aug.,"25 Aug. Social Security Law. No. 140. (Ibid., 10 Oct.) Iraq 1 "
IRAQ,,"A Law to ratify the resolutions and recommendations of the Arab Economic Unity Council respecting the creation of an Arab Common Market. No. 209. (Ibid., 8 Jan. 1965) 1 L.S. 1935—Ind. 2, 1958—Ind. 1. 2 L.S. 1963—Iraq i. 3 L.S. 1961—Iraq 1 B. 34 —",26.12.,1964,26,26 Dec.,"26 Dec. A Law to ratify the resolutions and recommendations of the Arab Economic Unity Council respecting the creation of an Arab Common Market. No. 209. (Ibid., 8 Jan. 1965) 1 L.S. 1935—Ind. 2, 1958—Ind. 1. 2 L.S. 1963—Iraq i. 3 L.S. 1961—Iraq 1 B. 34 — "
ITALY,,"Decree No. 185 of the President of the Republic, respecting the safety of factories and the health protection of workers and the population against the dangers of ionising radiations produced by the peaceful use of nuclear power. - (Gazzetta Ufficiale, 16 Apr., Supplement)",13.2.,1964,27,13 Feb.,"13 Feb. Decree No. 185 of the President of the Republic, respecting the safety of factories and the health protection of workers and the population against the dangers of ionising radiations produced by the peaceful use of nuclear power. - (Gazzetta Ufficiale, 16 Apr., Supplement) "
ITALY,,"Decree No. 272 of the President of the Republic, to issue a list of the light types of work which may be performed by young persons of not less than 13 years of age. (Ibid., 14 May)",9.3.,1964,27,9 Mar.,"9 Mar. Decree No. 272 of the President of the Republic, to issue a list of the light types of work which may be performed by young persons of not less than 13 years of age. (Ibid., 14 May) "
IVORY COAST,,"Decree No. 64-177, to establish labour courts and prescribe their territorial competence and membership. (Journal Officiel, 30 Apr.)",16.4.,1964,27,16 Apr.,"16 Apr. Decree No. 64-177, to establish labour courts and prescribe their territorial competence and membership. (Journal Officiel, 30 Apr.) "
IVORY COAST,,"Act No. 64-290, to establish a Labour Code. (Ibid., 17 Aug., Extraordinary) Extracts: 1.C. 1",4.8.,1964,27,4 Aug.,"4 Aug. Act No. 64-290, to establish a Labour Code. (Ibid., 17 Aug., Extraordinary) Extracts: 1.C. 1 "
IVORY COAST,,"Order No. 1975TP.DTR., to prescribe the conditions of work in public and private road transport with a view to ensuring road traffic safety [inter alia, makes it illegal to drive a vehicle for more than 12 hours in any 24-hour period]. (Ibid., 17 Sep.)",4.9.,1964,27,4 Sep.,"4 Sep. Order No. 1975TP.DTR., to prescribe the conditions of work in public and private road transport with a view to ensuring road traffic safety [inter alia, makes it illegal to drive a vehicle for more than 12 hours in any 24-hour period]. (Ibid., 17 Sep.) "
IVORY COAST,,"Act No. 64-488, to issue general civil service rules [Part I: General Provisions; Part II: Recruitment; Part III: Remuneration and Welfare Benefits; Part IV: Annual Reports and Promotion; Part V: Discipline; Part VI: Status; Part VII: Final Cessation of Service; Part VIII: Miscellaneous]. (lbid., 12 Jan. 1965, Extraordinary)",21.12.,1964,27,21 Dec.,"21 Dec. Act No. 64-488, to issue general civil service rules [Part I: General Provisions; Part II: Recruitment; Part III: Remuneration and Welfare Benefits; Part IV: Annual Reports and Promotion; Part V: Discipline; Part VI: Status; Part VII: Final Cessation of Service; Part VIII: Miscellaneous]. (lbid., 12 Jan. 1965, Extraordinary) "
JAMAICA,,"An Act relating to the employment of persons who are not citizens of Jamaica, and matters incidental thereto or connected therewith. No. 48. Foreign Nationals and Commonwealth Citi- zens (Employment) Act 1964. (Jamaica Gazette ,t Dec., Bills and Acts Supplement)",18.11.,1964,27,18 Nov.,"18 Nov. An Act relating to the employment of persons who are not citizens of Jamaica, and matters incidental thereto or connected therewith. No. 48. Foreign Nationals and Commonwealth Citi- zens (Employment) Act 1964. (Jamaica Gazette ,t Dec., Bills and Acts Supplement) "
KENYA,,"An Act of Parliament to amend the Trade Unions Act (Cap. 233) inserts, inter alia, new ss. 20 A registration of trade union bran- ches) and 29A (penalties for purporting to act as officer of an unregistered trade union} and amends s. 30 (registration of change of officers, etc.)]. No. 16. Trade Unions (Amendment) Act. (Kenya Gazette, 20 Oct., Supplement)",19.10.,1964,27,19 Oct.,"19 Oct. An Act of Parliament to amend the Trade Unions Act (Cap. 233) inserts, inter alia, new ss. 20 A registration of trade union bran- ches) and 29A (penalties for purporting to act as officer of an unregistered trade union} and amends s. 30 (registration of change of officers, etc.)]. No. 16. Trade Unions (Amendment) Act. (Kenya Gazette, 20 Oct., Supplement) "
LEBANON,,"Decree No. 17199, to promulgate the Co-operative Societies Act. Al-Jarida al-Rasmiya, 27 Aug.) Leb. 1",18.8.,1964,27,18 Aug.,"18 Aug. Decree No. 17199, to promulgate the Co-operative Societies Act. Al-Jarida al-Rasmiya, 27 Aug.) Leb. 1 "
LEBANON,,"Decree No. 17240, to promulgate an Act to establish and make regulations for the National Rural Handicrafts Council. (Ibid., 31 Aug.)",21.8.,1964,27,21 Aug.,"21 Aug. Decree No. 17240, to promulgate an Act to establish and make regulations for the National Rural Handicrafts Council. (Ibid., 31 Aug.) "
LEBANON,,"Decree No. 17386, to promulgate the Act respecting collective labour agreements, mediation and arbitration. (Ibid., 10 Sep.) Leb. 2 35 —",3.9.,1964,27,3 Sep.,"3 Sep. Decree No. 17386, to promulgate the Act respecting collective labour agreements, mediation and arbitration. (Ibid., 10 Sep.) Leb. 2 35 — "
LEBANON,,"Decree No. 17561, to regulate the work of aliens. (Ifbid., 1 Oct.)",18.9.,1964,28,18 Sep.,"18 Sep. Decree No. 17561, to regulate the work of aliens. (Ifbid., 1 Oct.) "
LEBANON,,"Act No. 62/64, to regulate private vocational training facilities. (Ibid., 11 Jan. 1965)",30.12.,1964,28,30 Dec.,"30 Dec. Act No. 62/64, to regulate private vocational training facilities. (Ibid., 11 Jan. 1965) "
LIECHTENSTEIN,,"An Ordinance to regulate the annual leave of officials and salaried employees in the service of the Government. (Liechtensteinisches Landes-Gesetzblatt, 26 June)",16.6.,1964,28,16 June,"16 June An Ordinance to regulate the annual leave of officials and salaried employees in the service of the Government. (Liechtensteinisches Landes-Gesetzblatt, 26 June) "
LIECHTENSTEIN,,"Radiation Protection Act. (Ibid., 7 Sep.)",17.7.,1964,28,17 July,"17 July Radiation Protection Act. (Ibid., 7 Sep.) "
LIECHTENSTEIN,,"An Act to amend the Old-Age and Survivors’ Insurance Act of 14 Dec. 1952, as amended by the Acts of 23 Dec. 1958, 19 Nov. 1959, 23 Dec. 1959, 28 Dec. 1962 and 28 Dec. 1963 [replaces ss. 52 and 76 and repeals s. 74]. (Ibid., 2 Oct.)",23.7.,1964,28,23 July,"23 July An Act to amend the Old-Age and Survivors’ Insurance Act of 14 Dec. 1952, as amended by the Acts of 23 Dec. 1958, 19 Nov. 1959, 23 Dec. 1959, 28 Dec. 1962 and 28 Dec. 1963 [replaces ss. 52 and 76 and repeals s. 74]. (Ibid., 2 Oct.) "
LUXEMBOURG,,"An Act to supplement the Act of 4 Apr. 1924 respecting the establishment of elective trade chambers, by the establishment of a Chamber of Public Officials And Salaried Employees [amends ss. 1 (establishment of chambers) and 3 (payment of contributions, taxes, etc.) and adds a new Ch. VII (Chamber of Public Officials and Salaried Employees: ss. 432s to octies)]. (Mémorial, Series A, 15 Feb.)",12.2.,1964,28,12 Feb.,"12 Feb. An Act to supplement the Act of 4 Apr. 1924 respecting the establishment of elective trade chambers, by the establishment of a Chamber of Public Officials And Salaried Employees [amends ss. 1 (establishment of chambers) and 3 (payment of contributions, taxes, etc.) and adds a new Ch. VII (Chamber of Public Officials and Salaried Employees: ss. 432s to octies)]. (Mémorial, Series A, 15 Feb.) "
LUXEMBOURG,,"An Act to amend the Act of 30 July 1960 2 to set up a National Solidarity Fund [inter alia, amends ss. 3 (calculation of pensions) and 10 (assignment) and supplements s. 5 (determination of income)]. (Ibid., 29 Feb.)",28.2.,1964,28,28 Feb.,"28 Feb. An Act to amend the Act of 30 July 1960 2 to set up a National Solidarity Fund [inter alia, amends ss. 3 (calculation of pensions) and 10 (assignment) and supplements s. 5 (determination of income)]. (Ibid., 29 Feb.) "
LUXEMBOURG,,"Family Benefits Act. (Ibid., 30 Apr.) Lux. 1",29.4.,1964,28,29 Apr.,"29 Apr. Family Benefits Act. (Ibid., 30 Apr.) Lux. 1 "
LUXEMBOURG,,"A comprehensive Act to improve and co-ordinate the various contributory pension schemes [amends ss. 199 and 200 (recognised periods), 202 to 205, 207 and 208 (calculation of pensions) and 238 to 241 (financing) of the Social Insurance Code 3, the Act of 21 May 1951 to establish a handicraft workers’ pension fund, the Act of 29 Aug. 1951 to reorganise the pension insurance scheme for salaried employees in private employment, the Act of 3 Sep. 1956 to establish an agricultural pension fund and the Act of 22 Jan. 1960 to establish a pension fund for shopkeepers and manu- facturers]. (Ibid., 20 May)",13.5.,1964,28,13 May,"13 May A comprehensive Act to improve and co-ordinate the various contributory pension schemes [amends ss. 199 and 200 (recognised periods), 202 to 205, 207 and 208 (calculation of pensions) and 238 to 241 (financing) of the Social Insurance Code 3, the Act of 21 May 1951 to establish a handicraft workers’ pension fund, the Act of 29 Aug. 1951 to reorganise the pension insurance scheme for salaried employees in private employment, the Act of 3 Sep. 1956 to establish an agricultural pension fund and the Act of 22 Jan. 1960 to establish a pension fund for shopkeepers and manu- facturers]. (Ibid., 20 May) "
LUXEMBOURG,,"An Act to amend and supplement certain provisions [ss. 158 to 163 and 165] of the Social Insurance Code ® in the matter of the insurance of agricultural and forestry undertakings. (Ibid., 28 May)",21.5.,1964,28,21 May,"21 May An Act to amend and supplement certain provisions [ss. 158 to 163 and 165] of the Social Insurance Code ® in the matter of the insurance of agricultural and forestry undertakings. (Ibid., 28 May) "
LUXEMBOURG,,Act respecting the admission of self-employed professional workers to the pension fund for salaried employees in private employment. (Ibid.) L * LS. 1924—Lux. 4. 2L.S. 1969—Lux. 2. 3 L.S. 1925—Iux. 2... 1946— ux. 4,23.5.,1964,28,23 May,23 May Act respecting the admission of self-employed professional workers to the pension fund for salaried employees in private employment. (Ibid.) L * LS. 1924—Lux. 4. 2L.S. 1969—Lux. 2. 3 L.S. 1925—Iux. 2... 1946— ux. 4. 
LUXEMBOURG,,"Grand-Ducal Regulations respecting the hours of work of salaried employees in the private sector [repeals the Order of 21 Oct. 1938 respecting the contracts of service of such employees]. (Ibid., 17 Nov.)",28.10.,1964,29,28 Oct.,"28 Oct. Grand-Ducal Regulations respecting the hours of work of salaried employees in the private sector [repeals the Order of 21 Oct. 1938 respecting the contracts of service of such employees]. (Ibid., 17 Nov.) "
MALAGASY REPUBLIC,,"Decree No. 64-162, to prescribe the conditions and periods of notice to be observed in the termination of contracts of employ- ment of unspecified duration [repeals Order No. 2261-IGT of 17 Nov. 1953 to prescribe the conditions to be observed in giving notice of the termination of contracts of employment of unspeci- fied duration]. (Journal Officiel, 2 May)",22.4.,1964,29,22 Apr.,"22 Apr. Decree No. 64-162, to prescribe the conditions and periods of notice to be observed in the termination of contracts of employ- ment of unspecified duration [repeals Order No. 2261-IGT of 17 Nov. 1953 to prescribe the conditions to be observed in giving notice of the termination of contracts of employment of unspeci- fied duration]. (Journal Officiel, 2 May) "
MALAGASY REPUBLIC,,"Decree No. 64-495, to establish an employment service. (Ibid., 28 Nov.) Mad. 1",18.11.,1964,29,18 Nov.,"18 Nov. Decree No. 64-495, to establish an employment service. (Ibid., 28 Nov.) Mad. 1 "
MALAGASY REPUBLIC,,"Act No. 64-019, to amend the Labour Code. (Ibid., 12 Dec.) Mad. 2",11.12.,1964,29,11 Dec.,"11 Dec. Act No. 64-019, to amend the Labour Code. (Ibid., 12 Dec.) Mad. 2 "
MALAGASY REPUBLIC,,"Decree No. 64-528, to amend the Family Allowances and Indus- trial Accidents Code [of 22 Feb. 1963] [replaces ss. 146 (2) (c), 189, 199, 210, 212 (first para.) and 221 and adds a news. 197bis]. (Ibid., 2 Jan. 1965)",23.12.,1964,29,23 Dec.,"23 Dec. Decree No. 64-528, to amend the Family Allowances and Indus- trial Accidents Code [of 22 Feb. 1963] [replaces ss. 146 (2) (c), 189, 199, 210, 212 (first para.) and 221 and adds a news. 197bis]. (Ibid., 2 Jan. 1965) "
MALAGASY REPUBLIC,,"Order No. 3553-MTLS, to amend and supplement the schedules of occupational diseases [replaces Schedules 2, 4, 6, 14, 19, 36, 38 and 40 to Decree No. 63-124 of 22 Feb. 1963 to establish a Family Allowances and Industrial Accidents Code]. (Ibid.)",23.12.,1964,29,23 Dec.,"23 Dec. Order No. 3553-MTLS, to amend and supplement the schedules of occupational diseases [replaces Schedules 2, 4, 6, 14, 19, 36, 38 and 40 to Decree No. 63-124 of 22 Feb. 1963 to establish a Family Allowances and Industrial Accidents Code]. (Ibid.) "
MALAGASY REPUBLIC,,"Apprenticeship Regulations 1964. G.N. No. 191. (Malawi Government Gazette, 31 Dec.) Malawi 1",19.12.,1964,29,19 Dec.,"19 Dec. Apprenticeship Regulations 1964. G.N. No. 191. (Malawi Government Gazette, 31 Dec.) Malawi 1 "
MAURITANIA,,"Act No. 64-064, to establish an Economic and Social Council. (Journal Officiel, 20 May)",24.4.,1964,29,24 Apr.,"24 Apr. Act No. 64-064, to establish an Economic and Social Council. (Journal Officiel, 20 May) "
MEXICO,,"Regulations to classify undertakings and degrees of risk for the purposes of the employment accident and occupational disease insurance scheme [repeal the Regulations of 5 Sep. 1960 on the same subject]. (Diario Oficial, 29 Jan.; errata: ibid., 4 Feb.)",27.1.,1964,29,27 Jan.,"27 Jan. Regulations to classify undertakings and degrees of risk for the purposes of the employment accident and occupational disease insurance scheme [repeal the Regulations of 5 Sep. 1960 on the same subject]. (Diario Oficial, 29 Jan.; errata: ibid., 4 Feb.) "
MONACO,,"Sovereign Ordinance No. 3154, to prescribe the form of contracts of apprenticeship and apprenticeship diplomas. (Journal de Monaco, 3 Apr.)",28.3.,1964,29,28 Mar.,"28 Mar. Sovereign Ordinance No. 3154, to prescribe the form of contracts of apprenticeship and apprenticeship diplomas. (Journal de Monaco, 3 Apr.) "
MONACO,,"Act No. 762, to prescribe rules governing the occupations of commercial travellers, representatives and commission agents. (Ibid., 29 May)",26.5.,1964,29,26 May,"26 May Act No. 762, to prescribe rules governing the occupations of commercial travellers, representatives and commission agents. (Ibid., 29 May) "
MONACO,,"Sovereign Ordinance No. 3217, made under Act No. 735 of 16 Mar. 19631 to make regulations concerning home work. (Ibid., 17 July)",9.7.,1964,30,9 July,"9 July Sovereign Ordinance No. 3217, made under Act No. 735 of 16 Mar. 19631 to make regulations concerning home work. (Ibid., 17 July) "
MOROCCO,,"Decree No. 2-64-426, respecting the vocational training given by the Directorate of Handicrafts in apprentice training centres. (Bulletin Offictel, 28 Oct.)",17.10.,1964,30,17 Oct.,"17 Oct. Decree No. 2-64-426, respecting the vocational training given by the Directorate of Handicrafts in apprentice training centres. (Bulletin Offictel, 28 Oct.) "
