country,region,text,date,year,page,extracted_date,full_text
INDIA BRITISH,,"An Act further to amend the Factories Act, 1934101 [adds new section 5, power to apply provisions applicable to factories to certain other places). No. XVI of 1941. Factorzes (Amend- ment) Act, 1941",20.11.,1941,26,Nov. 20,"Nov. 20 An Act further to amend the Factories Act, 1934101 [adds new section 5, power to apply provisions applicable to factories to certain other places). No. XVI of 1941. Factorzes (Amend- ment) Act, 1941. "
INDIA BRITISH,,"An Act to regulate the employment of women in mines for a certain period before and after childbirth and to provide for payment of maternity benefit to them. No. XIX of 1941. Mines Maternity Benejit Act, 1941. Ind 1",26.11.,1941,26,Nov. 26,"Nov. 26 An Act to regulate the employment of women in mines for a certain period before and after childbirth and to provide for payment of maternity benefit to them. No. XIX of 1941. Mines Maternity Benejit Act, 1941. Ind 1 "
INDIA BRITISH,,"An Ordinance to make provision for the maintenance of certain essential services [control of employment]. No. XI of 1941. EssentiaZ Services (Maintenance) Ordinance, 1941. (Gazette of India, Extraordinary, 20th December, 1941, p. 733) PROVINCES",29.12.,1941,26,Dec. 29,"Dec. 29 An Ordinance to make provision for the maintenance of certain essential services [control of employment]. No. XI of 1941. EssentiaZ Services (Maintenance) Ordinance, 1941. (Gazette of India, Extraordinary, 20th December, 1941, p. 733) PROVINCES "
INDIA BRITISH,Bombay,"Notification No. 9073, to amend the Factories Rules relating to the safety of hoists. (B.G.G. 29th May, 1941, Part Ill-A, p. 107) I.S.S. Vol. XVII, No. 4, p. 136",23.5.,1941,26,May 23,"May 23 Notification No. 9073, to amend the Factories Rules relating to the safety of hoists. (B.G.G. 29th May, 1941, Part Ill-A, p. 107) I.S.S. Vol. XVII, No. 4, p. 136 "
INDIA BRITISH,Bombay,"Bombay Industrial Disputes (Amendment) Act, 1941102. (B.G.G. 29th May, 1941, Part IV, p. 175)",29.5.,1941,26,May 29,"May 29 Bombay Industrial Disputes (Amendment) Act, 1941102. (B.G.G. 29th May, 1941, Part IV, p. 175) "
INDIA BRITISH,Bombay,"Bombay Industrial Disputes (Second Amendment) Act, 1941102. (B.G.G. 4th November, 1941, Part IV, p. 212)",4.11.,1941,26,Nov. 4,"Nov. 4 Bombay Industrial Disputes (Second Amendment) Act, 1941102. (B.G.G. 4th November, 1941, Part IV, p. 212) "
INDIA BRITISH,Madras,"Factories (Madras Amendment) Act, 1941 [amendment of section 52 (1) medical examination of young persons]. No. VI of 1941. (F.G.G., 4th March, 1941, Part IV-B, No. 6, p. 19)",9.2.,1941,26,Feb. 9,"Feb. 9 Factories (Madras Amendment) Act, 1941 [amendment of section 52 (1) medical examination of young persons]. No. VI of 1941. (F.G.G., 4th March, 1941, Part IV-B, No. 6, p. 19) "
INDIA BRITISH,Madras,"Hazardous Occupations (Graphite) Rules, 1941. (F.G.G., 27tb May, 1941, Part I, p. 660) I.S.S. Vol. XVII, No. 4, p. 136",3.5.,1941,26,May 3,"May 3 Hazardous Occupations (Graphite) Rules, 1941. (F.G.G., 27tb May, 1941, Part I, p. 660) I.S.S. Vol. XVII, No. 4, p. 136 "
INDIAN STATES,Mysore,"The Mysore European British Subjects Reinstatement Act, 1941. No. XVI of 1941. (The Mysore Gazette, 7th August, 1941, No. 32, p. 368)",16.7.,1941,26,July 16,"July 16 The Mysore European British Subjects Reinstatement Act, 1941. No. XVI of 1941. (The Mysore Gazette, 7th August, 1941, No. 32, p. 368) "
INDIAN STATES,Mysore,"The Mysore Labour (Emergency) Act, 1941 [conciliation and arbitration; organisation of industrial employees]. No. XX of 1941",24.8.,1941,27,Aug. 24,"Aug. 24 The Mysore Labour (Emergency) Act, 1941 [conciliation and arbitration; organisation of industrial employees]. No. XX of 1941. "
INDIAN STATES,Travancore,"The Travancore Payment of Wages Act, 1116. Act XX of 1116. (T.G.G. 13th May, 1941, Vol. LXXVIII, No. 39, Part II, p. 350)",7.5.,1941,27,May 7,"May 7 The Travancore Payment of Wages Act, 1116. Act XX of 1116. (T.G.G. 13th May, 1941, Vol. LXXVIII, No. 39, Part II, p. 350) "
IRELAND,,"An Act to amend subsection (4) of section 8 of the Unemploy- ment Insurance Act, 1920. No. 3 of 1941. UnemplOyment Insurance Act, 1941",12.3.,1941,27,Mar. 12,"Mar. 12 An Act to amend subsection (4) of section 8 of the Unemploy- ment Insurance Act, 1920. No. 3 of 1941. UnemplOyment Insurance Act, 1941. "
IRELAND,,"An Act to provide for the licensing of bodies carrying on nego- tiations for fixing wages or other conditions of employment, to provide for the establishment of a Tribunal having power to restrict the rights of organisation of trade unions, and for other matters connected with the matters aforesaid. No. 22 of 1941. Trade Union Act, 1941. Ire. 1",23.9.,1941,27,Sept. 23,"Sept. 23 An Act to provide for the licensing of bodies carrying on nego- tiations for fixing wages or other conditions of employment, to provide for the establishment of a Tribunal having power to restrict the rights of organisation of trade unions, and for other matters connected with the matters aforesaid. No. 22 of 1941. Trade Union Act, 1941. Ire. 1 "
IRELAND,,"Trade Union Act, 1941 (commencement of Section 6) Order, 1941 [section 6 to come into operation on 1st May, 1942]. Statutory Rules and Orders, 1941, No. 590",11.12.,1941,27,Dec. 11,"Dec. 11 Trade Union Act, 1941 (commencement of Section 6) Order, 1941 [section 6 to come into operation on 1st May, 1942]. Statutory Rules and Orders, 1941, No. 590. "
ITALY,,"Navigation code'°3. (G.U. 31st January, 1941, supplement)",27.1.,1941,27,Jan. 27,"Jan. 27 Navigation code'°3. (G.U. 31st January, 1941, supplement) "
ITALY,,"civil code: Labour Book. (G.U. extraordinary, 5th February, 1941, No. 31 quinquies)",30.1.,1941,27,Jan. 30,"Jan. 30 civil code: Labour Book. (G.U. extraordinary, 5th February, 1941, No. 31 quinquies) "
ITALY,,"Act No. 67, respecting war pensions (G.U. 28th February, 1941, supplement)",20.2.,1941,27,Feb. 20,"Feb. 20 Act No. 67, respecting war pensions (G.U. 28th February, 1941, supplement) "
ITALY,,"Legislative Decree No. 124, to increase from 120 to 180 the maximum number of days for which unemployment benefit may be paid [converted into an Act by Act No. 1137 of 8th August, 1941]. (G.U. 23rd March, 1941, p. 1218, and 22nd October, 1941, p. 4204)",17.3.,1941,27,Mar. 17,"Mar. 17 Legislative Decree No. 124, to increase from 120 to 180 the maximum number of days for which unemployment benefit may be paid [converted into an Act by Act No. 1137 of 8th August, 1941]. (G.U. 23rd March, 1941, p. 1218, and 22nd October, 1941, p. 4204) "
ITALY,,"Legislative Decree No. 123, respecting the salaries of private salaried employees and workers placed on the same footing who are called up for military service, kept under arms, or employed abroad, and sent to concentration camps, declared missing or taken prisoner [converted into an Act by Act No. 985 of 1st August, 1941, with amendments of sections 1 and 4]. (G.U. 23rd March, 1941, p. 1216, and 22nd September, 1941, p. 3750)",20.3.,1941,27,Mar. 20,"Mar. 20 Legislative Decree No. 123, respecting the salaries of private salaried employees and workers placed on the same footing who are called up for military service, kept under arms, or employed abroad, and sent to concentration camps, declared missing or taken prisoner [converted into an Act by Act No. 985 of 1st August, 1941, with amendments of sections 1 and 4]. (G.U. 23rd March, 1941, p. 1216, and 22nd September, 1941, p. 3750) "
ITALY,,"Legislative Decree No. D5, to authonse the Minister of corpora- tions to order, for the duration of the war, the putting into operation of special conditions of employment and to fix hours of work and wages,: etc. [converted into an Act by Act No. 983 of 11th July, 1941, with an amendment of sections 1 and 2]. (G.U. 23rd March, 1941, p. 1218 and 22nd September, 1941, p. 3750)",20.3.,1941,27,Mar. 20,"Mar. 20 Legislative Decree No. D5, to authonse the Minister of corpora- tions to order, for the duration of the war, the putting into operation of special conditions of employment and to fix hours of work and wages,: etc. [converted into an Act by Act No. 983 of 11th July, 1941, with an amendment of sections 1 and 2]. (G.U. 23rd March, 1941, p. 1218 and 22nd September, 1941, p. 3750) "
ITALY,,"Decree No. 933, to amend item 2 [persons employed in public health and allied services] of the schedule [anproved by Decree No. 2657 of 6th December, 1923104] specifying the occupations which require only intermittent work or mere being in attendance or watching to which the Act respecting the compulsory limita- tion of hours of work'°5 does not apply. (G.U. 12th September, 1941, p. 3615)",11.7.,1941,27,July 11,"July 11 Decree No. 933, to amend item 2 [persons employed in public health and allied services] of the schedule [anproved by Decree No. 2657 of 6th December, 1923104] specifying the occupations which require only intermittent work or mere being in attendance or watching to which the Act respecting the compulsory limita- tion of hours of work'°5 does not apply. (G.U. 12th September, 1941, p. 3615) "
ITALY,,"Act No. 1313, to amend section 4 of Legislative Decree No. 636 of 14th April, 1939'°° (amended and converted into an Act by Act No. 1272 of 6th July, 1939107), to amend the provisions respecting compulsory invalidity, old age, tuberculosis and un- employment insurance and compulsory marriage and birth insur- ance. (G.U. 11th December, 1941, p. 4838)",8.8.,1941,28,Aug. 8,"Aug. 8 Act No. 1313, to amend section 4 of Legislative Decree No. 636 of 14th April, 1939'°° (amended and converted into an Act by Act No. 1272 of 6th July, 1939107), to amend the provisions respecting compulsory invalidity, old age, tuberculosis and un- employment insurance and compulsory marriage and birth insur- ance. (G.U. 11th December, 1941, p. 4838) "
ITALY,,"Act No. 1485, to approve the Agreements respecting social insurance entered Into between Germany and Italy on 31st March, 1941108. (G.U. 15th January, 1942, p. 162)",20.11.,1941,28,Nov. 20,"Nov. 20 Act No. 1485, to approve the Agreements respecting social insurance entered Into between Germany and Italy on 31st March, 1941108. (G.U. 15th January, 1942, p. 162) "
ITALY,,"Act No. 1611, to Issue penal and disciplinary provisions for mobilized civilians. (G.U. 14th February, 1942, p. 626)",16.12.,1941,28,Dec. 16,"Dec. 16 Act No. 1611, to Issue penal and disciplinary provisions for mobilized civilians. (G.U. 14th February, 1942, p. 626) "
ITALY,,"Act No. 1659, respectIng the compulsory insurance against ac- cidents and industrial diseases of the technical staff employed in the institutes and laboratories of the National Research Council. (G.U. 12th March, 1942, p. 978)",29.12.,1941,28,Dec. 29,"Dec. 29 Act No. 1659, respectIng the compulsory insurance against ac- cidents and industrial diseases of the technical staff employed in the institutes and laboratories of the National Research Council. (G.U. 12th March, 1942, p. 978) "
LEAGUE OF NATIONS,New Guinea,Workers' Compensation Ordinance 1941. No. 4 of 1941,22.4.,1941,28,Apr. 22,Apr. 22 Workers' Compensation Ordinance 1941. No. 4 of 1941. 
LEAGUE OF NATIONS,New Guinea,"Notice to fix 1st August, 1941, as the date of commencement of the Workers' Compensation Ordinance 1941. (New Guinea Gazette, 14th June, 1941, No. 637, p. 4607)",11.6.,1941,28,June 11,"June 11 Notice to fix 1st August, 1941, as the date of commencement of the Workers' Compensation Ordinance 1941. (New Guinea Gazette, 14th June, 1941, No. 637, p. 4607) "
LEAGUE OF NATIONS,New Guinea,Workers' Compensation Ordinance (No. 2) 1941. No. 15 of 1941. Territory,8.7.,1941,28,July 8,July 8 Workers' Compensation Ordinance (No. 2) 1941. No. 15 of 1941. Territory 
LEAGUE OF NATIONS,New Guinea,"Government Notice No. 32: The Defence (Native Labour) Regulations, 1941. (Supplement to the Tanganyika Territory Gazette Vol. XXII, No. 5, p. 40)",19.1.,1941,28,Jan. 19,"Jan. 19 Government Notice No. 32: The Defence (Native Labour) Regulations, 1941. (Supplement to the Tanganyika Territory Gazette Vol. XXII, No. 5, p. 40) "
LEAGUE OF NATIONS,New Guinea,"Government Notice No. 11. The Master and Native Servants Rules, 1941 (op. cit. Vol XXIII, No. 4, p. 12)",6.11.,1941,28,Nov. 6,"Nov. 6 Government Notice No. 11. The Master and Native Servants Rules, 1941 (op. cit. Vol XXIII, No. 4, p. 12) "
MEXICO,,"Decree to amend the Federal Labour Act108. (D.O. Vol. CXXV, No. 35, p. 3) iVIex. 1",29.3.,1941,28,Mar. 29,"Mar. 29 Decree to amend the Federal Labour Act108. (D.O. Vol. CXXV, No. 35, p. 3) iVIex. 1 "
MEXICO,,"Act to alter the National Economic Council of the United States of Mexico. (D.O. Vol. CXXV, No. 41, Part I, p. 3)",3.4.,1941,28,Apr. 3,"Apr. 3 Act to alter the National Economic Council of the United States of Mexico. (D.O. Vol. CXXV, No. 41, Part I, p. 3) "
NETHERLANDS,,Decree respecting the institution of an Air Raid Precautions Accident Fund. (St. No. S. 800),3.1.,1941,28,Jan. 3,Jan. 3 Decree respecting the institution of an Air Raid Precautions Accident Fund. (St. No. S. 800) 
NETHERLANDS,,"Decrees No. 769, No. 777 and No. 778, to amend the Family Allowances Act [of 23rd December, 19391110, (Nederlandsche Staatscourant, 27th February, 1941, No. 41, p. 2)",27.2.,1941,28,Feb. 27,"Feb. 27 Decrees No. 769, No. 777 and No. 778, to amend the Family Allowances Act [of 23rd December, 19391110, (Nederlandsche Staatscourant, 27th February, 1941, No. 41, p. 2) "
NETHERLANDS,,"Order respecting compulsory service and restriction on change- of employment. (L.C.V. part I, p. 84)",28.2.,1941,28,Feb. 28,"Feb. 28 Order respecting compulsory service and restriction on change- of employment. (L.C.V. part I, p. 84) "
NETHERLANDS,,"Decree to appoint 17th March, 1941, as the date of commence- ment of sections V, XI and XII of the Act of 19th October, 1939 [Legislative Series, 1941 (Neth. 1, F)], to amend the Accidents Act, 1921. (L.C.V. part 11, p. 218)",12.5.,1941,29,May 12,"May 12 Decree to appoint 17th March, 1941, as the date of commence- ment of sections V, XI and XII of the Act of 19th October, 1939 [Legislative Series, 1941 (Neth. 1, F)], to amend the Accidents Act, 1921. (L.C.V. part 11, p. 218) "
NETHERLANDS,,"Decree to regulate the employment of aliens [amends section 2 of the Act of 16th May, 1934 ('L.S. 1934, Neth. 1]. (L.C.V. part 11, p. 219)",12.5.,1941,29,May 12,"May 12 Decree to regulate the employment of aliens [amends section 2 of the Act of 16th May, 1934 ('L.S. 1934, Neth. 1]. (L.C.V. part 11, p. 219) "
NETHERLANDS,,"Order respecting measures to ensure industrial peace. (L.C.V., part 2, p. 199)",19.5.,1941,29,May 19,"May 19 Order respecting measures to ensure industrial peace. (L.C.V., part 2, p. 199) "
NETHERLANDS,,"Order respecting the Netherlands labour service (Labour Service Order). (L.C.V. part 2, p. 202)",26.5.,1941,29,May 26,"May 26 Order respecting the Netherlands labour service (Labour Service Order). (L.C.V. part 2, p. 202) "
NETHERLANDS,,"Order to amend certain in provisions of industrial and labour law [hours of work, etc.], (L.C.V. part- 3, p. 263)",26.6.,1941,29,June 26,"June 26 Order to amend certain in provisions of industrial and labour law [hours of work, etc.], (L.C.V. part- 3, p. 263) "
NETHERLANDS,,"Decree to amend and supplement the Sickness Insurance Act"". (St. No. 5. 805) Neth. I (A)",1.8.,1941,29,Aug. 1,"Aug. 1 Decree to amend and supplement the Sickness Insurance Act"". (St. No. 5. 805) Neth. I (A) "
NETHERLANDS,,Decree respecting sick funds. (St. No. S. 804),1.8.,1941,29,Aug. 1,Aug. 1 Decree respecting sick funds. (St. No. S. 804) 
NETHERLANDS,,"Decree to amend the Accidents Act, 1921"", the Agricultural and Horticultural Accidents Act 1922"", and Decree No. 13/1941, respecting the institution of an Air Raid Accident Fund. (St. No. S. 807) Neth. 1 (B)",18.8.,1941,29,Aug. 18,"Aug. 18 Decree to amend the Accidents Act, 1921"", the Agricultural and Horticultural Accidents Act 1922"", and Decree No. 13/1941, respecting the institution of an Air Raid Accident Fund. (St. No. S. 807) Neth. 1 (B) "
NETHERLANDS,,"Decree to amend section 50 of the Sickness Insurance Act "". (L.C.V. part 11, p. 266)",10.9.,1941,29,Sept. 10,"Sept. 10 Decree to amend section 50 of the Sickness Insurance Act "". (L.C.V. part 11, p. 266) "
NETHERLANDS,,"Decree to amend the Shops Closing Act, 1930 [L.S. 1930, Neth. 4]. (L.C.V. part 11, p. 264)",10.9.,1941,29,Sept. 10,"Sept. 10 Decree to amend the Shops Closing Act, 1930 [L.S. 1930, Neth. 4]. (L.C.V. part 11, p. 264) "
NETHERLANDS,,"Decree to amend section 66 of the Sickness Insurance Act""1. (L.C.V. part 11, p. 275)",26.9.,1941,29,Sept. 26,"Sept. 26 Decree to amend section 66 of the Sickness Insurance Act""1. (L.C.V. part 11, p. 275) "
NETHERLANDS,,"Decree to amend 49 of the Sickness Insurance Act"". (St. No. S. 811) Neth. 1 (C)",10.11.,1941,29,Nov. 10,"Nov. 10 Decree to amend 49 of the Sickness Insurance Act"". (St. No. S. 811) Neth. 1 (C) "
NETHERLANDS,,"Decree to amend sections 7, 8 and 41 of the Accidents Act, 1921112. (L.C.V. part 11, p. 313)",10.12.,1941,29,Dec. 10,"Dec. 10 Decree to amend sections 7, 8 and 41 of the Accidents Act, 1921112. (L.C.V. part 11, p. 313) "
NETHERLANDS,,"Decree to amend the Shops Closing Act, 1930 [L.S. 1930, Neth, 4]. (L.C.V. part 11, p. 316) GOVERNIvIENT IN LONDON",18.12.,1941,29,Dec. 18,"Dec. 18 Decree to amend the Shops Closing Act, 1930 [L.S. 1930, Neth, 4]. (L.C.V. part 11, p. 316) GOVERNIvIENT IN LONDON "
NETHERLANDS,,Decree to lay down further rules to promote safety in shipping. (St. No. B. 71),11.9.,1941,29,Sept. 11,Sept. 11 Decree to lay down further rules to promote safety in shipping. (St. No. B. 71) 
NETHERLANDS,,"Decree to supplement the provisions of the Decree of 26th November, 1932 (Shipping Decree)"" [special wartime safety measures]. (St. No. B 90)",23.10.,1941,29,Oct 23,"Oct 23 Decree to supplement the provisions of the Decree of 26th November, 1932 (Shipping Decree)"" [special wartime safety measures]. (St. No. B 90) "
NETHERLANDS INDIES,,"Decree respecting the employment of women at night Decree of 17th December, 1925""]. (St. N. No.45)",28.2.,1941,29,Feb. 28,"Feb. 28 Decree respecting the employment of women at night Decree of 17th December, 1925""]. (St. N. No.45) "
NETHERLANDS INDIES,,"Decree to introduce in the Outer Provinces a tax entitled ""road tax"" for the purpose of abolishing statute labour. (St. N. No. 97)",11.4.,1941,29,Apr. 11,"Apr. 11 Decree to introduce in the Outer Provinces a tax entitled ""road tax"" for the purpose of abolishing statute labour. (St. N. No. 97) "
NETHERLANDS DEPENDENCIES,,Ordinance to lay down rules respecting conditions of employ- ment in certain industrial undertakings (Regulation of Employ- ment in Industrial Undertakings). (St. N. No. 467) Neth. md. 1 (A),13.10.,1941,30,Oct. 13,Oct. 13 Ordinance to lay down rules respecting conditions of employ- ment in certain industrial undertakings (Regulation of Employ- ment in Industrial Undertakings). (St. N. No. 467) Neth. md. 1 (A) 
NETHERLANDS DEPENDENCIES,,"Ordinance to repeal the Coolie Ordinance 1931/1936110, and certain connected therewith. (St. N. No. 514) Neth. md. 1 (B)",14.11.,1941,30,Nov. 14,"Nov. 14 Ordinance to repeal the Coolie Ordinance 1931/1936110, and certain connected therewith. (St. N. No. 514) Neth. md. 1 (B) "
NEWFOUNDLAND,,"An Act to make further provision as to the submergence of load lines. No. 7 of 1941. (N.G. No. 21, p. 1)",7.5.,1941,30,May 7,"May 7 An Act to make further provision as to the submergence of load lines. No. 7 of 1941. (N.G. No. 21, p. 1) "
NEWFOUNDLAND,,"Defence (Avoidance of Strikes and Lockouts) Regulations, 1941. (N.G. No. 26, P. 1)",27.6.,1941,30,June 27,"June 27 Defence (Avoidance of Strikes and Lockouts) Regulations, 1941. (N.G. No. 26, P. 1) "
NEWFOUNDLAND,,"Defence (Control and Conditions of Employment and Disputes Settlement) Regulations, 1941 [amended on 12th December, 19411. (N.G. No. 43, p. 2, and No. 50, p. 1)",23.10.,1941,30,Oct. 23,"Oct. 23 Defence (Control and Conditions of Employment and Disputes Settlement) Regulations, 1941 [amended on 12th December, 19411. (N.G. No. 43, p. 2, and No. 50, p. 1) "
NEW ZEALAND,,"Order in Council to declare epitheliomatous cancer of the skin and ulceration of the corneal surface of the eye, due to tar, pitch, bitumen, mineral oil, paraffin, etc.,- to be diseases within the operation of the Workers' Compensation Act, (New Zealand Gazette, p. 356)",19.2.,1941,30,Feb. 19,"Feb. 19 Order in Council to declare epitheliomatous cancer of the skin and ulceration of the corneal surface of the eye, due to tar, pitch, bitumen, mineral oil, paraffin, etc.,- to be diseases within the operation of the Workers' Compensation Act, (New Zealand Gazette, p. 356) "
NEW ZEALAND,,"Order in Council to make the National Service Emergency Regulations 1940, Amendment No. 4 [adds new Regulations 9a and 9b, relating to placing of labour and registration of em- -ployers and workers]. S. R. No. 73",14.5.,1941,30,May 14,"May 14 Order in Council to make the National Service Emergency Regulations 1940, Amendment No. 4 [adds new Regulations 9a and 9b, relating to placing of labour and registration of em- -ployers and workers]. S. R. No. 73. "
NEW ZEALAND,,"Order in Council to make the Occupational Re-establishment Emergency Regulations 1940, Amendment No. 1. S. R. No. 91. N.Z. 1 (B)",18.6.,1941,30,June 18,"June 18 Order in Council to make the Occupational Re-establishment Emergency Regulations 1940, Amendment No. 1. S. R. No. 91. N.Z. 1 (B) "
NEW ZEALAND,,"An Act to make provision with respect to public finance and other matters [Part II, Social Security]. No. 4. Fznance Act, 1941",27.8.,1941,30,Aug. 27,"Aug. 27 An Act to make provision with respect to public finance and other matters [Part II, Social Security]. No. 4. Fznance Act, 1941. "
NEW ZEALAND,,"An Act to amend the Social Security Act, 1938110. No. 14",13.10.,1941,30,Oct. 13,"Oct. 13 An Act to amend the Social Security Act, 1938110. No. 14. "
NEW ZEALAND,,"An Act to amend the Coal-mines Act, 1925119. No. 15. LS.S. VoL XVIII, No. 2, p. 60",13.10.,1941,30,Oct. 13,"Oct. 13 An Act to amend the Coal-mines Act, 1925119. No. 15. LS.S. VoL XVIII, No. 2, p. 60 "
NEW ZEALAND,,"An Act to amend the Mining Act 1926120. No. 16. LS.S. Vol. XVIII, No. 2, p. 60",13.10.,1941,30,Oct. 13,"Oct. 13 An Act to amend the Mining Act 1926120. No. 16. LS.S. Vol. XVIII, No. 2, p. 60 "
NEW ZEALAND,,"An Act to make provision for the re-establishment in civil life of persons who have served with His Majesty's Armed Forces, for the reconstitution of war-time industries on a peace-time basis, and for matters incidental thereto. No. 25. Reha,bilitat ion Act, 1941. N.Z. 1 (A)",17.10.,1941,30,Oct. 17,"Oct. 17 An Act to make provision for the re-establishment in civil life of persons who have served with His Majesty's Armed Forces, for the reconstitution of war-time industries on a peace-time basis, and for matters incidental thereto. No. 25. Reha,bilitat ion Act, 1941. N.Z. 1 (A) "
NEW ZEALAND,,"An Act to amend certain enactments of the General Assembly of New Zealand [inter alfa: the Child Welfare Act, 1925 (exten- sion of power to regulate employment of children): the Factories Amendment Act, 1936"" (as to wages payable for holidays); and the Industrial Conciliation and Arbitration Act, 1925""]. No. 26. Statutes Amendment Act, 1941",17.10.,1941,31,Oct 17,"Oct 17 An Act to amend certain enactments of the General Assembly of New Zealand [inter alfa: the Child Welfare Act, 1925 (exten- sion of power to regulate employment of children): the Factories Amendment Act, 1936"" (as to wages payable for holidays); and the Industrial Conciliation and Arbitration Act, 1925""]. No. 26. Statutes Amendment Act, 1941. "
NEW ZEALAND,,"An Act to make provision with respect to public finance and other matters [sections 8 and 9, social security taxi. No. 27. Finance Act (No. 2), 1941",17.10.,1941,31,Oct. 17,"Oct. 17 An Act to make provision with respect to public finance and other matters [sections 8 and 9, social security taxi. No. 27. Finance Act (No. 2), 1941. "
NORTHERN IRELAND,,"Determination of Needs Act (Northern Ireland), 1941. Ch. 4",8.4.,1941,31,Apr. 8,"Apr. 8 Determination of Needs Act (Northern Ireland), 1941. Ch. 4. "
NORTHERN IRELAND,,"Factories (Standards of Lighting) Regulations (Northern Ireland), 1941. S.R. & 0. No. 94, p. 35",28.4.,1941,31,Apr. 28,"Apr. 28 Factories (Standards of Lighting) Regulations (Northern Ireland), 1941. S.R. & 0. No. 94, p. 35. "
NORTHERN IRELAND,,"Essential Work (Merchant Navy) (Northern Ireland) Order, 1941. S.R. & 0. No. 121, p. 150",27.5.,1941,31,May 27,"May 27 Essential Work (Merchant Navy) (Northern Ireland) Order, 1941. S.R. & 0. No. 121, p. 150. "
NORTHERN IRELAND,,"Conditions of Employment and National Arbitration (Amend- ment) (Northern Ireland) Order, 1941. SR. & 0. No. 176, p. 150)",15.10.,1941,31,Oct. 15,"Oct. 15 Conditions of Employment and National Arbitration (Amend- ment) (Northern Ireland) Order, 1941. SR. & 0. No. 176, p. 150). "
NORTHERN IRELAND,,"Workmen's Compensation (Industrial Diseases) Order (Northern Ireland), 1941. SR. & 0. No. 182, p. 115",28.10.,1941,31,Oct. 28,"Oct. 28 Workmen's Compensation (Industrial Diseases) Order (Northern Ireland), 1941. SR. & 0. No. 182, p. 115. "
NORTHERN IRELAND,,"National Health and Contributory Pensions Act (Northern Ireland), 1941. Ch. 14",11.11.,1941,31,Nov. 11,"Nov. 11 National Health and Contributory Pensions Act (Northern Ireland), 1941. Ch. 14. "
NORTHERN IRELAND,,"Workmen's Compensation (Amendment) Act (Northern Ireland), 1941. Ch. 16",25.11.,1941,31,Nov. 25,"Nov. 25 Workmen's Compensation (Amendment) Act (Northern Ireland), 1941. Ch. 16. "
