country,region,text,date,year,page,extracted_date,full_text
PORTUGAL,,"Decree no. 15,431, to suspend the operation of Decree no. 15,342 [of ixth April, 1928] (creation of the National Provident Fund; reorganisation of the insurance industry, creation of the permanent Social Provident Fund), no. 55,343 [of ixth April, '928] (organisation of compulsory old age and invalidity insurance) and no. 15,387 [of ,8th April, 1928] (election of two representatives of Portuguese insurance companies to the Insurance Council). (D. G. p. 1,104)",7.5.,1928,118,May 7,"May 7 Decree no. 15,431, to suspend the operation of Decree no. 15,342 [of ixth April, 1928] (creation of the National Provident Fund; reorganisation of the insurance industry, creation of the permanent Social Provident Fund), no. 55,343 [of ixth April, '928] (organisation of compulsory old age and invalidity insurance) and no. 15,387 [of ,8th April, 1928] (election of two representatives of Portuguese insurance companies to the Insurance Council). (D. G. p. 1,104) "
PORTUGAL,,"Decree no. 15,433, to vary the conditions for the embarkation of Portuguese emigrants for U.S.A. ports [passports for quota emigrants to the U.S.A. to be issued exclusively under a permit from the Minister of the Interior (section 2); preference is given in the issue of such passports to children going to join their parents or guardians (section i); a special warrant from the Minister is needed for passports for Cuba or Mexico (section ii); emigrants must not sail from a foreign port, nor even from a Portuguese colony (section 6); the procedure for the issue and checking of passports and the obtaining of the American visa is laid down in detail]. (D. G. p. 1,107)",8.5.,1928,118,May 8,"May 8 Decree no. 15,433, to vary the conditions for the embarkation of Portuguese emigrants for U.S.A. ports [passports for quota emigrants to the U.S.A. to be issued exclusively under a permit from the Minister of the Interior (section 2); preference is given in the issue of such passports to children going to join their parents or guardians (section i); a special warrant from the Minister is needed for passports for Cuba or Mexico (section ii); emigrants must not sail from a foreign port, nor even from a Portuguese colony (section 6); the procedure for the issue and checking of passports and the obtaining of the American visa is laid down in detail]. (D. G. p. 1,107) "
PORTUGAL,,"Order no. 5,372, to suspend the operation of Decree no. 13,651 [of 21St May, 5927] in so far as it refers to the emigration of natives from the colony of Mozambique for the territory of the Union of South Africa during the period of negotiations and to maintain the present system in force during the period in question. (D. G. p. 1,135)",8.5.,1928,118,May 8,"May 8 Order no. 5,372, to suspend the operation of Decree no. 13,651 [of 21St May, 5927] in so far as it refers to the emigration of natives from the colony of Mozambique for the territory of the Union of South Africa during the period of negotiations and to maintain the present system in force during the period in question. (D. G. p. 1,135) "
PORTUGAL,,"Instructions for the administration of the regulations respecting loading and unloading appliances used on board ship [Part I (sections i—2), masts in mechanically propelled vessels; Part II (sections 3—so), ropes and chains; slings and strops; Part III (sections 51—63), cranes; Part IV (sections 64—83), direct tests of cranes]. (D.G. 1929, P. ',39')",25.5.,1928,119,May 25,"May 25 Instructions for the administration of the regulations respecting loading and unloading appliances used on board ship [Part I (sections i—2), masts in mechanically propelled vessels; Part II (sections 3—so), ropes and chains; slings and strops; Part III (sections 51—63), cranes; Part IV (sections 64—83), direct tests of cranes]. (D.G. 1929, P. ',39') "
PORTUGAL,,"Decree no. 55,553, to remove doubts which have arisen respecting the administration of the Decrees governing weekly rest and the relevant regu- lations issued by the municipal councils. (D. G. p. 2,262) Text: Por. 2",26.5.,1928,119,May 26,"May 26 Decree no. 55,553, to remove doubts which have arisen respecting the administration of the Decrees governing weekly rest and the relevant regu- lations issued by the municipal councils. (D. G. p. 2,262) Text: Por. 2 "
PORTUGAL,,"Decree no. 15,646, to alter the limits of capacity for certain stores of inflam- mable liquids mentioned in schedule I to the Regulations for dangerous, smbealthy and offensive industries approved by Decree no. 8,364 [of z5th August, 5922]. (D. G. p. 5,423)",27.6.,1928,119,June 27,"June 27 Decree no. 15,646, to alter the limits of capacity for certain stores of inflam- mable liquids mentioned in schedule I to the Regulations for dangerous, smbealthy and offensive industries approved by Decree no. 8,364 [of z5th August, 5922]. (D. G. p. 5,423) "
PORTUGAL,,"Decree no. 55,647, to substitute ""urban areas"" for ""cities and towns"" in the schedules to the Regulations for dangerous, unhealthy and offensive industries approved by Decree no. 8,364 [of 25th August, 1922]. (D. G. p. 1,424)",27.6.,1928,119,June 27,"June 27 Decree no. 55,647, to substitute ""urban areas"" for ""cities and towns"" in the schedules to the Regulations for dangerous, unhealthy and offensive industries approved by Decree no. 8,364 [of 25th August, 1922]. (D. G. p. 1,424) "
PORTUGAL,,"Decree no. i5,658, to issue various provisions respecting the clearance of foreign merchant vessels calling at ports in the continental territory of the Republic and the adjacent islands. (D. G. p. 1,432)",29.6.,1928,119,June 29,"June 29 Decree no. i5,658, to issue various provisions respecting the clearance of foreign merchant vessels calling at ports in the continental territory of the Republic and the adjacent islands. (D. G. p. 1,432) "
PORTUGAL,,"s Decree no. 15,698, to add spinning mills to Schedule I appended to the Reg- ulations for dangerous, unhealthy and offensive industries approved by Decree no. 8,364 [of 25th August, 1922]. (D. G. p. 1,470)",1.7.,1928,119,July i,"July is Decree no. 15,698, to add spinning mills to Schedule I appended to the Reg- ulations for dangerous, unhealthy and offensive industries approved by Decree no. 8,364 [of 25th August, 1922]. (D. G. p. 1,470) "
PORTUGAL,,"s Decree no. 55,699, to add garages for automobiles, motor bicycles and other similar vehicles driven by inflammable or combustible liquids to Schedule I appended to the Regulations for dangerous, unhealthy and offensive in- dustries [approved by Decree no. 8,364 of 25th August, 2922]. (D. G. p. 1,471)",1.7.,1928,119,July i,"July is Decree no. 55,699, to add garages for automobiles, motor bicycles and other similar vehicles driven by inflammable or combustible liquids to Schedule I appended to the Regulations for dangerous, unhealthy and offensive in- dustries [approved by Decree no. 8,364 of 25th August, 2922]. (D. G. p. 1,471) "
PORTUGAL,,"Decree no. 15,768, to ratify the agreement between Portugal and the Nether- lands [signed at the Hague on 27th June, r928] respecting their approval of each other's legislative provisions in respect of life saving appliances on board ship [does not apply to Dutch emigrant vessels in Portuguese ports which are covered by Decree no. 21,020 of 20th June, 2925]. (D. G. p. 2,558)",24.7.,1928,119,July 24,"July 24 Decree no. 15,768, to ratify the agreement between Portugal and the Nether- lands [signed at the Hague on 27th June, r928] respecting their approval of each other's legislative provisions in respect of life saving appliances on board ship [does not apply to Dutch emigrant vessels in Portuguese ports which are covered by Decree no. 21,020 of 20th June, 2925]. (D. G. p. 2,558) "
PORTUGAL,,"Decree no. 15,812, to amend section 4 of the Regulations for dangerous, unhealthy, offensive or poisonous industries approved by Decree no. 8,364 [of 25th August, 1922; section 4 relates to the conditions for the construction of establishments of the 2nd class in the vicinity of inhabited buildings]. (0. G. p. 2,63,)",3.8.,1928,119,Aug. 3,"Aug. 3 Decree no. 15,812, to amend section 4 of the Regulations for dangerous, unhealthy, offensive or poisonous industries approved by Decree no. 8,364 [of 25th August, 1922; section 4 relates to the conditions for the construction of establishments of the 2nd class in the vicinity of inhabited buildings]. (0. G. p. 2,63,) "
PORTUGAL,,"Decree no. 25,897, to bring into operation in the territories under the con- trol of the Mozambique and Nyasa Companies Decree no. 37 of the Governor General of Mozambique [dated 12th November, 1927] to approve the regulations for special native courts. (D. G. p. 1,760)",24.8.,1928,119,Aug. 24,"Aug. 24 Decree no. 25,897, to bring into operation in the territories under the con- trol of the Mozambique and Nyasa Companies Decree no. 37 of the Governor General of Mozambique [dated 12th November, 1927] to approve the regulations for special native courts. (D. G. p. 1,760) "
PORTUGAL,,"j Charter of Confirmation and Ratification of the Draft Convention adopted at the first session of the International Labour Conference held in Washington from 29th October to 29th November, i9s9, bmiting the houfs of work in industrial to eight in the day and forty-eight in the week. (D. G. p. 5,840)",2.8.,1928,119,Aug. 2,"Aug. 2j Charter of Confirmation and Ratification of the Draft Convention adopted at the first session of the International Labour Conference held in Washington from 29th October to 29th November, i9s9, bmiting the houfs of work in industrial to eight in the day and forty-eight in the week. (D. G. p. 5,840) "
PORTUGAL,,"Charter of Confirmation and Ratificationof the Draft Convention adopted at the third Session of the International Labour Conference held in Geneva from 25th October to 21st November, 1921, concerning the application of the weekly rest in industrial undertakings. (D. G. p. 1,846)",25.8.,1928,119,Aug. 25,"Aug. 25 Charter of Confirmation and Ratificationof the Draft Convention adopted at the third Session of the International Labour Conference held in Geneva from 25th October to 21st November, 1921, concerning the application of the weekly rest in industrial undertakings. (D. G. p. 1,846) "
PORTUGAL),,"Decree no. 15,917, to approve the Constitutional Charter of the Colony of Angola. (D.G. p. 1,793)",1.9.,1928,120,Sept. i,"Sept. i Decree no. 15,917, to approve the Constitutional Charter of the Colony of Angola. (D.G. p. 1,793) "
PORTUGAL),,"Decree no. i6,ooo, to create an Executive Board for the General Directorate of Shipping and to abolish the Executive Boards of the Director. ates of Merchant Shipping, Fisheries and Shipbuilding and of the Merchant Service Welfare Fund [superseded by Decree no. 16,051 of 19th October below]. (D. G. p. 2,039)",28.9.,1928,120,Sept. 28,"Sept. 28 Decree no. i6,ooo, to create an Executive Board for the General Directorate of Shipping and to abolish the Executive Boards of the Director. ates of Merchant Shipping, Fisheries and Shipbuilding and of the Merchant Service Welfare Fund [superseded by Decree no. 16,051 of 19th October below]. (D. G. p. 2,039) "
PORTUGAL),,"Decree no. 16,ooj, to fix the penalty to be imposed on Portuguese officials on foreign vessels for the assistance of Portuguese emigrants under Decree no. 13,213 [of 4th March, in the event of the commission by the said officials during the voyage of offences for which proceedings are not taken against them on board by the competent authority. (D. G. p. 2,041)",4.10.,1928,120,Oct. 4,"Oct. 4 Decree no. 16,ooj, to fix the penalty to be imposed on Portuguese officials on foreign vessels for the assistance of Portuguese emigrants under Decree no. 13,213 [of 4th March, in the event of the commission by the said officials during the voyage of offences for which proceedings are not taken against them on board by the competent authority. (D. G. p. 2,041) "
PORTUGAL),,"Decree no. 56,051, to create an Executive Board for the General Directorate of Shipping and to abolish the Executive Boards of the Central Fisheries Commission and the Directorates of Shipbuilding and Merchant Shipping and transfer their duties to the new Executive Board [supersedes Decree no. i6,ooo of 28th September, 5928]. (D. G. p. 2,154)",19.10.,1928,120,Oct. 19,"Oct. 19 Decree no. 56,051, to create an Executive Board for the General Directorate of Shipping and to abolish the Executive Boards of the Central Fisheries Commission and the Directorates of Shipbuilding and Merchant Shipping and transfer their duties to the new Executive Board [supersedes Decree no. i6,ooo of 28th September, 5928]. (D. G. p. 2,154) "
PORTUGAL),,"Decree no. 16,072, to proclaim that the issue of passports to Portuguese emigrants to Cuba is not subject to any special restrictions [repeals section 12 of Decree no. 55,433 of i8th May, 1928, in so far as it relates to Cuba]. (D. G. p. 2,596)",26.10.,1928,120,Oct. 26,"Oct. 26 Decree no. 16,072, to proclaim that the issue of passports to Portuguese emigrants to Cuba is not subject to any special restrictions [repeals section 12 of Decree no. 55,433 of i8th May, 1928, in so far as it relates to Cuba]. (D. G. p. 2,596) "
PORTUGAL),,"Order no. 5,689, to issue regulations concerning emigration to the U.S.A. [limitation of permits for emigration to correspond with U.S.A. quotas for admission]. (D. G. p. 2,264)",32.10.,1928,120,Oct. 32,"Oct. 32 Order no. 5,689, to issue regulations concerning emigration to the U.S.A. [limitation of permits for emigration to correspond with U.S.A. quotas for admission]. (D. G. p. 2,264) "
PORTUGAL),,"Decree no. 16,102, to amend section 16 of Decree no. 10,782 [of zoth May, 1925]242 which assigns to the police authorities and officers lo—zo per cent. of the fines imposed for the contraventions respecting hours of work which they report and to provide that the said percentage shall accrue to the local poor relief funds and the remainder shall be deemed to be State revenue. (D. G. p. 2,273; republication in corrected form, p. 2,337)",35.10.,1928,120,Oct. 35,"Oct. 35 Decree no. 16,102, to amend section 16 of Decree no. 10,782 [of zoth May, 1925]242 which assigns to the police authorities and officers lo—zo per cent. of the fines imposed for the contraventions respecting hours of work which they report and to provide that the said percentage shall accrue to the local poor relief funds and the remainder shall be deemed to be State revenue. (D. G. p. 2,273; republication in corrected form, p. 2,337) "
PORTUGAL),,"Decree no. 16,135, to fix the strength of the crews of vessels in the mercantile marine [supersedes. Decree no. 14,629 of 26th November, 1927]. (D.G. p. 2,332; errata, p. 2,360, p. 2,385 and 2929, p. 40)",8.11.,1928,120,Nov. 8,"Nov. 8 Decree no. 16,135, to fix the strength of the crews of vessels in the mercantile marine [supersedes. Decree no. 14,629 of 26th November, 1927]. (D.G. p. 2,332; errata, p. 2,360, p. 2,385 and 2929, p. 40) "
PORTUGAL),,"Decree no. 16,177, to ratify the Convention between the Government of the Portuguese Republic and the Government of the Union of South Africa [signed on sith September, 1928, concerning the introduction of native labourers from Mozambique into the Transvaal, railway matters and com- mercial intercourse between Mozambique and the Union]243. (D. G. p. 2,403)",29.11.,1928,120,Nov. 29,"Nov. 29 Decree no. 16,177, to ratify the Convention between the Government of the Portuguese Republic and the Government of the Union of South Africa [signed on sith September, 1928, concerning the introduction of native labourers from Mozambique into the Transvaal, railway matters and com- mercial intercourse between Mozambique and the Union]243. (D. G. p. 2,403) "
PORTUGAL),,"Decree no. 16,199, to approve the Native Labour Code for the Portuguese colonies in Africa [supersedes Decree no. 951 of 14th October, 1914]. (D.G. p. 2,445) Text: Por. 3",6.12.,1928,120,Dec. 6,"Dec. 6 Decree no. 16,199, to approve the Native Labour Code for the Portuguese colonies in Africa [supersedes Decree no. 951 of 14th October, 1914]. (D.G. p. 2,445) Text: Por. 3 "
PORTUGAL),,"Decree no. 16,206, to authorise mining undertakings and any other industrial undertakings carried on in places remote from the chief towns of the districts to which they belong to establish and maintain a private police force en- tirely at their own expense in cases where the mining or industrial popula- tion is not less than soo persons. (D. G. p. 2,491)",7.12.,1928,120,Dec. 7,"Dec. 7 Decree no. 16,206, to authorise mining undertakings and any other industrial undertakings carried on in places remote from the chief towns of the districts to which they belong to establish and maintain a private police force en- tirely at their own expense in cases where the mining or industrial popula- tion is not less than soo persons. (D. G. p. 2,491) "
PORTUGAL),,"Decree no. 16,242, to approve the Regulations for the Superannuation ahd Pension Fund of the State Railways. (D. G. p. 2,535)",17.12.,1928,120,Dec. 17,"Dec. 17 Decree no. 16,242, to approve the Regulations for the Superannuation ahd Pension Fund of the State Railways. (D. G. p. 2,535) "
PORTUGAL DEPENDENCIES,Angola (Portuguese West Africa),"Legislative Decree no. 3, to issue various provisions respecting the hygienic care and medical attendance to be given to native workers recruited in the Colony for the service of the State or private persons, and to those destined for S. Tomb [precautions against sleeping sickness and other infectious dis- eases]. (B.O.A. Part I, no. s8, p. 288; corrected text, no. 29, p. 298)",30.4.,1928,121,Apr. 30,"Apr. 30 Legislative Decree no. 3, to issue various provisions respecting the hygienic care and medical attendance to be given to native workers recruited in the Colony for the service of the State or private persons, and to those destined for S. Tomb [precautions against sleeping sickness and other infectious dis- eases]. (B.O.A. Part I, no. s8, p. 288; corrected text, no. 29, p. 298) "
PORTUGAL DEPENDENCIES,Angola (Portuguese West Africa),"Order to appoint a commission to consider the revision of Legislative Decree no. 68o [of 31st December, 5927], issuing certain provisions respecting im- migration. (B.O.A. Part II, no. ao, p. 256)",17.5.,1928,121,May 17,"May 17 Order to appoint a commission to consider the revision of Legislative Decree no. 68o [of 31st December, 5927], issuing certain provisions respecting im- migration. (B.O.A. Part II, no. ao, p. 256) "
PORTUGAL DEPENDENCIES,Manica and Sofala (Portuguese East Africa),"Order no. 5,830, to adopt and bring into operation in the Territory Legis- lative Decree of the Colony of Mozambique no. 36 of sath November, 5927 [to define the special features characteristic of natives for the purpose of special legislation relating to natives]. (lloletim da Companhia de Moçam- bique, no. 24, p. 383)",10.12.,1928,121,Dec. io,"Dec. io Order no. 5,830, to adopt and bring into operation in the Territory Legis- lative Decree of the Colony of Mozambique no. 36 of sath November, 5927 [to define the special features characteristic of natives for the purpose of special legislation relating to natives]. (lloletim da Companhia de Moçam- bique, no. 24, p. 383) "
PORTUGAL DEPENDENCIES,lilozambique (Portuguese East Africa),"Legislative Decree no. 74, to provide for the granting of a monthly pension to ali native wage-earning employees in the permanent service of the State who owing to incurable diseases or advanced age cannot continue to per- form their duties. (Boletim Oficial da Colonia de Moçambique, Part I, no. 24, p. 174)",9.6.,1928,121,June 9,"June 9 Legislative Decree no. 74, to provide for the granting of a monthly pension to ali native wage-earning employees in the permanent service of the State who owing to incurable diseases or advanced age cannot continue to per- form their duties. (Boletim Oficial da Colonia de Moçambique, Part I, no. 24, p. 174) "
PORTUGAL DEPENDENCIES,Portuguese Guinea,"Order no. 3, to institute the Fund for the civilisation and assistance of natives [fifty per cent, of receipts are to be assigned to the establishment and main- tenance of charitable institutions and trade schools for natives alone]. (Bole- tin oficial da Colonia da Guinb, no. a, p. as)",6.1.,1928,121,Jan. 6,"Jan. 6 Order no. 3, to institute the Fund for the civilisation and assistance of natives [fifty per cent, of receipts are to be assigned to the establishment and main- tenance of charitable institutions and trade schools for natives alone]. (Bole- tin oficial da Colonia da Guinb, no. a, p. as) "
PORTUGAL DEPENDENCIES,Portuguese Guinea,"Order no. 29, to fix the remimerailon of natives employed in the service of the State and in private industrial and agricultural undertakings. (op. ru. no. so, p. 533)",5.3.,1928,121,Mar. 5,"Mar. 5 Order no. 29, to fix the remimerailon of natives employed in the service of the State and in private industrial and agricultural undertakings. (op. ru. no. so, p. 533) "
PORTUGAL DEPENDENCIES,Portuguese Guinea,"Order no. io6, to issue regulations for the administration of the provinces [divides Portuguese Guinea into four provinces, each under an intendant, and these provinces are further divided into residences; the duties of the residents include (section 20) encouragement of native agriculture on cer- tam lines and repression of idleness and vagrancy among natives; also re- porting on treatment of workers by employees; sections 46— 66, native author- ities; section employment of natives on public works; sections 76— so8, judicial organisation for natives]. (op. nit, supplement to no. no. a6— 2928, p.s)",27.12.,1928,121,Dec. 27,"Dec. 27 Order no. io6, to issue regulations for the administration of the provinces [divides Portuguese Guinea into four provinces, each under an intendant, and these provinces are further divided into residences; the duties of the residents include (section 20) encouragement of native agriculture on cer- tam lines and repression of idleness and vagrancy among natives; also re- porting on treatment of workers by employees; sections 46— 66, native author- ities; section employment of natives on public works; sections 76— so8, judicial organisation for natives]. (op. nit, supplement to no. no. a6— 2928, p.s) "
PORTUGAL DEPENDENCIES,Portuguese India,"er no. 171, to approve the proposed amendments of the rulth of the Nova Goa Welfare Fund [section a, (d), one of the objects of the fund is to assist members who are incapacitated for work on account of illness or an acci- dent]. (Boletim oficial do Governo Geral do Estado da India, no. 24, p. 416)",9.3.,1928,121,Mar. Ord,"Mar. Order no. 171, to approve the proposed amendments of the rulth of the Nova Goa Welfare Fund [section a, (d), one of the objects of the fund is to assist members who are incapacitated for work on account of illness or an acci- dent]. (Boletim oficial do Governo Geral do Estado da India, no. 24, p. 416) "
PORTUGAL DEPENDENCIES,Portuguese India,"Order no. 445, to approve the regulations for the storage and use of explo- sives intended for work in mines. (op. cit. no. p. 1,094)",6.7.,1928,121,July 6,"July 6 Order no. 445, to approve the regulations for the storage and use of explo- sives intended for work in mines. (op. cit. no. p. 1,094) "
PORTUGAL DEPENDENCIES,S Tome and Principe,"Order no. 50 and to regulate the remuneration of native workers whose contracts have expired and who are awaiting repatriation. (B.O.T. no. 23, p. 230)",9.6.,1928,122,June 9,"June 9 Order no. 50 and to regulate the remuneration of native workers whose contracts have expired and who are awaiting repatriation. (B.O.T. no. 23, p. 230) "
PORTUGAL DEPENDENCIES,S Tome and Principe,"Order no. 52, respecting the fixing in local currency of the wages of native workers from Mozambique. (B.O.T. no. 23, p. 230)",9.6.,1928,122,June 9,"June 9 Order no. 52, respecting the fixing in local currency of the wages of native workers from Mozambique. (B.O.T. no. 23, p. 230) "
PORTUGAL DEPENDENCIES,S Tome and Principe,"Legislative Decree- no. 57, to amend certain provisions of the civil Register code respectidg the registration of the deaths of workers under the care of the Protector's Office. (B.O.T. no. 29, p. 294)",19.7.,1928,122,July 19,"July 19 Legislative Decree- no. 57, to amend certain provisions of the civil Register code respectidg the registration of the deaths of workers under the care of the Protector's Office. (B.O.T. no. 29, p. 294) "
PORTUGAL DEPENDENCIES,S Tome and Principe,"Legislative Decree no. s8, to fix the penalties to be imposed on persons (acoutadores) who receive natives under coistract with a third party referred to in section 203 of the General Regulations for native labour [of 14th Oc- tober, 1914]. (B.O.T. no. 29, p. 295)",20.7.,1928,122,July 20,"July 20 Legislative Decree no. s8, to fix the penalties to be imposed on persons (acoutadores) who receive natives under coistract with a third party referred to in section 203 of the General Regulations for native labour [of 14th Oc- tober, 1914]. (B.O.T. no. 29, p. 295) "
PORTUGAL DEPENDENCIES,S Tome and Principe,"Order no. 99, to approve the regulations for the work of the Department of the curator General for indentured labourers and settlers. (B. O.T. supple- ment to no. 49, no. 19—1928, p. s)",6.12.,1928,122,Dec. 6,"Dec. 6 Order no. 99, to approve the regulations for the work of the Department of the curator General for indentured labourers and settlers. (B. O.T. supple- ment to no. 49, no. 19—1928, p. s) "
