country,region,text,date,year,page,extracted_date,full_text
GREECE,,"Legislative Decree respecting the organisation of the services of the Ministry of Public Health, Welfare and Relief. (E.K. no. p. 2,293; errata, no. 170, p. 1,382)",10.8.,1928,80,Aug. io,"Aug. io Legislative Decree respecting the organisation of the services of the Ministry of Public Health, Welfare and Relief. (E.K. no. p. 2,293; errata, no. 170, p. 1,382) "
GREECE,,"Act no. 3,651, to ratify the Legislative Decree of 12th November, 1927, to ratify the Legislative Decrees respecting the hackney carriage drivers' fund, as amended. (E.K. no. x68, p. 1,315)",14.8.,1928,80,Aug. 14,"Aug. 14 Act no. 3,651, to ratify the Legislative Decree of 12th November, 1927, to ratify the Legislative Decrees respecting the hackney carriage drivers' fund, as amended. (E.K. no. x68, p. 1,315) "
GREECE,,"Decree to amend the Decree of 5th January, 1926, with respect to the con- stitution of a disciplinary board for the pilot corps [board to be appointed every three months by the Minister of Marine]. (E. K. no. zoi, p. 1,708)",7.9.,1928,80,Sept. 7,"Sept. 7 Decree to amend the Decree of 5th January, 1926, with respect to the con- stitution of a disciplinary board for the pilot corps [board to be appointed every three months by the Minister of Marine]. (E. K. no. zoi, p. 1,708) "
GREECE,,"Decree to extend the Sunday rest regulations to photographic establish- ments in Athens and Piraeus. (E.K. flO. 242, p. 2,152)",19.11.,1928,81,Nov. 19,"Nov. 19 Decree to extend the Sunday rest regulations to photographic establish- ments in Athens and Piraeus. (E.K. flO. 242, p. 2,152) "
GREECE,,"Decree respecting the closing in rotation of eating-houses and wine-bars in Athens [half to be closed on Sunday]. (E.K. no. 242, p. 2,151)",19.11.,1928,81,Nov. 19,"Nov. 19 Decree respecting the closing in rotation of eating-houses and wine-bars in Athens [half to be closed on Sunday]. (E.K. no. 242, p. 2,151) "
GREECE,,"Decree respecting Sunday rest in restaurants, public-houses, eating-houses and wine-bars in the Piraeus during the winter season. (E. K. flO. 242, p. 2,151)",19.11.,1928,81,Nov. 19,"Nov. 19 Decree respecting Sunday rest in restaurants, public-houses, eating-houses and wine-bars in the Piraeus during the winter season. (E. K. flO. 242, p. 2,151) "
GREECE,,"Decree respecting the correct interpretation of the provisions of the Decree of 8th July, 1925, respecting the application of the eight-hour day to tobacco stores and tobacco factories'42. (E.K. no. z5o, p. 2,231) Text: Gr. 4 (B)",23.11.,1928,81,Nov. 23,"Nov. 23 Decree respecting the correct interpretation of the provisions of the Decree of 8th July, 1925, respecting the application of the eight-hour day to tobacco stores and tobacco factories'42. (E.K. no. z5o, p. 2,231) Text: Gr. 4 (B) "
GREECE,,"Decree to consolidate the Acts respecting Sunday rest. (E. K. no.251, p. 2,233) Text: Gr. 3",23.11.,1928,81,Nov. 23,"Nov. 23 Decree to consolidate the Acts respecting Sunday rest. (E. K. no.251, p. 2,233) Text: Gr. 3 "
GREECE,,"Decree respecting the position of salaried employees called up for military service. (E. K. 1929, flO. 23, p. 242) Text: Gr. 5",8.9.,1928,81,Dee. 8,"Dee. 8 Decree respecting the position of salaried employees called up for military service. (E. K. 1929, flO. 23, p. 242) Text: Gr. 5 "
GREECE,,"Act no. 3,685, respecting the laying of steamboats alongsidequays in ports and the granting of unemployment relief of boatmen. (E. K. flO. 260, p. 2,315)",8.12.,1928,81,Dec. 8,"Dec. 8 Act no. 3,685, respecting the laying of steamboats alongsidequays in ports and the granting of unemployment relief of boatmen. (E. K. flO. 260, p. 2,315) "
GREECE,,"Decree to amend the Decrees respecting the working of the Tobacco Workers' Insurance Fund [amends Decree of z6th April, 1926]. (E. K. 1929, flO. i, p. 7)",2.12.,1928,81,Dec. z,"Dec. z, Decree to amend the Decrees respecting the working of the Tobacco Workers' Insurance Fund [amends Decree of z6th April, 1926]. (E. K. 1929, flO. i, p. 7) "
GREECE,,"Act no. 3,714 to ratify the Legislative Decree of ,oth August, 1928, respect- ing the organisation of the services in the Ministry of Public Health, Welfare and Relief. (E. K. no. 274, p. 2,428)",24.12.,1928,81,Dec. 24,"Dec. 24 Act no. 3,714 to ratify the Legislative Decree of ,oth August, 1928, respect- ing the organisation of the services in the Ministry of Public Health, Welfare and Relief. (E. K. no. 274, p. 2,428) "
GREECE,,"Decree to amend the regulations concerning unemployment issued by the Tobacco Workers' Insurance Fund [tobacco workers discharged from the army entitled to unemployment benefit]. (E. K. 1929, no. 3, p. 22)",28.12.,1928,81,Dec. z8,"Dec. z8 Decree to amend the regulations concerning unemployment issued by the Tobacco Workers' Insurance Fund [tobacco workers discharged from the army entitled to unemployment benefit]. (E. K. 1929, no. 3, p. 22) "
GUATEMALA,,"Decision to approve the Regulations for the protection of the health of labourers on estates. (Ministerio de Gobernación y Justicia: Ley de Trabajadores y sus reformas, etc., octubre de 1929, p. 149)",15.1.,1928,81,Jan. iS,"Jan. iS Decision to approve the Regulations for the protection of the health of labourers on estates. (Ministerio de Gobernación y Justicia: Ley de Trabajadores y sus reformas, etc., octubre de 1929, p. 149) "
GUATEMALA,,"Decree no. 967: [to set up in the Ministry of Agriculture an administrative section entitled ""Land Settlement, Repatriation and Immigration Section; to encourage land settlement, the repatriation of Guatemalans who have emigrated, and the immigration of aliens]. (G. vol. CXIX, no. 35, p. 193)",19.1.,1928,81,Jan. 19,"Jan. 19 Decree no. 967: [to set up in the Ministry of Agriculture an administrative section entitled ""Land Settlement, Repatriation and Immigration Section; to encourage land settlement, the repatriation of Guatemalans who have emigrated, and the immigration of aliens]. (G. vol. CXIX, no. 35, p. 193) "
GUATEMALA,,"Decree no. 968, to issue the Education Act [chap. XXXV, evening schools for workers: chap. XXXIX, vocational schools (commerce, industry, agri- culture)]. (G. vol. CXIX, no. p. 277; flO. 52, p. 289)",9.2.,1928,81,Feb. 9,"Feb. 9 Decree no. 968, to issue the Education Act [chap. XXXV, evening schools for workers: chap. XXXIX, vocational schools (commerce, industry, agri- culture)]. (G. vol. CXIX, no. p. 277; flO. 52, p. 289) "
GUATEMALA,,"Regulations for the administration of Decree no. gôs [of xgth December, 1917; sections i registration of commercial, industrial and agricultural undertakings and statistical returns of employees; sections 5, 6, 8, arrange- ments for enforcement of Regulations; section 7, eight-hour day and forty- eight hour week made the standard for commercial establishments and banks; further work to be deemed to be overtime; establishments may be kept open on Sundays and holidays, but employees must not be compelled to work on these days]. (G. vol. CXIX, no. So, p",29.2.,1928,81,Feb. 29,"Feb. 29 Regulations for the administration of Decree no. gôs [of xgth December, 1917; sections i registration of commercial, industrial and agricultural undertakings and statistical returns of employees; sections 5, 6, 8, arrange- ments for enforcement of Regulations; section 7, eight-hour day and forty- eight hour week made the standard for commercial establishments and banks; further work to be deemed to be overtime; establishments may be kept open on Sundays and holidays, but employees must not be compelled to work on these days]. (G. vol. CXIX, no. So, p. "
GUATEMALA,,"Amendment of Regulations respecting barbers' shops approved by a Resolu- tion dated s8th November, 1927. (G. vol. CXIX, no. 99, p. 693)",27.3.,1928,81,Mar. 27,"Mar. 27 Amendment of Regulations respecting barbers' shops approved by a Resolu- tion dated s8th November, 1927. (G. vol. CXIX, no. 99, p. 693) "
GUATEMALA,,"Decree no. 1535 [to ratify Decree no. 950, issued by the Executive on 31st August, 5927 (immigration restrictions)). (G. vol. CXX, no. 69, p. 513)",1.5.,1928,81,May i,"May i Decree no. 1535 [to ratify Decree no. 950, issued by the Executive on 31st August, 5927 (immigration restrictions)). (G. vol. CXX, no. 69, p. 513) "
GUATEMALA,,"Decision to amend a Government meaaure dated 29th February of the current year [respecting the registration of employees]. (Ministerio de Gobernacion y Justicia: Ley de Trabajadores y sus reformas, etc., octubre de 1929, p. 40)",13.6.,1928,82,June 13,"June 13 Decision to amend a Government meaaure dated 29th February of the current year [respecting the registration of employees]. (Ministerio de Gobernacion y Justicia: Ley de Trabajadores y sus reformas, etc., octubre de 1929, p. 40) "
GUATEMALA,,"Decision [under Decree uo. 962 of 19th December, '927] to approve the regu- lations for the register of agricultural estates and their employees. (op. cit. p. 41)",31.7.,1928,82,July 31,"July 31 Decision [under Decree uo. 962 of 19th December, '927] to approve the regu- lations for the register of agricultural estates and their employees. (op. cit. p. 41) "
HAITI,,"Act to ensure the proper supervision of immigration iii Haiti [passports]. (Le Moniteur, no. 205, p. 415)",24.12.,1928,82,Dec. 24,"Dec. 24 Act to ensure the proper supervision of immigration iii Haiti [passports]. (Le Moniteur, no. 205, p. 415) "
HONDURAS,,"Feb. '6 Decree no. 43: [safety regulations for mining undertakings (dry boring)]. (La Gaeeta, no. 7,567, p. 373; Boletin Legislativo, no. ss, p. 97)",6.2.,1928,82,Feb. 6,"Feb. '6 Decree no. 43: [safety regulations for mining undertakings (dry boring)]. (La Gaeeta, no. 7,567, p. 373; Boletin Legislativo, no. ss, p. 97) "
HUNGARY,,"s Act no. V, respecting the protection of children, young persons and women employed in industry and in certain other undertakings. (0. T. no. 3, p. 203) Text: Hung. 1",1.1.,1928,82,Jan. i,"Jan. is Act no. V, respecting the protection of children, young persons and women employed in industry and in certain other undertakings. (0. T. no. 3, p. 203) Text: Hung. 1 "
HUNGARY,,"Order no. 198/1928 of the council of Ministers, to issue a schedule of occupa- tional diseases giving a right to accident compensation. (B. K. no. 54) Text; Hung.2",13.1.,1928,82,Jan. 13,"Jan. 13 Order no. 198/1928 of the council of Ministers, to issue a schedule of occupa- tional diseases giving a right to accident compensation. (B. K. no. 54) Text; Hung.2 "
HUNGARY,,"Order no. 199/1928 of the council of Ministers [under sections 7 and 56 of Act no. XXI of 3rd August, respecting the exemption of theatrical artistes and certain editorial members of the staff of newspapers from com- pulsory sickness and accident insurance. (B. K. no. 14)",13.1.,1928,82,Jan. 13,"Jan. 13 Order no. 199/1928 of the council of Ministers [under sections 7 and 56 of Act no. XXI of 3rd August, respecting the exemption of theatrical artistes and certain editorial members of the staff of newspapers from com- pulsory sickness and accident insurance. (B. K. no. 14) "
HUNGARY,,"er no. 200/1928 of the council of Ministers [under section s8o of Act no. XXI of 3rd August, respecting the extension of liability to sick- ness insurance with the commercial Sickness Insurance Institution in Bnda- pest. (BK. no. 14)",9.1.,1928,82,Jan. Ord,"Jan. Order no. 200/1928 of the council of Ministers [under section s8o of Act no. XXI of 3rd August, respecting the extension of liability to sick- ness insurance with the commercial Sickness Insurance Institution in Bnda- pest. (BK. no. 14) "
HUNGARY,,"Order no. 310/1927 of the council of Ministers, to repeal and amend certain provisions of the Provisional River, canal and Lake Shipping Code pro- mulgated by Order no. 2,362/1869 of the Minister of Public Works and Trans- port and republished in 1883 (Magyarorsshgi Rendeletek T:ra, 2883, p. 5,807) by the Minister of Public Works and Transport. (B. K. no. 24) Extracts: Hung. 8",13.1.,1928,82,Jan. 13,"Jan. 13 Order no. 310/1927 of the council of Ministers, to repeal and amend certain provisions of the Provisional River, canal and Lake Shipping Code pro- mulgated by Order no. 2,362/1869 of the Minister of Public Works and Trans- port and republished in 1883 (Magyarorsshgi Rendeletek T:ra, 2883, p. 5,807) by the Minister of Public Works and Transport. (B. K. no. 24) Extracts: Hung. 8 "
HUNGARY,,"Jan. '6 Order no. s26/eln./1928 of the Minister of Social Welfare and Labour, re- specting the administration of Order no. soo [of s3th January above] of the Council of Ministers respecting the extension of liability to insurance with the Commercial Sickness Insurance Institution in Budapest. (B. K. no. 14)",6.1.,1928,82,Jan. 6,"Jan. '6 Order no. s26/eln./1928 of the Minister of Social Welfare and Labour, re- specting the administration of Order no. soo [of s3th January above] of the Council of Ministers respecting the extension of liability to insurance with the Commercial Sickness Insurance Institution in Budapest. (B. K. no. 14) "
HUNGARY,,"Order no. 30,800/1928 of the Minister of Social Welfare and Labour [under section 532 of Act no. XXI of 3rd August, 1957143] respecting the registration for sickness insurance of domestic workers. (B. K. no. 42)",14.2.,1928,82,Feb. 14,"Feb. 14 Order no. 30,800/1928 of the Minister of Social Welfare and Labour [under section 532 of Act no. XXI of 3rd August, 1957143] respecting the registration for sickness insurance of domestic workers. (B. K. no. 42) "
HUNGARY,,"Order no. 32,680/1928 of the Minister of Social \Velfare and Labour in agree- ment with the Illinisters of the Interior and of commerce respecting the administration of Order no. ii,ioo of soth December, 2927, respecting the temporary prohibition of immigration. (B. K. no. 45)",17.2.,1928,83,Feb. 17,"Feb. 17 Order no. 32,680/1928 of the Minister of Social \Velfare and Labour in agree- ment with the Illinisters of the Interior and of commerce respecting the administration of Order no. ii,ioo of soth December, 2927, respecting the temporary prohibition of immigration. (B. K. no. 45) "
HUNGARY,,"er no. 1,200/1928 of the council of Ministers [under section iSo of Act no. XXI of 3rd August, 2927142] respecting the extension of liability to iii- surance with the Commercial Sickness Insurance Institution in Budapest. (BK. no. 6o)",9.3.,1928,83,Mar. Ord,"Mar. Order no. 1,200/1928 of the council of Ministers [under section iSo of Act no. XXI of 3rd August, 2927142] respecting the extension of liability to iii- surance with the Commercial Sickness Insurance Institution in Budapest. (BK. no. 6o) "
HUNGARY,,"er no. 1,026/1928 of the Minister of Social Welfare and Labour, to in- crease the number of assessors to be elected to the Budapest Workers' In- surance Court. (BK. no. 63)",9.3.,1928,83,Mar. Ord,"Mar. Order no. 1,026/1928 of the Minister of Social Welfare and Labour, to in- crease the number of assessors to be elected to the Budapest Workers' In- surance Court. (BK. no. 63) "
HUNGARY,,"Order no. 73,209/5928 of the Minister of Cosnmerce, respecting the temporary suspension of the statutory [weekly] rest in the soda-water industry [from ist May to pth September of the current year the manufacture and delivery of soda-water are permitted throughout the day on Sundays and St. Stephen's Day; from ibth September onwards manufacture is permitted uistil noon and delivery until 2 p.m. in accordance with section of the Sunday Rest Order of x8th November, 19211441. (B. K. no. 103)",20.4.,1928,83,Apr. 20,"Apr. 20 Order no. 73,209/5928 of the Minister of Cosnmerce, respecting the temporary suspension of the statutory [weekly] rest in the soda-water industry [from ist May to pth September of the current year the manufacture and delivery of soda-water are permitted throughout the day on Sundays and St. Stephen's Day; from ibth September onwards manufacture is permitted uistil noon and delivery until 2 p.m. in accordance with section of the Sunday Rest Order of x8th November, 19211441. (B. K. no. 103) "
HUNGARY,,"Acts no. XV—XVIII inclusive to ratify the Draft Conventions of the General Conference of the International Labour Organisation (s) concerning unemployment (Washington, 1919); (2) fixing the minimum age for the admission of children to employment at sea (Genoa, 5920); (3) fixing the minimum age for the admission of young persons to employ- ment as trimnsers or stokers (Geneva, 1921); concerning the compulsory medical examination of children and young persons employed at sea (Geneva, 1921). (O.T. no. 8, pp. 253, 256, 259, 262)",24.4.,1928,83,Apr. 24,"Apr. 24 Acts no. XV—XVIII inclusive to ratify the Draft Conventions of the General Conference of the International Labour Organisation (s) concerning unemployment (Washington, 1919); (2) fixing the minimum age for the admission of children to employment at sea (Genoa, 5920); (3) fixing the minimum age for the admission of young persons to employ- ment as trimnsers or stokers (Geneva, 1921); concerning the compulsory medical examination of children and young persons employed at sea (Geneva, 1921). (O.T. no. 8, pp. 253, 256, 259, 262) "
HUNGARY,,"Order no. 67,45u/XI/1928 of the Minister of Commerce, to fix the amount of the security to be deposited by employment agencies. (B.K. no. iii)",8.5.,1928,83,May 8,"May 8 Order no. 67,45u/XI/1928 of the Minister of Commerce, to fix the amount of the security to be deposited by employment agencies. (B.K. no. iii) "
HUNGARY,,"Order no. 73,558/XI/1928 of the Minister of Commerce, respecting the packing on rest days of goods intended for the annual fair and the storage of goods returned from the annual fair in the place of business, workplace or warehouse. (B. K. no. iii) Text: Hung. 3",8.5.,1928,83,May 8,"May 8 Order no. 73,558/XI/1928 of the Minister of Commerce, respecting the packing on rest days of goods intended for the annual fair and the storage of goods returned from the annual fair in the place of business, workplace or warehouse. (B. K. no. iii) Text: Hung. 3 "
HUNGARY,,"er no. 2,300/1928 of the Council of Ministers [under section 7 of Act no. XXI of 3rd August, 2927541] respecting the payments due to particular classes of State and county employees in case of sickness. (BK. no. xis)",9.5.,1928,83,May. Ord,"May. Order no. 2,300/1928 of the Council of Ministers [under section 7 of Act no. XXI of 3rd August, 2927541] respecting the payments due to particular classes of State and county employees in case of sickness. (BK. no. xis) "
HUNGARY,,"Order no. 85,237/XI/1928 of the Minister of Commerce in agreement with the Minister of the Interior, to ensure the co-operation of free public and private employment agencies. (B. K. no. 523) Text: Hung. &",23.5.,1928,83,May 23,"May 23 Order no. 85,237/XI/1928 of the Minister of Commerce in agreement with the Minister of the Interior, to ensure the co-operation of free public and private employment agencies. (B. K. no. 523) Text: Hung. & "
HUNGARY,,"er no. 584,000/ VII of the Minister of the Interior, respecting the main- tenance of order at political meetings, public meetings and meetings of organisations. (B. K. no. 142)",9.6.,1928,83,June Ord,"June Order no. 584,000/ VII of the Minister of the Interior, respecting the main- tenance of order at political meetings, public meetings and meetings of organisations. (B. K. no. 142) "
HUNGARY,,"Acts nos. XXVI—XXXII inclusive to ratify the Draft Conventions of the General Conference of the International Labour Organisation concerning — (s) the night work of young persons employed in industry (Washington, 1919); (2) the employment of women before and after childbirth (Washington, 1919); the employment of women during the night (Washington, 1919); workmen's compensation for accidents (Geneva, 1925); workmen's compensation for occupational diseases (Geneva, 2925); (6) equality of treatment for national and foreign workers as regards workmen's compensation for accidents (Geneva, 1925); (7) sickness insurance for workers in industry and commerce and domestic servants (Geneva, 1927). (O.T. no. 13, pp. 338, 341, 344, 347, 353, 359, 364)",15.6.,1928,83,June iS,"June iS Acts nos. XXVI—XXXII inclusive to ratify the Draft Conventions of the General Conference of the International Labour Organisation concerning — (s) the night work of young persons employed in industry (Washington, 1919); (2) the employment of women before and after childbirth (Washington, 1919); the employment of women during the night (Washington, 1919); workmen's compensation for accidents (Geneva, 1925); workmen's compensation for occupational diseases (Geneva, 2925); (6) equality of treatment for national and foreign workers as regards workmen's compensation for accidents (Geneva, 1925); (7) sickness insurance for workers in industry and commerce and domestic servants (Geneva, 1927). (O.T. no. 13, pp. 338, 341, 344, 347, 353, 359, 364) "
HUNGARY,,"Order no. 77,724/1928 of the Minister of Commerce, respecting security for employees in hotels, boarding-houses, restaurants, public houses, cookshops, cafés, coffee bars and dairies. (B. K. no. 555) Text; Hung. 6",4.7.,1928,84,July 4,"July 4 Order no. 77,724/1928 of the Minister of Commerce, respecting security for employees in hotels, boarding-houses, restaurants, public houses, cookshops, cafés, coffee bars and dairies. (B. K. no. 555) Text; Hung. 6 "
HUNGARY,,"Act no. XL, respecting compulsory old age, invalidity, widows' and orphans' insurance. (O.T. no. 17, p. Text; Hung. 4",28.7.,1928,84,July 28,"July 28 Act no. XL, respecting compulsory old age, invalidity, widows' and orphans' insurance. (O.T. no. 17, p. Text; Hung. 4 "
HUNGARY,,"Order no. 3,590/1928 of the Council of Ministers to amend Order no. 371/1922 respecting the registration of ocean going merchant vessels. (B. K. no. 184)",8.8.,1928,84,Aug. 8,"Aug. 8 Order no. 3,590/1928 of the Council of Ministers to amend Order no. 371/1922 respecting the registration of ocean going merchant vessels. (B. K. no. 184) "
HUNGARY,,"Order no. 98,882 of the Ministry of Commerce to restrict commerce in caustic soda, etc. (solid or in solution). (BK. no. 187)",10.8.,1928,84,Aug. io,"Aug. io Order no. 98,882 of the Ministry of Commerce to restrict commerce in caustic soda, etc. (solid or in solution). (BK. no. 187) "
HUNGARY,,"Order no. 3,96o/eln./2928 of the Minister of Social Welfare and Labour, respecting the bringing into operation of certain provisions of Act no. XL of 1928 [of 28th July] respecting compulsory old age, invalidity, widows' and orphans' insurance. (B.K. no. 202)",1.9.,1928,84,Sept. i,"Sept. i Order no. 3,96o/eln./2928 of the Minister of Social Welfare and Labour, respecting the bringing into operation of certain provisions of Act no. XL of 1928 [of 28th July] respecting compulsory old age, invalidity, widows' and orphans' insurance. (B.K. no. 202) "
HUNGARY,,"er no. 1o6,29o/XI/1928 of the Minister of Commerce, to re-arrange the closing-hours of businesses engaged exclusively in the retail sale of forage in the capital city of Budapest [closing hour fixed at 8 p.m.]. (B. K. no. 217)",9.9.,1928,84,Sept. Ord,"Sept. Order no. 1o6,29o/XI/1928 of the Minister of Commerce, to re-arrange the closing-hours of businesses engaged exclusively in the retail sale of forage in the capital city of Budapest [closing hour fixed at 8 p.m.]. (B. K. no. 217) "
HUNGARY,,"Order no. 4,223/eln./1928 of the Minister of Social Welfare and Labour, respecting the conversion of the pensions and pension bonuses for accidents occurring before the coming into operation of Act no. XXI of 2927 respect- ing compulsory sickness and accident insurance'43 into pensions in accord- ance with the provisions of that Act. (B. K. no. 221)",25.9.,1928,84,Sept. 25,"Sept. 25 Order no. 4,223/eln./1928 of the Minister of Social Welfare and Labour, respecting the conversion of the pensions and pension bonuses for accidents occurring before the coming into operation of Act no. XXI of 2927 respect- ing compulsory sickness and accident insurance'43 into pensions in accord- ance with the provisions of that Act. (B. K. no. 221) "
HUNGARY,,"Order no. 4,800/eln./1928 of the Minister of Social Welfare and Labour [under sections 115 and 181 of Act no. XXI of 3rd August, re- specting the staff rules of the National Social Insurance Institution and of the Insurance Institution for Salaried Employees. (B. K. no. 232)",8.10.,1928,84,Oct. 8,"Oct. 8 Order no. 4,800/eln./1928 of the Minister of Social Welfare and Labour [under sections 115 and 181 of Act no. XXI of 3rd August, re- specting the staff rules of the National Social Insurance Institution and of the Insurance Institution for Salaried Employees. (B. K. no. 232) "
HUNGARY,,"Order no. 38,9oo/VI.—I/1928 of the Minister of Agriculture, respecting the administration of accident insurance for the year 3929 through the State Agricultural Workers' Fund. (B. K. no. 247)",19.10.,1928,84,Oct. 19,"Oct. 19 Order no. 38,9oo/VI.—I/1928 of the Minister of Agriculture, respecting the administration of accident insurance for the year 3929 through the State Agricultural Workers' Fund. (B. K. no. 247) "
HUNGARY,,"Order no. 33,333/VT.— 1/1928 of the Minister of Agriculture, respecting the assessment of the claims to benefit of persons insured with the State Agri- cultural Workers' Fund in case of sickness consequent upon an accident. (B.K. no. 250)",26.10.,1928,84,Oct. 26,"Oct. 26 Order no. 33,333/VT.— 1/1928 of the Minister of Agriculture, respecting the assessment of the claims to benefit of persons insured with the State Agri- cultural Workers' Fund in case of sickness consequent upon an accident. (B.K. no. 250) "
