country,region,text,date,year,page,extracted_date,full_text
FRANCE,,"Act to amend the provisions of sections 32a, 32d, 32e and 99b of Book I of the Labour code respecting the guarantee of security deposited by wage- earning and salaried employees. (JO. p. 1,490; B.M.T. p. 7*) Text: Fr. 4 (A)",1.2.,1928,43,Feb. i,"Feb. i Act to amend the provisions of sections 32a, 32d, 32e and 99b of Book I of the Labour code respecting the guarantee of security deposited by wage- earning and salaried employees. (JO. p. 1,490; B.M.T. p. 7*) Text: Fr. 4 (A) "
FRANCE,,"Decree to amend the Decree of 20th June, 1915, to regulate the storage, sale and importation of dynamite and other explosives containing nitroglycerine [under the Dynamite Act of 8th March, 5875, and section 3 of the Explosives Act of s9th June, 5875: substitutes new provisions for sections 5, 8, i6, 17, 19, 20, 28 and 35 of Decree of 20th June, 5955]. (J.O. p. 1,597; erratum, p. 1,652)",2.2.,1928,43,Feb. 2,"Feb. 2 Decree to amend the Decree of 20th June, 1915, to regulate the storage, sale and importation of dynamite and other explosives containing nitroglycerine [under the Dynamite Act of 8th March, 5875, and section 3 of the Explosives Act of s9th June, 5875: substitutes new provisions for sections 5, 8, i6, 17, 19, 20, 28 and 35 of Decree of 20th June, 5955]. (J.O. p. 1,597; erratum, p. 1,652) "
FRANCE,,"Decree to amend the Decree of 9th September, 1905, respecting unemployment relief funds [calculation of State grants]. (J.O. p. 5,735; B.M.T. p. 27*)",7.2.,1928,43,Feb. 7,"Feb. 7 Decree to amend the Decree of 9th September, 1905, respecting unemployment relief funds [calculation of State grants]. (J.O. p. 5,735; B.M.T. p. 27*) "
FRANCE,,"Order [under the Eight-hour Day Act of 23rd April, and the Decree of 4th March, 192 respecting the eight-hour day in Italian paste making] to authorise work in relays in Italian paste factories for the kneading of the paste and the working up of scraps from the presses. (JO. p. 1,712; B. M.T",8.2.,1928,44,Feb. 8,"Feb. 8 Order [under the Eight-hour Day Act of 23rd April, and the Decree of 4th March, 192 respecting the eight-hour day in Italian paste making] to authorise work in relays in Italian paste factories for the kneading of the paste and the working up of scraps from the presses. (JO. p. 1,712; B. M.T. "
FRANCE,,"Decree to ratify and promulgate the Convention and Administrative Agreement respecting poor relief signed at Paris on 20th January, 1928, between the French Government and the Governing Commission of the Saar Territory. (J.O. p. 1,726)",9.2.,1928,44,Feb. 9,"Feb. 9 Decree to ratify and promulgate the Convention and Administrative Agreement respecting poor relief signed at Paris on 20th January, 1928, between the French Government and the Governing Commission of the Saar Territory. (J.O. p. 1,726) "
FRANCE,,"Order respecting the reorganisation of the advisory committee for international conventions respecting labour and social welfare. (J.O. p. 1,961)",15.2.,1928,44,Feb. 15,"Feb. 15 Order respecting the reorganisation of the advisory committee for international conventions respecting labour and social welfare. (J.O. p. 1,961) "
FRANCE,,"Order [under sections 3 and 5 of the Explosives Orders of 20th June, 1915, and 2nd February, 1928] to prescribe the .general technical regulations applicable to the establishment and use of mine explosives depots. (J. 0. p. 2,120; erraf urn, p. 2,377)",25.2.,1928,44,Feb. 25,"Feb. 25 Order [under sections 3 and 5 of the Explosives Orders of 20th June, 1915, and 2nd February, 1928] to prescribe the .general technical regulations applicable to the establishment and use of mine explosives depots. (J. 0. p. 2,120; erraf urn, p. 2,377) "
FRANCE,,"Decree to ratify the penalties prescribed in the Order of the General Govern. ment of French Indo-China, dated 25th October, 2927, respecting the protection of native and alien Asiatic labour in French Indo-China91. (J.O. p. 2,o68)",18.2.,1928,44,Feb. i8,"Feb. i8 Decree to ratify the penalties prescribed in the Order of the General Govern. ment of French Indo-China, dated 25th October, 2927, respecting the protection of native and alien Asiatic labour in French Indo-China91. (J.O. p. 2,o68) "
FRANCE,,"Act to ratify the Decree of 9th October, 1923,to provide for the application in the departments of the Haut-Rhin, Bas-Rhin and Moselle of sections to 321 of Part II and 99d, 106 and 107 of Part Vof Book I of the Labour Code (guarantee deposits). (JO. p. 2,574)",18.2.,1928,44,Feb. i8,"Feb. i8 Act to ratify the Decree of 9th October, 1923,to provide for the application in the departments of the Haut-Rhin, Bas-Rhin and Moselle of sections to 321 of Part II and 99d, 106 and 107 of Part Vof Book I of the Labour Code (guarantee deposits). (JO. p. 2,574) "
FRANCE,,"Act to supplement section 2 of the Act of 8th July, 192692, to amend the second paragraph of section a of the Act of pth April, amended by the Acts of 22nd March, 1902, and 5th August, respecting industrial accidents [Act of 8th July, 5926 (which relates to income limits for total and partial benefit) not to apply to heads of undertakings until beginning of seventh month after promulgation or after the passing of the income limit]. (J.O. p. 2,174; B.M.T. p. 8*)",24.2.,1928,44,Feb. 24,"Feb. 24 Act to supplement section 2 of the Act of 8th July, 192692, to amend the second paragraph of section a of the Act of pth April, amended by the Acts of 22nd March, 1902, and 5th August, respecting industrial accidents [Act of 8th July, 5926 (which relates to income limits for total and partial benefit) not to apply to heads of undertakings until beginning of seventh month after promulgation or after the passing of the income limit]. (J.O. p. 2,174; B.M.T. p. 8*) "
FRANCE,,"Order to extend to a certain numbenof establishments connected with mining undertakings the benefit of the special legislation respecting miners' pensions and relief funds [extends the Miners' Pensions Act to coke ovens, briquette works and auriferous ore dressing works at particular mines]. (JO. p. 2,269)",27.2.,1928,44,Feb. 27,"Feb. 27 Order to extend to a certain numbenof establishments connected with mining undertakings the benefit of the special legislation respecting miners' pensions and relief funds [extends the Miners' Pensions Act to coke ovens, briquette works and auriferous ore dressing works at particular mines]. (JO. p. 2,269) "
FRANCE,,"Act further to improve the miners' pension system. (J.O. p. 2,326 B.M.T. p. 8*) Text: Fr. 6",29.2.,1928,44,Feb. 29,"Feb. 29 Act further to improve the miners' pension system. (J.O. p. 2,326 B.M.T. p. 8*) Text: Fr. 6 "
FRANCE,,"Decrees to amend and supplement the general regulations respecting the operation of mines [(i) amends sections 58, 6i and 224 of the Decree of i3th August, 1911, respecting the operation of coal, etc., mines; (2) amends sec- tions 57, 60 and xôi of the Decree of 10th January, 1914, respecting mines other than coal, etc., mines. Both regulate use of cage and require provision of first-aid outfits and stretchers]. (J. 0. p. 2,413)",1.3.,1928,44,Mar. r,"Mar. r Decrees to amend and supplement the general regulations respecting the operation of mines [(i) amends sections 58, 6i and 224 of the Decree of i3th August, 1911, respecting the operation of coal, etc., mines; (2) amends sec- tions 57, 60 and xôi of the Decree of 10th January, 1914, respecting mines other than coal, etc., mines. Both regulate use of cage and require provision of first-aid outfits and stretchers]. (J. 0. p. 2,413) "
FRANCE,,"Act to amend the legislation respecting the National Old Age Pension Fund [instituted by the Act of 20th July, i886] and the National Life insurance Fund [instituted by the Act of xith July, 1868; authorises sale of annuities and other pensions at approved rates; extends limitation of amount of ordinary pensions to railwaymen and employees of other State and concession under- takings (excepted under Act of 27th March, varies composition of Superior Board; authorises extension of operations of National Life rnsurance Fund]. (JO. p. 2,750; B.M.T. p. 10*)",8.3.,1928,44,Mar. 8,"Mar. 8 Act to amend the legislation respecting the National Old Age Pension Fund [instituted by the Act of 20th July, i886] and the National Life insurance Fund [instituted by the Act of xith July, 1868; authorises sale of annuities and other pensions at approved rates; extends limitation of amount of ordinary pensions to railwaymen and employees of other State and concession under- takings (excepted under Act of 27th March, varies composition of Superior Board; authorises extension of operations of National Life rnsurance Fund]. (JO. p. 2,750; B.M.T. p. 10*) "
FRANCE,,"Decree to authorise the National Pensions Fund to administer the special guarantee fund instituted by the [Moroccan] Decree of 2sth June, 2927, respecting liability for accidents occurring to workers in the course of their employment86. (J.O. p. 2,929)",23.3.,1928,45,Mar. 23,"Mar. 23 Decree to authorise the National Pensions Fund to administer the special guarantee fund instituted by the [Moroccan] Decree of 2sth June, 2927, respecting liability for accidents occurring to workers in the course of their employment86. (J.O. p. 2,929) "
FRANCE,,"Decree to extend the operations of the National Accident Insurance Fund to the French zone of the Sherifian Empire. (J. 0. p. 2,919)",13.3.,1928,45,Mar. 13,"Mar. 13 Decree to extend the operations of the National Accident Insurance Fund to the French zone of the Sherifian Empire. (J. 0. p. 2,919) "
FRANCE,,"Decree to authorise the National Pensions Fund to receive the capital consitut- ing the pensions allocated in the French zone of the Sherifian Empire in pursuance of the [Moroccan] Decree of 25th June, 2927, respecting liability for accidents occurring to workers in the course of their employment96. (JO. p. 2,920)",23.3.,1928,45,Mar. 23,"Mar. 23 Decree to authorise the National Pensions Fund to receive the capital consitut- ing the pensions allocated in the French zone of the Sherifian Empire in pursuance of the [Moroccan] Decree of 25th June, 2927, respecting liability for accidents occurring to workers in the course of their employment96. (JO. p. 2,920) "
FRANCE,,"Mar. '3 Decree to promulgate the Convention and protocol for establishing facilities for finding employment for seamen signed at Paris on sat June, 1921, between France and Belgium. (JO. p. 3,136)",3.3.,1928,45,Mar. 3,"Mar. '3 Decree to promulgate the Convention and protocol for establishing facilities for finding employment for seamen signed at Paris on sat June, 1921, between France and Belgium. (JO. p. 3,136) "
FRANCE,,"Act respecting the employment agencies for the theatrical profession. (JO. p. 2,944 B.M.T. p. 53*) Text: Fr. 5 (B)",16.3.,1928,45,Mar. i6,"Mar. i6 Act respecting the employment agencies for the theatrical profession. (JO. p. 2,944 B.M.T. p. 53*) Text: Fr. 5 (B) "
FRANCE,,"Act to repeal in favour of natives of French protectorates the provisions relating to loss of rights in the sixteenth, seventeenth and eighteenth paragraphs of section of the Act of gth April, 1898, respecting the liability for accidents occurring to workers in the course of their employment. (JO. p. 2,973; B.M.T. p",16.3.,1928,45,Mar. i6,"Mar. i6 Act to repeal in favour of natives of French protectorates the provisions relating to loss of rights in the sixteenth, seventeenth and eighteenth paragraphs of section of the Act of gth April, 1898, respecting the liability for accidents occurring to workers in the course of their employment. (JO. p. 2,973; B.M.T. p. "
FRANCE,,"Mar. '7 Act to ratify the Decree of x8th December, 2924, to extend the system of supplementary grants to persons in receipt of accident pensions of 30 to 49 per cent, under Book III of the [German] Social Insurance Code in force in the departments of the Haut-Rhin, Bas-Rhin and Moselle. (JO. p. 3,598)",7.3.,1928,45,Mar. 7,"Mar. '7 Act to ratify the Decree of x8th December, 2924, to extend the system of supplementary grants to persons in receipt of accident pensions of 30 to 49 per cent, under Book III of the [German] Social Insurance Code in force in the departments of the Haut-Rhin, Bas-Rhin and Moselle. (JO. p. 3,598) "
FRANCE,,"Decree to promulgate the Labour Treaty signed at Brussels on 24th December, 2924, between France and Belgium86. (J.O. p. 3,237)",17.3.,1928,45,Mar. 17,"Mar. 17 Decree to promulgate the Labour Treaty signed at Brussels on 24th December, 2924, between France and Belgium86. (J.O. p. 3,237) "
FRANCE,,"Act respecting the organisation of apprenticeship. (JO. p. 3,184; errefum, p. 3,313; .B.M.T. p. 24*) Text: Fr. 7",20.3.,1928,45,Mar. 20,"Mar. 20 Act respecting the organisation of apprenticeship. (JO. p. 3,184; errefum, p. 3,313; .B.M.T. p. 24*) Text: Fr. 7 "
FRANCE,,"Act to amend the pensions system for wage-earning employees in State industrial establishments. (J. 0. p. 3,282)",21.3.,1928,45,Mar. 21,"Mar. 21 Act to amend the pensions system for wage-earning employees in State industrial establishments. (J. 0. p. 3,282) "
FRANCE,,"Act to amend section xo of the Act of 3oth June, 2923 (section 42 (i) of the Acts codified by the Decree of i5th October, 1926) by raising from sixteen to eighteen years of age the age limit for apprentices [workers employing only members of their own family and apprentices not over eighteen to pay tax on wages and not tax on industrial profits]. (J. 0. p. 3,254; B. M.T. p. 56*)",22.3.,1928,45,Mar. 22,"Mar. 22 Act to amend section xo of the Act of 3oth June, 2923 (section 42 (i) of the Acts codified by the Decree of i5th October, 1926) by raising from sixteen to eighteen years of age the age limit for apprentices [workers employing only members of their own family and apprentices not over eighteen to pay tax on wages and not tax on industrial profits]. (J. 0. p. 3,254; B. M.T. p. 56*) "
FRANCE,,"Act to ratify the Decree of 21st December, 2923, to amend section 2 of the Decree of i9th November, 1921, ratified by the Act of 6th March, 1923, respecting the application to the departments of the Haut-Rhin, Bas-Rhin and Moselle of certain provisions concerning the maximum rates prescribed by the [German] Social Insurance Code in respect of accident insurance. (JO. p. 3,719) 0. = Jon real of field",23.3.,1928,45,Mar. 23,"Mar. 23 Act to ratify the Decree of 21st December, 2923, to amend section 2 of the Decree of i9th November, 1921, ratified by the Act of 6th March, 1923, respecting the application to the departments of the Haut-Rhin, Bas-Rhin and Moselle of certain provisions concerning the maximum rates prescribed by the [German] Social Insurance Code in respect of accident insurance. (JO. p. 3,719) 0. = Jon real of field. "
FRANCE,,"Decree respecting the relations between the invalidity and old age social insurance institution and the Alsace and Lorraine railway pension fimd. (J. 0. p. 4,0,4)",23.3.,1928,46,Mar. 23,"Mar. 23 Decree respecting the relations between the invalidity and old age social insurance institution and the Alsace and Lorraine railway pension fimd. (J. 0. p. 4,0,4) "
FRANCE,,"Act to ratify the Decree of 3oth August, 1925, to continue in operation the provisions of sections i and 2 of the Decree of i4th February, 1924, granting supplementary allowances to persons in receipt of pensions paio by the Stras- burg invalidity insurance institution and by the Alsace and Lorraine railway pension fund. (JO. p. 3,902)",24.3.,1928,46,Mar. 24,"Mar. 24 Act to ratify the Decree of 3oth August, 1925, to continue in operation the provisions of sections i and 2 of the Decree of i4th February, 1924, granting supplementary allowances to persons in receipt of pensions paio by the Stras- burg invalidity insurance institution and by the Alsace and Lorraine railway pension fund. (JO. p. 3,902) "
FRANCE,,"Act to increase the pension bonuses granted to victims of industrial accidents by the Act of 25th July, 1922 [to grant temporary allowances to certain persons in receipt of pensions under the Industrial Accidents Act of 9th April, 1898]. (JO. p. 3,40'; B.M.T. p.16*)",24.3.,1928,46,Mar. 24,"Mar. 24 Act to increase the pension bonuses granted to victims of industrial accidents by the Act of 25th July, 1922 [to grant temporary allowances to certain persons in receipt of pensions under the Industrial Accidents Act of 9th April, 1898]. (JO. p. 3,40'; B.M.T. p.16*) "
FRANCE,,"Act to amend tile Act of 8th July, 1890, and to extend the powers of the miners' safety inspectors. (JO. p. 3,479; B.M.T. p. Text: Fr. S",25.3.,1928,46,Mar. 25,"Mar. 25 Act to amend tile Act of 8th July, 1890, and to extend the powers of the miners' safety inspectors. (JO. p. 3,479; B.M.T. p. Text: Fr. S "
FRANCE,,"Act respecting the pilotage system in maritime waters. (J. 0. p. 3,673)",28.3.,1928,46,Mar. 28,"Mar. 28 Act respecting the pilotage system in maritime waters. (J. 0. p. 3,673) "
FRANCE,,"Decree respecting the surveying of vessels engaged in inland navigation. (J. 0. p. 3,703)",29.3.,1928,46,Mar. 29,"Mar. 29 Decree respecting the surveying of vessels engaged in inland navigation. (J. 0. p. 3,703) "
FRANCE,,"Act to ratify the Draft Convention concerning seamen's articles of agreement adopted by the International Labour Conference at its Ninth Session, held in Geneva from 7th to z4th June, 1926. (J.O. p. 3,719; B.M.T. p. 47k)",30.3.,1928,46,Mar. 30,"Mar. 30 Act to ratify the Draft Convention concerning seamen's articles of agreement adopted by the International Labour Conference at its Ninth Session, held in Geneva from 7th to z4th June, 1926. (J.O. p. 3,719; B.M.T. p. 47k) "
FRANCE,,"Act to ratify the Draft Convention concerning workmen's compensation in agriculture, adopted by the International Labour Conference at its Third Session held in Geneva from 25th October to i9th November, 1921. (JO. p. 3,720; B.M.T. p. 47*)",30.3.,1928,46,Mar. 30,"Mar. 30 Act to ratify the Draft Convention concerning workmen's compensation in agriculture, adopted by the International Labour Conference at its Third Session held in Geneva from 25th October to i9th November, 1921. (JO. p. 3,720; B.M.T. p. 47*) "
FRANCE,,"Act to ratify the Draft Convention concerning equality of treatment for national and foreign workers as regards workmen's compensation, adopted by the International Labour Conference at its Seventh Session, held at Geneva from 19th May to ioth June, 1925. (J.O. p. 3,720; B.M.T. p. 47*)",30.3.,1928,46,Mar. 30,"Mar. 30 Act to ratify the Draft Convention concerning equality of treatment for national and foreign workers as regards workmen's compensation, adopted by the International Labour Conference at its Seventh Session, held at Geneva from 19th May to ioth June, 1925. (J.O. p. 3,720; B.M.T. p. 47*) "
FRANCE,,"Act to grant a special allowance in 1928 to persons in receipt of pensions from the Miners' Independent Pension Fund. (JO. p. 3,676)",30.3.,1928,46,Mar. 30,"Mar. 30 Act to grant a special allowance in 1928 to persons in receipt of pensions from the Miners' Independent Pension Fund. (JO. p. 3,676) "
FRANCE,,"Act to amend and supplement the Act of 22nd July, 2922, respecting the pensions of employees on local railway and tramway systems. (J. 0. p. 3,720)",31.3.,1928,46,Mar. 31,"Mar. 31 Act to amend and supplement the Act of 22nd July, 2922, respecting the pensions of employees on local railway and tramway systems. (J. 0. p. 3,720) "
FRANCE,,"Act to amend certain provisions of the [German] Social Insurance Code in the departments of the Haut-Rhin, Bas-Rhin and Moselle with respect to sickness insurance; (JO. p. 4,414)",4.4.,1928,46,Apr. 4,"Apr. 4 Act to amend certain provisions of the [German] Social Insurance Code in the departments of the Haut-Rhin, Bas-Rhin and Moselle with respect to sickness insurance; (JO. p. 4,414) "
FRANCE,,"Decree respecting the entry of native Algerian workers into France. (J.O. p. 3,951)",4.4.,1928,46,Apr. 4,"Apr. 4 Decree respecting the entry of native Algerian workers into France. (J.O. p. 3,951) "
FRANCE,,"Act respecting social insurance. (JO. p. 4,086; B.M.T. p. 48*) Text: Fr. 9",5.4.,1928,46,Apr. 5,"Apr. 5 Act respecting social insurance. (JO. p. 4,086; B.M.T. p. 48*) Text: Fr. 9 "
FRANCE,,"Decree to extend the benefits of the Act of 2nd January, 1918, to all women in receipt of pensions under the Act of 3,st March, 1919 [occupational retraining and finding of employment for war widows in receipt of pensions]. (JO. p. 4,621)",13.4.,1928,46,Apr. 13,"Apr. 13 Decree to extend the benefits of the Act of 2nd January, 1918, to all women in receipt of pensions under the Act of 3,st March, 1919 [occupational retraining and finding of employment for war widows in receipt of pensions]. (JO. p. 4,621) "
FRANCE,,"Decree issuing public administrative regulations under the Act of July, 1925, respecting chambers of arts and crafts [ch. I, organisation of chambers; ch. II, election of members; ch. III, revenues; ch. IV, dissolution and abolition of the chambers]. (JO. p. 4,417; erialum, p. 4,449)",14.4.,1928,46,Apr. 14,"Apr. 14 Decree issuing public administrative regulations under the Act of July, 1925, respecting chambers of arts and crafts [ch. I, organisation of chambers; ch. II, election of members; ch. III, revenues; ch. IV, dissolution and abolition of the chambers]. (JO. p. 4,417; erialum, p. 4,449) "
FRANCE,,"Decree to issue regulations for the emigration and circulation of natives in French West Africa [repeals Decrees of 17th June, 1895, 12th January, 1897, 25th October, 1901, and 24th October, 1902, on the same subject]. (J.O. p. 4,834)",24.4.,1928,46,Apr. 24,"Apr. 24 Decree to issue regulations for the emigration and circulation of natives in French West Africa [repeals Decrees of 17th June, 1895, 12th January, 1897, 25th October, 1901, and 24th October, 1902, on the same subject]. (J.O. p. 4,834) "
FRANCE,,"Act to ratify the Franco-Belgian Convention of 1st Juiie, 1921, in conformity with the Draft Convention concerning unemployment indemnity in case of loss or foundering of the ship, adopted by the International Labour Conference at its Second Session held in Genoa from 15th June to ioth JulY, 1920. (J. 0. p. 4,854)",24.4.,1928,46,Apr. 24,"Apr. 24 Act to ratify the Franco-Belgian Convention of 1st Juiie, 1921, in conformity with the Draft Convention concerning unemployment indemnity in case of loss or foundering of the ship, adopted by the International Labour Conference at its Second Session held in Genoa from 15th June to ioth JulY, 1920. (J. 0. p. 4,854) "
FRANCE,,"Decree to promulgate the Draft Convention respecting the compulsory medical examination of children and young persons employed at sea, adopted by the International Labour conference at its Third Session held at Geneva from 25th october to i9th November, 1921. (JO. p. 5,633)",28.4.,1928,47,Apr. 28,"Apr. 28 Decree to promulgate the Draft Convention respecting the compulsory medical examination of children and young persons employed at sea, adopted by the International Labour conference at its Third Session held at Geneva from 25th october to i9th November, 1921. (JO. p. 5,633) "
FRANCE,,"Decree issuing public administrative regulatioos to amend the Decree of ,sth August, amended by the Decree of 3rd April, and by the Decree of ,8th May, issuing public administrative regulations under the Eight-hour Day Act of 23rd April, 595945, for retail trade in goods other than provisions in a certain number of towns [applies to Paris and other specified towns. Overtime under section 6 (2) of the Decree of i5th August, 1923, for exceptional pressure of work, is fixed at i5o hours a year, with an addition of 50 hours in 1928 and 5929 and of 25 hours in 1930 and 1931; an extra 50 hours a year is allowed for packers and deapatchers]. (J.O. p. 4,988; B.M.T. p. 80*)",29.4.,1928,47,Apr. 29,"Apr. 29 Decree issuing public administrative regulatioos to amend the Decree of ,sth August, amended by the Decree of 3rd April, and by the Decree of ,8th May, issuing public administrative regulations under the Eight-hour Day Act of 23rd April, 595945, for retail trade in goods other than provisions in a certain number of towns [applies to Paris and other specified towns. Overtime under section 6 (2) of the Decree of i5th August, 1923, for exceptional pressure of work, is fixed at i5o hours a year, with an addition of 50 hours in 1928 and 5929 and of 25 hours in 1930 and 1931; an extra 50 hours a year is allowed for packers and deapatchers]. (J.O. p. 4,988; B.M.T. p. 80*) "
FRANCE,,"Decree to promulgate the Agreement respecting the delimitation of the Frencb-Saar Territory frontier signed on 22nd December, 1926, between France and Germany, and the protocols signed by the Saar Territory Frontiers Commission [protocol no. x, employment of workers at the German frontier of the Saar Territnry; protocols no. 5 and no. 6, right to use the French-Saar Territory and German-Saar Territory frontiers respectively]. (J.O. p. 5,247)",9.5.,1928,47,May 9,"May 9 Decree to promulgate the Agreement respecting the delimitation of the Frencb-Saar Territory frontier signed on 22nd December, 1926, between France and Germany, and the protocols signed by the Saar Territory Frontiers Commission [protocol no. x, employment of workers at the German frontier of the Saar Territnry; protocols no. 5 and no. 6, right to use the French-Saar Territory and German-Saar Territory frontiers respectively]. (J.O. p. 5,247) "
FRANCE,,"Decree to amend and consolidate the Decrees issuing public administrative regulations under the Eight-hour Day Act of 23rd April, 195984, for the various industries dealing with hides and skins. (J. 0. p. 5,595 B. M.T. p. 3j*) Text: Fr. 2 (B)",11.5.,1928,47,May ii,"May ii Decree to amend and consolidate the Decrees issuing public administrative regulations under the Eight-hour Day Act of 23rd April, 195984, for the various industries dealing with hides and skins. (J. 0. p. 5,595 B. M.T. p. 3j*) Text: Fr. 2 (B) "
